ID,Created At,Filter,Number of Likes,HashTags,url
1002642148994284024_223772269,2015-06-08 06:17:59,Brannan,2,"[Tag: building, Tag: skybridge, Tag: georgia, Tag: concrete, Tag: light, Tag: brutalist, Tag: midtown, Tag: at, Tag: shadow, Tag: atlanta, Tag: contrast, Tag: architecture]",https://scontent.cdninstagram.com/hphotos-xaf1/t51.2885-15/e15/11376663_487525841400129_621741300_n.jpg
1002641669586001383_1025062918,2015-06-08 06:17:02,Juno,0,"[Tag: turnerfield, Tag: pirates, Tag: braves, Tag: pittsburgh, Tag: atlanta, Tag: junghokang, Tag: 강정호]",https://scontent.cdninstagram.com/hphotos-xaf1/t51.2885-15/e15/11311513_107600269577467_1999034145_n.jpg
1002641277687901274_1501323786,2015-06-08 06:16:16,Normal,2,[Tag: nationalbestfriendday],https://scontent.cdninstagram.com/hphotos-xfa1/t51.2885-15/e15/11334512_829793020450549_424611073_n.jpg
1002640854647443522_146315899,2015-06-08 06:15:25,Normal,22,"[Tag: 78east, Tag: nationalbestfriendsday]",https://scontent.cdninstagram.com/hphotos-xaf1/t51.2885-15/e15/11352151_599960073440980_664484428_n.jpg
1002640785855425615_1501323786,2015-06-08 06:15:17,Normal,3,[Tag: nationalbestfriendday],https://scontent.cdninstagram.com/hphotos-xaf1/t51.2885-15/e15/11374714_1629417583969259_1760157336_n.jpg
1002640449404367930_31583036,2015-06-08 06:14:37,Normal,10,"[Tag: yngkillers, Tag: photography, Tag: visualarchitects, Tag: aov, Tag: visualsgang, Tag: atlanta, Tag: vsco, Tag: vscocam, Tag: acreativevisual, Tag: exploreeverything, Tag: illgrammers, Tag: iphoneonly, Tag: streetdreamsmag, Tag: instagood, Tag: mkexplore, Tag: uncalculated, Tag: tunestogram, Tag: exklusive_shot, Tag: justgoshoot, Tag: agameoftones, Tag: vintique]",https://scontent.cdninstagram.com/hphotos-xaf1/t51.2885-15/e15/11283337_1625769994360284_1059021267_n.jpg
1002640088903939127_31583036,2015-06-08 06:13:54,Normal,14,"[Tag: yngkillers, Tag: photography, Tag: visualarchitects, Tag: aov, Tag: visualsgang, Tag: atlanta, Tag: vsco, Tag: vscocam, Tag: acreativevisual, Tag: exploreeverything, Tag: illgrammers, Tag: iphoneonly, Tag: streetdreamsmag, Tag: instagood, Tag: mkexplore, Tag: uncalculated, Tag: tunestogram, Tag: exklusive_shot, Tag: justgoshoot, Tag: agameoftones, Tag: vintique]",https://scontent.cdninstagram.com/hphotos-xfa1/t51.2885-15/e15/11376122_482221051934913_1333138365_n.jpg
1002637057266524439_9435231,2015-06-08 06:07:52,Ludwig,4,"[Tag: got, Tag: fuckstannis, Tag: cats]",https://scontent.cdninstagram.com/hphotos-xaf1/t51.2885-15/e15/11372368_397525850450926_1752180724_n.jpg
1002636652777144993_667121119,2015-06-08 06:07:04,Normal,9,[Tag: mood],https://scontent.cdninstagram.com/hphotos-xfa1/t51.2885-15/e15/11325062_1671128559788238_1276997231_n.jpg
1002632473195491710_12216451,2015-06-08 05:58:46,Normal,22,"[Tag: dj, Tag: shawnytaughtu, Tag: shezthedj, Tag: turnupden, Tag: doitfortheville, Tag: shawnyspinz, Tag: radio, Tag: gmathis4u, Tag: mamawewinnin, Tag: femaledj, Tag: theemixxkween, Tag: mediapersonality, Tag: djproblems, Tag: whotaughtudat, Tag: thecampaignatl, Tag: shawnysthedj, Tag: shoneville, Tag: alwayswinning, Tag: atl, Tag: djlife, Tag: personality]",https://scontent.cdninstagram.com/hphotos-xaf1/t51.2885-15/e15/11358262_377409899122360_254202462_n.jpg
1002632001252414589_9706460,2015-06-08 05:57:50,Amaro,0,"[Tag: myhighisepik, Tag: epikatlanta, Tag: yasss, Tag: 에픽하이, Tag: thenorthamericantour, Tag: centerstage, Tag: epikhightour, Tag: epikhighatl]",https://scontent.cdninstagram.com/hphotos-xaf1/t51.2885-15/e15/11358199_785556904897548_1802576122_n.jpg
1002631935832723858_27374451,2015-06-08 05:57:42,Rise,2,"[Tag: yeezus, Tag: yeezyseason, Tag: mari, Tag: muse, Tag: lateregistration, Tag: nas, Tag: kanyewest, Tag: mrwest, Tag: chitown]",https://scontent.cdninstagram.com/hphotos-xaf1/t51.2885-15/e15/11357998_453490668158859_233446033_n.jpg
1002631221591111964_1290852525,2015-06-08 05:56:17,Normal,19,[Tag: nationalbestfriendday],https://scontent.cdninstagram.com/hphotos-xfa1/t51.2885-15/e15/11313413_909974529063487_1543084313_n.jpg
1002631085486787719_19703346,2015-06-08 05:56:01,Lark,1,"[Tag: crunk, Tag: trapqueen, Tag: flyaf, Tag: whitegirlwasted]",https://scontent.cdninstagram.com/hphotos-xfa1/t51.2885-15/e15/11282192_867710229967553_1283383917_n.jpg
1002631035910165417_1838078395,2015-06-08 05:55:55,Normal,4,"[Tag: mainevent, Tag: besthubbyever, Tag: bestbirthdaypresent, Tag: nkotb, Tag: bestanniverssrypresent, Tag: finally, Tag: music, Tag: newkidsontheblock, Tag: philipsarena, Tag: maineventtour, Tag: themainevent]",https://scontent.cdninstagram.com/hphotos-xaf1/t51.2885-15/e15/11356672_433102540202841_1774507469_n.jpg
1002630729659793082_1393019302,2015-06-08 05:55:18,Normal,1,"[Tag: parceros, Tag: cerveza, Tag: yare, Tag: domingosocial]",https://scontent.cdninstagram.com/hphotos-xaf1/t51.2885-15/e15/11328430_385174645023825_2025453849_n.jpg
1002630703864975741_27374451,2015-06-08 05:55:15,Normal,4,"[Tag: collegedropout, Tag: allday, Tag: yeezus, Tag: yeezyseason, Tag: hbd, Tag: goodlife, Tag: mari, Tag: mydarktwistedfantasy, Tag: music, Tag: lateregistration, Tag: 808sandheartbreaks, Tag: mrwest]",https://scontent.cdninstagram.com/hphotos-xaf1/t51.2885-15/e15/11374620_102044070136988_402076441_n.jpg
1002630385407933179_36404141,2015-06-08 05:54:37,Inkwell,46,[Tag: quote],https://scontent.cdninstagram.com/hphotos-xfa1/t51.2885-15/e15/11355953_1444172609219820_1780131911_n.jpg
1002630289867110909_511121245,2015-06-08 05:54:26,Normal,88,[Tag: croppedaction],https://scontent.cdninstagram.com/hphotos-xfa1/t51.2885-15/e15/11421953_1023236284354073_819689314_n.jpg
1002629898926593926_31703364,2015-06-08 05:53:39,Normal,24,[Tag: natinalbestfriendday],https://scontent.cdninstagram.com/hphotos-xaf1/t51.2885-15/e15/11378962_434998016674305_919881044_n.jpg
1002629667174552465_1838078395,2015-06-08 05:53:11,Normal,2,"[Tag: philipsarena, Tag: ainttooproudtobeg, Tag: gonebutnotforgotten, Tag: riplefteye, Tag: noscrubs, Tag: tlc, Tag: finally, Tag: music, Tag: waterfalls, Tag: mainevent, Tag: maineventtour, Tag: amazingshow, Tag: themainevent, Tag: after15yearstheyrebackinatlanta]",https://scontent.cdninstagram.com/hphotos-xaf1/t51.2885-15/e15/11374720_933131093411683_247768166_n.jpg
1002628955485049734_1838078395,2015-06-08 05:51:47,Normal,0,"[Tag: philipsarena, Tag: ainttooproudtobeg, Tag: noscrubs, Tag: tlc, Tag: finally, Tag: waterfalls, Tag: mainevent, Tag: amazingshow, Tag: themainevent, Tag: after15yearstheyrebackinatlanta]",https://scontent.cdninstagram.com/hphotos-xaf1/t51.2885-15/e15/11330617_1590285294592379_1914793352_n.jpg
1002628848544500720_296570881,2015-06-08 05:51:34,Vesper,4,"[Tag: flexohohoh, Tag: bulldogsbar, Tag: bar, Tag: gay, Tag: gaybar, Tag: dancing, Tag: bisexual, Tag: lgbtq, Tag: lgbt, Tag: richhomiequan, Tag: bulldogs, Tag: queer, Tag: transgender, Tag: lesbian]",https://scontent.cdninstagram.com/hphotos-xaf1/t51.2885-15/e15/11230495_907464965977509_96018811_n.jpg
1002627654830237336_188427280,2015-06-08 05:49:12,Normal,9,"[Tag: marriott, Tag: architecture]",https://scontent.cdninstagram.com/hphotos-xtp1/t51.2885-15/e15/10809763_923771231021346_1419240238_n.jpg
1002627434638222356_398722824,2015-06-08 05:48:45,Normal,0,"[Tag: ingress, Tag: atlantabeltline, Tag: honeybubble, Tag: parisonponce, Tag: myworld]",https://scontent.cdninstagram.com/hphotos-xfa1/t51.2885-15/e15/11351678_875604079201378_539594482_n.jpg
1002626787152308879_16140073,2015-06-08 05:47:28,Perpetua,1,"[Tag: greenthumb, Tag: shishitos]",https://scontent.cdninstagram.com/hphotos-xfa1/l/t51.2885-15/e15/11379161_697894927004636_617993879_n.jpg
1002626475946580175_296053237,2015-06-08 05:46:51,Normal,4,[Tag: wurk],https://scontent.cdninstagram.com/hphotos-xfa1/t51.2885-15/e15/11417513_1454757268156812_1115218124_n.jpg
1002626124245963620_1838078395,2015-06-08 05:46:09,Normal,1,"[Tag: giveme2pair, Tag: mainevent, Tag: omg, Tag: eiei, Tag: nellyville, Tag: grillz, Tag: nelly, Tag: amazing, Tag: countrygrammar, Tag: philipsarena, Tag: atlanta, Tag: themainevent]",https://scontent.cdninstagram.com/hphotos-xaf1/t51.2885-15/e15/11356431_1603782693213750_1918260318_n.jpg
1002625666614273716_12553816,2015-06-08 05:45:15,Normal,1,[Tag: radasfuck],https://scontent.cdninstagram.com/hphotos-xfa1/t51.2885-15/e15/11311958_1606278649612163_1387551012_n.jpg
1002625439577583605_564369778,2015-06-08 05:44:48,Normal,2,"[Tag: yoshbenjamin, Tag: theredpaintings]",https://scontent.cdninstagram.com/hphotos-xaf1/t51.2885-15/e15/11380293_981982131821328_245461383_n.jpg
1002625162618766457_1672479256,2015-06-08 05:44:15,Willow,7,"[Tag: pencil, Tag: art, Tag: lyrics, Tag: appbreeze, Tag: igers, Tag: 20likes, Tag: paper, Tag: toher, Tag: words, Tag: follow4follow, Tag: love, Tag: message, Tag: open, Tag: instadaily, Tag: itsmyq, Tag: look, Tag: quote, Tag: instafollow, Tag: iphoneonly, Tag: instaquote, Tag: amazing, Tag: pen, Tag: instalike, Tag: smile, Tag: followme, Tag: like4like, Tag: tweegram, Tag: picoftheday, Tag: realshit, Tag: photooftheday]",https://scontent.cdninstagram.com/hphotos-xfa1/t51.2885-15/e15/11350934_1597255340562865_236487898_n.jpg
1002624916320028466_275003456,2015-06-08 05:43:45,Normal,10,[Tag: nationalbestfriendday],https://scontent.cdninstagram.com/hphotos-xaf1/t51.2885-15/e15/11379810_790315267750108_265620486_n.jpg
1002624069591796982_46994514,2015-06-08 05:42:04,Normal,12,"[Tag: beyoncethighgap, Tag: 70lbsdown, Tag: richbrothers, Tag: drsorders, Tag: bathroomselfie, Tag: premier, Tag: feelinggreat]",https://scontent.cdninstagram.com/hphotos-xaf1/t51.2885-15/e15/11324392_1405207429807815_975342548_n.jpg
1002624067475590613_5217290,2015-06-08 05:42:04,Normal,20,[Tag: alicelovelivelaughinusa],https://scontent.cdninstagram.com/hphotos-xfa1/t51.2885-15/e15/11327210_907524742622117_1795867582_n.jpg
1002623624676018091_944498744,2015-06-08 05:41:11,Normal,4,"[Tag: summer, Tag: lookinggood, Tag: beachday, Tag: mondaymotivation, Tag: chic, Tag: boutiques, Tag: nightynight, Tag: hometeam, Tag: makeprettythings, Tag: instagood, Tag: midtown, Tag: homemade, Tag: keepingmefresh, Tag: jewelrydesigner, Tag: nightsky, Tag: buckhead]",https://scontent.cdninstagram.com/hphotos-xaf1/t51.2885-15/e15/11324283_881287998610720_1726161107_n.jpg
1002623509883374490_296570881,2015-06-08 05:40:57,Vesper,4,"[Tag: bulldogsbar, Tag: antwanpatton, Tag: gay, Tag: brookvalentine, Tag: bisexual, Tag: lgbtq, Tag: lgbt, Tag: girlfight, Tag: bulldogs, Tag: queer, Tag: transgender, Tag: lesbian, Tag: bigboi]",https://scontent.cdninstagram.com/hphotos-xaf1/t51.2885-15/e15/11335147_1584637678452067_2051742877_n.jpg
1002621841162750841_296570881,2015-06-08 05:37:39,Clarendon,8,"[Tag: raesremmurd, Tag: throwsomemo, Tag: gay, Tag: bisexual, Tag: lgbtq, Tag: bulldogsbar, Tag: twerking, Tag: lgbt, Tag: twerk, Tag: nickiminaj, Tag: bulldogs, Tag: queer, Tag: transgender, Tag: lesbian, Tag: assphatyeahiknow]",https://scontent.cdninstagram.com/hphotos-xfa1/t51.2885-15/e15/11373728_971520552892620_2105177480_n.jpg
1002621244523599808_9706460,2015-06-08 05:36:27,Clarendon,3,"[Tag: myhighisepik, Tag: epikatlanta, Tag: yasss, Tag: 에픽하이, Tag: thenorthamericantour, Tag: centerstage, Tag: epikhightour, Tag: epikhighatl]",https://scontent.cdninstagram.com/hphotos-xfa1/t51.2885-15/e15/11356961_917551488301944_906355921_n.jpg
1002621138568383501_14262722,2015-06-08 05:36:15,Normal,35,"[Tag: weloveatl, Tag: midtown, Tag: atlanta, Tag: sundays, Tag: vibes]",https://scontent.cdninstagram.com/hphotos-xaf1/t51.2885-15/e15/11353138_482210988604650_1918719867_n.jpg
1002621136724745475_1566674534,2015-06-08 05:36:15,Normal,14,[Tag: him],https://scontent.cdninstagram.com/hphotos-xaf1/t51.2885-15/e15/11378721_102114163463216_1888587528_n.jpg
1002620454519126382_38322509,2015-06-08 05:34:53,Normal,1,"[Tag: bham, Tag: frombhamtoatl, Tag: atl, Tag: jezzy]",https://scontent.cdninstagram.com/hphotos-xfa1/t51.2885-15/e15/11333441_383559651854988_760035522_n.jpg
1002620388090607123_8356,2015-06-08 05:34:45,Normal,4,[Tag: 💨🌄🌲],https://scontent.cdninstagram.com/hphotos-xaf1/t51.2885-15/e15/11374492_1619435201633606_87569127_n.jpg
1002619950026574688_296570881,2015-06-08 05:33:53,Ludwig,11,"[Tag: bulldogsbar, Tag: bar, Tag: midtownatlanta, Tag: gay, Tag: bisexual, Tag: lgbtq, Tag: lgbt, Tag: trangender, Tag: bulldogs, Tag: queer, Tag: gaybar, Tag: lesbian]",https://scontent.cdninstagram.com/hphotos-xap1/t51.2885-15/e15/11201584_828561963918575_1505764651_n.jpg
1002619580762982247_944498744,2015-06-08 05:33:09,Normal,1,"[Tag: pink, Tag: pastel, Tag: win, Tag: emiunicornwdb, Tag: competition, Tag: emiunicorn, Tag: wheelsanddollbaby, Tag: giveaway, Tag: instacomp, Tag: pinup, Tag: repost]",https://scontent.cdninstagram.com/hphotos-xaf1/t51.2885-15/e15/11417418_100496023626605_772413733_n.jpg
1002619421695858595_9706460,2015-06-08 05:32:50,Clarendon,3,"[Tag: myhighisepik, Tag: epikatlanta, Tag: yasss, Tag: 에픽하이, Tag: thenorthamericantour, Tag: centerstage, Tag: epikhightour, Tag: epikhighatl, Tag: lightitup]",https://scontent.cdninstagram.com/hphotos-xaf1/t51.2885-15/e15/11374605_1612100842370793_1913764887_n.jpg
1002618955834503330_12216451,2015-06-08 05:31:55,Normal,32,"[Tag: dj, Tag: shawnytaughtu, Tag: shezthedj, Tag: turnupden, Tag: doitfortheville, Tag: shawnyspinz, Tag: radio, Tag: gmathis4u, Tag: mamawewinnin, Tag: femaledj, Tag: theemixxkween, Tag: mediapersonality, Tag: shawnysthedj, Tag: alwayswinning, Tag: atl, Tag: hitthatheartsignho3, Tag: miami, Tag: shoneville, Tag: whotaughtudat, Tag: personality]",https://scontent.cdninstagram.com/hphotos-xaf1/t51.2885-15/e15/11378910_909671159090422_562855539_n.jpg
1002618461283923050_22611260,2015-06-08 05:30:56,Ludwig,0,[Tag: madmax],https://scontent.cdninstagram.com/hphotos-xaf1/t51.2885-15/e15/11335122_367156300148456_9791884_n.jpg
1002618097377501446_575461047,2015-06-08 05:30:12,Amaro,2,"[Tag: bestfriends, Tag: sproglove]",https://scontent.cdninstagram.com/hphotos-xaf1/t51.2885-15/e15/11378577_718325274944278_368860130_n.jpg
1002617641742916206_264032069,2015-06-08 05:29:18,Normal,28,"[Tag: womensupportingwomen, Tag: style, Tag: fashion, Tag: allwhite, Tag: highlow, Tag: ilove, Tag: lifestylemonday, Tag: repost]",https://scontent.cdninstagram.com/hphotos-xaf1/t51.2885-15/e15/11335249_121714171493322_1175474383_n.jpg
1001917436049808479_1550330310,2015-06-07 06:18:07,Normal,24,"[Tag: septum, Tag: vegastakemeback, Tag: atlnights, Tag: thatsmile, Tag: beatbyme, Tag: atl, Tag: nofilter, Tag: macgirl, Tag: kravelounge]",https://scontent.cdninstagram.com/hphotos-xaf1/t51.2885-15/e15/11381461_852709328148381_1873150967_n.jpg
1001917398884536919_311704851,2015-06-07 06:18:03,Normal,14,"[Tag: shawtyinkk, Tag: dj, Tag: turnup, Tag: grind, Tag: atlnightlife, Tag: workin, Tag: salute, Tag: hustle]",https://scontent.cdninstagram.com/hphotos-xaf1/t51.2885-15/e15/11311339_651845594947295_264135427_n.jpg
1001917285241884562_14262722,2015-06-07 06:17:49,Normal,33,[Tag: bukowski],https://scontent.cdninstagram.com/hphotos-xaf1/t51.2885-15/e15/11374579_1575976235998191_2049019922_n.jpg
1001917140034409241_1755277067,2015-06-07 06:17:32,Normal,153,"[Tag: officialagpevent, Tag: agp2015]",https://scontent.cdninstagram.com/hphotos-xaf1/t51.2885-15/e15/11380891_910914072308580_1569386281_n.jpg
1001917130621845100_185521534,2015-06-07 06:17:30,Stinson,17,"[Tag: novelties, Tag: vividnovelty, Tag: pvnrule, Tag: adulttoys, Tag: sexshop, Tag: adultnovelties, Tag: masturbate, Tag: sextoys, Tag: sexy, Tag: atlanta, Tag: bestofatlanta, Tag: felixs, Tag: platinum, Tag: platinumvividnovelties, Tag: bussinessowerofatlanta, Tag: adultsextoys, Tag: vivid, Tag: bussinessowers, Tag: novelty, Tag: adultnovlty, Tag: adultsex, Tag: bussinessowersofatlanta, Tag: smokeshop, Tag: vividnovelties]",https://scontent.cdninstagram.com/hphotos-xaf1/t51.2885-15/e15/11334495_122495341415563_1111148970_n.jpg
1001916983858128163_12714824,2015-06-07 06:17:13,Valencia,5,"[Tag: ikea, Tag: ikeakids]",https://scontent.cdninstagram.com/hphotos-xfa1/t51.2885-15/e15/11382938_894171633989975_1718418307_n.jpg
1001916970552038251_233338107,2015-06-07 06:17:11,Normal,50,"[Tag: bikelifeatl, Tag: hoglife, Tag: harleydavidson, Tag: mph, Tag: edgewoodoriginal]",https://scontent.cdninstagram.com/hphotos-xfa1/t51.2885-15/e15/11380784_1590596191209793_927131345_n.jpg
1001916862497984387_14262722,2015-06-07 06:16:59,Normal,31,[Tag: kerouac],https://scontent.cdninstagram.com/hphotos-xaf1/t51.2885-15/e15/11280444_1591211804484146_2092215289_n.jpg
1001915790292319694_31213742,2015-06-07 06:14:51,Normal,96,[Tag: eeques],https://scontent.cdninstagram.com/hphotos-xaf1/t51.2885-15/e15/11380765_393896374135230_1322626559_n.jpg
1001915712606004089_275944311,2015-06-07 06:14:42,Juno,9,"[Tag: supportmyhustles, Tag: smoothie, Tag: sweetthickness, Tag: teamfit, Tag: eatlean, Tag: positiveenergysmoothie, Tag: chrisbaileyisdotcom, Tag: eatingright]",https://scontent.cdninstagram.com/hphotos-xaf1/t51.2885-15/e15/11376579_918557544868993_1527531221_n.jpg
1001915523334277657_47514737,2015-06-07 06:14:19,Normal,74,"[Tag: atlnights, Tag: spirittriplets, Tag: itsbeenaday, Tag: stillgoingtochurchinthemorning]",https://scontent.cdninstagram.com/hphotos-xaf1/t51.2885-15/e15/11334451_816357685137970_2049588387_n.jpg
1001915003575747745_551154368,2015-06-07 06:13:17,Normal,23,"[Tag: pullup, Tag: welit, Tag: saturdaynightlive]",https://scontent.cdninstagram.com/hphotos-xaf1/t51.2885-15/e15/11374480_870856569653738_1669903166_n.jpg
1001914598816617243_22388971,2015-06-07 06:12:29,Normal,16,"[Tag: gramfam, Tag: dst, Tag: omegapsiphi, Tag: tauchapter]",https://scontent.cdninstagram.com/hphotos-xaf1/t51.2885-15/e15/11336055_889556511124240_1300412719_n.jpg
1001914547098834446_320222004,2015-06-07 06:12:23,Normal,22,"[Tag: downtownatl, Tag: shes21, Tag: latinas, Tag: localuna]",https://scontent.cdninstagram.com/hphotos-xfa1/t51.2885-15/e15/11381789_978941562137502_450327988_n.jpg
1001914139163300633_194464419,2015-06-07 06:11:34,Normal,153,"[Tag: sneakerque, Tag: acedawg, Tag: psiddmade, Tag: everybluemoon, Tag: whatyaknow, Tag: agp2k15, Tag: mediabruhz]",https://scontent.cdninstagram.com/hphotos-xaf1/t51.2885-15/e15/11429784_1667292160169284_662239762_n.jpg
1001913983056428383_144351230,2015-06-07 06:11:15,Normal,12,"[Tag: greatreminders, Tag: godusesordinarypeopletodoextraordinarythings, Tag: focusonthefundamentals, Tag: wordsfrompeoplethatloveyou, Tag: godwillmaximizeoursimplicity, Tag: becontentinchrist]",https://scontent.cdninstagram.com/hphotos-xaf1/t51.2885-15/e15/11325046_910686595660097_1416899569_n.jpg
1001912872960844017_261333639,2015-06-07 06:09:03,Juno,1,"[Tag: simplesketch, Tag: figure]",https://scontent.cdninstagram.com/hphotos-xaf1/t51.2885-15/e15/11376559_661574353975427_1062717415_n.jpg
1001912744633160175_311704851,2015-06-07 06:08:48,Normal,23,"[Tag: teammarleblu, Tag: dj, Tag: turnup, Tag: xsquaddjs, Tag: grind, Tag: atlnightlife, Tag: workin, Tag: salute, Tag: hustle]",https://scontent.cdninstagram.com/hphotos-xfa1/t51.2885-15/e15/11377646_852812254811928_1952891305_n.jpg
1001912626235385045_26623912,2015-06-07 06:08:34,Normal,14,"[Tag: atlantacomedy, Tag: 1amsecretshow]",https://scontent.cdninstagram.com/hphotos-xaf1/t51.2885-15/e15/11358156_1436118500030782_1342109381_n.jpg
1001912466095494341_275287580,2015-06-07 06:08:14,Normal,5,[Tag: 75bucks],https://scontent.cdninstagram.com/hphotos-xaf1/t51.2885-15/e15/11379958_380510022148720_1516355883_n.jpg
1001912396496058076_1623113404,2015-06-07 06:08:06,Normal,10,[Tag: outchea],https://scontent.cdninstagram.com/hphotos-xfa1/t51.2885-15/e15/11352278_467946556693106_683401537_n.jpg
1001912360312728754_1374410218,2015-06-07 06:08:02,Reyes,10,"[Tag: love, Tag: instagram, Tag: dontactlikeyouforgot, Tag: missing, Tag: sleepy, Tag: bedtimestory, Tag: myeyes, Tag: like, Tag: goodnight, Tag: igers, Tag: rockmetosleep, Tag: bedtime]",https://scontent.cdninstagram.com/hphotos-xfa1/t51.2885-15/e15/11385230_992081344157837_1272042035_n.jpg
1001912290192160151_195585028,2015-06-07 06:07:53,Nashville,18,[Tag: stitch],https://scontent.cdninstagram.com/hphotos-xfa1/t51.2885-15/e15/11266529_579619122180435_1564090881_n.jpg
1001911847335122711_1018157708,2015-06-07 06:07:01,Normal,31,[Tag: billionairemovement],https://scontent.cdninstagram.com/hphotos-xaf1/t51.2885-15/e15/11417337_1594615467471353_1225490386_n.jpg
1001911488854496818_29200900,2015-06-07 06:06:18,Normal,876,"[Tag: baeday, Tag: basicessentials]",https://scontent.cdninstagram.com/hphotos-xaf1/t51.2885-15/e15/11380117_1634684883435089_1333155204_n.jpg
1001911407858143698_311704851,2015-06-07 06:06:08,Normal,17,"[Tag: workin, Tag: turnup, Tag: xsquaddjs, Tag: grind, Tag: atlnightlife, Tag: dj, Tag: salute, Tag: hustle]",https://scontent.cdninstagram.com/hphotos-xaf1/t51.2885-15/e15/11379931_416906508516728_1894931058_n.jpg
1001911294947151250_39584530,2015-06-07 06:05:55,Normal,6,[Tag: timehop],https://scontent.cdninstagram.com/hphotos-xaf1/t51.2885-15/e15/11280190_1663609673867905_564606449_n.jpg
1001911252431843508_4132731,2015-06-07 06:05:50,Rise,16,[Tag: blockheads],https://scontent.cdninstagram.com/hphotos-xaf1/t51.2885-15/e15/11327200_1441849562784746_1827271917_n.jpg
1001910965011167549_1964530973,2015-06-07 06:05:15,Normal,29,"[Tag: homeboys, Tag: bachelorparty, Tag: peacetothefresh, Tag: newyork, Tag: money, Tag: peace, Tag: goodlife, Tag: goodtimes, Tag: useyourpretty, Tag: vip, Tag: freshlife, Tag: buybottles, Tag: fresh, Tag: itsmagic]",https://scontent.cdninstagram.com/hphotos-xaf1/t51.2885-15/e15/11358930_831079676975811_677304314_n.jpg
1001910912576924696_240853850,2015-06-07 06:05:09,Normal,14,[Tag: agpfinale],https://scontent.cdninstagram.com/hphotos-xaf1/t51.2885-15/e15/11326779_907307412676280_974115141_n.jpg
1001910623151351657_308772072,2015-06-07 06:04:35,Normal,34,"[Tag: dj, Tag: business, Tag: marketing, Tag: worldwidemusic, Tag: atl, Tag: bookings, Tag: records, Tag: studiobuzz, Tag: london, Tag: rap, Tag: artists, Tag: follow, Tag: atlanta, Tag: unique, Tag: promotions, Tag: producers, Tag: genres, Tag: talent, Tag: showcase, Tag: support, Tag: music, Tag: uk, Tag: events]",https://scontent.cdninstagram.com/hphotos-xaf1/t51.2885-15/e15/11378632_645100178925426_1526807821_n.jpg
1001910376067253298_551154368,2015-06-07 06:04:05,Normal,26,"[Tag: pullup, Tag: welit, Tag: saturdaynightlive]",https://scontent.cdninstagram.com/hphotos-xaf1/t51.2885-15/e15/11352181_599981813478463_1462336119_n.jpg
1001910124340626482_237053120,2015-06-07 06:03:35,Normal,23,[Tag: margaretforever],https://scontent.cdninstagram.com/hphotos-xfa1/t51.2885-15/e15/11373494_1596363197285601_1022384836_n.jpg
1001909981205255084_194082579,2015-06-07 06:03:18,Normal,49,[Tag: fafatl],https://scontent.cdninstagram.com/hphotos-xaf1/t51.2885-15/e15/11372511_1428521897470311_352098922_n.jpg
1001909943809121372_26187854,2015-06-07 06:03:14,Normal,15,"[Tag: epicwedding, Tag: bobbyvalentino, Tag: minttobeamurray, Tag: bobbyv]",https://scontent.cdninstagram.com/hphotos-xaf1/t51.2885-15/e15/11326716_692147280912500_585565980_n.jpg
1001909653699466538_298374772,2015-06-07 06:02:39,Normal,33,[Tag: tipsey],https://scontent.cdninstagram.com/hphotos-xaf1/t51.2885-15/e15/11352046_774757215956656_1773039628_n.jpg
1001909639883510193_311704851,2015-06-07 06:02:38,Normal,16,"[Tag: dj, Tag: atlnightlife, Tag: hustle, Tag: workin, Tag: grind]",https://scontent.cdninstagram.com/hphotos-xaf1/t51.2885-15/e15/11381427_1442282016090285_42371368_n.jpg
1001909620412882022_199544198,2015-06-07 06:02:35,Normal,41,"[Tag: indylove, Tag: agp2015]",https://scontent.cdninstagram.com/hphotos-xfa1/t51.2885-15/e15/11381468_993670687344950_706362658_n.jpg
1001908925182416154_298374772,2015-06-07 06:01:12,Normal,29,"[Tag: birthdaygirl, Tag: rickersongirls, Tag: bigsis]",https://scontent.cdninstagram.com/hphotos-xfa1/l/t51.2885-15/e15/11372216_488195374678373_1534025212_n.jpg
1001192472089187666_13142804,2015-06-06 06:17:45,Normal,461,[Tag: boaaccountoncloud9],https://scontent.cdninstagram.com/hphotos-xfa1/t51.2885-15/e15/11377757_1575617056032852_1529619998_n.jpg
1001192193207773178_470830712,2015-06-06 06:17:11,Nashville,12,"[Tag: heart, Tag: familyandfriends, Tag: ilovebaseball, Tag: ga, Tag: family, Tag: 3weeks, Tag: lifeisgood, Tag: atlantabond, Tag: timetosaygoodbye, Tag: 450instagramphotos, Tag: home, Tag: atlanta, Tag: friends, Tag: laststop, Tag: georgia, Tag: usa, Tag: friendship, Tag: roadtrip, Tag: bravescountry, Tag: timeflies, Tag: shedsometears]",https://scontent.cdninstagram.com/hphotos-xaf1/t51.2885-15/e15/11325904_1457386681239208_1843666714_n.jpg
1001192096286168720_19076076,2015-06-06 06:17:00,Normal,19,"[Tag: iglove, Tag: instapic, Tag: hilife, Tag: falife, Tag: downtown, Tag: layover, Tag: instadaily, Tag: instagramhub, Tag: hotlanta, Tag: crewlife, Tag: atl, Tag: ilovemyjob, Tag: instalayover, Tag: igdaily, Tag: instaview, Tag: instawork]",https://scontent.cdninstagram.com/hphotos-xaf1/t51.2885-15/e15/11420452_1008334289178348_1274958772_n.jpg
1001191785718018858_36539283,2015-06-06 06:16:23,Lo-fi,5,"[Tag: diner, Tag: atl, Tag: latenightfood, Tag: atlanta, Tag: ishouldbesleeping, Tag: majesticdiner]",https://scontent.cdninstagram.com/hphotos-xaf1/t51.2885-15/e15/11335606_103447223328122_12380834_n.jpg
1001191784207856758_225604076,2015-06-06 06:16:22,Valencia,327,"[Tag: noturnup2nite, Tag: roomservice, Tag: atl, Tag: 6hrdrive, Tag: imadeit]",https://scontent.cdninstagram.com/hphotos-xaf1/t51.2885-15/e15/11272845_1436836499956954_984448839_n.jpg
1001191171343613572_29193166,2015-06-06 06:15:09,Normal,39,[Tag: fat],https://scontent.cdninstagram.com/hphotos-xaf1/t51.2885-15/e15/11386498_1003503969667222_1930785681_n.jpg
