ID,Created At,Filter,Number of Likes,HashTags,url
1001163840567642499_1233120001,2015-06-06 05:20:51,Normal,45,"[Tag: 600seconds, Tag: littleboyartist, Tag: twicewhilerunning, Tag: bna, Tag: mofrigger, Tag: dramaticbooty, Tag: littlebignose😂😄❤]",https://scontent.cdninstagram.com/hphotos-xaf1/t51.2885-15/e15/11379321_461692007338205_1485495515_n.jpg
1001161829310129143_1651683447,2015-06-06 05:16:52,Ashby,11,"[Tag: blind, Tag: braille, Tag: abbietaylor, Tag: wyoming, Tag: poetry, Tag: dreamabovethedreamless, Tag: openmic, Tag: dreambig, Tag: wyowritersconference2015]",https://scontent.cdninstagram.com/hphotos-xaf1/t51.2885-15/e15/11374552_758663984248356_1559174404_n.jpg
1001155762224227223_1651683447,2015-06-06 05:04:48,Inkwell,3,"[Tag: aspirations, Tag: dreambig, Tag: wyowritersconference2015, Tag: cheyenne]",https://scontent.cdninstagram.com/hphotos-xaf1/t51.2885-15/e15/11283406_987024191309864_208380899_n.jpg
1001154106875603786_1729268993,2015-06-06 05:01:31,Amaro,2,"[Tag: thatsmyboy, Tag: bensonmomma, Tag: blessed]",https://scontent.cdninstagram.com/hphotos-xaf1/t51.2885-15/e15/11378908_1406998926294589_1885894283_n.jpg
1001147858897185700_287398433,2015-06-06 04:49:06,Normal,179,[Tag: knarknarpowpow],https://scontent.cdninstagram.com/hphotos-xfa1/t51.2885-15/e15/11326712_483909518438970_393080046_n.jpg
1001142812198500986_397905445,2015-06-06 04:39:05,Normal,13,"[Tag: sweateverydamnday, Tag: fit, Tag: dadbod, Tag: results, Tag: keg, Tag: detox, Tag: 6pack, Tag: healthy]",https://scontent.cdninstagram.com/hphotos-xaf1/t51.2885-15/e15/11287495_1053872114640535_286630897_n.jpg
1001142082619783001_272384044,2015-06-06 04:37:38,Slumber,70,[Tag: summer2k15],https://scontent.cdninstagram.com/hphotos-xaf1/t51.2885-15/e15/11410224_1443165512652294_247341970_n.jpg
1001139633871982938_305260067,2015-06-06 04:32:46,Lark,24,"[Tag: classof2015, Tag: ilooklikeababe, Tag: nerdbuddies, Tag: gradparty, Tag: graduation]",https://scontent.cdninstagram.com/hphotos-xaf1/t51.2885-15/e15/11357329_1611304139147868_1539827484_n.jpg
1001116751571560316_271446896,2015-06-06 03:47:18,Brannan,25,"[Tag: on, Tag: selfie, Tag: hennig, Tag: point]",https://scontent.cdninstagram.com/hphotos-xaf1/t51.2885-15/e15/11410491_384974131705985_291805689_n.jpg
1001100709526083365_230168172,2015-06-06 03:15:26,Normal,18,"[Tag: bunkerdrills, Tag: firefighter, Tag: dreamjob, Tag: family, Tag: fireacademy]",https://scontent.cdninstagram.com/hphotos-xaf1/t51.2885-15/e15/11419188_810882088967671_70484040_n.jpg
1001099207572263649_340714419,2015-06-06 03:12:27,Lo-fi,9,[Tag: blessed],https://scontent.cdninstagram.com/hphotos-xaf1/t51.2885-15/e15/11287854_647956015349220_2117283355_n.jpg
1001091384261121522_206471444,2015-06-06 02:56:54,Normal,18,"[Tag: sun, Tag: dandan, Tag: park]",https://scontent.cdninstagram.com/hphotos-xpa1/t51.2885-15/e15/1723843_946199002099080_967038970_n.jpg
1001086078216802314_1025308299,2015-06-06 02:46:21,Normal,15,"[Tag: lds, Tag: comics, Tag: mormon, Tag: 2, Tag: moving]",https://scontent.cdninstagram.com/hphotos-xaf1/t51.2885-15/e15/11352309_1566472283616991_811715726_n.jpg
1001085994095841287_1025308299,2015-06-06 02:46:11,Normal,19,"[Tag: lds, Tag: comics, Tag: 3, Tag: moving, Tag: mormon]",https://scontent.cdninstagram.com/hphotos-xfa1/t51.2885-15/e15/11311097_926933494047797_157501588_n.jpg
1001084932970484717_1025308299,2015-06-06 02:44:05,Normal,16,"[Tag: 1, Tag: lds, Tag: mormon, Tag: moving, Tag: comics]",https://scontent.cdninstagram.com/hphotos-xaf1/t51.2885-15/e15/11325109_730048397107559_2125410578_n.jpg
1001083395179960508_1643368989,2015-06-06 02:41:02,Sierra,7,"[Tag: julepshawn, Tag: girlygirl, Tag: julepmaven, Tag: julepfireworks]",https://scontent.cdninstagram.com/hphotos-xpt1/t51.2885-15/e15/1388843_591609054315632_2052524811_n.jpg
1001076505244505251_206471444,2015-06-06 02:27:20,Normal,18,"[Tag: drag, Tag: green, Tag: dragqueen, Tag: fauxdrag]",https://scontent.cdninstagram.com/hphotos-xaf1/l/t51.2885-15/e15/11377788_1593585447557599_1433768907_n.jpg
1001072237641358488_1637576942,2015-06-06 02:18:51,Reyes,3,"[Tag: wyoming, Tag: cheapgas, Tag: buffaloes, Tag: roadtrip]",https://scontent.cdninstagram.com/hphotos-xaf1/t51.2885-15/e15/11312454_836184183118990_1131600691_n.jpg
1001060852238235718_1369073437,2015-06-06 01:56:14,Juno,6,"[Tag: happilyobsessed, Tag: store1381, Tag: loveyourcurves, Tag: region3strong, Tag: mauricesmanagers, Tag: livfashiondiaries, Tag: silverjeans, Tag: shopwithmauricescheyenne, Tag: plussizefashionista, Tag: plus, Tag: plussizefashion, Tag: plussizes, Tag: workwhereyoulovetoshop, Tag: maurices]",https://scontent.cdninstagram.com/hphotos-xaf1/t51.2885-15/e15/11327029_1079455312082323_712398563_n.jpg
1001059770249198085_2011737253,2015-06-06 01:54:05,Normal,4,[Tag: swag],https://scontent.cdninstagram.com/hphotos-xaf1/t51.2885-15/e15/11313664_1622908574590225_2031576538_n.jpg
1001055431250098617_2011737253,2015-06-06 01:45:28,Lark,3,[Tag: nature],https://scontent.cdninstagram.com/hphotos-xfa1/t51.2885-15/e15/11420939_1427890447534455_2146957484_n.jpg
1001054222904930791_208697507,2015-06-06 01:43:04,Reyes,12,[Tag: champion],https://scontent.cdninstagram.com/hphotos-xaf1/t51.2885-15/e15/11377879_454800448013044_1026941019_n.jpg
1001052969369811321_2011737253,2015-06-06 01:40:34,Brannan,2,[Tag: weirdo],https://scontent.cdninstagram.com/hphotos-xaf1/t51.2885-15/e15/11380299_905911509467505_1702847775_n.jpg
1001051923145268276_286599838,2015-06-06 01:38:30,Slumber,22,"[Tag: ordo, Tag: oooooves, Tag: bangsandcheese, Tag: loveyoulongtime, Tag: cheeseandbangs, Tag: mylellie, Tag: moves, Tag: dontgivehertequila]",https://scontent.cdninstagram.com/hphotos-xaf1/t51.2885-15/e15/11372307_1024633637587621_455937542_n.jpg
1001050707348745529_627422874,2015-06-06 01:36:05,Valencia,8,"[Tag: gerberdaisies, Tag: icecreamcake, Tag: birthday, Tag: esprotations, Tag: dq]",https://scontent.cdninstagram.com/hphotos-xaf1/t51.2885-15/e15/11380227_903219439740511_189651477_n.jpg
1001036152105947418_236886619,2015-06-06 01:07:10,Normal,24,[Tag: vibes],https://scontent.cdninstagram.com/hphotos-xaf1/t51.2885-15/e15/11283348_1088907637790649_1806508562_n.jpg
1001027588925084692_283354020,2015-06-06 00:50:09,Juno,66,"[Tag: 2k15, Tag: graduation]",https://scontent.cdninstagram.com/hphotos-xfa1/t51.2885-15/e15/11358131_739123529530701_1748806550_n.jpg
1001025520554974692_193529582,2015-06-06 00:46:02,Normal,116,"[Tag: classof2k15, Tag: graduation]",https://scontent.cdninstagram.com/hphotos-xaf1/t51.2885-15/e15/11380794_1637842356434909_1949962826_n.jpg
1001015836258239711_315163488,2015-06-06 00:26:48,Normal,104,"[Tag: 2015senior, Tag: graduate]",https://scontent.cdninstagram.com/hphotos-xfa1/t51.2885-15/e15/11377451_886574628055609_150275072_n.jpg
1001006115712163010_414640278,2015-06-06 00:07:29,Normal,13,"[Tag: wyoming, Tag: burninhell, Tag: notiniowaanymore]",https://scontent.cdninstagram.com/hphotos-xaf1/t51.2885-15/e15/11324914_1429830444005435_1719593848_n.jpg
1001003889915209883_1774477953,2015-06-06 00:03:04,Juno,2,"[Tag: johndeere, Tag: sunnydays, Tag: lazybones, Tag: summer2k15]",https://scontent.cdninstagram.com/hphotos-xfa1/t51.2885-15/e15/11353010_1591370251116689_27053643_n.jpg
1000987874217550717_1651683447,2015-06-05 23:31:15,Reyes,4,"[Tag: wyoming, Tag: wyowritersconference2015, Tag: historicplainshotel, Tag: cheyenne]",https://scontent.cdninstagram.com/hphotos-xaf1/t51.2885-15/e15/11417470_769112243210399_1206366343_n.jpg
1000986183268350964_360079653,2015-06-05 23:27:53,Aden,58,"[Tag: paramountcafe, Tag: openmic]",https://scontent.cdninstagram.com/hphotos-xaf1/t51.2885-15/e15/11385229_1603683109882735_1100590598_n.jpg
1000985536119563053_1651683447,2015-06-05 23:26:36,Normal,1,"[Tag: wyominglife, Tag: wyowritersconference2015, Tag: historicplainshotel, Tag: cheyenne]",https://scontent.cdninstagram.com/hphotos-xaf1/t51.2885-15/e15/11334589_1610058495936179_277550135_n.jpg
1000984107422180108_1651683447,2015-06-05 23:23:46,Normal,2,"[Tag: wyoming, Tag: historicplainshotel, Tag: cheyenne]",https://scontent.cdninstagram.com/hphotos-xfa1/t51.2885-15/e15/11380928_1596384727309394_674251654_n.jpg
1000979262715847313_1651683447,2015-06-05 23:14:08,Lark,4,"[Tag: wyowritersconference2015, Tag: historicplainshotel, Tag: view, Tag: awesome, Tag: wyoming, Tag: cheyenne]",https://scontent.cdninstagram.com/hphotos-xaf1/t51.2885-15/e15/11325811_862044320541212_321646044_n.jpg
1000436136795801776_20982913,2015-06-05 05:15:02,Normal,17,"[Tag: art, Tag: pomeranian, Tag: puppylove]",https://scontent.cdninstagram.com/hphotos-xfa1/t51.2885-15/e15/11281997_964434986940343_639986426_n.jpg
1000427775350114344_20982913,2015-06-05 04:58:26,Earlybird,2,[Tag: halcyon],https://scontent.cdninstagram.com/hphotos-xaf1/t51.2885-15/e15/11372101_928322087189189_882198387_n.jpg
1000426841781930011_20982913,2015-06-05 04:56:34,Hefe,6,"[Tag: babykidjosh, Tag: halcyon]",https://scontent.cdninstagram.com/hphotos-xaf1/t51.2885-15/e15/11282238_406528512867082_1109551564_n.jpg
1000400558424625118_523125034,2015-06-05 04:04:21,Normal,142,"[Tag: ibleedblueandorange, Tag: boisestate, Tag: officialbronco, Tag: broncoventure, Tag: repost]",https://scontent.cdninstagram.com/hphotos-xaf1/t51.2885-15/e15/11374488_382794841913059_954480291_n.jpg
1000397680941915849_306767742,2015-06-05 03:58:38,Juno,3,"[Tag: yuleroadtrip, Tag: summer2015]",https://scontent.cdninstagram.com/hphotos-xaf1/t51.2885-15/e15/11357584_841377345912243_2130149254_n.jpg
1000393616968978585_305260067,2015-06-05 03:50:34,Moon,21,"[Tag: georgewatsky, Tag: drunktextmessagetogod, Tag: ayyyye, Tag: blackandwhite]",https://scontent.cdninstagram.com/hphotos-xaf1/t51.2885-15/e15/11248360_879316545448029_108970253_n.jpg
1000382927940806670_307664537,2015-06-05 03:29:19,Normal,15,"[Tag: summer, Tag: sibblings, Tag: grammy, Tag: throwbackthursday, Tag: smiles, Tag: tbt, Tag: lake, Tag: throwback]",https://scontent.cdninstagram.com/hphotos-xaf1/t51.2885-15/e15/11410524_862693027147166_2091662224_n.jpg
1000372036112103107_31013212,2015-06-05 03:07:41,Normal,36,"[Tag: maxout, Tag: preworkout, Tag: vascularity, Tag: webreatheit, Tag: roadmap, Tag: hemavo2, Tag: themyth, Tag: boom, Tag: thebostonmassprodigy, Tag: iforcenutrition, Tag: iforcenation, Tag: weliveit]",https://scontent.cdninstagram.com/hphotos-xaf1/t51.2885-15/e15/11378755_1134653683230951_464429234_n.jpg
1000367677740955413_202540524,2015-06-05 02:59:01,Reyes,38,"[Tag: iloveyou, Tag: squad, Tag: keepit💯, Tag: blessed, Tag: family]",https://scontent.cdninstagram.com/hphotos-xaf1/t51.2885-15/e15/11378917_815639898523266_1715495092_n.jpg
1000358163938786888_1535858822,2015-06-05 02:40:07,Normal,10,"[Tag: ourdoors, Tag: america, Tag: movingtowyoming, Tag: colorado, Tag: adventure]",https://scontent.cdninstagram.com/hphotos-xaf1/t51.2885-15/e15/11353491_866267046780057_324677879_n.jpg
1000356847447424543_1535858822,2015-06-05 02:37:30,Normal,8,"[Tag: ourdoors, Tag: america, Tag: movingtowyoming, Tag: colorado, Tag: adventure]",https://scontent.cdninstagram.com/hphotos-xaf1/t51.2885-15/e15/11274441_820536244703879_2104374963_n.jpg
1000348405789242522_31013212,2015-06-05 02:20:44,Normal,12,"[Tag: 307muscle, Tag: earnyourrespect, Tag: bakerathletics, Tag: bodybuilder, Tag: nutritioncompanycheyenne, Tag: cheyenne, Tag: iforcenutrition, Tag: iforcenation, Tag: weliveit, Tag: middleweight]",https://scontent.cdninstagram.com/hphotos-xaf1/t51.2885-15/e15/11313678_1444174385885739_1838314215_n.jpg
1000347385088586883_31013212,2015-06-05 02:18:42,Maven,23,"[Tag: themyth, Tag: 7wksout, Tag: webreatheit, Tag: npc, Tag: bakerathletics, Tag: 307muscle, Tag: nutritioncompanycheyenne, Tag: usachampionships, Tag: bodybuilding, Tag: iforcenutrition, Tag: iforcenation, Tag: weliveit, Tag: middleweight]",https://scontent.cdninstagram.com/hphotos-xaf1/t51.2885-15/e15/11372346_372102239656307_121925868_n.jpg
1000342188412818929_145977996,2015-06-05 02:08:23,Normal,11,"[Tag: lovehim, Tag: thoughtsofathreeyearold, Tag: sillyboy]",https://scontent.cdninstagram.com/hphotos-xaf1/t51.2885-15/e15/11358202_1008610719163218_914691498_n.jpg
1000328683240977743_192588484,2015-06-05 01:41:33,Normal,19,"[Tag: realtalk, Tag: truestory]",https://scontent.cdninstagram.com/hphotos-xaf1/t51.2885-15/e15/11419140_1663190987243550_406495024_n.jpg
1000325629621294485_193724852,2015-06-05 01:35:29,Lark,11,"[Tag: tattoos, Tag: bullybreed, Tag: dogsofinstagram, Tag: paintedmoth, Tag: bluenosepit, Tag: pitbull, Tag: cassaved, Tag: cheyenneanimalshelter, Tag: flowers, Tag: boyswithink]",https://scontent.cdninstagram.com/hphotos-xfa1/t51.2885-15/e15/11330633_698066336960400_1638326108_n.jpg
1000322370810210610_900370313,2015-06-05 01:29:00,Lark,11,"[Tag: firstbase, Tag: baseballmom, Tag: myamariisbetterthanyours, Tag: baseball]",https://scontent.cdninstagram.com/hphotos-xfa1/t51.2885-15/e15/11377865_1859131910978506_1366319993_n.jpg
1000315405383008711_1617293359,2015-06-05 01:15:10,Normal,11,"[Tag: tattoos, Tag: alternativegirl, Tag: punkkids, Tag: indie, Tag: peace, Tag: punk, Tag: punkinpink, Tag: cute, Tag: flowercrown, Tag: poppunk, Tag: pxppunk]",https://scontent.cdninstagram.com/hphotos-xaf1/t51.2885-15/e15/11357910_401402703364696_809755048_n.jpg
1000313826856444313_244518111,2015-06-05 01:12:02,Normal,150,[Tag: tbt],https://scontent.cdninstagram.com/hphotos-xaf1/t51.2885-15/e15/11282614_1641543406066690_1516401837_n.jpg
1000311945736835384_269003667,2015-06-05 01:08:18,Lark,34,[Tag: tbt],https://scontent.cdninstagram.com/hphotos-xfa1/t51.2885-15/e15/11266151_453875264785463_875893052_n.jpg
1000310197331765531_248622633,2015-06-05 01:04:49,Ludwig,8,[Tag: wyoming],https://scontent.cdninstagram.com/hphotos-xaf1/t51.2885-15/e15/11377594_1602656906671929_193183181_n.jpg
1000307804035031433_551105967,2015-06-05 01:00:04,Normal,58,"[Tag: love, Tag: exploremore, Tag: hiking, Tag: rei1440project, Tag: utah, Tag: insta_exploring, Tag: instatravel, Tag: neverstopexploring, Tag: wild, Tag: getoutside, Tag: adventure, Tag: nature_seekers, Tag: vsco_hub, Tag: instadaily, Tag: vsco, Tag: wander, Tag: landscape, Tag: wanderlust, Tag: instavsco, Tag: welltravelled, Tag: exploreeverything, Tag: hike, Tag: vscophile, Tag: moab, Tag: peoplescreative, Tag: vscocam, Tag: instamood]",https://scontent.cdninstagram.com/hphotos-xaf1/t51.2885-15/e15/11417322_1456162178028705_506863255_n.jpg
1000297998627437653_386693646,2015-06-05 00:40:35,Normal,45,"[Tag: damonfizzy, Tag: cantwaittomeethim, Tag: screwsocietysstandards, Tag: warrior, Tag: snapchat, Tag: tumblr, Tag: lovehim, Tag: peaceskies, Tag: lifesaver, Tag: warpedtour, Tag: dream, Tag: favorite, Tag: staypositive, Tag: bae, Tag: peacetea, Tag: smile, Tag: youtuber, Tag: august2, Tag: fizzyfamilyforever]",https://scontent.cdninstagram.com/hphotos-xaf1/t51.2885-15/e15/11379325_904963879542912_879122625_n.jpg
1000286798149535101_174628536,2015-06-05 00:18:20,Normal,4,"[Tag: ngd, Tag: newguitar, Tag: deanvendetta]",https://scontent.cdninstagram.com/hphotos-xaf1/t51.2885-15/e15/11296752_396308670493656_475414202_n.jpg
1000278685953293826_1733752302,2015-06-05 00:02:13,Normal,30,"[Tag: summer, Tag: milliondollarlisting, Tag: 1properties, Tag: relax, Tag: firepit, Tag: volkteam, Tag: design, Tag: newlisting, Tag: bluesky, Tag: inspiration, Tag: instadesign, Tag: stone, Tag: realestate, Tag: wyoming, Tag: summernights, Tag: lounge, Tag: cheyenne, Tag: summertime, Tag: brick, Tag: forsale, Tag: patio, Tag: architecture]",https://scontent.cdninstagram.com/hphotos-xaf1/t51.2885-15/e15/11420772_677826242361538_1912479264_n.jpg
1000277952772058485_1628252186,2015-06-05 00:00:45,Normal,27,"[Tag: bdtravels, Tag: summerroadtrip2015, Tag: destinationdenver, Tag: humansoftheworld, Tag: destinationcolorado, Tag: adventures]",https://scontent.cdninstagram.com/hphotos-xaf1/t51.2885-15/e15/11283355_911610432213977_2096198146_n.jpg
1000276095788772015_186114985,2015-06-04 23:57:04,Valencia,17,"[Tag: backintheday, Tag: chubbycheeks, Tag: tbt, Tag: schoolpic]",https://scontent.cdninstagram.com/hphotos-xaf1/t51.2885-15/e15/11379309_476130549221149_1981140329_n.jpg
1000272381727736460_24885255,2015-06-04 23:49:41,Perpetua,7,"[Tag: mycity, Tag: thecity, Tag: warriors]",https://scontent.cdninstagram.com/hphotos-xfa1/t51.2885-15/e15/11419202_1735087643384754_104644472_n.jpg
1000268014639176160_224464149,2015-06-04 23:41:01,Normal,23,"[Tag: vedauwoo, Tag: camp4pix, Tag: wyoming, Tag: nautilus, Tag: wyolife]",https://scontent.cdninstagram.com/hphotos-xaf1/t51.2885-15/e15/11333668_379502138926905_713801126_n.jpg
1000266628124310334_397905445,2015-06-04 23:38:15,Juno,33,[Tag: watermelon],https://scontent.cdninstagram.com/hphotos-xaf1/t51.2885-15/e15/11378734_1631499107087875_1748680799_n.jpg
1000265009097800481_397905445,2015-06-04 23:35:02,Normal,14,[Tag: oneroomschoolhouse],https://scontent.cdninstagram.com/hphotos-xaf1/t51.2885-15/e15/11355003_1452828251694093_1452061284_n.jpg
1000254219996929505_4820038,2015-06-04 23:13:36,Normal,33,"[Tag: albertos, Tag: burrito, Tag: tbt, Tag: carneasada]",https://scontent.cdninstagram.com/hphotos-xaf1/t51.2885-15/e15/11357547_770346403081776_654905269_n.jpg
1000249062266138342_6099762,2015-06-04 23:03:21,Normal,10,"[Tag: imgoingonacruise, Tag: neriumblessings, Tag: neriumdelirium, Tag: vacation]",https://scontent.cdninstagram.com/hphotos-xfa1/t51.2885-15/e15/11334668_830503027003305_1880453605_n.jpg
1000244629951587362_8674200,2015-06-04 22:54:33,Normal,15,"[Tag: notsothrowback, Tag: tourist, Tag: pikesmarket, Tag: filipina, Tag: tbt, Tag: foreign, Tag: downtown, Tag: seattle, Tag: aboutaweekago]",https://scontent.cdninstagram.com/hphotos-xaf1/t51.2885-15/e15/11419026_838895402812810_1010328301_n.jpg
1000232090129317350_12051710,2015-06-04 22:29:38,Ashby,16,"[Tag: wyoming, Tag: yogiface, Tag: funwithmirrors]",https://scontent.cdninstagram.com/hphotos-xfa1/t51.2885-15/e15/11379707_1591789031097495_1981302738_n.jpg
1000228512533232503_29674269,2015-06-04 22:22:32,Normal,36,[Tag: throwbackthursday],https://scontent.cdninstagram.com/hphotos-xaf1/t51.2885-15/e15/11376021_848968531823182_1987575507_n.jpg
1000225487203006473_397905445,2015-06-04 22:16:31,Mayfair,3,"[Tag: sweateverydamnday, Tag: summertime, Tag: schoolsout, Tag: sunsoutgunsout, Tag: slim, Tag: slender]",https://scontent.cdninstagram.com/hphotos-xat1/t51.2885-15/e15/10919532_1111803758847746_1058577898_n.jpg
1000222076471912680_14821833,2015-06-04 22:09:44,Normal,31,"[Tag: smiles, Tag: chinese, Tag: relaxing, Tag: chi, Tag: selfie, Tag: medicine, Tag: tcm, Tag: energy, Tag: acupuncture, Tag: needles, Tag: fertility, Tag: alternative]",https://scontent.cdninstagram.com/hphotos-xaf1/t51.2885-15/e15/11357901_1609130542704625_1774746589_n.jpg
999737930283370241_543730400,2015-06-04 06:07:50,Crema,14,[Tag: wywx],https://scontent.cdninstagram.com/hphotos-xaf1/t51.2885-15/e15/11374656_1455463521433166_1589648875_n.jpg
999736317474286338_14821833,2015-06-04 06:04:37,Normal,23,"[Tag: beautiful, Tag: sunset, Tag: storm, Tag: nature, Tag: wyoming, Tag: sky, Tag: skies]",https://scontent.cdninstagram.com/hphotos-xfa1/t51.2885-15/e15/11379812_1646721922209957_1987890062_n.jpg
999718107307878922_14821833,2015-06-04 05:28:27,Normal,51,"[Tag: beautiful, Tag: lightening, Tag: nature, Tag: photographer, Tag: awesome, Tag: sky, Tag: wednesday, Tag: amazing, Tag: loveit, Tag: scary, Tag: freaky, Tag: cool]",https://scontent.cdninstagram.com/hphotos-xaf1/t51.2885-15/e15/11419273_394838440719414_199538756_n.jpg
999705174725617643_11277296,2015-06-04 05:02:45,Sierra,9,"[Tag: itsajeepthing, Tag: thegreatoutdoors]",https://scontent.cdninstagram.com/hphotos-xfa1/t51.2885-15/e15/11313695_350054845202534_536690945_n.jpg
999705144869292263_696916057,2015-06-04 05:02:41,Hudson,13,"[Tag: collectivenecklaces, Tag: leatherhandbags, Tag: popupshop, Tag: leathertote, Tag: fathersday, Tag: grad, Tag: alexisdrakepopup]",https://scontent.cdninstagram.com/hphotos-xaf1/t51.2885-15/e15/11417235_740544482734594_1676147849_n.jpg
999700951070145907_7627558,2015-06-04 04:54:21,X-Pro II,48,"[Tag: 28hourcarride, Tag: starvingcatsinafrica, Tag: atleastimnotdriving]",https://scontent.cdninstagram.com/hphotos-xfa1/t51.2885-15/e15/11386505_473783359443208_1633322013_n.jpg
999698581121438571_1834838363,2015-06-04 04:49:39,Normal,33,"[Tag: megandeangelis, Tag: megedits]",https://scontent.cdninstagram.com/hphotos-xaf1/t51.2885-15/e15/11356887_855801907829596_945003655_n.jpg
999682847111636609_11277296,2015-06-04 04:18:23,Normal,5,[Tag: crazystorm],https://scontent.cdninstagram.com/hphotos-xaf1/t51.2885-15/e15/11378004_1618872495026022_1773299134_n.jpg
999675550876085077_14821833,2015-06-04 04:03:53,Normal,11,"[Tag: cute, Tag: brady, Tag: smiles, Tag: sweet, Tag: baseball, Tag: noworries, Tag: photofy, Tag: lovehim, Tag: kiddo, Tag: allboy, Tag: stepson]",https://scontent.cdninstagram.com/hphotos-xaf1/t51.2885-15/e15/11353489_382792261918884_151182693_n.jpg
999671890162856063_428521643,2015-06-04 03:56:37,Perpetua,0,"[Tag: gotcha, Tag: correction]",https://scontent.cdninstagram.com/hphotos-xaf1/t51.2885-15/e15/11325325_1662265623986412_2043474106_n.jpg
999660799794415845_11977113,2015-06-04 03:34:35,Normal,50,"[Tag: travel, Tag: startingoffright, Tag: wyomingaintready, Tag: day1]",https://scontent.cdninstagram.com/hphotos-xaf1/t51.2885-15/e15/11313219_491399284350208_1810271702_n.jpg
999653839382792466_1496489369,2015-06-04 03:20:45,Normal,101,"[Tag: nextlevelsquad, Tag: refocused, Tag: teamventura]",https://scontent.cdninstagram.com/hphotos-xaf1/t51.2885-15/e15/11377440_1589648881293186_809520627_n.jpg
999644584071813133_1643368989,2015-06-04 03:02:22,Normal,5,"[Tag: springstorm, Tag: thunder, Tag: rain, Tag: lightening]",https://scontent.cdninstagram.com/hphotos-xfa1/t51.2885-15/e15/11379734_845646178823607_990710782_n.jpg
999642287344912128_144427496,2015-06-04 02:57:48,Ludwig,6,"[Tag: wyoming, Tag: dieselthedog]",https://scontent.cdninstagram.com/hphotos-xaf1/t51.2885-15/e15/11377891_1005707279442505_1659271005_n.jpg
999642058133529260_15606463,2015-06-04 02:57:21,Reyes,6,"[Tag: gta, Tag: grandtheftauto]",https://scontent.cdninstagram.com/hphotos-xfa1/t51.2885-15/e15/11273027_1662938853927037_1869150698_n.jpg
999640732673769657_1733440511,2015-06-04 02:54:43,Normal,19,"[Tag: getripped, Tag: getshredded, Tag: getbig, Tag: back, Tag: cleaneating, Tag: health, Tag: fitness, Tag: lifting]",https://scontent.cdninstagram.com/hphotos-xfa1/t51.2885-15/e15/11378606_1662273847340253_345316463_n.jpg
999639292201188661_32937862,2015-06-04 02:51:51,Dogpatch,42,"[Tag: wyoming, Tag: wywx, Tag: thunderstorm, Tag: wy, Tag: lightning]",https://scontent.cdninstagram.com/hphotos-xfa1/t51.2885-15/e15/11379182_1595860970669891_1132805087_n.jpg
999638946986773098_302614785,2015-06-04 02:51:10,Ginza,288,"[Tag: yeass, Tag: lightening, Tag: nightmade, Tag: inlove]",https://scontent.cdninstagram.com/hphotos-xfa1/t51.2885-15/e15/11410424_992004817485956_1288008005_n.jpg
999632133440057540_205659267,2015-06-04 02:37:38,Normal,21,"[Tag: wyomingskies, Tag: supercell, Tag: thunderstorm]",https://scontent.cdninstagram.com/hphotos-xaf1/t51.2885-15/e15/11378026_834955546553035_2041319453_n.jpg
999623664384042967_31208032,2015-06-04 02:20:48,Normal,6,"[Tag: cheyennehomes, Tag: wyoming, Tag: coldwellbanker, Tag: wyominghomewednesday, Tag: cbtpe, Tag: realestate]",https://scontent.cdninstagram.com/hphotos-xaf1/t51.2885-15/e15/11376187_1438510553121322_1485104081_n.jpg
999621357590225909_551105967,2015-06-04 02:16:13,Normal,51,"[Tag: wyomingexplored, Tag: instanature, Tag: art, Tag: exploremore, Tag: rei1440project, Tag: getoutstayout, Tag: insta_exploring, Tag: instatravel, Tag: getoutside, Tag: adventure, Tag: nature_seekers, Tag: vsco_hub, Tag: naturelovers, Tag: love, Tag: instadaily, Tag: vsco, Tag: wander, Tag: landscape, Tag: wanderlust, Tag: instavsco, Tag: gooutstayout, Tag: exploreeverything, Tag: vscophile, Tag: wild, Tag: vscocam]",https://scontent.cdninstagram.com/hphotos-xfa1/t51.2885-15/e15/11311268_969053243127218_729015206_n.jpg
999620667821452191_376242233,2015-06-04 02:14:51,Normal,113,"[Tag: hbd, Tag: vegas, Tag: 21, Tag: cousins]",https://scontent.cdninstagram.com/hphotos-xaf1/t51.2885-15/e15/11421949_445995645571914_2101472114_n.jpg
999615949148259714_196304864,2015-06-04 02:05:28,Sierra,62,"[Tag: graduating, Tag: cousins, Tag: soproud]",https://scontent.cdninstagram.com/hphotos-xfa1/t51.2885-15/e15/11376047_498841650269771_2011638449_n.jpg
999609813884638460_206471444,2015-06-04 01:53:17,Normal,8,[Tag: allahakbar],https://scontent.cdninstagram.com/hphotos-xaf1/t51.2885-15/e15/11378344_1410232622636202_1129434620_n.jpg
999605294011526397_1293562570,2015-06-04 01:44:18,Normal,60,"[Tag: summer, Tag: wakeboarding, Tag: favorite, Tag: getonmylevel, Tag: watersports]",https://scontent.cdninstagram.com/hphotos-xaf1/t51.2885-15/e15/11296698_1591896627742468_688598214_n.jpg
999605192226493753_193724852,2015-06-04 01:44:06,Normal,1,"[Tag: archetypeofthecore, Tag: varchetype]",https://scontent.cdninstagram.com/hphotos-xfa1/t51.2885-15/e15/11376113_872001489534083_1829485613_n.jpg
999600954634929965_11907560,2015-06-04 01:35:41,Lark,16,"[Tag: horses, Tag: cheyanne, Tag: bestfriends, Tag: wyoming]",https://scontent.cdninstagram.com/hphotos-xfa1/t51.2885-15/e15/11328500_899277013452583_477146309_n.jpg
999600302044986903_181114334,2015-06-04 01:34:23,Lo-fi,1,"[Tag: theamericanwest, Tag: equalrights, Tag: cheyenne]",https://scontent.cdninstagram.com/hphotos-xfa1/t51.2885-15/e15/11351936_843341225721717_1985786682_n.jpg
999598316722050181_193724852,2015-06-04 01:30:26,Stinson,1,[Tag: deletethis],https://scontent.cdninstagram.com/hphotos-xaf1/t51.2885-15/e15/11357571_875964982474851_338447005_n.jpg
