ID,Created At,Filter,Number of Likes,HashTags,url
1001135348210133399_5087489,2015-06-06 04:24:15,Lo-fi,8,"[Tag: newmexicotrue, Tag: abqweekend, Tag: imagoodluckcharm, Tag: abqtopes, Tag: d🍩nutday, Tag: projectlife]",https://scontent.cdninstagram.com/hphotos-xaf1/t51.2885-15/e15/11376538_692645227546476_76942595_n.jpg
1001132394873903829_2077671557,2015-06-06 04:18:23,X-Pro II,19,"[Tag: building, Tag: carvings, Tag: granada, Tag: windows, Tag: light, Tag: andalucia, Tag: alhambra, Tag: arches, Tag: celestial, Tag: architecture, Tag: espana, Tag: spain]",https://scontent.cdninstagram.com/hphotos-xfa1/t51.2885-15/e15/11274335_455434574637431_560110720_n.jpg
1001132290706392197_340583728,2015-06-06 04:18:10,Normal,3,"[Tag: miojitos, Tag: yadiralexander]",https://scontent.cdninstagram.com/hphotos-xfa1/t51.2885-15/e15/11282810_472698906232700_1658568464_n.jpg
1001130628384753636_30332240,2015-06-06 04:14:52,Normal,14,"[Tag: r8, Tag: audi]",https://scontent.cdninstagram.com/hphotos-xaf1/t51.2885-15/e15/11335549_1452284131753913_1553813569_n.jpg
1001128157623344033_1004597,2015-06-06 04:09:58,Reyes,47,"[Tag: thecrew, Tag: polercampstuff, Tag: stussy, Tag: burque, Tag: downtown, Tag: abq, Tag: adventuresinparenting, Tag: newmexicotrue, Tag: familynight]",https://scontent.cdninstagram.com/hphotos-xaf1/t51.2885-15/e15/11246787_446216572206397_635707173_n.jpg
1001127647402897961_18684459,2015-06-06 04:08:57,Normal,12,"[Tag: beer, Tag: indio]",https://scontent.cdninstagram.com/hphotos-xaf1/t51.2885-15/e15/11386453_759875640796446_810876579_n.jpg
1001122836293011111_235484528,2015-06-06 03:59:23,Rise,13,"[Tag: frenchcuisine, Tag: bleufromage, Tag: filetmignon, Tag: bleucheese, Tag: mashedpotatoes, Tag: france]",https://scontent.cdninstagram.com/hphotos-xaf1/t51.2885-15/e15/11336020_478257709017470_917696106_n.jpg
1001122741542212390_1434048091,2015-06-06 03:59:12,Normal,19,"[Tag: isotopes, Tag: win, Tag: dt, Tag: topes, Tag: forthewin]",https://scontent.cdninstagram.com/hphotos-xaf1/t51.2885-15/e15/11355867_835489259833062_373744640_n.jpg
1001121916431964624_33324677,2015-06-06 03:57:34,Juno,21,"[Tag: jdm, Tag: acura, Tag: boostcity, Tag: imallaboutthatboost, Tag: nsx, Tag: nmdessertfest, Tag: boosterrooster, Tag: turbbin]",https://scontent.cdninstagram.com/hphotos-xaf1/t51.2885-15/e15/11279953_655169841249328_1762535226_n.jpg
1001120743586800194_177949359,2015-06-06 03:55:14,Normal,82,[Tag: icecreamsandwhich],https://scontent.cdninstagram.com/hphotos-xaf1/t51.2885-15/e15/11283165_383494261840685_894162064_n.jpg
1001117844023073670_1092649917,2015-06-06 03:49:28,Normal,405,"[Tag: catdaddy, Tag: womenlovepussiestoo, Tag: catsandmen, Tag: kitty, Tag: meow, Tag: menlovecats, Tag: pussywhipped, Tag: menandcats, Tag: menwithcats, Tag: catdad, Tag: catman, Tag: menlovepussies, Tag: kittycat, Tag: realmenlovepussy, Tag: catsofinstagram, Tag: welovepussies, Tag: notacliche, Tag: cat, Tag: crazycatman, Tag: cats, Tag: catlove]",https://scontent.cdninstagram.com/hphotos-xaf1/t51.2885-15/e15/11386552_948890111800190_1865778070_n.jpg
1001115276613161229_475519003,2015-06-06 03:44:22,Normal,14,[Tag: pizzaprophet],https://scontent.cdninstagram.com/hphotos-xaf1/t51.2885-15/e15/11327083_549823491823445_2085233133_n.jpg
1001114492773545221_1164014300,2015-06-06 03:42:49,Lark,2,"[Tag: cookies, Tag: noonecares, Tag: allmine]",https://scontent.cdninstagram.com/hphotos-xfa1/t51.2885-15/e15/11380052_370414066477702_953794259_n.jpg
1001114005571981048_1712854690,2015-06-06 03:41:51,Normal,161,"[Tag: motivation, Tag: fitfam, Tag: fitgirl, Tag: healthyoption, Tag: workout, Tag: cleaneating, Tag: healthychoices, Tag: vegan, Tag: lifestyle, Tag: detox, Tag: portioncontrol, Tag: fitlifestyle, Tag: tourlife, Tag: whatveganseat, Tag: mdqontour, Tag: 21dayfixapproved, Tag: vegansofig, Tag: actorlife, Tag: travel, Tag: glutenfree, Tag: noexcuses, Tag: actor, Tag: weightloss, Tag: 21dayfix, Tag: tour, Tag: healthyfoodporn, Tag: eatclean, Tag: transformation, Tag: goals]",https://scontent.cdninstagram.com/hphotos-xaf1/t51.2885-15/e15/11296686_1654040318150614_2067414293_n.jpg
1001112647982155820_221522081,2015-06-06 03:39:09,Normal,35,"[Tag: abq, Tag: beer, Tag: nobhill, Tag: unm, Tag: beerislife]",https://scontent.cdninstagram.com/hphotos-xaf1/t51.2885-15/e15/11378106_1129699703724939_545845838_n.jpg
1001112379965234502_247216206,2015-06-06 03:38:37,Normal,51,"[Tag: firstplace, Tag: teamutah, Tag: santafe]",https://scontent.cdninstagram.com/hphotos-xaf1/t51.2885-15/e15/11374737_390387927831191_503839585_n.jpg
1001111070496347945_294232388,2015-06-06 03:36:01,Normal,37,"[Tag: purenm, Tag: sandia, Tag: igersabq, Tag: albuquerque, Tag: vip, Tag: baseball, Tag: expensive, Tag: isotopes, Tag: nm, Tag: eleven, Tag: dukecity, Tag: burque, Tag: sports, Tag: abq, Tag: beer, Tag: dolllars, Tag: victory, Tag: suite, Tag: newmexico, Tag: 505]",https://scontent.cdninstagram.com/hphotos-xaf1/t51.2885-15/e15/11355864_796989000408740_1880252232_n.jpg
1001110456122174959_295891498,2015-06-06 03:34:47,Normal,28,[Tag: getonitgurl],https://scontent.cdninstagram.com/hphotos-xaf1/t51.2885-15/e15/11330776_453029758197790_453082359_n.jpg
1001110011759810407_1484820500,2015-06-06 03:33:54,Normal,14,[Tag: befornine],https://scontent.cdninstagram.com/hphotos-xfa1/t51.2885-15/e15/11380037_1530398450514124_1104961588_n.jpg
1001109637849593162_444012,2015-06-06 03:33:10,Lark,14,"[Tag: weareactuallywinning, Tag: abqtopes]",https://scontent.cdninstagram.com/hphotos-xaf1/t51.2885-15/e15/11379903_1446941162273683_217129908_n.jpg
1001109283052597190_11713210,2015-06-06 03:32:28,Nashville,43,[Tag: handstand],https://scontent.cdninstagram.com/hphotos-xfa1/t51.2885-15/e15/11324249_900559373343384_1198405799_n.jpg
1001107883807694346_30828286,2015-06-06 03:29:41,Normal,35,"[Tag: mountains, Tag: photograph, Tag: dogsofinstagram, Tag: hiking, Tag: mansbestfriend, Tag: pitbullsofinstagram, Tag: life, Tag: pitbull, Tag: australiancattledog]",https://scontent.cdninstagram.com/hphotos-xfa1/t51.2885-15/e15/11328545_841136525921742_1791220990_n.jpg
1001107229820828112_20035749,2015-06-06 03:28:23,Amaro,33,[Tag: circus],https://scontent.cdninstagram.com/hphotos-xfa1/t51.2885-15/e15/11350754_1426123871043672_290941329_n.jpg
1001106965530280351_190736663,2015-06-06 03:27:51,Perpetua,26,"[Tag: wineporn, Tag: moscato, Tag: scalos, Tag: dinner, Tag: happypeople, Tag: internationallove, Tag: delicious, Tag: 2years, Tag: wine]",https://scontent.cdninstagram.com/hphotos-xaf1/t51.2885-15/e15/11378488_710617515709987_893332763_n.jpg
1001106275393018911_372188526,2015-06-06 03:26:29,Amaro,10,"[Tag: respect, Tag: fairydress, Tag: flowers, Tag: roses]",https://scontent.cdninstagram.com/hphotos-xaf1/t51.2885-15/e15/11282239_1639554642934217_839794277_n.jpg
1001105403102677885_288432609,2015-06-06 03:24:45,Ashby,54,"[Tag: foamroller, Tag: tendinitis, Tag: ifbb, Tag: ufc, Tag: mma, Tag: muscleandhealth, Tag: lifting]",https://scontent.cdninstagram.com/hphotos-xpa1/t51.2885-15/e15/11123942_385453034993696_231076439_n.jpg
1001103972466718647_278651820,2015-06-06 03:21:55,Juno,27,"[Tag: pb, Tag: lifeinabq, Tag: treats, Tag: gradschool, Tag: cupcake]",https://scontent.cdninstagram.com/hphotos-xfa1/t51.2885-15/e15/11312096_648092671990665_86058156_n.jpg
1001102413335299496_183422240,2015-06-06 03:18:49,Lo-fi,22,"[Tag: gotopes, Tag: pictureabq]",https://scontent.cdninstagram.com/hphotos-xaf1/t51.2885-15/e15/11377890_773067219481260_2043503182_n.jpg
1001101744846999446_1436327114,2015-06-06 03:17:29,Ludwig,12,"[Tag: smokeweedeveryday, Tag: girlsgonekush, Tag: smokingeveryday, Tag: joints, Tag: stonerkitty, Tag: weed, Tag: high, Tag: cats, Tag: girlswhosmokeweed, Tag: yeahh, Tag: hashtag, Tag: blunts]",https://scontent.cdninstagram.com/hphotos-xfa1/t51.2885-15/e15/11376170_1449554392027836_1189778643_n.jpg
1000454117711602842_318334536,2015-06-05 05:50:46,Normal,18,"[Tag: happycamper, Tag: nighttoremember, Tag: foralotofpictures, Tag: beprepared, Tag: andhashtags]",https://scontent.cdninstagram.com/hphotos-xfa1/t51.2885-15/e15/11287817_869923519767284_1640368009_n.jpg
1000452599950240019_444822457,2015-06-05 05:47:45,Normal,19,"[Tag: newyork, Tag: abq, Tag: tbt]",https://scontent.cdninstagram.com/hphotos-xfa1/t51.2885-15/e15/11420909_121538158178070_413459757_n.jpg
1000451089877275491_193854707,2015-06-05 05:44:45,Lark,36,"[Tag: beardy, Tag: andyscute, Tag: shopping, Tag: mancrush, Tag: nobhill, Tag: aqua]",https://scontent.cdninstagram.com/hphotos-xaf1/t51.2885-15/e15/11358198_1450090888624626_987491905_n.jpg
1000446364413087693_1158042834,2015-06-05 05:35:22,Normal,6,"[Tag: bringstearstomyeyes, Tag: ga, Tag: missing, Tag: atlanta, Tag: albuquerque, Tag: relieftomyheart]",https://scontent.cdninstagram.com/hphotos-xfa1/t51.2885-15/e15/11357774_1459484494348819_794515391_n.jpg
1000440934611643660_261109698,2015-06-05 05:24:34,Normal,87,[Tag: gn],https://scontent.cdninstagram.com/hphotos-xaf1/t51.2885-15/e15/11378997_891976120874385_631670764_n.jpg
1000440433892241717_215241387,2015-06-05 05:23:35,Normal,16,[Tag: onedayillaffordthesebeautifulboots],https://scontent.cdninstagram.com/hphotos-xfa1/t51.2885-15/e15/11378624_100138336995530_999956975_n.jpg
1000437577438950606_465968292,2015-06-05 05:17:54,Valencia,29,"[Tag: darkhair, Tag: itsthursday, Tag: goodgenes, Tag: browneyes, Tag: workflow]",https://scontent.cdninstagram.com/hphotos-xaf1/t51.2885-15/e15/11373570_1596833323912975_1922892787_n.jpg
1000433198595627536_1092649917,2015-06-05 05:09:12,Rise,351,"[Tag: catdaddy, Tag: womenlovepussiestoo, Tag: catsandmen, Tag: kitty, Tag: menlovecats, Tag: pussywhipped, Tag: menandcats, Tag: menwithcats, Tag: catdad, Tag: catman, Tag: menlovepussies, Tag: kittycat, Tag: realmenlovepussy, Tag: catsofinstagram, Tag: welovepussies, Tag: notacliche, Tag: cat, Tag: crazycatman, Tag: cats, Tag: catlove]",https://scontent.cdninstagram.com/hphotos-xaf1/t51.2885-15/e15/11376012_823115064424418_2111440304_n.jpg
1000426871361107512_18473836,2015-06-05 04:56:38,Normal,26,"[Tag: tattoo, Tag: hippie, Tag: tattoos, Tag: inked, Tag: inks, Tag: ink, Tag: ififall, Tag: tatted, Tag: 1st, Tag: myfirsttime, Tag: happy]",https://scontent.cdninstagram.com/hphotos-xfa1/t51.2885-15/e15/11335562_1618419331703377_1413975770_n.jpg
1000425145763819893_1230326979,2015-06-05 04:53:12,Normal,10,"[Tag: isletaamphitheater, Tag: albuquerque, Tag: lukebryan, Tag: kickthedustuptour]",https://scontent.cdninstagram.com/hphotos-xfa1/t51.2885-15/e15/11352935_1622147014732614_959062526_n.jpg
1000421387224423583_372188526,2015-06-05 04:45:44,Normal,25,"[Tag: lovemygirls, Tag: mommamoves, Tag: singing, Tag: jamout, Tag: idancelikeyourmomdances, Tag: drive, Tag: carefree, Tag: laugh, Tag: roadtrippin, Tag: fun, Tag: sing, Tag: putthedamnphonedown, Tag: friends]",https://scontent.cdninstagram.com/hphotos-xfa1/t51.2885-15/e15/11274461_697050547087172_1975339420_n.jpg
1000419514264411813_249956622,2015-06-05 04:42:01,Normal,12,"[Tag: nobhill, Tag: sandals]",https://scontent.cdninstagram.com/hphotos-xaf1/t51.2885-15/e15/11326660_1381495672157192_1739869975_n.jpg
1000413056066482275_1731300091,2015-06-05 04:29:11,Normal,153,"[Tag: jacksonwinkmma, Tag: ufc, Tag: albuquerque, Tag: keithjardine, Tag: fanartwork, Tag: thedeanofmean, Tag: newmexico, Tag: mma]",https://scontent.cdninstagram.com/hphotos-xaf1/t51.2885-15/e15/11311183_708335992628981_19977352_n.jpg
1000412603881210479_365967671,2015-06-05 04:28:17,Ludwig,35,"[Tag: nmjuicebars, Tag: loboswimmeet, Tag: organic, Tag: poweredbyjuice]",https://scontent.cdninstagram.com/hphotos-xaf1/t51.2885-15/e15/11357743_1442052282780267_1713973059_n.jpg
1000406277361990934_1294468806,2015-06-05 04:15:43,Ludwig,18,"[Tag: abq, Tag: ignm, Tag: abqtopes]",https://scontent.cdninstagram.com/hphotos-xaf1/t51.2885-15/e15/11410444_1641147239463058_374822245_n.jpg
1000404723707308765_1226558225,2015-06-05 04:12:38,X-Pro II,12,"[Tag: ladybait, Tag: studmuffin, Tag: summershred, Tag: gym, Tag: lean, Tag: selfie]",https://scontent.cdninstagram.com/hphotos-xaf1/t51.2885-15/e15/11266642_1635561643326276_1014760923_n.jpg
1000404522917309066_1450177953,2015-06-05 04:12:14,Normal,12,"[Tag: watercolor, Tag: arrows, Tag: lines, Tag: illustration, Tag: ink]",https://scontent.cdninstagram.com/hphotos-xaf1/t51.2885-15/e15/11333697_837155223031137_927619248_n.jpg
1000401712324019164_1387789351,2015-06-05 04:06:39,Normal,121,"[Tag: throwback, Tag: vet, Tag: pima]",https://scontent.cdninstagram.com/hphotos-xaf1/t51.2885-15/e15/11283406_983820518308548_830950517_n.jpg
1000401313258341405_5376600,2015-06-05 04:05:51,Valencia,12,"[Tag: otakukitty, Tag: naptime]",https://scontent.cdninstagram.com/hphotos-xfa1/t51.2885-15/e15/11357936_1574554886140336_814739788_n.jpg
1000400084085870548_1419923426,2015-06-05 04:03:25,Normal,36,"[Tag: tibbers, Tag: gaming, Tag: leagueoflegends, Tag: annie, Tag: gamergirl, Tag: f4f, Tag: lol]",https://scontent.cdninstagram.com/hphotos-xat1/t51.2885-15/e15/1600002_1103053899711321_1147103292_n.jpg
1000396873682121823_18473836,2015-06-05 03:57:02,Normal,30,"[Tag: tatts, Tag: inks, Tag: love, Tag: tattoos, Tag: mystud, Tag: ink, Tag: thankful, Tag: tatted, Tag: learning, Tag: 1st, Tag: tattooed, Tag: inklife, Tag: tattoo, Tag: inklove, Tag: hippie, Tag: inked, Tag: lesbianswithink, Tag: teamchris, Tag: stud, Tag: myfirsttime, Tag: tatt, Tag: fun, Tag: happy]",https://scontent.cdninstagram.com/hphotos-xfa1/t51.2885-15/e15/11379986_1079073998773919_1774374803_n.jpg
1000396419982455617_265657075,2015-06-05 03:56:08,Normal,24,"[Tag: freedom, Tag: murica]",https://scontent.cdninstagram.com/hphotos-xfa1/t51.2885-15/e15/11357747_1421285211528474_1736673840_n.jpg
1000395869580188258_2077671557,2015-06-05 03:55:02,Mayfair,73,"[Tag: city, Tag: abqinabox, Tag: nm, Tag: nightlandscape, Tag: nature, Tag: sky, Tag: mountains, Tag: manvsnature, Tag: purplesky, Tag: abq, Tag: sandias, Tag: sunset, Tag: sandiapeak, Tag: howtoabq, Tag: landscape]",https://scontent.cdninstagram.com/hphotos-xaf1/t51.2885-15/e15/11378707_268415086665361_949345516_n.jpg
1000393713801800122_1185573113,2015-06-05 03:50:45,Lark,25,[Tag: abqisotopes],https://scontent.cdninstagram.com/hphotos-xaf1/t51.2885-15/e15/11377648_985627078143921_1602363333_n.jpg
1000392901230533429_323267757,2015-06-05 03:49:08,Ludwig,5,[Tag: youthwork],https://scontent.cdninstagram.com/hphotos-xaf1/t51.2885-15/e15/11426224_1594909534111516_1258671426_n.jpg
1000386298222518503_2042803623,2015-06-05 03:36:01,Normal,42,[Tag: tb],https://scontent.cdninstagram.com/hphotos-xfa1/t51.2885-15/e15/11296709_1671578483073359_1720111627_n.jpg
1000385497268277754_104942099,2015-06-05 03:34:26,Normal,42,"[Tag: alejandroleyba, Tag: drum, Tag: hero4, Tag: barleyroom, Tag: proud, Tag: percussion, Tag: gopro, Tag: drummer, Tag: mapex, Tag: drums, Tag: youngdudejamming]",https://scontent.cdninstagram.com/hphotos-xaf1/t51.2885-15/e15/11378872_1590596551228058_1780122111_n.jpg
1000384452308525069_1437302839,2015-06-05 03:32:21,Normal,13,"[Tag: steel, Tag: stairs, Tag: funkysteel]",https://scontent.cdninstagram.com/hphotos-xaf1/t51.2885-15/e15/11282590_1439590489680057_139270719_n.jpg
1000384399779871702_205013629,2015-06-05 03:32:15,Normal,117,[Tag: tbt],https://scontent.cdninstagram.com/hphotos-xaf1/t51.2885-15/e15/11333395_1128619630497171_385692775_n.jpg
1000384072301769321_1731300091,2015-06-05 03:31:36,Normal,180,"[Tag: backintime, Tag: cowboy, Tag: ufc, Tag: albuquerque, Tag: donaldcerrone, Tag: jacksonwinkmma, Tag: mma, Tag: newmexico]",https://scontent.cdninstagram.com/hphotos-xaf1/t51.2885-15/e15/11282277_1602981539978476_243495819_n.jpg
1000383451477894586_53350312,2015-06-05 03:30:22,Normal,7,[Tag: baseball],https://scontent.cdninstagram.com/hphotos-xaf1/t51.2885-15/e15/11334534_1606778282936818_1533338562_n.jpg
1000381752055748035_1011001076,2015-06-05 03:26:59,Normal,15,"[Tag: inyourface, Tag: whatyougonnado]",https://scontent.cdninstagram.com/hphotos-xfa1/t51.2885-15/e15/11379122_1634463096772236_109090714_n.jpg
1000381563441502795_1004597,2015-06-05 03:26:37,Reyes,29,"[Tag: coffee, Tag: pourover, Tag: coffeelove, Tag: manualdrip, Tag: acaica, Tag: decafnoir, Tag: decafhasitaplace, Tag: kalita]",https://scontent.cdninstagram.com/hphotos-xaf1/t51.2885-15/e15/11267091_1670694766496132_1254835554_n.jpg
1000380748401634688_180846946,2015-06-05 03:24:59,Normal,135,"[Tag: fireandmetal, Tag: bodybranding]",https://scontent.cdninstagram.com/hphotos-xfa1/t51.2885-15/e15/11419259_856985881005729_1185528866_n.jpg
1000373053599656927_1450177953,2015-06-05 03:09:42,Normal,14,"[Tag: watercolor, Tag: arrows, Tag: lines, Tag: illustration]",https://scontent.cdninstagram.com/hphotos-xaf1/t51.2885-15/e15/11379994_383159245214974_431376466_n.jpg
1000372320385197700_26838160,2015-06-05 03:08:15,Normal,16,"[Tag: sketch, Tag: babe, Tag: original, Tag: burntoutbabe, Tag: fox, Tag: mine, Tag: hey, Tag: pen, Tag: bae, Tag: anime, Tag: ink, Tag: ay, Tag: art, Tag: instasize, Tag: manga]",https://scontent.cdninstagram.com/hphotos-xaf1/t51.2885-15/e15/11357589_875575335842389_1187104837_n.jpg
1000372046355682933_23834276,2015-06-05 03:07:42,Normal,8,[Tag: apothecary],https://scontent.cdninstagram.com/hphotos-xaf1/t51.2885-15/e15/11376445_1681609648727440_150875960_n.jpg
1000371391850864693_845113831,2015-06-05 03:06:24,Normal,19,[Tag: tbt],https://scontent.cdninstagram.com/hphotos-xaf1/t51.2885-15/e15/10254142_1602166023375706_2095874536_n.jpg
1000371126283287767_52262830,2015-06-05 03:05:52,Amaro,14,"[Tag: favoritebeerever, Tag: 2paccalired]",https://scontent.cdninstagram.com/hphotos-xaf1/t51.2885-15/e15/11410464_1456823057948748_292297805_n.jpg
1000369198840578659_388572207,2015-06-05 03:02:03,Slumber,2,"[Tag: sisterfriends, Tag: twining]",https://scontent.cdninstagram.com/hphotos-xaf1/t51.2885-15/e15/11335047_936350059720494_1172656290_n.jpg
1000367608420146723_42178110,2015-06-05 02:58:53,Normal,13,"[Tag: cocktailsipping, Tag: patiositting]",https://scontent.cdninstagram.com/hphotos-xaf1/t51.2885-15/e15/11254233_1013860261967588_204254238_n.jpg
1000366541411199047_257325009,2015-06-05 02:56:46,Lark,35,"[Tag: shop, Tag: starwars, Tag: fashion, Tag: missing, Tag: photo, Tag: dividedgrey, Tag: tbt, Tag: darthvader, Tag: styled, Tag: darklord, Tag: shirt, Tag: comicbook, Tag: shorts, Tag: mystyle, Tag: abq, Tag: mensfashion, Tag: found, Tag: newmexico]",https://scontent.cdninstagram.com/hphotos-xaf1/t51.2885-15/e15/11382544_107895149547232_616648419_n.jpg
1000366240142815449_1731300091,2015-06-05 02:56:10,Sierra,163,"[Tag: omariakhmedov, Tag: jacksonwinkmma, Tag: newmexico, Tag: ufc, Tag: mma, Tag: albuquerque, Tag: fightweek]",https://scontent.cdninstagram.com/hphotos-xfa1/t51.2885-15/e15/11313686_688503524628895_260023163_n.jpg
1000363383545024287_1412490146,2015-06-05 02:50:29,Normal,10,"[Tag: deathmetal, Tag: metal, Tag: instagram]",https://scontent.cdninstagram.com/hphotos-xaf1/t51.2885-15/e15/11281981_384275091769468_1420557907_n.jpg
1000362106314214206_938011969,2015-06-05 02:47:57,Normal,41,"[Tag: guildcinema, Tag: filingcabinet, Tag: storage, Tag: albuquerque, Tag: candy, Tag: system]",https://scontent.cdninstagram.com/hphotos-xfa1/t51.2885-15/e15/11379698_781764788588095_1302762939_n.jpg
1000362011397128291_390416983,2015-06-05 02:47:46,Normal,14,"[Tag: gwbgoeswest, Tag: georgeeatsabq, Tag: sopaipilla]",https://scontent.cdninstagram.com/hphotos-xaf1/t51.2885-15/e15/11380818_1641426452745910_1834672086_n.jpg
999738154133114661_1412490146,2015-06-04 06:08:16,Normal,5,[Tag: fingereleven],https://scontent.cdninstagram.com/hphotos-xaf1/t51.2885-15/e15/11283319_1597361350512289_216350170_n.jpg
999734241992993829_261109698,2015-06-04 06:00:30,Inkwell,72,"[Tag: gn, Tag: closeup]",https://scontent.cdninstagram.com/hphotos-xaf1/t51.2885-15/e15/11374656_871252322948322_15628119_n.jpg
999733009143164515_31918450,2015-06-04 05:58:03,Normal,71,"[Tag: purenm, Tag: igersabq, Tag: igersnm, Tag: nmtrue, Tag: solarpower, Tag: architecture, Tag: solar, Tag: chasinglight]",https://scontent.cdninstagram.com/hphotos-xfa1/t51.2885-15/e15/11352854_428246144014796_1509047498_n.jpg
999730992974503128_325808174,2015-06-04 05:54:03,Normal,55,"[Tag: summer, Tag: pawpunk, Tag: joelshat, Tag: sickinvite, Tag: 病了, Tag: brickyardpizza, Tag: ilovemygrandma, Tag: aprophecymisread, Tag: apm, Tag: noboatsallamerica, Tag: friends, Tag: selfiegameonpoint, Tag: meowdown, Tag: joelshatadventure, Tag: rumbleintherockies, Tag: poppunkkids, Tag: mexicanjesus, Tag: netflex, Tag: sick, Tag: localshows, Tag: illfittingflannel, Tag: postshowhangs, Tag: pizza]",https://scontent.cdninstagram.com/hphotos-xfa1/t51.2885-15/e15/11410505_471207906369226_383945637_n.jpg
999722450133839308_31918450,2015-06-04 05:37:04,Normal,65,"[Tag: igersnm, Tag: igersabq, Tag: purenm, Tag: chasinglight]",https://scontent.cdninstagram.com/hphotos-xfa1/t51.2885-15/e15/11376527_1595196110766327_1787843626_n.jpg
999718401856981442_225311745,2015-06-04 05:29:02,Normal,19,"[Tag: nyc, Tag: sleepytimekit, Tag: jetblue, Tag: redeye, Tag: abq]",https://scontent.cdninstagram.com/hphotos-xfa1/t51.2885-15/e15/11358032_1395838680746770_1513598966_n.jpg
999713358368663332_318334536,2015-06-04 05:19:00,Normal,27,"[Tag: flapforthebathroom, Tag: pjs]",https://scontent.cdninstagram.com/hphotos-xaf1/t51.2885-15/e15/11373733_1598550513747995_475184382_n.jpg
999712204771189772_145945152,2015-06-04 05:16:43,Normal,34,"[Tag: kiwi, Tag: alwaystheroomie, Tag: girlsnight, Tag: iloveyoulikexoxo, Tag: strawberries, Tag: amolguin, Tag: humpday, Tag: nailsbyme]",https://scontent.cdninstagram.com/hphotos-xfa1/t51.2885-15/e15/11380841_469299089895529_1714991005_n.jpg
999710989023531023_407134947,2015-06-04 05:14:18,Normal,11,[Tag: mmm],https://scontent.cdninstagram.com/hphotos-xfa1/t51.2885-15/e15/11334626_371665396375815_843803789_n.jpg
999703404609895061_395930349,2015-06-04 04:59:14,Hudson,21,"[Tag: holly, Tag: hollyday, Tag: birthday, Tag: dogsofinstagram, Tag: instadog]",https://scontent.cdninstagram.com/hphotos-xfa1/t51.2885-15/e15/11372021_1450122488616582_252141015_n.jpg
999700524392352818_224927914,2015-06-04 04:53:30,Normal,12,"[Tag: lovebug, Tag: sleepingbaby, Tag: mybaby, Tag: lovehim]",https://scontent.cdninstagram.com/hphotos-xaf1/t51.2885-15/e15/11358090_1155089061183183_938292932_n.jpg
999699537751169285_1004597,2015-06-04 04:51:33,Crema,27,"[Tag: ohfuckmoment, Tag: forgottobreakatwenty, Tag: toothfairy]",https://scontent.cdninstagram.com/hphotos-xfa1/t51.2885-15/e15/11376560_1415801318744921_1178931105_n.jpg
999698541985756386_1626885604,2015-06-04 04:49:34,Normal,21,"[Tag: burquebaby, Tag: slightlyspoiled, Tag: albuquerquekid, Tag: summer2k15, Tag: summernights]",https://scontent.cdninstagram.com/hphotos-xaf1/t51.2885-15/e15/11374692_1594430770807299_1705225037_n.jpg
999689869364672565_1461900621,2015-06-04 04:32:20,Normal,12,[Tag: whoops],https://scontent.cdninstagram.com/hphotos-xfa1/t51.2885-15/e15/11375867_1624601407752613_1798050340_n.jpg
999689682718522009_2137310989,2015-06-04 04:31:58,Normal,9,"[Tag: animecouples, Tag: anime2015, Tag: reachingyou, Tag: animerivals, Tag: animegirl, Tag: kazehaya, Tag: otaku, Tag: anime, Tag: sawako, Tag: sawakoxkazehaya, Tag: sawakokuronuma, Tag: kiminitodoke, Tag: kazehayashouta, Tag: frommetoyou]",https://scontent.cdninstagram.com/hphotos-xaf1/t51.2885-15/e15/11356404_1102287759787276_589767389_n.jpg
999686948503052022_3761942,2015-06-04 04:26:32,Amaro,60,"[Tag: day307, Tag: handstandjourney, Tag: yoga, Tag: 365daysofhandstands, Tag: bedtimeyoga, Tag: movingforward🙏🏼💪🏼🙌🏼💞, Tag: yogajourney]",https://scontent.cdninstagram.com/hphotos-xaf1/t51.2885-15/e15/11287888_948856721820511_1005812411_n.jpg
999686118215075246_258901616,2015-06-04 04:24:53,Normal,4,[Tag: oneplexus],https://scontent.cdninstagram.com/hphotos-xfa1/t51.2885-15/e15/11357537_495675740591142_1993153783_n.jpg
999680381606648330_723626493,2015-06-04 04:13:29,Normal,13,[Tag: bad],https://scontent.cdninstagram.com/hphotos-xaf1/t51.2885-15/e15/11280258_1436217206699184_1792693031_n.jpg
999678069713665108_365930510,2015-06-04 04:08:54,Normal,49,"[Tag: trappedunderice, Tag: staycold, Tag: tui]",https://scontent.cdninstagram.com/hphotos-xfa1/t51.2885-15/e15/11327897_1583353671916140_743013021_n.jpg
999677422360582764_1004597,2015-06-04 04:07:37,Normal,17,"[Tag: cycling, Tag: landofgoatheads, Tag: beprepared, Tag: microrocket, Tag: mininpumps, Tag: 2co2sandapumpalways]",https://scontent.cdninstagram.com/hphotos-xfa1/t51.2885-15/e15/11377691_850625098308102_2018715286_n.jpg
999675053904477015_1594974845,2015-06-04 04:02:54,Lo-fi,47,"[Tag: chicana, Tag: highmija, Tag: rasquache, Tag: vida, Tag: chicano, Tag: marijuana, Tag: zine, Tag: culture, Tag: familia]",https://scontent.cdninstagram.com/hphotos-xaf1/t51.2885-15/e15/11377885_1639179429638368_1325890081_n.jpg
999674417593948115_2543812,2015-06-04 04:01:38,Nashville,73,"[Tag: runhappy, Tag: crocs]",https://scontent.cdninstagram.com/hphotos-xfa1/t51.2885-15/e15/11379992_1459988480960864_862750824_n.jpg
999673471816980820_589570533,2015-06-04 03:59:46,Sierra,32,"[Tag: nmtrue, Tag: puppy, Tag: unm, Tag: golfcourse, Tag: mansbestfriend]",https://scontent.cdninstagram.com/hphotos-xaf1/l/t51.2885-15/e15/11282271_1622119051334205_318953336_n.jpg
999671184398609122_1081569473,2015-06-04 03:55:13,Normal,16,[Tag: fullmoon],https://scontent.cdninstagram.com/hphotos-xaf1/t51.2885-15/e15/11376360_1018308168188125_2077099674_n.jpg
999669810634798343_963186132,2015-06-04 03:52:29,Normal,29,"[Tag: repost, Tag: mindfulmft, Tag: troof, Tag: yowzaa]",https://scontent.cdninstagram.com/hphotos-xaf1/t51.2885-15/e15/11350693_440359089458773_1415167980_n.jpg
