ID,Created At,Filter,Number of Likes,HashTags,url
1002633384852124593_1236245955,2015-06-08 06:00:35,Normal,2,"[Tag: gratitude, Tag: serenity, Tag: natureischurch]",https://scontent.cdninstagram.com/hphotos-xaf1/t51.2885-15/e15/11282298_1454495091517027_1298489815_n.jpg
1002632299869859209_12791242,2015-06-08 05:58:25,Juno,5,"[Tag: abqisatrip, Tag: itsnotsunday, Tag: guywithhalfshirt, Tag: boyfriends, Tag: oddcouple, Tag: gladwerenotallthesame, Tag: dungeonsanddragons]",https://scontent.cdninstagram.com/hphotos-xaf1/t51.2885-15/e15/11330611_475477532610178_6308698_n.jpg
1002616526738136127_227437662,2015-06-08 05:27:05,Normal,1,"[Tag: cuddlebug, Tag: americanpitbull]",https://scontent.cdninstagram.com/hphotos-xfa1/t51.2885-15/e15/11376674_1436821656627586_1615425897_n.jpg
1002606894326727240_41683311,2015-06-08 05:07:57,Normal,17,"[Tag: coloradoriver, Tag: floatopia2k15]",https://scontent.cdninstagram.com/hphotos-xaf1/t51.2885-15/e15/11352190_673931846070388_1911881308_n.jpg
1002599430309132734_362156389,2015-06-08 04:53:07,Lark,41,"[Tag: yoga, Tag: chinstand, Tag: yogi, Tag: bottomsup365, Tag: trees, Tag: yogaeverydamnday, Tag: sunset, Tag: yogaaddict, Tag: yogaprogress]",https://scontent.cdninstagram.com/hphotos-xaf1/t51.2885-15/e15/11333697_643239745775706_1522280701_n.jpg
1002599223574082705_636818532,2015-06-08 04:52:42,Sierra,15,"[Tag: summer, Tag: sundayfunday, Tag: abq, Tag: dukecity, Tag: 505, Tag: cliffs]",https://scontent.cdninstagram.com/hphotos-xfa1/t51.2885-15/e15/11419199_713911712073779_1602136338_n.jpg
1002598785585887670_362156389,2015-06-08 04:51:50,Lark,35,"[Tag: yogaeverydamnday, Tag: yoga, Tag: fitgirls, Tag: yogaaddict, Tag: yogi, Tag: bottomsup365, Tag: handstand]",https://scontent.cdninstagram.com/hphotos-xaf1/l/t51.2885-15/e15/11330694_851946598175516_1871062706_n.jpg
1002589883503890958_1834067451,2015-06-08 04:34:09,Normal,8,"[Tag: 2k16, Tag: studioplayhaus, Tag: newplay, Tag: script]",https://scontent.cdninstagram.com/hphotos-xaf1/t51.2885-15/e15/11427333_1590178211263463_1482774222_n.jpg
1002587047299747482_1419923426,2015-06-08 04:28:31,Normal,19,"[Tag: gaming, Tag: ninetailed, Tag: ahri, Tag: leagueoflegends]",https://scontent.cdninstagram.com/hphotos-xfa1/t51.2885-15/e15/11335172_351465898396434_1402669606_n.jpg
1002586724916902493_713181,2015-06-08 04:27:52,Ludwig,11,"[Tag: wash, Tag: cat]",https://scontent.cdninstagram.com/hphotos-xaf1/t51.2885-15/e15/11417337_674923862642202_235624534_n.jpg
1002586339451366827_278637586,2015-06-08 04:27:06,Juno,30,"[Tag: tbird, Tag: route66, Tag: odeon, Tag: rockabillyontheroute, Tag: thunderbird, Tag: tucumcari]",https://scontent.cdninstagram.com/hphotos-xfa1/t51.2885-15/e15/11252363_1588446108073907_102833412_n.jpg
1002585237792037606_649402373,2015-06-08 04:24:55,Normal,16,"[Tag: unmsouth, Tag: golfing]",https://scontent.cdninstagram.com/hphotos-xaf1/t51.2885-15/e15/11373595_854162081320396_436775113_n.jpg
1002582073146074854_19940760,2015-06-08 04:18:38,Clarendon,36,[Tag: championsdomore],https://scontent.cdninstagram.com/hphotos-xfa1/t51.2885-15/e15/11374592_579870468783283_1993325453_n.jpg
1002581036827983626_175952862,2015-06-08 04:16:34,Hefe,2,"[Tag: maplove, Tag: planningnerd]",https://scontent.cdninstagram.com/hphotos-xaf1/t51.2885-15/e15/11376357_953387314705282_37728898_n.jpg
1002568040207610065_182208835,2015-06-08 03:50:45,Brannan,7,"[Tag: sewing, Tag: diy, Tag: bellydance]",https://scontent.cdninstagram.com/hphotos-xfa1/t51.2885-15/e15/11357774_1442748732711084_1506172674_n.jpg
1002563241159984142_4713360,2015-06-08 03:41:13,Dogpatch,7,"[Tag: monsoon, Tag: tropical, Tag: newmexico, Tag: albuquerque]",https://scontent.cdninstagram.com/hphotos-xfa1/t51.2885-15/e15/11417492_782133655234980_101058513_n.jpg
1002562321345826262_1412490146,2015-06-08 03:39:23,Normal,9,"[Tag: beer, Tag: alcohol, Tag: true, Tag: fuckyou, Tag: truedat, Tag: fuckoff]",https://scontent.cdninstagram.com/hphotos-xaf1/t51.2885-15/e15/11385628_788357524611104_1658954026_n.jpg
1002561494928289215_146273034,2015-06-08 03:37:45,Lo-fi,34,"[Tag: radiotower, Tag: evening, Tag: sunset, Tag: fadein, Tag: running, Tag: contact]",https://scontent.cdninstagram.com/hphotos-xfa1/t51.2885-15/e15/11385608_1453804041598787_2026294216_n.jpg
1002561142306775111_40334999,2015-06-08 03:37:03,Normal,8,"[Tag: nailart, Tag: nails, Tag: gelnails, Tag: love]",https://scontent.cdninstagram.com/hphotos-xaf1/t51.2885-15/e15/11410551_1602419646665818_426568150_n.jpg
1002560506407868381_224164532,2015-06-08 03:35:47,Normal,27,"[Tag: clovers, Tag: pause, Tag: park, Tag: nmtrue, Tag: sunset, Tag: calm, Tag: randomadventures, Tag: inspiration]",https://scontent.cdninstagram.com/hphotos-xfa1/t51.2885-15/e15/11313248_107572092913226_1261636312_n.jpg
1002559632550273062_40334999,2015-06-08 03:34:03,Normal,9,"[Tag: birthday, Tag: homecooking, Tag: howithrowaparty, Tag: family, Tag: party, Tag: homebaking, Tag: blessed]",https://scontent.cdninstagram.com/hphotos-xfa1/t51.2885-15/e15/11313254_1752358784990905_304566367_n.jpg
1002551710472184496_1983657535,2015-06-08 03:18:18,Normal,4,"[Tag: abqpride, Tag: abq]",https://scontent.cdninstagram.com/hphotos-xaf1/t51.2885-15/e15/11352384_1603988743194652_1141902446_n.jpg
1002550311847217092_7746808,2015-06-08 03:15:32,Amaro,30,"[Tag: hispanicexcellence, Tag: newmexicotrue]",https://scontent.cdninstagram.com/hphotos-xfa1/t51.2885-15/e15/11311664_835377403207424_1886376488_n.jpg
1002546513765111080_177949516,2015-06-08 03:07:59,Normal,13,"[Tag: cute, Tag: nightnight, Tag: puppy, Tag: sleeptight, Tag: applewatch]",https://scontent.cdninstagram.com/hphotos-xfa1/t51.2885-15/e15/11357534_1650207255190831_1134344974_n.jpg
1002538554619090173_1776053348,2015-06-08 02:52:10,Normal,4,"[Tag: trunkmuzik, Tag: slumerican, Tag: lovestory, Tag: yelawolf]",https://scontent.cdninstagram.com/hphotos-xaf1/t51.2885-15/e15/11282014_1442751599364138_947897730_n.jpg
1002537502492094681_26985795,2015-06-08 02:50:05,Normal,4,[Tag: nmsunsets],https://scontent.cdninstagram.com/hphotos-xaf1/t51.2885-15/e15/11325339_426505344201024_2112990966_n.jpg
1002531682126412175_198838597,2015-06-08 02:38:31,Juno,2,"[Tag: jimmazytec, Tag: mountain_tops_edc, Tag: jamesgriego]",https://scontent.cdninstagram.com/hphotos-xaf1/t51.2885-15/e15/11337145_817333785040291_746172567_n.jpg
1001910210793280267_180737787,2015-06-07 06:03:46,Lark,9,[Tag: familytime],https://scontent.cdninstagram.com/hphotos-xfa1/t51.2885-15/e15/11372216_1446593955657806_1301859778_n.jpg
1001905336650178244_1493246670,2015-06-07 05:54:05,Amaro,10,[Tag: gsw],https://scontent.cdninstagram.com/hphotos-xfa1/t51.2885-15/e15/11374718_645303328938244_663801842_n.jpg
1001904845388804729_269287331,2015-06-07 05:53:06,Normal,25,"[Tag: sunset, Tag: skyporn, Tag: purenewmexico, Tag: newmexico, Tag: alloutcallout, Tag: abqdragway]",https://scontent.cdninstagram.com/hphotos-xaf1/t51.2885-15/e15/11287930_855473457865116_1520346954_n.jpg
1001904457606329215_1731300091,2015-06-07 05:52:20,Normal,191,[Tag: repost],https://scontent.cdninstagram.com/hphotos-xaf1/t51.2885-15/e15/11429737_445577012270104_399395869_n.jpg
1001901089398773584_215163124,2015-06-07 05:45:38,Normal,26,"[Tag: downtown, Tag: abq, Tag: newmexico]",https://scontent.cdninstagram.com/hphotos-xaf1/t51.2885-15/e15/11358183_1601677943413295_36069136_n.jpg
1001900085986453934_261142553,2015-06-07 05:43:39,Lo-fi,25,"[Tag: etsyseller, Tag: handmadejewelry, Tag: etsyjeweler, Tag: etsyhandmade, Tag: hechoennuevomexico]",https://scontent.cdninstagram.com/hphotos-xaf1/t51.2885-15/e15/11376594_852522144784306_1387483083_n.jpg
1001899861195892262_48746544,2015-06-07 05:43:12,Hudson,8,[Tag: antannamanchez],https://scontent.cdninstagram.com/hphotos-xaf1/t51.2885-15/e15/11258394_1145948068767698_1345309686_n.jpg
1001899810414480686_1712854690,2015-06-07 05:43:06,Normal,203,"[Tag: motivation, Tag: fitfam, Tag: fitgirl, Tag: healthyoption, Tag: workout, Tag: cleaneating, Tag: healthychoices, Tag: vegan, Tag: detox, Tag: portioncontrol, Tag: fitlifestyle, Tag: tourlife, Tag: whatveganseat, Tag: lifestyle, Tag: 21dayfixapproved, Tag: vegansofig, Tag: actorlife, Tag: travel, Tag: glutenfree, Tag: noexcuses, Tag: actor, Tag: weightloss, Tag: 21dayfix, Tag: tour, Tag: healthyfoodporn, Tag: eatclean, Tag: transformation, Tag: goals]",https://scontent.cdninstagram.com/hphotos-xaf1/t51.2885-15/e15/11330688_280638372106925_1732224384_n.jpg
1001898964261792150_261142553,2015-06-07 05:41:25,Lo-fi,10,"[Tag: etsyseller, Tag: handmadejewelry, Tag: etsyjeweler, Tag: etsyhandmade, Tag: chelagurneejewelry]",https://scontent.cdninstagram.com/hphotos-xaf1/t51.2885-15/e15/11251303_1437957329845254_1465720282_n.jpg
1001897064519639491_197768271,2015-06-07 05:37:38,Lark,17,[Tag: שבוע_טוב_ומבורך],https://scontent.cdninstagram.com/hphotos-xaf1/t51.2885-15/e15/11428693_697617407028198_525591461_n.jpg
1001893637091155706_211870694,2015-06-07 05:30:50,Normal,15,"[Tag: projectclimbtv, Tag: theclimb, Tag: sistas]",https://scontent.cdninstagram.com/hphotos-xaf1/t51.2885-15/e15/11358054_487938371365026_1255003592_n.jpg
1001892789157959705_33324677,2015-06-07 05:29:09,Juno,10,"[Tag: chevy, Tag: americanmuscle, Tag: dragstrip, Tag: bigblock]",https://scontent.cdninstagram.com/hphotos-xaf1/t51.2885-15/e15/11333352_835683119820175_440593626_n.jpg
1001891848741643227_346941719,2015-06-07 05:27:17,Normal,61,[Tag: 4eva21],https://scontent.cdninstagram.com/hphotos-xaf1/t51.2885-15/e15/11378130_704234189723066_527861026_n.jpg
1001887293251031665_1252618363,2015-06-07 05:18:14,X-Pro II,1,[Tag: inspiration],https://scontent.cdninstagram.com/hphotos-xaf1/t51.2885-15/e15/11326446_103930176613350_601787663_n.jpg
1001886713881922192_33861889,2015-06-07 05:17:05,Normal,401,[Tag: littlejackpenner],https://scontent.cdninstagram.com/hphotos-xaf1/t51.2885-15/e15/11378823_907922062587862_1381773532_n.jpg
1001886565202867915_34027508,2015-06-07 05:16:47,Normal,18,"[Tag: urban, Tag: fotodeldia, Tag: dukecity, Tag: citydweller, Tag: burque, Tag: igersnm, Tag: abq, Tag: landofenchantment, Tag: greatshots, Tag: nobhillnm]",https://scontent.cdninstagram.com/hphotos-xfa1/t51.2885-15/e15/11248193_1614921638751977_964327656_n.jpg
1001882847088961089_975799824,2015-06-07 05:09:24,Normal,32,"[Tag: americanglass, Tag: glassforsale, Tag: honeycombs, Tag: glassartist, Tag: abq, Tag: thelandofenchantment, Tag: theburque, Tag: birdlandthehippiestore, Tag: 505, Tag: nobhillabq]",https://scontent.cdninstagram.com/hphotos-xfa1/t51.2885-15/e15/11380952_1043918522286760_736053910_n.jpg
1001879951730919921_10965113,2015-06-07 05:03:38,Dogpatch,6,"[Tag: glowstick, Tag: awesome, Tag: galacticbowling, Tag: holidaybowl, Tag: cosmicbowling]",https://scontent.cdninstagram.com/hphotos-xaf1/t51.2885-15/e15/11325771_1634787913424750_300196654_n.jpg
1001878027411410116_464832066,2015-06-07 04:59:49,Normal,13,"[Tag: drschollsworksmiracles, Tag: slaving, Tag: tiredeveryday, Tag: thestruggleisreal]",https://scontent.cdninstagram.com/hphotos-xaf1/t51.2885-15/e15/11385196_773766209405129_1672851931_n.jpg
1001875182994110904_18782349,2015-06-07 04:54:10,Amaro,34,[Tag: lovemydad],https://scontent.cdninstagram.com/hphotos-xaf1/t51.2885-15/e15/11374486_446628628852274_1431043949_n.jpg
1001874373569489875_236072889,2015-06-07 04:52:34,Mayfair,36,"[Tag: matchinghaircolor, Tag: dogsofinstagram, Tag: muttsofinstagram, Tag: somuchlove]",https://scontent.cdninstagram.com/hphotos-xaf1/t51.2885-15/e15/11324905_1752945978265783_284711339_n.jpg
1001869593379941208_236072889,2015-06-07 04:43:04,Willow,27,[Tag: reunitedanditfeelssogood],https://scontent.cdninstagram.com/hphotos-xaf1/t51.2885-15/e15/11428609_1451441958489375_1642154720_n.jpg
1001868442024503168_1895728,2015-06-07 04:40:46,Lark,2,[Tag: gonavy],https://scontent.cdninstagram.com/hphotos-xfa1/t51.2885-15/e15/11417336_409505845903252_1281719572_n.jpg
1001867388618702666_329267718,2015-06-07 04:38:41,Juno,12,"[Tag: pull, Tag: flavorfitness, Tag: park, Tag: morning, Tag: sunday, Tag: knee, Tag: hidden, Tag: piyo]",https://scontent.cdninstagram.com/hphotos-xfa1/t51.2885-15/e15/11374760_849943201707875_859494379_n.jpg
1001866137625968826_1421548087,2015-06-07 04:36:12,Normal,12,"[Tag: abq, Tag: newmexico, Tag: 505]",https://scontent.cdninstagram.com/hphotos-xaf1/t51.2885-15/e15/11377653_462527097243010_1521851837_n.jpg
1001864997351361042_17695417,2015-06-07 04:33:56,Earlybird,75,"[Tag: greatsouthwestclassic, Tag: tracknation]",https://scontent.cdninstagram.com/hphotos-xaf1/t51.2885-15/e15/11380942_581416835294765_1733336661_n.jpg
1001863019523072064_175949471,2015-06-07 04:30:00,Normal,238,[Tag: gswc],https://scontent.cdninstagram.com/hphotos-xfa1/t51.2885-15/e15/11328350_1455265164787990_415530038_n.jpg
1001860091661871716_211762393,2015-06-07 04:24:11,Normal,26,"[Tag: camaro, Tag: dragracing, Tag: doingwhatheloves, Tag: hispassion, Tag: newmexico, Tag: alloutcallout2015]",https://scontent.cdninstagram.com/hphotos-xaf1/t51.2885-15/e15/11380263_1443686462600911_1801703640_n.jpg
1001858717514948973_18491751,2015-06-07 04:21:27,Normal,35,[Tag: thegodfather],https://scontent.cdninstagram.com/hphotos-xaf1/t51.2885-15/e15/11379232_1857602884465138_572973425_n.jpg
1001858009569971619_293979882,2015-06-07 04:20:03,Juno,8,"[Tag: girltime, Tag: oloyogurtstudio, Tag: girltalk, Tag: ilovemysister, Tag: theresnoplacelikehome, Tag: delish, Tag: frozenyogurt, Tag: olo, Tag: bejello, Tag: catchingup, Tag: sisters, Tag: beautifulnight, Tag: bestie]",https://scontent.cdninstagram.com/hphotos-xfa1/t51.2885-15/e15/11355224_1621321781439596_1293548263_n.jpg
1001857691630314780_223976928,2015-06-07 04:19:25,Normal,37,"[Tag: onlyhalf, Tag: family]",https://scontent.cdninstagram.com/hphotos-xfa1/t51.2885-15/e15/11420912_106960706308479_1208055505_n.jpg
1001854116777115798_1529309303,2015-06-07 04:12:19,Reyes,8,[Tag: lazycat],https://scontent.cdninstagram.com/hphotos-xaf1/t51.2885-15/e15/11378562_800576990058207_1553834385_n.jpg
1001853687950652902_383283500,2015-06-07 04:11:28,Slumber,21,"[Tag: cats, Tag: funnycats, Tag: catsofinstagram, Tag: blackcats]",https://scontent.cdninstagram.com/hphotos-xfa1/t51.2885-15/e15/11353016_926948960676593_272187574_n.jpg
1001851972577873299_175750466,2015-06-07 04:08:03,Lo-fi,12,"[Tag: project, Tag: canvas, Tag: art, Tag: archetype, Tag: archetypalpsychology, Tag: arttherapy, Tag: expressyourself, Tag: mandala, Tag: painting, Tag: final]",https://scontent.cdninstagram.com/hphotos-xaf1/t51.2885-15/e15/11417391_109179329418202_672267673_n.jpg
1001850101524029207_182605470,2015-06-07 04:04:20,Valencia,95,[Tag: turnup],https://scontent.cdninstagram.com/hphotos-xaf1/t51.2885-15/e15/11325468_1663710430527476_1260263931_n.jpg
1001849952219045036_1417774230,2015-06-07 04:04:02,Ludwig,235,"[Tag: allred, Tag: squaddd, Tag: fctucson, Tag: fam, Tag: togetherwestand, Tag: grimmymotel6]",https://scontent.cdninstagram.com/hphotos-xfa1/t51.2885-15/e15/11379902_1572591396337844_218028477_n.jpg
1001849487655551223_574816903,2015-06-07 04:03:07,Valencia,29,"[Tag: sportscar, Tag: hair, Tag: staytrue, Tag: love, Tag: reddress, Tag: car, Tag: awesome, Tag: eastindian, Tag: hot, Tag: indian, Tag: modeling, Tag: model, Tag: mustangcobra, Tag: dream, Tag: happiness]",https://scontent.cdninstagram.com/hphotos-xfa1/t51.2885-15/e15/11296619_123363564661364_1879192123_n.jpg
1001849391748323367_17861637,2015-06-07 04:02:55,Lark,21,"[Tag: hiphop, Tag: underground, Tag: realhiphop, Tag: albuquerque, Tag: supportlocal, Tag: thegrainstation]",https://scontent.cdninstagram.com/hphotos-xaf1/t51.2885-15/e15/11379169_962045653827713_1019494117_n.jpg
1001848423466880333_175750466,2015-06-07 04:01:00,Lark,8,"[Tag: archetypalpsychology, Tag: canvas, Tag: art, Tag: archetype, Tag: project, Tag: arttherapy, Tag: therapy, Tag: mandala, Tag: painting]",https://scontent.cdninstagram.com/hphotos-xaf1/t51.2885-15/e15/11357656_1461513564142011_277316968_n.jpg
1001848048330877213_1450177953,2015-06-07 04:00:15,Lark,16,"[Tag: watercolor, Tag: burque, Tag: illustration, Tag: ink]",https://scontent.cdninstagram.com/hphotos-xfa1/t51.2885-15/e15/11380085_1570309939896822_260423240_n.jpg
1001847650383306291_304267566,2015-06-07 03:59:28,Normal,30,"[Tag: nosepiercing, Tag: lookinfab]",https://scontent.cdninstagram.com/hphotos-xaf1/t51.2885-15/e15/11353012_465430583623099_653519681_n.jpg
1001847277484910854_1450177953,2015-06-07 03:58:43,Lark,16,"[Tag: watercolor, Tag: flowers, Tag: burque, Tag: illustration, Tag: ink]",https://scontent.cdninstagram.com/hphotos-xfa1/t51.2885-15/e15/11417303_1456635437967048_1206499108_n.jpg
1001846906705529679_10965113,2015-06-07 03:57:59,Normal,4,"[Tag: holidaybowl, Tag: galacticbowling, Tag: cosmic, Tag: ilovesaturdays, Tag: bowling]",https://scontent.cdninstagram.com/hphotos-xfa1/t51.2885-15/e15/11376068_1605939303025100_1093245718_n.jpg
1001844748999192086_179413066,2015-06-07 03:53:42,Gingham,23,[Tag: muddvolleyball2015],https://scontent.cdninstagram.com/hphotos-xaf1/t51.2885-15/e15/11379820_1578331392432157_1134513416_n.jpg
1001844031025720458_1741592186,2015-06-07 03:52:16,Normal,12,"[Tag: genocide, Tag: book49of2015, Tag: jamespatterson, Tag: toys, Tag: june6, Tag: elites]",https://scontent.cdninstagram.com/hphotos-xaf1/t51.2885-15/e15/11383323_453996551444862_1525053694_n.jpg
1001842490693665469_1421548087,2015-06-07 03:49:13,Valencia,9,"[Tag: cousins, Tag: newmexico, Tag: love, Tag: family]",https://scontent.cdninstagram.com/hphotos-xaf1/t51.2885-15/e15/11372086_810549915732058_2079486062_n.jpg
1001840709198343861_1682784794,2015-06-07 03:45:40,Normal,14,[Tag: shrimpnights],https://scontent.cdninstagram.com/hphotos-xfa1/t51.2885-15/e15/11280440_1644009839175998_1472294041_n.jpg
1001840188852279806_209599101,2015-06-07 03:44:38,Lark,9,"[Tag: purenm, Tag: hiking, Tag: hikingwithdogs, Tag: hikenm, Tag: igsouthwest, Tag: travelnewmexico, Tag: travelnm, Tag: purenewmexico]",https://scontent.cdninstagram.com/hphotos-xaf1/t51.2885-15/e15/11348146_1013027038722048_797614466_n.jpg
1001840012135779512_464832066,2015-06-07 03:44:17,Juno,13,[Tag: mysweetgirl],https://scontent.cdninstagram.com/hphotos-xaf1/t51.2885-15/e15/11351029_756044654513162_1251604232_n.jpg
1001839590652254702_209599101,2015-06-07 03:43:27,Normal,5,"[Tag: igsouthwest, Tag: purenm, Tag: purenewmexico]",https://scontent.cdninstagram.com/hphotos-xfa1/t51.2885-15/e15/11333732_857174667703366_956132479_n.jpg
1001839221366647570_354236849,2015-06-07 03:42:43,Normal,5,"[Tag: saturdaynight, Tag: abq, Tag: newmexico, Tag: welcometomynight, Tag: jacknicholson]",https://scontent.cdninstagram.com/hphotos-xta1/t51.2885-15/e15/10809706_419344401585589_689535715_n.jpg
1001838552201304536_209599101,2015-06-07 03:41:23,Normal,4,"[Tag: hikenm, Tag: igsouthwest, Tag: purenm, Tag: purenewmexico]",https://scontent.cdninstagram.com/hphotos-xaf1/t51.2885-15/e15/11328384_476373589185365_1794581796_n.jpg
1001838405140617686_209599101,2015-06-07 03:41:06,Normal,9,"[Tag: hikenm, Tag: purenm, Tag: nationaltrailsday, Tag: travelnewmexico, Tag: purenewmexico, Tag: hikingwithdogs]",https://scontent.cdninstagram.com/hphotos-xfa1/t51.2885-15/e15/1388878_706069979538751_1662602563_n.jpg
1001837871943915978_209599101,2015-06-07 03:40:02,Normal,16,"[Tag: purenm, Tag: hikingwithdogs, Tag: hikenm, Tag: igsouthwest, Tag: nationaltrailsday, Tag: travelnewmexico, Tag: travelnm, Tag: purenewmexico]",https://scontent.cdninstagram.com/hphotos-xfa1/t51.2885-15/e15/11357660_392347164295208_1441073741_n.jpg
1001836485011408879_358587144,2015-06-07 03:37:17,Normal,5,"[Tag: iearnedit, Tag: mixedberries, Tag: smoothie, Tag: chocolate, Tag: lowcalorie, Tag: banana, Tag: pomagranate, Tag: healthieralternative]",https://scontent.cdninstagram.com/hphotos-xaf1/l/t51.2885-15/e15/11333389_1454497088177257_272709678_n.jpg
1001836042748183067_1421548087,2015-06-07 03:36:24,Perpetua,10,"[Tag: cousins, Tag: newmexico, Tag: love, Tag: family]",https://scontent.cdninstagram.com/hphotos-xfa1/t51.2885-15/e15/11421977_1184081498275485_671568309_n.jpg
1001834257785231661_341706733,2015-06-07 03:32:51,Sierra,93,"[Tag: beautiful, Tag: ladies, Tag: pageant, Tag: empower, Tag: motivate, Tag: brainsandbeauty, Tag: fitgirls, Tag: smile, Tag: newmexico, Tag: friends, Tag: dresses]",https://scontent.cdninstagram.com/hphotos-xaf1/t51.2885-15/e15/11379879_1645055545725480_1278283632_n.jpg
1001833479694795692_357619943,2015-06-07 03:31:19,X-Pro II,20,"[Tag: alloutcallout, Tag: albuquerque, Tag: bmw, Tag: e30]",https://scontent.cdninstagram.com/hphotos-xfa1/t51.2885-15/e15/11377652_1027558100589547_609803051_n.jpg
1001832816440237195_1735844086,2015-06-07 03:30:00,Normal,12,"[Tag: dragonfly, Tag: vscocam, Tag: vsco, Tag: stowaway]",https://scontent.cdninstagram.com/hphotos-xaf1/t51.2885-15/e15/11417233_468391380003145_2119777144_n.jpg
1001822955773671648_54643629,2015-06-07 03:10:24,Willow,23,[Tag: selfiesaturday],https://scontent.cdninstagram.com/hphotos-xaf1/t51.2885-15/e15/11417466_445792488914512_794250584_n.jpg
1001192396140705035_15354732,2015-06-06 06:17:35,Inkwell,20,"[Tag: wearesocute, Tag: kissyface, Tag: picoftheday, Tag: ducklips, Tag: goodtimes, Tag: bejealous, Tag: sillyfaces, Tag: makingmemories, Tag: instadaily, Tag: instagood, Tag: friendship, Tag: instamood]",https://scontent.cdninstagram.com/hphotos-xaf1/t51.2885-15/e15/11357833_397554527102755_1876014472_n.jpg
1001187039591234341_2137310989,2015-06-06 06:06:57,Normal,24,"[Tag: sadanime, Tag: art, Tag: animemovie, Tag: movie, Tag: wolfchilderenthemovie, Tag: wolfchildren, Tag: feelz]",https://scontent.cdninstagram.com/hphotos-xaf1/t51.2885-15/e15/11352015_769855186469215_491475061_n.jpg
1001181408041094962_982895242,2015-06-06 05:55:46,Normal,27,[Tag: callsheets],https://scontent.cdninstagram.com/hphotos-xaf1/t51.2885-15/e15/11356516_410466692459586_1653825806_n.jpg
1001164439472459352_1412490146,2015-06-06 05:22:03,Normal,16,"[Tag: thrashmetal, Tag: riffs, Tag: goatwhore, Tag: blackmetal, Tag: deathmetal, Tag: metal]",https://scontent.cdninstagram.com/hphotos-xfa1/t51.2885-15/e15/11311067_462392403934840_304567795_n.jpg
1001162209742001817_176213556,2015-06-06 05:17:37,Valencia,9,"[Tag: reunited, Tag: westmesa]",https://scontent.cdninstagram.com/hphotos-xaf1/t51.2885-15/e15/11325748_957146094306518_1903936289_n.jpg
1001159346760720467_1838847,2015-06-06 05:11:56,Normal,27,"[Tag: gotopes, Tag: photoofthegame]",https://scontent.cdninstagram.com/hphotos-xaf1/t51.2885-15/e15/11374552_913201255404157_99997338_n.jpg
1001157779204856519_273907037,2015-06-06 05:08:49,Amaro,13,[Tag: weekendvibes],https://scontent.cdninstagram.com/hphotos-xaf1/t51.2885-15/e15/11417320_445230785638060_1859306070_n.jpg
1001152197777937017_1569262547,2015-06-06 04:57:43,Ludwig,16,"[Tag: scruffy, Tag: gay, Tag: gayboy, Tag: hottie, Tag: scruff, Tag: gaylife, Tag: gayboi, Tag: gayguy, Tag: cutie]",https://scontent.cdninstagram.com/hphotos-xaf1/t51.2885-15/e15/11326968_1603642763258147_1882877485_n.jpg
1001150497398626103_32692468,2015-06-06 04:54:21,Normal,39,"[Tag: regram, Tag: someplanet]",https://scontent.cdninstagram.com/hphotos-xaf1/t51.2885-15/e15/11353036_373587979513796_698312318_n.jpg
1001146011925503703_3761942,2015-06-06 04:45:26,Normal,52,"[Tag: handstandjourney, Tag: 365daysofhandstands, Tag: practice, Tag: movingforward🙏🏼💪🏼🙌🏼💞, Tag: notsominicooper, Tag: igyoga, Tag: yogajourney, Tag: illusion, Tag: day308]",https://scontent.cdninstagram.com/hphotos-xaf1/t51.2885-15/e15/11311930_1608299969428482_1825454164_n.jpg
1001144931054605023_182938155,2015-06-06 04:43:17,Valencia,6,"[Tag: snapthatpic, Tag: number4hair, Tag: stylingfoam, Tag: diffuse, Tag: kimkardashian, Tag: supportsolution]",https://scontent.cdninstagram.com/hphotos-xfa1/t51.2885-15/e15/11424608_849130841789606_1900253733_n.jpg
1001144116385212776_354236849,2015-06-06 04:41:40,Ludwig,9,"[Tag: abq, Tag: newmexico, Tag: abandonedplaces, Tag: edo, Tag: heart]",https://scontent.cdninstagram.com/hphotos-xaf1/t51.2885-15/e15/11325877_544689025662775_504526862_n.jpg
1001142737007244306_263154572,2015-06-06 04:38:56,Valencia,47,"[Tag: cute, Tag: loveher, Tag: family, Tag: summer, Tag: hotel, Tag: albuquerque, Tag: roadtrip, Tag: sillyfaces, Tag: happy, Tag: chillin, Tag: pjs, Tag: newmexicolivin]",https://scontent.cdninstagram.com/hphotos-xaf1/t51.2885-15/e15/11325691_814464998621771_1708135460_n.jpg
1001142655041657887_1735844086,2015-06-06 04:38:46,Normal,8,"[Tag: flowers, Tag: nofilter, Tag: vscocam, Tag: vsco]",https://scontent.cdninstagram.com/hphotos-xaf1/t51.2885-15/e15/11311656_834560793248236_2069732398_n.jpg
1001141562809051424_354236849,2015-06-06 04:36:36,Lo-fi,5,"[Tag: abq, Tag: newmexico, Tag: window, Tag: edo]",https://scontent.cdninstagram.com/hphotos-xaf1/t51.2885-15/e15/11374657_1418644738460363_634788098_n.jpg
1001140187834377357_252008864,2015-06-06 04:33:52,Normal,21,"[Tag: numberoneuncle, Tag: polaroid, Tag: photography, Tag: hipster, Tag: retro]",https://scontent.cdninstagram.com/hphotos-xaf1/t51.2885-15/e15/11274357_366053913593400_337551157_n.jpg
1001140081509509297_49049585,2015-06-06 04:33:39,Normal,127,"[Tag: 1320video, Tag: gtr, Tag: nissan, Tag: godzilla]",https://scontent.cdninstagram.com/hphotos-xaf1/t51.2885-15/e15/11311441_1474652236159805_1971413557_n.jpg
1001139667889613044_354236849,2015-06-06 04:32:50,Juno,5,"[Tag: whatisthis, Tag: abq, Tag: newmexico, Tag: flowers, Tag: edo]",https://scontent.cdninstagram.com/hphotos-xfa1/t51.2885-15/e15/11386580_1612049159037320_1496489467_n.jpg
1001136164595357440_1745925052,2015-06-06 04:25:52,Normal,0,"[Tag: gotopes, Tag: 10, Tag: topeswin]",https://scontent.cdninstagram.com/hphotos-xaf1/t51.2885-15/e15/11372455_1443722365929716_1162988070_n.jpg
