ID,Created At,Filter,Number of Likes,HashTags,url
992411480115396640_192289879,2015-05-25 03:31:29,Normal,8,"[Tag: catholic, Tag: art, Tag: italy, Tag: passport, Tag: travelandlife, Tag: church, Tag: firenze, Tag: bernardodaddi, Tag: architecture, Tag: nextdestination, Tag: italia, Tag: madonna, Tag: traveladdicted, Tag: florence]",https://scontent.cdninstagram.com/hphotos-xaf1/t51.2885-15/e15/11377923_1578896999028381_342977498_n.jpg
992411081069134843_1077379703,2015-05-25 03:30:41,Normal,3,"[Tag: italy, Tag: vscoitaly, Tag: vscorussia, Tag: cinqueterre, Tag: instadaily, Tag: italian, Tag: travel, Tag: vernazza]",https://scontent.cdninstagram.com/hphotos-xaf1/t51.2885-15/e15/11371972_484162968401158_1471151071_n.jpg
992410708201507416_180337369,2015-05-25 03:29:57,Normal,24,"[Tag: eurotrip, Tag: toscana, Tag: firenze, Tag: simplybsac, Tag: explore, Tag: adventure, Tag: duomodifirenze, Tag: cathedral, Tag: vsco, Tag: florence, Tag: italy, Tag: duomo, Tag: travel, Tag: florenceitaly, Tag: italia, Tag: architecture, Tag: vscocam, Tag: history]",https://scontent.cdninstagram.com/hphotos-xfa1/t51.2885-15/e15/11327051_1631701360409926_194005313_n.jpg
992409924888718149_265851049,2015-05-25 03:28:23,Juno,28,"[Tag: beautiful, Tag: art, Tag: florence, Tag: instagood, Tag: instafun, Tag: italy, Tag: instadaily, Tag: weekend, Tag: picoftheday, Tag: photooftheday]",https://scontent.cdninstagram.com/hphotos-xaf1/t51.2885-15/e15/11355966_922242247817089_2026993937_n.jpg
992409612689613670_197900775,2015-05-25 03:27:46,Reyes,2,"[Tag: italy, Tag: pisa]",https://scontent.cdninstagram.com/hphotos-xaf1/t51.2885-15/e15/11265984_458188361017263_660483919_n.jpg
992408552465724917_13439572,2015-05-25 03:25:40,Normal,4,"[Tag: italia, Tag: florence, Tag: piazza]",https://scontent.cdninstagram.com/hphotos-xaf1/t51.2885-15/e15/11282589_1624953077719217_1679727977_n.jpg
992407543743773567_798419349,2015-05-25 03:23:39,Hudson,1,"[Tag: italy, Tag: loveitaly, Tag: perfectlife, Tag: firenze, Tag: happydays, Tag: fun, Tag: love, Tag: florence, Tag: happy]",https://scontent.cdninstagram.com/hphotos-xfa1/t51.2885-15/e15/11348345_773988859381171_612318315_n.jpg
992407299270310506_51460189,2015-05-25 03:23:10,Normal,4,"[Tag: firenze, Tag: uffizi]",https://scontent.cdninstagram.com/hphotos-xaf1/t51.2885-15/e15/11357719_1450098978618873_1073299001_n.jpg
992404980745165313_21932357,2015-05-25 03:18:34,Normal,3,"[Tag: firenzeitalia, Tag: mangia]",https://scontent.cdninstagram.com/hphotos-xfa1/t51.2885-15/e15/11326163_1630024570548062_39896783_n.jpg
992398696723874554_1077379703,2015-05-25 03:06:05,Normal,10,"[Tag: urban, Tag: italy, Tag: vscoitaly, Tag: vscorussia, Tag: monterosso, Tag: cinqueterre, Tag: architecture, Tag: streetphoto, Tag: travel]",https://scontent.cdninstagram.com/hphotos-xfa1/t51.2885-15/e15/11378438_1611894302387806_1978205825_n.jpg
992397579022027595_242266073,2015-05-25 03:03:51,Reyes,5,"[Tag: newyork, Tag: florence, Tag: taiwan, Tag: friends, Tag: sanfrancisco]",https://scontent.cdninstagram.com/hphotos-xpf1/t51.2885-15/e15/1390067_480270605455879_107046158_n.jpg
992397495844396553_2384790,2015-05-25 03:03:42,Valencia,5,"[Tag: picture, Tag: life, Tag: love, Tag: may, Tag: instapic, Tag: florence, Tag: friends, Tag: italy, Tag: fitenze, Tag: top, Tag: club, Tag: sunday, Tag: nightlife, Tag: fun, Tag: party, Tag: friendship]",https://scontent.cdninstagram.com/hphotos-xaf1/t51.2885-15/e15/11269593_448019005373053_1259201866_n.jpg
992397495707715218_565577384,2015-05-25 03:03:42,Mayfair,9,[Tag: 피렌체],https://scontent.cdninstagram.com/hphotos-xfa1/t51.2885-15/e15/11375255_107974806203926_1974110088_n.jpg
992397332062449649_190147090,2015-05-25 03:03:22,Normal,11,"[Tag: dine, Tag: expresso, Tag: eating, Tag: eaten, Tag: piazzadelduomo, Tag: mussels, Tag: florenceduomo, Tag: silverware, Tag: shell, Tag: coffee, Tag: firenze, Tag: piazzaduomo, Tag: table, Tag: florence, Tag: florencecathedral, Tag: bread, Tag: italy, Tag: piazza, Tag: eat, Tag: shells, Tag: duomo, Tag: seafood, Tag: bowl, Tag: silver, Tag: food, Tag: dinner, Tag: mussel, Tag: firenzeduomo, Tag: italian]",https://scontent.cdninstagram.com/hphotos-xfa1/t51.2885-15/e15/11357270_109023316098589_1351920153_n.jpg
992393073029868725_253755058,2015-05-25 02:54:54,Normal,235,"[Tag: like4follow, Tag: gay, Tag: instalike, Tag: likeforfollow, Tag: iphonesia, Tag: likeforspam, Tag: instacool, Tag: likeforlike, Tag: igers, Tag: jj, Tag: gayboys, Tag: gayguy, Tag: portrait, Tag: like4like, Tag: picoftheday]",https://scontent.cdninstagram.com/hphotos-xfa1/t51.2885-15/e15/11380850_376457439224920_689446406_n.jpg
992388035227073236_305610941,2015-05-25 02:44:54,Normal,49,"[Tag: leaningtower, Tag: italy, Tag: vscocam, Tag: exploreeverything, Tag: explore, Tag: travel, Tag: pisa, Tag: vsco, Tag: vscophotos, Tag: italia, Tag: architecture, Tag: tower, Tag: leaningtowerofpisa, Tag: m3cphotography]",https://scontent.cdninstagram.com/hphotos-xaf1/t51.2885-15/e15/11378193_1619485044958889_1313329257_n.jpg
992380307620027697_287389662,2015-05-25 02:29:33,Normal,7,"[Tag: breathtaking, Tag: sunset, Tag: citytrip, Tag: italia, Tag: florence, Tag: stunning, Tag: firenze]",https://scontent.cdninstagram.com/hphotos-xaf1/t51.2885-15/e15/11282646_751051045021381_1859790708_n.jpg
992374138956471478_287389662,2015-05-25 02:17:17,Normal,7,"[Tag: londonreunion, Tag: blackandwhite, Tag: florence, Tag: andagain, Tag: amazing, Tag: london, Tag: italia, Tag: friendship]",https://scontent.cdninstagram.com/hphotos-xaf1/t51.2885-15/e15/11326320_1758952437664607_1097002348_n.jpg
992370388744937895_982139231,2015-05-25 02:09:50,Normal,14,"[Tag: beautiful, Tag: cute, Tag: fashion, Tag: love, Tag: summer, Tag: food, Tag: instalike, Tag: tbt, Tag: tagsforlikesapp, Tag: igers, Tag: follow, Tag: instadaily, Tag: instamood, Tag: friends, Tag: girl, Tag: me, Tag: swag, Tag: like4like, Tag: tflers, Tag: followme, Tag: instagood, Tag: tagsforlikes, Tag: amazing, Tag: bestoftheday, Tag: fun, Tag: smile, Tag: photooftheday, Tag: picoftheday, Tag: happy]",https://scontent.cdninstagram.com/hphotos-xfa1/t51.2885-15/e15/11269910_1597047493911139_474290_n.jpg
992369669990339851_1157807388,2015-05-25 02:08:25,Normal,22,"[Tag: art, Tag: nature, Tag: firenze, Tag: tuscany, Tag: florence, Tag: adayinflorence, Tag: igerstuscany, Tag: italy, Tag: ig_tuscany, Tag: igersitalia, Tag: travel, Tag: culinarytours, Tag: travelphotography, Tag: sunrise, Tag: pontevecchio, Tag: italia, Tag: mygourmetjourney, Tag: arno]",https://scontent.cdninstagram.com/hphotos-xfa1/t51.2885-15/e15/11379284_447266035433298_78569447_n.jpg
992367692014822200_193276927,2015-05-25 02:04:29,Amaro,3,"[Tag: afternoons, Tag: homemade]",https://scontent.cdninstagram.com/hphotos-xfa1/t51.2885-15/e15/11372453_673678722736828_989394904_n.jpg
992367436005136134_628179116,2015-05-25 02:03:58,Normal,20,"[Tag: cane, Tag: italy, Tag: mybodyguard, Tag: dog, Tag: firenze, Tag: amazing, Tag: goodnight, Tag: husky]",https://scontent.cdninstagram.com/hphotos-xfa1/t51.2885-15/e15/11326196_1589892254615203_1960204377_n.jpg
992366929883756509_1284646084,2015-05-25 02:02:58,Normal,8,"[Tag: murifiorentini, Tag: italia, Tag: artedistrada, Tag: weloveitaly, Tag: exitenter, Tag: florence, Tag: firenze]",https://scontent.cdninstagram.com/hphotos-xaf1/t51.2885-15/e15/11380296_1062064317155254_1267157285_n.jpg
992363844722409347_2082516966,2015-05-25 01:56:50,Amaro,11,"[Tag: beautiful, Tag: cute, Tag: fashion, Tag: love, Tag: summer, Tag: food, Tag: instalike, Tag: tbt, Tag: tagsforlikesapp, Tag: igers, Tag: follow, Tag: instadaily, Tag: instamood, Tag: friends, Tag: girl, Tag: me, Tag: swag, Tag: like4like, Tag: tflers, Tag: followme, Tag: instagood, Tag: tagsforlikes, Tag: amazing, Tag: bestoftheday, Tag: fun, Tag: smile, Tag: photooftheday, Tag: picoftheday, Tag: happy]",https://scontent.cdninstagram.com/hphotos-xaf1/t51.2885-15/e15/11377521_794495577337405_459885427_n.jpg
992358483498038200_199189027,2015-05-25 01:46:11,Juno,1,"[Tag: movie, Tag: frame, Tag: set, Tag: florence, Tag: cinema]",https://scontent.cdninstagram.com/hphotos-xfa1/t51.2885-15/e15/11325881_446174312230388_706772868_n.jpg
992356565551870848_199189027,2015-05-25 01:42:22,Sierra,3,"[Tag: set, Tag: cinema, Tag: movie, Tag: frame, Tag: florence, Tag: princess]",https://scontent.cdninstagram.com/hphotos-xaf1/t51.2885-15/e15/11252142_977731585604573_2028177978_n.jpg
992354561789029325_192617841,2015-05-25 01:38:24,Normal,4,"[Tag: beautiful, Tag: cute, Tag: fashion, Tag: love, Tag: summer, Tag: food, Tag: instalike, Tag: tbt, Tag: tagsforlikesapp, Tag: igers, Tag: follow, Tag: instadaily, Tag: instagood, Tag: friends, Tag: girl, Tag: instamood, Tag: me, Tag: swag, Tag: like4like, Tag: tflers, Tag: followme, Tag: macomefai, Tag: tagsforlikes, Tag: amazing, Tag: bestoftheday, Tag: fun, Tag: smile, Tag: photooftheday, Tag: picoftheday, Tag: happy]",https://scontent.cdninstagram.com/hphotos-xaf1/t51.2885-15/e15/11330689_979623968723472_1610686343_n.jpg
992354489950204742_199189027,2015-05-25 01:38:15,Lark,3,"[Tag: theater, Tag: shakespeare, Tag: actress]",https://scontent.cdninstagram.com/hphotos-xaf1/t51.2885-15/e15/11326624_1579740778974199_58926106_n.jpg
992353311257536747_470768081,2015-05-25 01:35:54,Normal,0,[Tag: nike],https://scontent.cdninstagram.com/hphotos-xaf1/t51.2885-15/e15/11356869_353994034770996_1920314259_n.jpg
992353111232148249_199189027,2015-05-25 01:35:31,Amaro,1,"[Tag: mask, Tag: theater, Tag: shakespeare]",https://scontent.cdninstagram.com/hphotos-xaf1/t51.2885-15/e15/11374134_1653079651571778_1817033633_n.jpg
992351409020897167_27645800,2015-05-25 01:32:08,Normal,305,[Tag: putabibonit],https://scontent.cdninstagram.com/hphotos-xaf1/t51.2885-15/e15/11273035_1447577985555889_1998525355_n.jpg
992350937172638538_279008293,2015-05-25 01:31:11,Normal,7,"[Tag: florencia, Tag: italy, Tag: travel, Tag: novios, Tag: nikon, Tag: romanticismo, Tag: italia, Tag: amor, Tag: vacaciones, Tag: nikond3200]",https://scontent.cdninstagram.com/hphotos-xaf1/t51.2885-15/e15/11330658_1098685633491811_1133738681_n.jpg
992348360319023881_245279205,2015-05-25 01:26:04,Nashville,159,"[Tag: important, Tag: sweatitout💦]",https://scontent.cdninstagram.com/hphotos-xfa1/t51.2885-15/e15/11357876_373391959523540_1151810892_n.jpg
992347936925031187_314075133,2015-05-25 01:25:14,Normal,3,"[Tag: emma, Tag: concert, Tag: memories, Tag: brown21, Tag: happybday, Tag: twins, Tag: schienatour, Tag: ciaoneproprio, Tag: florence]",https://scontent.cdninstagram.com/hphotos-xfa1/t51.2885-15/e15/11381015_933790503353988_632127985_n.jpg
992347138919987951_279008293,2015-05-25 01:23:39,Rise,10,"[Tag: florencia, Tag: italy, Tag: travel, Tag: automóvil, Tag: nikon, Tag: italia, Tag: vacaciones, Tag: nikond3200, Tag: audi]",https://scontent.cdninstagram.com/hphotos-xaf1/t51.2885-15/e15/11335132_1477892552501876_771097002_n.jpg
992346752154808190_287838274,2015-05-25 01:22:53,Normal,4,"[Tag: firenze4ever, Tag: firenze]",https://scontent.cdninstagram.com/hphotos-xaf1/t51.2885-15/e15/11377411_1441150379520414_923668687_n.jpg
992345991131790470_284208166,2015-05-25 01:21:22,Normal,1,[Tag: firenze],https://scontent.cdninstagram.com/hphotos-xaf1/t51.2885-15/e15/11313540_1672320492999865_1714110752_n.jpg
992343098362227645_977443129,2015-05-25 01:15:37,Aden,0,[Tag: folies],https://scontent.cdninstagram.com/hphotos-xaf1/t51.2885-15/e15/11311219_1399806163680695_1533442413_n.jpg
992341266474938113_287838274,2015-05-25 01:11:59,Reyes,2,"[Tag: italia, Tag: hungry, Tag: firenze]",https://scontent.cdninstagram.com/hphotos-xaf1/t51.2885-15/e15/11326414_541783132627634_270259109_n.jpg
992338729044253613_5745741,2015-05-25 01:06:56,Reyes,4,"[Tag: happybirthday, Tag: alcol, Tag: florence, Tag: miao, Tag: stile, Tag: flo, Tag: compleanno, Tag: auguri, Tag: tesoro, Tag: ciaone]",https://scontent.cdninstagram.com/hphotos-xaf1/t51.2885-15/e15/11377686_847158118672626_1171182586_n.jpg
992338272587367476_1004691552,2015-05-25 01:06:02,Hudson,2,"[Tag: gameover, Tag: goodluck]",https://scontent.cdninstagram.com/hphotos-xfa1/t51.2885-15/e15/11326796_412222905629075_667282350_n.jpg
992336358131843133_226302511,2015-05-25 01:02:13,Normal,149,[Tag: lafamilia],https://scontent.cdninstagram.com/hphotos-xfa1/t51.2885-15/e15/11355221_100720530267648_443740041_n.jpg
992332128757264224_2929650,2015-05-25 00:53:49,Normal,14,[Tag: 🔋💎👗📘ⓜ️🔰🏦🎽🎿🐠],https://scontent.cdninstagram.com/hphotos-xaf1/t51.2885-15/e15/11242272_443706625804717_1149852805_n.jpg
992331129161459812_327443785,2015-05-25 00:51:50,Normal,9,"[Tag: postrock, Tag: doubleexposure, Tag: piano, Tag: vscocam, Tag: midnight, Tag: fujifilm]",https://scontent.cdninstagram.com/hphotos-xaf1/t51.2885-15/e15/11327211_1580710572170499_1184795141_n.jpg
992329520686335696_217237336,2015-05-25 00:48:38,Normal,1,[Tag: amburgo],https://scontent.cdninstagram.com/hphotos-xaf1/t51.2885-15/e15/11363931_1597903157116837_336635233_n.jpg
992329325827497642_177502470,2015-05-25 00:48:15,Lark,32,[Tag: florence],https://scontent.cdninstagram.com/hphotos-xaf1/t51.2885-15/e15/11269657_504759373011743_340813487_n.jpg
992328090923667455_308922402,2015-05-25 00:45:48,Juno,8,"[Tag: florencia, Tag: italia, Tag: italy, Tag: firenze]",https://scontent.cdninstagram.com/hphotos-xaf1/t51.2885-15/e15/11380285_1620251238218510_1216359112_n.jpg
992327828949881858_11229788,2015-05-25 00:45:17,Juno,10,"[Tag: igersitalia, Tag: italia]",https://scontent.cdninstagram.com/hphotos-xfa1/t51.2885-15/e15/11380193_587187658090692_749674089_n.jpg
992325794173294565_270157564,2015-05-25 00:41:14,Lo-fi,38,"[Tag: eurotrip, Tag: rome, Tag: italy, Tag: florence, Tag: lbstate, Tag: bolkanabroad, Tag: italiancoast]",https://scontent.cdninstagram.com/hphotos-xaf1/t51.2885-15/e15/11380285_1610245895859391_168345265_n.jpg
992324475406052736_52620058,2015-05-25 00:38:37,Juno,36,"[Tag: tagstagramers, Tag: italianboy, Tag: life, Tag: love, Tag: selfie, Tag: view, Tag: tbt, Tag: tagsta, Tag: firstoftheday, Tag: ootd, Tag: follow4follow, Tag: portrait, Tag: florence, Tag: landscape, Tag: like, Tag: me, Tag: boy, Tag: italy, Tag: mood, Tag: teamfollowback, Tag: instagramers, Tag: iphonesia, Tag: followbackteam, Tag: smile, Tag: guy, Tag: like4like, Tag: picoftheday, Tag: igers]",https://scontent.cdninstagram.com/hphotos-xaf1/t51.2885-15/e15/11283285_1044855808876285_1347171817_n.jpg
992324362196228696_32097821,2015-05-25 00:38:23,Normal,17,"[Tag: likesforlikes, Tag: love, Tag: likebackteam, Tag: liker, Tag: likeall, Tag: liking, Tag: likes, Tag: tflers, Tag: liketeam, Tag: likes4likes, Tag: likeback, Tag: instagood, Tag: tagsforlikes, Tag: likeforlike, Tag: photooftheday, Tag: like4like, Tag: likealways, Tag: l4l]",https://scontent.cdninstagram.com/hphotos-xaf1/t51.2885-15/e15/11377834_1444594822522424_1711722190_n.jpg
992324291389884507_247919673,2015-05-25 00:38:15,Normal,12,"[Tag: random, Tag: why, Tag: yeshardrock]",https://scontent.cdninstagram.com/hphotos-xfa1/t51.2885-15/e15/11357813_586237454849863_1482814175_n.jpg
992323043171352480_271927670,2015-05-25 00:35:46,Valencia,45,[Tag: sketchbookheaven],https://scontent.cdninstagram.com/hphotos-xfa1/t51.2885-15/e15/11333315_115088985489134_810924449_n.jpg
992322505807279769_276059396,2015-05-25 00:34:42,Normal,6,"[Tag: italia, Tag: porcelino, Tag: firenze]",https://scontent.cdninstagram.com/hphotos-xfa1/t51.2885-15/e15/11326628_503555693129689_825944808_n.jpg
992317533380543447_1420260639,2015-05-25 00:24:49,Normal,7,"[Tag: picstitch, Tag: fashion, Tag: appbreeze, Tag: fashionista, Tag: tbt, Tag: bestagram, Tag: iphoneonly, Tag: igers, Tag: follow4follow, Tag: instamood, Tag: instadaily, Tag: instagood, Tag: style, Tag: webstagram, Tag: photoofday, Tag: instafollow, Tag: teamfollowback, Tag: all_shots, Tag: followme, Tag: tagsforlikes, Tag: iaddict, Tag: bestoftheday, Tag: photooftheday, Tag: editorial, Tag: like4like, Tag: tweegram, Tag: picoftheday, Tag: bepopular]",https://scontent.cdninstagram.com/hphotos-xaf1/t51.2885-15/e15/11371993_876360405789466_1429775336_n.jpg
992315990619088638_423474760,2015-05-25 00:21:45,Juno,12,"[Tag: beautiful, Tag: superfunny, Tag: astorcafe, Tag: intelligent, Tag: newfriendships, Tag: lovelyladies, Tag: gorg, Tag: stylish, Tag: florence]",https://scontent.cdninstagram.com/hphotos-xaf1/t51.2885-15/e15/11358268_761917573927657_847763625_n.jpg
992315903725667237_1420260639,2015-05-25 00:21:35,Normal,9,"[Tag: picstitch, Tag: fashion, Tag: appbreeze, Tag: fashionista, Tag: tbt, Tag: bestagram, Tag: iphoneonly, Tag: igers, Tag: follow4follow, Tag: instamood, Tag: instadaily, Tag: instagood, Tag: style, Tag: webstagram, Tag: photoofday, Tag: instafollow, Tag: teamfollowback, Tag: all_shots, Tag: followme, Tag: tagsforlikes, Tag: iaddict, Tag: bestoftheday, Tag: photooftheday, Tag: editorial, Tag: like4like, Tag: tweegram, Tag: picoftheday, Tag: bepopular]",https://scontent.cdninstagram.com/hphotos-xaf1/t51.2885-15/e15/11282236_722999261159824_1434303641_n.jpg
992315464045830964_346806287,2015-05-25 00:20:43,Normal,17,"[Tag: dogs, Tag: dogoftheday8, Tag: istaphoto, Tag: instapic, Tag: instalove, Tag: instadog, Tag: goodnight, Tag: artdog, Tag: istapic, Tag: dogoftheweek, Tag: bigtruffle, Tag: dogoftheday, Tag: istalove, Tag: bau, Tag: dogofday, Tag: dog, Tag: instaday, Tag: cooldog, Tag: instadogs, Tag: pictureoftheday, Tag: instanimal, Tag: dogofig, Tag: instanimals, Tag: bignose, Tag: picoftheday, Tag: istaday, Tag: dogofthedayjp]",https://scontent.cdninstagram.com/hphotos-xaf1/t51.2885-15/e15/11374546_844733748915020_1296009138_n.jpg
992313368059847416_346806287,2015-05-25 00:16:33,Normal,21,"[Tag: rolex6238, Tag: rarerolex, Tag: lovewatches, Tag: rolexero, Tag: rolexforums, Tag: rolexpassion, Tag: watchporn, Tag: montre, Tag: vintagerolexforum, Tag: horology, Tag: rarewatch, Tag: rolexlover, Tag: vintagerolex, Tag: watchgeek, Tag: rolexporn, Tag: wruw, Tag: whatchs, Tag: wristporn, Tag: womw, Tag: mondani, Tag: watchs, Tag: predaytona, Tag: dailywatch, Tag: wristshot, Tag: vintagewatch, Tag: rolexheritage, Tag: teamwatchanish, Tag: rolexhistory, Tag: rolexvintage, Tag: 6238]",https://scontent.cdninstagram.com/hphotos-xaf1/t51.2885-15/e15/11375955_1088995601129679_27522316_n.jpg
992312183129352639_409698561,2015-05-25 00:14:12,Crema,11,"[Tag: beautifulcity, Tag: dontwanttoleave]",https://scontent.cdninstagram.com/hphotos-xaf1/t51.2885-15/e15/11311353_401804906665685_196078331_n.jpg
992310946293662290_187736071,2015-05-25 00:11:44,Normal,7,"[Tag: pontevecchio, Tag: firenze]",https://scontent.cdninstagram.com/hphotos-xfa1/t51.2885-15/e15/11357489_443848325775428_858291926_n.jpg
992310813779172151_35366413,2015-05-25 00:11:28,Normal,11,"[Tag: toscana, Tag: italy, Tag: duomo, Tag: firenze, Tag: italia, Tag: night, Tag: tuscany, Tag: nofilter, Tag: florence]",https://scontent.cdninstagram.com/hphotos-xaf1/t51.2885-15/e15/11351029_434918810013430_828677905_n.jpg
992308892545258945_175426988,2015-05-25 00:07:39,Normal,48,"[Tag: italy, Tag: florence]",https://scontent.cdninstagram.com/hphotos-xaf1/t51.2885-15/e15/11378644_781402891973316_350611768_n.jpg
992307895896850181_297859046,2015-05-25 00:05:40,X-Pro II,6,"[Tag: rouge, Tag: montecarlo, Tag: alfaromeo, Tag: monaco]",https://scontent.cdninstagram.com/hphotos-xaf1/t51.2885-15/e15/11374201_839011219503149_1842558277_n.jpg
992306490350819227_4322868,2015-05-25 00:02:53,Ashby,46,"[Tag: discovereurope, Tag: discoveritaly, Tag: whatisthehashtag, Tag: siena]",https://scontent.cdninstagram.com/hphotos-xaf1/t51.2885-15/e15/11265802_1436478436656334_707182115_n.jpg
991688805826979441_273280792,2015-05-24 03:35:39,Lark,32,"[Tag: beautiful, Tag: clouds, Tag: horizon, Tag: nature, Tag: color, Tag: sky, Tag: isea_sunsets, Tag: night, Tag: sol, Tag: instasunsets, Tag: sunrays, Tag: scenicsunset, Tag: morning, Tag: sunrise, Tag: pink, Tag: all_sunsets, Tag: silhouette, Tag: cloudporn, Tag: sun, Tag: skyporn, Tag: irox_skyline, Tag: ig_sunsetshots, Tag: instagood, Tag: instasky, Tag: sunset, Tag: pretty, Tag: gorgeous, Tag: orange, Tag: red, Tag: photooftheday]",https://scontent.cdninstagram.com/hphotos-xaf1/t51.2885-15/e15/11282703_966728240015151_241057284_n.jpg
991688772449866056_294381923,2015-05-24 03:35:35,Brannan,40,"[Tag: sonjamoonear, Tag: fortezza, Tag: nextech, Tag: ricardovillalobos, Tag: nextechplus, Tag: ilritorno]",https://scontent.cdninstagram.com/hphotos-xfa1/t51.2885-15/e15/11272451_409510509221076_61213157_n.jpg
991682344102585187_187584279,2015-05-24 03:22:49,Normal,32,"[Tag: number8377, Tag: solosorrisi, Tag: thecolorrunfirenze, Tag: solocolori, Tag: friend, Tag: happy]",https://scontent.cdninstagram.com/hphotos-xfa1/t51.2885-15/e15/11282267_1627388480807980_218008647_n.jpg
991682059205883972_498406549,2015-05-24 03:22:15,Normal,39,"[Tag: dreaming, Tag: travelbug, Tag: florence, Tag: leftmyheartthere]",https://scontent.cdninstagram.com/hphotos-xaf1/t51.2885-15/e15/11280253_445571642273890_150256987_n.jpg
991678321311945437_1504129163,2015-05-24 03:14:49,Rise,18,"[Tag: thecolorrun, Tag: sister]",https://scontent.cdninstagram.com/hphotos-xfa1/t51.2885-15/e15/11330600_1589026744711676_815369656_n.jpg
991676796292346727_463900043,2015-05-24 03:11:48,Normal,16,"[Tag: villalobos, Tag: ricardo]",https://scontent.cdninstagram.com/hphotos-xaf1/t51.2885-15/e15/11246622_864391666944165_817079176_n.jpg
991676602115946902_704598069,2015-05-24 03:11:24,Normal,174,"[Tag: southfrance, Tag: cannesfilmfestival, Tag: cannes2015, Tag: crazyloc, Tag: hipowerent, Tag: hipower]",https://scontent.cdninstagram.com/hphotos-xfa1/t51.2885-15/e15/11326109_1581717645437282_2081678083_n.jpg
991676527684948653_1504129163,2015-05-24 03:11:16,Rise,10,"[Tag: thecolorrun, Tag: happy]",https://scontent.cdninstagram.com/hphotos-xfa1/t51.2885-15/e15/11372372_102124670125845_138264438_n.jpg
991676123610075584_259410243,2015-05-24 03:10:27,Normal,7,"[Tag: italia, Tag: florence, Tag: italy, Tag: firenze, Tag: イタリア]",https://scontent.cdninstagram.com/hphotos-xaf1/t51.2885-15/e15/11357638_779056588877154_1239206665_n.jpg
991673180989946164_704598069,2015-05-24 03:04:37,Normal,151,"[Tag: cannesfilmfestival, Tag: cannes2015, Tag: cannes]",https://scontent.cdninstagram.com/hphotos-xaf1/t51.2885-15/e15/11123946_817932581625668_157776404_n.jpg
991672723988564408_190059625,2015-05-24 03:03:42,Normal,38,"[Tag: toscana, Tag: tuscany, Tag: instagram, Tag: color, Tag: run, Tag: cascine, Tag: firenze]",https://scontent.cdninstagram.com/hphotos-xfa1/t51.2885-15/e15/11350970_642051715938395_1913172343_n.jpg
991671815240086357_1452491,2015-05-24 03:01:54,Slumber,9,"[Tag: italy, Tag: florence]",https://scontent.cdninstagram.com/hphotos-xfa1/t51.2885-15/e15/11324381_1615273462052277_549822337_n.jpg
991671780846553205_420897257,2015-05-24 03:01:50,Normal,26,"[Tag: belgianjokes, Tag: englishidioms, Tag: everyonelovestaylorswift]",https://scontent.cdninstagram.com/hphotos-xfa1/t51.2885-15/e15/11311565_895405870503419_603497_n.jpg
991671681853922613_288633558,2015-05-24 03:01:38,Rise,13,[Tag: florence],https://scontent.cdninstagram.com/hphotos-xaf1/t51.2885-15/e15/11282226_1458450011114037_1086277271_n.jpg
991668456489598047_2025366,2015-05-24 02:55:13,Normal,18,"[Tag: italy, Tag: florence]",https://scontent.cdninstagram.com/hphotos-xaf1/t51.2885-15/e15/11330803_822131444501629_1560142612_n.jpg
991668195556583122_27223320,2015-05-24 02:54:42,Normal,16,"[Tag: love, Tag: lights, Tag: dance, Tag: villalobos, Tag: ricardo, Tag: fortezza, Tag: music, Tag: partner, Tag: crime, Tag: view]",https://scontent.cdninstagram.com/hphotos-xaf1/t51.2885-15/e15/11247541_1743418299218580_1349653316_n.jpg
991667191349613385_200059963,2015-05-24 02:52:43,Normal,28,[Tag: варядаря],https://scontent.cdninstagram.com/hphotos-xaf1/t51.2885-15/e15/11326758_1576960799258246_607246204_n.jpg
991666673453411616_208234650,2015-05-24 02:51:41,Slumber,7,"[Tag: takemeback, Tag: contikikel, Tag: david, Tag: eupanorama, Tag: italy, Tag: travelling, Tag: holidays, Tag: florence, Tag: contiki]",https://scontent.cdninstagram.com/hphotos-xfa1/t51.2885-15/e15/11373941_398246440359184_869128080_n.jpg
991666491521602361_200059963,2015-05-24 02:51:19,Normal,29,[Tag: варядаря],https://scontent.cdninstagram.com/hphotos-xaf1/t51.2885-15/e15/11327106_1576725402586342_1515077774_n.jpg
991664904485977510_239376774,2015-05-24 02:48:10,Normal,22,"[Tag: luxe, Tag: luxurytravel, Tag: italy, Tag: hotel, Tag: florenceitaly, Tag: traveldeeper, Tag: instatbn, Tag: ddinitaly, Tag: luxelife, Tag: florence]",https://scontent.cdninstagram.com/hphotos-xaf1/t51.2885-15/e15/11324422_1595240824063547_1582204919_n.jpg
991663008554325507_50809516,2015-05-24 02:44:24,Slumber,16,"[Tag: redpassion, Tag: noncipiaceilrosso❤️️]",https://scontent.cdninstagram.com/hphotos-xaf1/t51.2885-15/e15/11313694_1571551369773567_1327994789_n.jpg
991662453762095651_1425686341,2015-05-24 02:43:18,Normal,19,"[Tag: beautiful, Tag: cute, Tag: fashion, Tag: love, Tag: summer, Tag: food, Tag: instalike, Tag: tbt, Tag: tagsforlikesapp, Tag: igers, Tag: follow, Tag: instadaily, Tag: instamood, Tag: friends, Tag: girl, Tag: me, Tag: swag, Tag: like4like, Tag: tflers, Tag: followme, Tag: instagood, Tag: tagsforlikes, Tag: amazing, Tag: bestoftheday, Tag: fun, Tag: smile, Tag: photooftheday, Tag: picoftheday, Tag: happy]",https://scontent.cdninstagram.com/hphotos-xfa1/t51.2885-15/e15/11379992_692723944186968_482697533_n.jpg
