ID,Created At,Filter,Number of Likes,HashTags,url
990916307062890752_305712055,2015-05-23 02:00:50,Inkwell,10,[Tag: sivola],https://scontent.cdninstagram.com/hphotos-xfa1/t51.2885-15/e15/11261627_476269575864536_437612478_n.jpg
990915930776500078_355958420,2015-05-23 02:00:05,Valencia,13,[Tag: friends],https://scontent.cdninstagram.com/hphotos-xaf1/t51.2885-15/e15/11377840_929984173709510_1664233170_n.jpg
990914524659186862_297841406,2015-05-23 01:57:18,Normal,34,"[Tag: europe, Tag: gladiatorsamongus, Tag: ciao, Tag: spring, Tag: roma, Tag: mediterranean, Tag: allroadsleadtorome, Tag: ancientrome, Tag: originalmsg, Tag: gameofthrones, Tag: eternalcity, Tag: empire, Tag: colosseum, Tag: gladiator, Tag: ancient, Tag: italy, Tag: backpacking, Tag: spqr, Tag: venividivici, Tag: angelsanddemons, Tag: studyabroad, Tag: wheninrome, Tag: rome, Tag: romanarmy, Tag: capital, Tag: msg, Tag: got, Tag: theatreintheround]",https://scontent.cdninstagram.com/hphotos-xfa1/t51.2885-15/e15/11328470_384251668436665_848376256_n.jpg
990913989132271780_25483183,2015-05-23 01:56:14,Slumber,23,"[Tag: tantilibri, Tag: alcool, Tag: rome, Tag: italy]",https://scontent.cdninstagram.com/hphotos-xaf1/t51.2885-15/e15/11273248_1606931099577826_1610900094_n.jpg
990236346900385658_1523927914,2015-05-22 03:29:53,Normal,35,"[Tag: 旅行, Tag: italy, Tag: jewish, Tag: ローマ, Tag: アーティチョーク, Tag: artichokes, Tag: foodgrasm, Tag: food, Tag: rome, Tag: instago, Tag: traveling, Tag: foodie, Tag: イタリア, Tag: instatraveling]",https://scontent.cdninstagram.com/hphotos-xaf1/t51.2885-15/e15/11324935_1589375028004481_1213103636_n.jpg
990235264910181545_180880592,2015-05-22 03:27:44,Normal,62,"[Tag: truffles, Tag: italy, Tag: cuisine, Tag: cheflife, Tag: foodlife, Tag: rome, Tag: roma, Tag: pasta, Tag: love, Tag: carbonara, Tag: foodpic, Tag: wow, Tag: italian]",https://scontent.cdninstagram.com/hphotos-xfa1/t51.2885-15/e15/11355980_457149257782740_969065546_n.jpg
990235024678215566_1265531558,2015-05-22 03:27:15,Normal,44,"[Tag: seratelatine, Tag: reggaeton, Tag: niggas, Tag: carusocafe, Tag: igersroma, Tag: bailar, Tag: pegao, Tag: nightlife, Tag: romamiabella]",https://scontent.cdninstagram.com/hphotos-xaf1/t51.2885-15/e15/11313261_396899420509820_1019108711_n.jpg
990232414504565112_671997,2015-05-22 03:22:04,Amaro,28,"[Tag: tired, Tag: knockout, Tag: night, Tag: sleepy, Tag: rest, Tag: dark, Tag: goodnight, Tag: sleep, Tag: bedtime, Tag: passout, Tag: instagood, Tag: out, Tag: moonlight, Tag: sleeptime, Tag: goodday, Tag: nighttime, Tag: sleepyhead, Tag: bed, Tag: moon, Tag: nightowl, Tag: nightynight, Tag: instagoodnight, Tag: knockedout, Tag: lightsout, Tag: photooftheday]",https://scontent.cdninstagram.com/hphotos-xfa1/t51.2885-15/e15/11312069_1110282515665503_653546178_n.jpg
990230751832992397_1161017841,2015-05-22 03:18:46,Normal,84,[Tag: viagemcommarina],https://scontent.cdninstagram.com/hphotos-xaf1/t51.2885-15/e15/11351595_472574619585851_2111384121_n.jpg
990230326991205187_1522517123,2015-05-22 03:17:55,Normal,63,[Tag: rome],https://scontent.cdninstagram.com/hphotos-xaf1/t51.2885-15/e15/11352436_1140635865962315_1860450543_n.jpg
990227796920731188_10632912,2015-05-22 03:12:53,Normal,20,"[Tag: rome, Tag: italy, Tag: roma, Tag: italia, Tag: travel, Tag: vacaciones, Tag: history]",https://scontent.cdninstagram.com/hphotos-xaf1/t51.2885-15/e15/11312079_1597220897211572_2031689453_n.jpg
990226797174818344_10632912,2015-05-22 03:10:54,Normal,28,"[Tag: italy, Tag: colosseo, Tag: travel, Tag: romano, Tag: rome, Tag: italia, Tag: roma, Tag: coliseo, Tag: vacaciones]",https://scontent.cdninstagram.com/hphotos-xaf1/t51.2885-15/e15/11269879_660440220766727_137567680_n.jpg
990226242721383963_10632912,2015-05-22 03:09:48,Normal,13,"[Tag: italy, Tag: colosseo, Tag: travel, Tag: romano, Tag: rome, Tag: italia, Tag: roma, Tag: coliseo, Tag: vacaciones, Tag: history]",https://scontent.cdninstagram.com/hphotos-xaf1/t51.2885-15/e15/11328345_777005215751220_1494877395_n.jpg
990225755794058045_178545777,2015-05-22 03:08:50,Normal,77,"[Tag: narcissism, Tag: cute, Tag: starving, Tag: fashioninspo, Tag: mirrorselfie, Tag: ootdshare, Tag: selfie, Tag: bagoftheday, Tag: shopaholic, Tag: easychic, Tag: girlish, Tag: ootd, Tag: igfashion, Tag: womenstyle, Tag: casual, Tag: ondiet, Tag: fashionology, Tag: fashionaddict, Tag: fashiondiaries, Tag: igstyle, Tag: dalbolognese, Tag: iphonesia, Tag: preppy, Tag: moda, Tag: stylediaries, Tag: mode, Tag: classy, Tag: missingrome]",https://scontent.cdninstagram.com/hphotos-xaf1/t51.2885-15/e15/11357550_1129525840396819_1246245098_n.jpg
990225460861175308_10632912,2015-05-22 03:08:15,Normal,10,"[Tag: italy, Tag: colosseo, Tag: travel, Tag: rome, Tag: italia, Tag: roma, Tag: coliseo, Tag: vacaciones, Tag: history]",https://scontent.cdninstagram.com/hphotos-xfa1/t51.2885-15/e15/11355851_1431867543787401_45576407_n.jpg
990218386898959723_1334787830,2015-05-22 02:54:12,Crema,51,"[Tag: pantheon, Tag: isthatapun, Tag: tbt, Tag: rome]",https://scontent.cdninstagram.com/hphotos-xaf1/t51.2885-15/e15/11352381_100170360322494_1529411377_n.jpg
990215153134239751_1551429511,2015-05-22 02:47:46,Normal,0,"[Tag: website, Tag: photos, Tag: italy, Tag: contemporaryart, Tag: art, Tag: newspapers]",https://scontent.cdninstagram.com/hphotos-xfa1/t51.2885-15/e15/11371022_918406608226907_1702291161_n.jpg
990214986188852348_1255055898,2015-05-22 02:47:26,Normal,49,"[Tag: stairs, Tag: rome, Tag: italy, Tag: architecture, Tag: vatican]",https://scontent.cdninstagram.com/hphotos-xaf1/t51.2885-15/e15/11349235_385020805017159_898774940_n.jpg
990211971677472296_964567864,2015-05-22 02:41:27,Normal,57,"[Tag: somereed, Tag: honeymoon, Tag: azzaro, Tag: nikkireed, Tag: gentleman, Tag: iansomerhalder, Tag: lovebird, Tag: couture, Tag: bestcouple, Tag: somerhalder, Tag: cannes, Tag: sexy, Tag: intense, Tag: betterhalf]",https://scontent.cdninstagram.com/hphotos-xfa1/t51.2885-15/e15/11246294_100167106989579_2054395101_n.jpg
990210131466521613_1255055898,2015-05-22 02:37:47,Normal,79,"[Tag: stairs, Tag: rome, Tag: italy, Tag: architecture, Tag: vatican]",https://scontent.cdninstagram.com/hphotos-xaf1/t51.2885-15/e15/11356000_920826307975849_1201112684_n.jpg
990209073321012076_1680137745,2015-05-22 02:35:41,Lo-fi,3,"[Tag: akabclub, Tag: jordan, Tag: numero23, Tag: todalavida, Tag: italyiloveyou, Tag: air]",https://scontent.cdninstagram.com/hphotos-xfa1/t51.2885-15/e15/11330555_1453366541643908_1624489075_n.jpg
990206694527995845_1255055898,2015-05-22 02:30:58,Normal,42,"[Tag: art, Tag: museum, Tag: rome, Tag: architecture, Tag: statue, Tag: vatican, Tag: italy, Tag: sculpture]",https://scontent.cdninstagram.com/hphotos-xaf1/t51.2885-15/e15/11356579_1452902638342195_483333233_n.jpg
990206426725092042_29924225,2015-05-22 02:30:26,Normal,19,"[Tag: jornaloglobo, Tag: tourist, Tag: italytravel, Tag: italy, Tag: travel, Tag: iphoneonly, Tag: spanishsteps, Tag: achadosdasemana, Tag: amazing, Tag: rome, Tag: bestoftheday, Tag: boaviagem, Tag: roma, Tag: italia, Tag: picoftheday, Tag: photooftheday]",https://scontent.cdninstagram.com/hphotos-xfa1/t51.2885-15/e15/11326088_1602552800021698_2025461178_n.jpg
990204164636574453_1551429511,2015-05-22 02:25:56,Normal,0,[Tag: myart],https://scontent.cdninstagram.com/hphotos-xaf1/t51.2885-15/e15/11325090_1655568594674563_1224971780_n.jpg
990203540406698727_1551429511,2015-05-22 02:24:42,Normal,0,[Tag: london],https://scontent.cdninstagram.com/hphotos-xfa1/t51.2885-15/e15/11244527_765279336903203_818423715_n.jpg
990203502495738426_324186737,2015-05-22 02:24:37,Normal,38,"[Tag: carusocafe, Tag: sibaila, Tag: sensualunmovimentosensuale, Tag: muevelacolita]",https://scontent.cdninstagram.com/hphotos-xaf1/t51.2885-15/e15/11288115_409662022548918_1020549185_n.jpg
990203049706685151_1551429511,2015-05-22 02:23:43,Normal,2,"[Tag: london, Tag: londra, Tag: uk]",https://scontent.cdninstagram.com/hphotos-xaf1/t51.2885-15/e15/11312427_462151000614569_587728984_n.jpg
990202977041915792_1482366926,2015-05-22 02:23:35,Hefe,16,"[Tag: romantico, Tag: ultimo]",https://scontent.cdninstagram.com/hphotos-xfa1/t51.2885-15/e15/11356367_619001498235223_1765843453_n.jpg
990202590019554387_27759706,2015-05-22 02:22:48,Normal,127,"[Tag: ancient, Tag: foro, Tag: forum, Tag: trajan, Tag: column, Tag: roman, Tag: rome, Tag: italia, Tag: architecture, Tag: monument, Tag: italy, Tag: ruins]",https://scontent.cdninstagram.com/hphotos-xaf1/t51.2885-15/e15/11288160_635115993257123_1396178207_n.jpg
990202394854690667_1255055898,2015-05-22 02:22:25,Normal,33,"[Tag: art, Tag: museum, Tag: rome, Tag: italy, Tag: vatican]",https://scontent.cdninstagram.com/hphotos-xfa1/t51.2885-15/e15/11324885_936884189696096_626266361_n.jpg
990200467002127665_1319436436,2015-05-22 02:18:35,Nashville,25,"[Tag: 이로, Tag: fashion, Tag: 아크네, Tag: cinqueterre, Tag: phliplim, Tag: 골든구스, Tag: coconut, Tag: 쟈딕, Tag: street, Tag: 데일리룩, Tag: 셀스타그램, Tag: 여행, Tag: 코코넛, Tag: venice, Tag: 끌로에, Tag: dailylook, Tag: 코디, Tag: 쇼핑, Tag: 필립림, Tag: rome, Tag: item, Tag: 패션, Tag: 마랑, Tag: 일상, Tag: romanforum, Tag: 스타일, Tag: 스트릿패션, Tag: 얼스타그램]",https://scontent.cdninstagram.com/hphotos-xfa1/t51.2885-15/e15/11350922_115315232132774_847649137_n.jpg
990200289449024354_7801605,2015-05-22 02:18:14,Normal,54,"[Tag: rome, Tag: italy, Tag: vaticano, Tag: blessedtbt, Tag: nofilter, Tag: tbt, Tag: piazzasanpietro]",https://scontent.cdninstagram.com/hphotos-xfa1/t51.2885-15/e15/11349170_402650156593340_520416507_n.jpg
990199189147952999_9455712,2015-05-22 02:16:03,Normal,498,[Tag: roma],https://scontent.cdninstagram.com/hphotos-xaf1/t51.2885-15/e15/11282808_1011540272197005_1918602352_n.jpg
990198532390094255_45753680,2015-05-22 02:14:45,Normal,58,[Tag: hadabitofwinewithlunch],https://scontent.cdninstagram.com/hphotos-xfa1/t51.2885-15/e15/11271059_1646007135629524_2079870536_n.jpg
990197222111440693_1214495506,2015-05-22 02:12:09,Normal,10,"[Tag: 2015, Tag: juve, Tag: finaletimcup, Tag: lazio, Tag: juvepersempresarà, Tag: olimpico]",https://scontent.cdninstagram.com/hphotos-xaf1/t51.2885-15/e15/11282110_349961578532207_1922545646_n.jpg
990197091568324331_1255055898,2015-05-22 02:11:53,Normal,22,"[Tag: rome, Tag: italy]",https://scontent.cdninstagram.com/hphotos-xfa1/t51.2885-15/e15/11326646_1644775022408273_1980172247_n.jpg
990194049842286240_1255055898,2015-05-22 02:05:50,Normal,32,"[Tag: rome, Tag: italy, Tag: architecture, Tag: vatican]",https://scontent.cdninstagram.com/hphotos-xaf1/t51.2885-15/e15/11262900_996437760367558_2115503827_n.jpg
990193949625126348_1122402,2015-05-22 02:05:38,Sierra,28,"[Tag: europe, Tag: eurotrip, Tag: roman, Tag: vatican, Tag: holysee, Tag: train, Tag: ertw, Tag: trip, Tag: catholic, Tag: stpetersbasilica, Tag: italy, Tag: backpacking, Tag: travel, Tag: adventures, Tag: jal, Tag: rome, Tag: eurorail]",https://scontent.cdninstagram.com/hphotos-xaf1/t51.2885-15/e15/11327332_618149218322166_1011047347_n.jpg
990193070540333248_145486799,2015-05-22 02:03:54,Normal,20,"[Tag: love, Tag: picoftheday, Tag: colorful, Tag: food, Tag: instalike, Tag: swag, Tag: instago, Tag: igers, Tag: follow4follow, Tag: follow, Tag: instadaily, Tag: girl, Tag: style, Tag: webstagram, Tag: tflers, Tag: look, Tag: instafollow, Tag: iphoneonly, Tag: 20likes, Tag: all_shots, Tag: instagood, Tag: tagsforlikes, Tag: amazing, Tag: instacool, Tag: bestoftheday, Tag: smile, Tag: like4like, Tag: tweegram, Tag: followme, Tag: photooftheday]",https://scontent.cdninstagram.com/hphotos-xaf1/t51.2885-15/e15/11349294_1615414562049119_293551523_n.jpg
990192803102773533_12856459,2015-05-22 02:03:22,Normal,17,"[Tag: good, Tag: sweet, Tag: romebynight, Tag: dolcevita, Tag: friends, Tag: italiangirl, Tag: tagforlike, Tag: cool, Tag: italianboy, Tag: zazà, Tag: lookbook, Tag: italy, Tag: top, Tag: loveforever, Tag: amazing, Tag: rome, Tag: night, Tag: followme]",https://scontent.cdninstagram.com/hphotos-xaf1/t51.2885-15/e15/11325957_561069720698354_1678474181_n.jpg
990191704632377365_173792479,2015-05-22 02:01:11,Normal,3,"[Tag: sephoralipsparty, Tag: roma, Tag: repost]",https://scontent.cdninstagram.com/hphotos-xaf1/t51.2885-15/e15/11280090_472908802876801_20594562_n.jpg
990191250807066195_1255055898,2015-05-22 02:00:17,Normal,50,"[Tag: italy, Tag: mextagram, Tag: sky, Tag: rain, Tag: rome, Tag: architecture, Tag: vatican, Tag: igersmexico]",https://scontent.cdninstagram.com/hphotos-xfa1/t51.2885-15/e15/11355308_715887668520858_1362406675_n.jpg
990191129056822339_964567864,2015-05-22 02:00:02,Normal,59,"[Tag: beautiful, Tag: somereed, Tag: honeymoon, Tag: love, Tag: costarica, Tag: family, Tag: nikkireed, Tag: iansomerhalder, Tag: lovebird, Tag: bestcouple, Tag: somerhalder, Tag: betterhalf, Tag: volunteer]",https://scontent.cdninstagram.com/hphotos-xfa1/t51.2885-15/e15/11327219_1578698885712827_929446610_n.jpg
990188880364618766_964567864,2015-05-22 01:55:34,Normal,30,"[Tag: deandemon, Tag: moose, Tag: dean, Tag: squirrel, Tag: family, Tag: crazy, Tag: johnwinchester, Tag: jensenackles, Tag: sammy, Tag: baltazar, Tag: jaredpadalecki, Tag: funny, Tag: sebastianroche, Tag: mishacollins, Tag: markpellegrino, Tag: lucifer, Tag: supernatural, Tag: mattchoen, Tag: castiel, Tag: parody]",https://scontent.cdninstagram.com/hphotos-xaf1/t51.2885-15/e15/11312544_1405753016417109_1349220978_n.jpg
990187655636643272_38258258,2015-05-22 01:53:08,X-Pro II,9,"[Tag: luce, Tag: goodnight, Tag: divertirsiconpoco, Tag: risate, Tag: capelli]",https://scontent.cdninstagram.com/hphotos-xaf1/t51.2885-15/e15/11281974_849780145057384_1861682690_n.jpg
990187021693191347_427183680,2015-05-22 01:51:53,Normal,26,"[Tag: италия, Tag: рим]",https://scontent.cdninstagram.com/hphotos-xaf1/t51.2885-15/e15/11312307_577404192399755_520315932_n.jpg
990186142187413375_645741558,2015-05-22 01:50:08,Crema,7,"[Tag: goaclub, Tag: anygiventhursday, Tag: tuttobene]",https://scontent.cdninstagram.com/hphotos-xfa1/t51.2885-15/e15/10860142_1583439018597584_1606012838_n.jpg
990185412713136610_1745460655,2015-05-22 01:48:41,Ginza,2,[Tag: primavera],https://scontent.cdninstagram.com/hphotos-xaf1/t51.2885-15/e15/11326320_1602862163304655_625097322_n.jpg
990184793888538279_1698753598,2015-05-22 01:47:27,Normal,2,[Tag: vamosrivercarajoo],https://scontent.cdninstagram.com/hphotos-xfa1/t51.2885-15/e15/11333588_1405919559733597_1233290965_n.jpg
990184374508047933_43218186,2015-05-22 01:46:37,Normal,41,"[Tag: summer, Tag: likesforlikes, Tag: buonanotte, Tag: love, Tag: cute, Tag: spring, Tag: selfie, Tag: night, Tag: tbt, Tag: notte, Tag: goodnight, Tag: home, Tag: instadaily, Tag: instamood, Tag: italiangirl, Tag: cool, Tag: me, Tag: girl, Tag: followforfollow, Tag: girls, Tag: iphonesia, Tag: instagood, Tag: tagsforlikes, Tag: hot, Tag: rome, Tag: bestoftheday, Tag: sweet, Tag: igdaily, Tag: followme, Tag: photooftheday]",https://scontent.cdninstagram.com/hphotos-xfa1/t51.2885-15/e15/11282603_1606056493014944_494481340_n.jpg
990183698903406242_32385324,2015-05-22 01:45:16,Normal,306,"[Tag: paris, Tag: magnificent, Tag: versailles]",https://scontent.cdninstagram.com/hphotos-xaf1/t51.2885-15/e15/11353107_637472933051607_1265136249_n.jpg
990182353417368189_522289955,2015-05-22 01:42:36,Normal,30,"[Tag: dead, Tag: daisy]",https://scontent.cdninstagram.com/hphotos-xfa1/t51.2885-15/e15/11269661_371958682998908_1090164570_n.jpg
990181871948507127_2123700360,2015-05-22 01:41:39,Rise,17,"[Tag: italotreno, Tag: toscana, Tag: clouds, Tag: tuscany, Tag: river, Tag: landscape, Tag: cloudyday]",https://scontent.cdninstagram.com/hphotos-xaf1/t51.2885-15/e15/11313703_844167758972567_1240861409_n.jpg
990181456396049375_37847709,2015-05-22 01:40:49,Normal,5,"[Tag: vaticancity, Tag: stpeterssquare, Tag: italy, Tag: tbt, Tag: canigobackyet]",https://scontent.cdninstagram.com/hphotos-xaf1/t51.2885-15/e15/11311213_1424241021230628_1601725818_n.jpg
990181226016943631_254835010,2015-05-22 01:40:22,Lark,29,"[Tag: colosseum, Tag: italy2015, Tag: tbt]",https://scontent.cdninstagram.com/hphotos-xaf1/t51.2885-15/e15/11337190_1440322609604296_720804803_n.jpg
990181195654345428_837564075,2015-05-22 01:40:18,Lo-fi,17,"[Tag: likeavirgin, Tag: rosso, Tag: perledisaggezza, Tag: virgin, Tag: philosophy, Tag: legno, Tag: scrittocolsangue, Tag: filosofiadivita, Tag: scritta, Tag: wood, Tag: saggezza, Tag: vergine, Tag: pensierieparole, Tag: red, Tag: filosofia]",https://scontent.cdninstagram.com/hphotos-xaf1/t51.2885-15/e15/11334430_894478180610600_2135685449_n.jpg
990180911554778474_4051556,2015-05-22 01:39:44,Normal,543,"[Tag: whatitalyis, Tag: romanity, Tag: shotaward, Tag: ig_photooftheday, Tag: notmynonni, Tag: letsgosomewhere, Tag: streetdreamsmag, Tag: huffpostgram, Tag: welltraveled, Tag: instaitalia, Tag: jj, Tag: featuremeinstagood, Tag: instadaily, Tag: vsco, Tag: buongiornoroma, Tag: romeroaming, Tag: italy, Tag: amselcom, Tag: vscogood, Tag: igersitalia, Tag: igersroma, Tag: 🇮🇹, Tag: iphonesia, Tag: igmasters, Tag: liveauthentic, Tag: rome, Tag: bestoftheday, Tag: global_hotzshotz, Tag: vscocam, Tag: picoftheday]",https://scontent.cdninstagram.com/hphotos-xaf1/t51.2885-15/e15/11357274_1636990466544960_2055129369_n.jpg
990180216652220251_964567864,2015-05-22 01:38:21,Normal,97,"[Tag: beautiful, Tag: azzaro, Tag: nikloveian, Tag: honeymoon, Tag: vegan, Tag: couture, Tag: bestcouple, Tag: somerhalder, Tag: sexy, Tag: intense, Tag: betterhalf, Tag: perfect, Tag: somereed, Tag: ianlovenik, Tag: nikkireed, Tag: elegance, Tag: iansomerhalder, Tag: lovebird, Tag: cannes, Tag: party, Tag: lovely]",https://scontent.cdninstagram.com/hphotos-xfa1/t51.2885-15/e15/11372258_673483932781503_1196567773_n.jpg
990179637006973439_1153037061,2015-05-22 01:37:12,Amaro,14,"[Tag: luces, Tag: calles, Tag: monumentos, Tag: historia, Tag: italia, Tag: night, Tag: holidays, Tag: pasado, Tag: happy]",https://scontent.cdninstagram.com/hphotos-xaf1/t51.2885-15/e15/11296905_824404554310754_1433843118_n.jpg
990178944932149408_245869125,2015-05-22 01:35:50,Hefe,30,"[Tag: europe, Tag: loves_world, Tag: intaitalia, Tag: ig_piemonte, Tag: igworldclub, Tag: loves_europe, Tag: city_explore, Tag: bestcity, Tag: tbt, Tag: worlderlust, Tag: italian_places, Tag: hot_shotz, Tag: citybestpics, Tag: bridge, Tag: instadaily, Tag: ig_exquisite, Tag: city, Tag: italy, Tag: roma, Tag: loves_roma, Tag: instagood, Tag: italia, Tag: europe_gallery, Tag: ig_europe, Tag: instagramer, Tag: loves_italia, Tag: instagramitalia]",https://scontent.cdninstagram.com/hphotos-xaf1/t51.2885-15/e15/11327454_1427999870843258_115493033_n.jpg
990175900602184596_222215747,2015-05-22 01:29:47,Normal,40,"[Tag: rome, Tag: italy, Tag: colosseum]",https://scontent.cdninstagram.com/hphotos-xaf1/t51.2885-15/e15/11296722_1620451648239556_1833451178_n.jpg
990175617504786840_1153037061,2015-05-22 01:29:13,X-Pro II,11,"[Tag: historia, Tag: italia, Tag: night, Tag: monumentos, Tag: pasado, Tag: happy, Tag: holidays]",https://scontent.cdninstagram.com/hphotos-xfa1/t51.2885-15/e15/11311415_1445311332450113_561765332_n.jpg
990173886643248093_177973909,2015-05-22 01:25:47,Hefe,16,[Tag: rome],https://scontent.cdninstagram.com/hphotos-xaf1/t51.2885-15/e15/11326767_101060540232934_2113234040_n.jpg
989511998624906462_1349005398,2015-05-21 03:30:44,Normal,7,"[Tag: ucoitaly, Tag: ucoitaly2015, Tag: rome, Tag: bronchosabroad, Tag: roma]",https://scontent.cdninstagram.com/hphotos-xaf1/t51.2885-15/e15/11336010_1617002668546872_97213041_n.jpg
989506030978138500_36570959,2015-05-21 03:18:52,Normal,3,"[Tag: after, Tag: lotitomerda]",https://scontent.cdninstagram.com/hphotos-xfa1/t51.2885-15/e15/11355788_103992663269847_1556996312_n.jpg
989505035537334511_52817671,2015-05-21 03:16:53,Normal,36,"[Tag: saudeoanotodo, Tag: job, Tag: estoupresente, Tag: mesmolonge]",https://scontent.cdninstagram.com/hphotos-xaf1/t51.2885-15/e15/11263495_406193906230188_583392933_n.jpg
989504624116979712_1426036621,2015-05-21 03:16:04,Mayfair,8,"[Tag: europe, Tag: 가장작은독립국가, Tag: 성베드로성당, Tag: 로마교황청, Tag: rome, Tag: 바티칸궁전, Tag: 바티칸박물관, Tag: 배낭여행, Tag: vaticancity, Tag: 동유럽]",https://scontent.cdninstagram.com/hphotos-xaf1/t51.2885-15/e15/11311137_1664903360395585_1169308828_n.jpg
989504039137893902_48197102,2015-05-21 03:14:55,Skyline,34,"[Tag: coppaitalia, Tag: juvelazio, Tag: campeones, Tag: bianconeri, Tag: camp10ni, Tag: finoallafine, Tag: forzajuventus, Tag: juvetoday, Tag: civediamoaberlino, Tag: olimpico, Tag: finoalladecima, Tag: faffj, Tag: stadio, Tag: juve, Tag: berlín, Tag: coppa, Tag: stella, Tag: jointhegame, Tag: decima, Tag: timcup, Tag: jstadium, Tag: juventus, Tag: roma, Tag: infinale, Tag: fiuuu, Tag: instajuve]",https://scontent.cdninstagram.com/hphotos-xaf1/t51.2885-15/e15/11246419_493598277458856_2067303918_n.jpg
989503211872961344_195344847,2015-05-21 03:13:16,Slumber,22,"[Tag: coppaitalia, Tag: unica, Tag: finale, Tag: chepartita, Tag: olimpico, Tag: finoallafineforzajuventus, Tag: storiadiungrandeamore, Tag: 10, Tag: coppa, Tag: lazio, Tag: emozioneunica, Tag: stadio, Tag: piùgufatepiùvinciamo, Tag: italia, Tag: juventus, Tag: roma, Tag: grandejuve]",https://scontent.cdninstagram.com/hphotos-xaf1/t51.2885-15/e15/11335072_1656967224537715_1982592980_n.jpg
989500272265121508_539255242,2015-05-21 03:07:26,Normal,89,"[Tag: vsco, Tag: vscocam]",https://scontent.cdninstagram.com/hphotos-xaf1/t51.2885-15/e15/11281950_876244999106739_1630971429_n.jpg
989496536340654606_1149281049,2015-05-21 03:00:00,Normal,15,[Tag: la],https://scontent.cdninstagram.com/hphotos-xfa1/t51.2885-15/e15/11254046_1635413086693738_1514017973_n.jpg
989496410511442125_36570959,2015-05-21 02:59:45,Crema,4,[Tag: sorci],https://scontent.cdninstagram.com/hphotos-xaf1/t51.2885-15/e15/11350738_1432352893738477_2102266713_n.jpg
989495201547373682_1994878026,2015-05-21 02:57:21,Normal,5,"[Tag: roma, Tag: smoke, Tag: night, Tag: smile, Tag: work, Tag: metroc, Tag: insanity]",https://scontent.cdninstagram.com/hphotos-xaf1/t51.2885-15/e15/11296890_407369132781299_509233642_n.jpg
989494983525246043_383410872,2015-05-21 02:56:55,Lark,0,[Tag: 1900],https://scontent.cdninstagram.com/hphotos-xaf1/t51.2885-15/e15/11313481_1585394875074809_988157047_n.jpg
989494370518689394_1357415248,2015-05-21 02:55:42,Normal,5,[Tag: pernadecobraproduções],https://scontent.cdninstagram.com/hphotos-xaf1/t51.2885-15/e15/11275392_1463629387261748_1381375200_n.jpg
989493768511056332_1149281049,2015-05-21 02:54:30,Normal,29,"[Tag: emoción, Tag: audiencia, Tag: francisco]",https://scontent.cdninstagram.com/hphotos-xaf1/t51.2885-15/e15/11327197_421572354682053_1370565472_n.jpg
989490755809245562_472060701,2015-05-21 02:48:31,Normal,22,"[Tag: sis, Tag: imgoingtomissthislittlefacesomuch, Tag: mom]",https://scontent.cdninstagram.com/hphotos-xfa1/t51.2885-15/e15/11351618_1568924993370257_520963857_n.jpg
989489499290160193_1900007770,2015-05-21 02:46:01,Crema,7,"[Tag: felicidade, Tag: bus85, Tag: thenightisstillyoung, Tag: desgraçadas, Tag: sfaveladas, Tag: comeipoveri, Tag: belezapornatureza]",https://scontent.cdninstagram.com/hphotos-xaf1/t51.2885-15/e15/11282223_378731889002717_166518610_n.jpg
989489018453718807_29526372,2015-05-21 02:45:04,Rise,29,[Tag: 2manyperonis],https://scontent.cdninstagram.com/hphotos-xfa1/t51.2885-15/e15/11246315_1585248671737123_861721044_n.jpg
989487962891345267_21722678,2015-05-21 02:42:58,Lark,31,"[Tag: bossstatus, Tag: italy, Tag: travel, Tag: pose, Tag: vacation, Tag: boss, Tag: travellife, Tag: rome, Tag: roma, Tag: colosseum]",https://scontent.cdninstagram.com/hphotos-xfa1/t51.2885-15/e15/11312381_672071506270871_657146219_n.jpg
989487247513121287_36334891,2015-05-21 02:41:33,Normal,10,[Tag: takemeback],https://scontent.cdninstagram.com/hphotos-xaf1/t51.2885-15/e15/11351677_705829206210932_1273186209_n.jpg
989484160270201457_2010044603,2015-05-21 02:35:25,Normal,50,"[Tag: beautiful, Tag: love, Tag: roma, Tag: robxmarie, Tag: couples, Tag: passionpassport, Tag: laugh, Tag: travelzoo, Tag: tasteintravel, Tag: wanderlust, Tag: travelbucketlist, Tag: italy, Tag: romantic, Tag: shopping, Tag: travel, Tag: spanishsteps, Tag: live, Tag: rome, Tag: travelawesome, Tag: architecture, Tag: travelgram, Tag: tlpicks, Tag: italian]",https://scontent.cdninstagram.com/hphotos-xaf1/t51.2885-15/e15/11325400_1439930456309245_111529144_n.jpg
989481619998464447_1404364693,2015-05-21 02:30:22,Normal,25,"[Tag: europe, Tag: instapic, Tag: igtravel, Tag: adventure, Tag: instadaily, Tag: colosseum, Tag: italy, Tag: traveldiary, Tag: bobearahlife, Tag: vacation, Tag: instagood, Tag: rome, Tag: travelgram, Tag: holiday, Tag: picoftheday, Tag: travel]",https://scontent.cdninstagram.com/hphotos-xaf1/t51.2885-15/e15/11349183_395499983975590_408737188_n.jpg
989480378849905366_1656061105,2015-05-21 02:27:54,Normal,17,"[Tag: italy, Tag: roma]",https://scontent.cdninstagram.com/hphotos-xfa1/t51.2885-15/e15/11352080_1431836457125156_1531865037_n.jpg
989477183078467304_1266894032,2015-05-21 02:21:33,Normal,1733,[Tag: dametraveler],https://scontent.cdninstagram.com/hphotos-xfa1/t51.2885-15/e15/11325296_817806141600804_868617060_n.jpg
989477005663843881_297450172,2015-05-21 02:21:12,Earlybird,8,"[Tag: fumo, Tag: sogno, Tag: completo, Tag: uccide, Tag: amico, Tag: amore, Tag: sangue, Tag: volte, Tag: cielo, Tag: cadermi, Tag: visto, Tag: nuda, Tag: sputo, Tag: inchiostro, Tag: nostro, Tag: ora]",https://scontent.cdninstagram.com/hphotos-xfa1/t51.2885-15/e15/11280503_865858033488611_200188919_n.jpg
989475942773330511_18359899,2015-05-21 02:19:05,Normal,4,[Tag: glamorize],https://scontent.cdninstagram.com/hphotos-xfa1/t51.2885-15/e15/11313707_1616538515257003_1633224469_n.jpg
