ID,Created At,Filter,Number of Likes,HashTags,url
991674584143946017_51167999,2015-05-24 03:07:24,Lark,24,"[Tag: love, Tag: picoftheday, Tag: colorful, Tag: instalike, Tag: swag, Tag: instago, Tag: igers, Tag: follow4follow, Tag: follow, Tag: instadaily, Tag: friends, Tag: girl, Tag: style, Tag: webstagram, Tag: tflers, Tag: look, Tag: instafollow, Tag: iphoneonly, Tag: 20likes, Tag: all_shots, Tag: instagood, Tag: tagsforlikes, Tag: amazing, Tag: instacool, Tag: bestoftheday, Tag: smile, Tag: like4like, Tag: tweegram, Tag: followme, Tag: photooftheday]",https://scontent.cdninstagram.com/hphotos-xaf1/t51.2885-15/e15/11348331_934309786625429_1277872110_n.jpg
991674440321643049_40023371,2015-05-24 03:07:07,Aden,36,"[Tag: beautiful, Tag: cute, Tag: fashion, Tag: love, Tag: summer, Tag: food, Tag: instalike, Tag: tbt, Tag: tagsforlikesapp, Tag: igers, Tag: follow, Tag: instadaily, Tag: instamood, Tag: friends, Tag: girl, Tag: me, Tag: swag, Tag: like4like, Tag: tflers, Tag: followme, Tag: instagood, Tag: tagsforlikes, Tag: amazing, Tag: bestoftheday, Tag: fun, Tag: smile, Tag: photooftheday, Tag: picoftheday, Tag: happy]",https://scontent.cdninstagram.com/hphotos-xaf1/t51.2885-15/e15/11324233_851235028257502_940324868_n.jpg
991674405165161363_411688541,2015-05-24 03:07:03,Normal,20,"[Tag: artcafè, Tag: sabatosabato]",https://scontent.cdninstagram.com/hphotos-xfa1/t51.2885-15/e15/11334470_1589167694684276_730277373_n.jpg
991672938810460872_640747705,2015-05-24 03:04:08,Normal,6,"[Tag: artcafè, Tag: friends, Tag: roma]",https://scontent.cdninstagram.com/hphotos-xfa1/t51.2885-15/e15/11296835_270897479747269_1090122464_n.jpg
991672196140804001_46901704,2015-05-24 03:02:39,Ludwig,17,[Tag: ohrome],https://scontent.cdninstagram.com/hphotos-xaf1/t51.2885-15/e15/11264152_693361494109122_1422587454_n.jpg
991671129151967917_412191859,2015-05-24 03:00:32,Normal,10,"[Tag: doomwork, Tag: goanozoo, Tag: club, Tag: it, Tag: closingparty, Tag: goaclub, Tag: amazing, Tag: rome, Tag: night, Tag: onurözer]",https://scontent.cdninstagram.com/hphotos-xaf1/t51.2885-15/e15/11350665_1451494055162881_2021100498_n.jpg
991670842529119984_230200990,2015-05-24 02:59:58,Normal,34,"[Tag: fashion, Tag: love, Tag: instalike, Tag: night, Tag: fashionphotography, Tag: goodnight, Tag: buonanotte, Tag: follow, Tag: instagood, Tag: friends, Tag: photooftheday, Tag: boy, Tag: style, Tag: boanoite, Tag: iphoneonly, Tag: chaletnelbosco, Tag: disco, Tag: tagsforlikes, Tag: amazing, Tag: music, Tag: vscom, Tag: fashionstyle, Tag: smile, Tag: iphonesia, Tag: happy]",https://scontent.cdninstagram.com/hphotos-xfa1/t51.2885-15/e15/11374415_1623927144509176_1258706359_n.jpg
991670819707209163_186804400,2015-05-24 02:59:55,Mayfair,215,[Tag: stadlin],https://scontent.cdninstagram.com/hphotos-xfa1/t51.2885-15/e15/11357948_1437063453262325_513634642_n.jpg
991670324347820194_315845789,2015-05-24 02:58:56,Brannan,52,[Tag: black],https://scontent.cdninstagram.com/hphotos-xfa1/t51.2885-15/e15/11274335_470859946414160_2055472698_n.jpg
991668821809218918_186804400,2015-05-24 02:55:57,Willow,69,[Tag: stadlin],https://scontent.cdninstagram.com/hphotos-xfa1/t51.2885-15/e15/11281925_1431781340475746_781992363_n.jpg
991666184313237262_194724218,2015-05-24 02:50:43,Amaro,28,"[Tag: angeloazzurro, Tag: way🔵🈂➿🌀ⓜ️🛃💙🔹🔷]",https://scontent.cdninstagram.com/hphotos-xaf1/t51.2885-15/e15/11313694_1621262334757553_263926554_n.jpg
991663873041889740_1450054093,2015-05-24 02:46:07,Normal,1,"[Tag: ilariagraziano, Tag: love, Tag: fish, Tag: tbt, Tag: instagood, Tag: instamusic, Tag: francescoforni, Tag: follow, Tag: firstpost, Tag: instadaily, Tag: amazing]",https://scontent.cdninstagram.com/hphotos-xfa1/t51.2885-15/e15/11266244_1574961892756443_569278520_n.jpg
991663838823204850_1812576,2015-05-24 02:46:03,Normal,74,"[Tag: wanderlust, Tag: galingngfilipino, Tag: italy, Tag: vscocam, Tag: welltravelled, Tag: shotoniphone6, Tag: vscolovers, Tag: travel, Tag: sunsetlovers, Tag: rome, Tag: sunset, Tag: vscogrid, Tag: vsco]",https://scontent.cdninstagram.com/hphotos-xaf1/t51.2885-15/e15/11123922_365941780272134_375120417_n.jpg
991661855270213110_198558044,2015-05-24 02:42:06,Normal,63,"[Tag: hbday, Tag: loveher, Tag: love, Tag: picoftheday, Tag: picofthenight, Tag: instalook, Tag: girls, Tag: instasize, Tag: tagsforlikes, Tag: dinner, Tag: friends, Tag: saturday]",https://scontent.cdninstagram.com/hphotos-xaf1/t51.2885-15/e15/11358061_1397133237282014_2364975_n.jpg
991661853667063114_292127140,2015-05-24 02:42:06,Normal,26,"[Tag: week, Tag: testaccio, Tag: roma, Tag: thuglife, Tag: techno, Tag: amigos, Tag: friends, Tag: saturday, Tag: serata, Tag: ostienze, Tag: swag, Tag: top, Tag: rashmon, Tag: atutta, Tag: danceon, Tag: rome, Tag: bailando, Tag: night, Tag: style, Tag: mivida]",https://scontent.cdninstagram.com/hphotos-xaf1/t51.2885-15/e15/11380026_1631631523762145_770988025_n.jpg
991660852153724005_208234650,2015-05-24 02:40:07,Lark,7,"[Tag: italy, Tag: forum, Tag: contikikel, Tag: holidays, Tag: rome, Tag: eupanorama, Tag: takemeback, Tag: travelling, Tag: ruins, Tag: contiki]",https://scontent.cdninstagram.com/hphotos-xfa1/t51.2885-15/e15/11272796_1661454150736839_952688518_n.jpg
991660484111566294_145089288,2015-05-24 02:39:23,Normal,5,"[Tag: thinking, Tag: whatthefuck, Tag: problem, Tag: confused, Tag: numbers]",https://scontent.cdninstagram.com/hphotos-xfa1/t51.2885-15/e15/11312528_1641443276088165_1740777459_n.jpg
991660171038528539_209677532,2015-05-24 02:38:46,Normal,6,[Tag: monicaseighteen],https://scontent.cdninstagram.com/hphotos-xfa1/t51.2885-15/e15/11371163_704793282999161_385543208_n.jpg
991659490470354213_52422134,2015-05-24 02:37:25,Lo-fi,8,"[Tag: catholic, Tag: italy, Tag: pope, Tag: roma, Tag: religon, Tag: holyplace, Tag: tomb]",https://scontent.cdninstagram.com/hphotos-xfa1/t51.2885-15/e15/11312054_1433524516954427_775739114_n.jpg
991657233349920425_186804400,2015-05-24 02:32:55,Slumber,137,[Tag: stadlin],https://scontent.cdninstagram.com/hphotos-xaf1/t51.2885-15/e15/11377609_649270098542386_1837507543_n.jpg
991655409707074100_6123023,2015-05-24 02:29:18,Normal,25,[Tag: pieekridiconosi],https://scontent.cdninstagram.com/hphotos-xfa1/t51.2885-15/e15/11357531_560814620724672_996085970_n.jpg
991655012034997721_13506338,2015-05-24 02:28:31,Juno,3,"[Tag: mnrlight2015, Tag: felice, Tag: stremato, Tag: ancorainpista]",https://scontent.cdninstagram.com/hphotos-xfa1/t51.2885-15/e15/11379245_1638565526378518_1969244434_n.jpg
991654911777953368_187579852,2015-05-24 02:28:19,Normal,10,"[Tag: pompei, Tag: summer, Tag: sorrento, Tag: xylomusic, Tag: sun, Tag: lemoncello, Tag: history]",https://scontent.cdninstagram.com/hphotos-xaf1/t51.2885-15/e15/11374116_1573459552906047_564755473_n.jpg
991654754591731258_31664378,2015-05-24 02:28:00,Normal,27,"[Tag: crestanimancianaeuropa, Tag: comcoliseu, Tag: copocheio, Tag: semfiltro]",https://scontent.cdninstagram.com/hphotos-xaf1/t51.2885-15/e15/11333551_1452396918404047_142760964_n.jpg
991654608189302823_11710041,2015-05-24 02:27:42,Normal,25,"[Tag: coliseu, Tag: italy, Tag: roma, Tag: italia, Tag: sistersontheroad, Tag: tbt]",https://scontent.cdninstagram.com/hphotos-xfa1/t51.2885-15/e15/11273057_1140510555974670_1205736605_n.jpg
991653133289398739_12251927,2015-05-24 02:24:47,Normal,13,"[Tag: ëspanâ, Tag: chiaraècadutaperlascopadipotter, Tag: ilp, Tag: ericallaguida, Tag: rtl, Tag: repost, Tag: harrypotter]",https://scontent.cdninstagram.com/hphotos-xaf1/t51.2885-15/e15/11327145_580154818791640_842065049_n.jpg
991652857474571077_25719469,2015-05-24 02:24:14,Lark,8,"[Tag: me, Tag: armando, Tag: mybestfriend, Tag: mypei, Tag: ilovemypei]",https://scontent.cdninstagram.com/hphotos-xfa1/t51.2885-15/e15/11282240_1447249112257335_653361340_n.jpg
991652319099974198_464362395,2015-05-24 02:23:10,Normal,25,[Tag: mariale2015],https://scontent.cdninstagram.com/hphotos-xaf1/t51.2885-15/e15/11376153_388380128021064_1459009923_n.jpg
991651574663196384_185749202,2015-05-24 02:21:41,Normal,33,"[Tag: rns, Tag: prepotente, Tag: selfie, Tag: akab, Tag: bellimiei]",https://scontent.cdninstagram.com/hphotos-xfa1/t51.2885-15/e15/11282636_828595873876581_37199672_n.jpg
991651226591600448_27276190,2015-05-24 02:20:59,Normal,5,"[Tag: wheninrome, Tag: club, Tag: clubbing, Tag: rome, Tag: italy]",https://scontent.cdninstagram.com/hphotos-xaf1/t51.2885-15/e15/11380275_1446630348983583_26833335_n.jpg
990962023591290871_50716000,2015-05-23 03:31:40,Normal,26,"[Tag: crazy, Tag: after, Tag: red, Tag: drunk, Tag: club, Tag: indoor, Tag: vicious, Tag: neverstop, Tag: instamusic, Tag: rny, Tag: bar, Tag: pumpupyourattitude, Tag: best, Tag: drinks, Tag: sound, Tag: italy, Tag: cool, Tag: place, Tag: lights, Tag: amazing, Tag: rome, Tag: music, Tag: rocknyolk, Tag: goodbye, Tag: roma, Tag: party, Tag: electro, Tag: instasound, Tag: partyhard, Tag: clubbers]",https://scontent.cdninstagram.com/hphotos-xaf1/t51.2885-15/e15/11280420_1072291272785018_1597051137_n.jpg
990961347362746096_38258258,2015-05-23 03:30:19,Amaro,3,"[Tag: felice, Tag: roma, Tag: bimbo, Tag: erasmus]",https://scontent.cdninstagram.com/hphotos-xaf1/t51.2885-15/e15/11356951_1615280242052256_1618441444_n.jpg
990956952278279319_401169104,2015-05-23 03:21:35,Aden,26,"[Tag: primeiroturno, Tag: instalife, Tag: italy, Tag: photography, Tag: instagood, Tag: rome, Tag: fotografia, Tag: beautifulworld, Tag: voltaaomundo]",https://scontent.cdninstagram.com/hphotos-xaf1/l/t51.2885-15/e15/11355172_414741585379281_1682846569_n.jpg
990955820107871554_24502220,2015-05-23 03:19:21,Normal,39,"[Tag: instabike, Tag: bikesgram, Tag: statebicycleco, Tag: liveinlevis, Tag: bikesummit, Tag: bikeporn, Tag: makebikeportraits, Tag: commuter, Tag: cyvling, Tag: trackbike, Tag: mybicycleseries, Tag: bicichic, Tag: fromwhereibike, Tag: igersrome, Tag: forgottenbike, Tag: ihavethisthingwithbikes, Tag: rome, Tag: roma, Tag: pedalkraft, Tag: sttb]",https://scontent.cdninstagram.com/hphotos-xaf1/t51.2885-15/e15/11358921_970101779700395_500010224_n.jpg
990955407709153807_504174201,2015-05-23 03:18:31,Normal,33,[Tag: lesieintonati],https://scontent.cdninstagram.com/hphotos-xfa1/t51.2885-15/e15/11333345_1580620738855211_1037589940_n.jpg
990954959075856233_1421932098,2015-05-23 03:17:38,Normal,22,"[Tag: 바티칸시국, Tag: 천장화, Tag: 여행스타그램, Tag: 경복궁의, Tag: 이탈리아, Tag: 최후의심판, Tag: 시스티나성당, Tag: 미켈란젤로, Tag: 세계문화유산, Tag: 천지창조, Tag: 로마, Tag: 바티칸]",https://scontent.cdninstagram.com/hphotos-xaf1/t51.2885-15/e15/11374606_363719793833861_202518321_n.jpg
990954479250029515_28304589,2015-05-23 03:16:41,Juno,5,"[Tag: alba, Tag: dawn, Tag: breaking]",https://scontent.cdninstagram.com/hphotos-xaf1/t51.2885-15/e15/11363914_464298343744172_766609861_n.jpg
990953743490030269_177331093,2015-05-23 03:15:13,Lark,23,"[Tag: and, Tag: peace, Tag: love, Tag: situazione, Tag: hippie]",https://scontent.cdninstagram.com/hphotos-xaf1/t51.2885-15/e15/11265271_1586830808238292_720466952_n.jpg
990952878490474425_1269526236,2015-05-23 03:13:30,Ludwig,11,"[Tag: perfect, Tag: coffee, Tag: buenosdias, Tag: love, Tag: food, Tag: sweet, Tag: instafood, Tag: desayuno, Tag: perfection, Tag: asisi, Tag: cafe, Tag: inspiration]",https://scontent.cdninstagram.com/hphotos-xfa1/t51.2885-15/e15/11313410_731428730313254_1935121030_n.jpg
990950566430208597_1584055731,2015-05-23 03:08:54,Normal,19,"[Tag: beautiful, Tag: cute, Tag: fashion, Tag: love, Tag: summer, Tag: food, Tag: instalike, Tag: tbt, Tag: tagsforlikesapp, Tag: igers, Tag: follow, Tag: instadaily, Tag: instamood, Tag: friends, Tag: girl, Tag: me, Tag: swag, Tag: like4like, Tag: tflers, Tag: followme, Tag: instagood, Tag: tagsforlikes, Tag: amazing, Tag: bestoftheday, Tag: fun, Tag: smile, Tag: photooftheday, Tag: picoftheday, Tag: happy]",https://scontent.cdninstagram.com/hphotos-xaf1/t51.2885-15/e15/10891092_873593729374855_291936192_n.jpg
990950131800758087_1118346812,2015-05-23 03:08:02,Lark,7,"[Tag: mettiappostolocchi, Tag: nightend, Tag: aristocampo, Tag: frato, Tag: goodnight, Tag: gerard, Tag: semprescontrosi, Tag: diegogigi]",https://scontent.cdninstagram.com/hphotos-xfa1/t51.2885-15/e15/11357468_567801256694115_1485368039_n.jpg
990948748713313953_964567864,2015-05-23 03:05:18,Normal,55,"[Tag: beautiful, Tag: glamour, Tag: azzaro, Tag: nikkireed, Tag: amazing, Tag: elegance, Tag: iansomerhalder, Tag: somereed, Tag: couture, Tag: somerhalder, Tag: cannes, Tag: sexy, Tag: intense, Tag: repost]",https://scontent.cdninstagram.com/hphotos-xaf1/t51.2885-15/e15/11351794_968240773208642_985670882_n.jpg
990948595864671712_198558044,2015-05-23 03:04:59,Normal,90,"[Tag: dinuovonoi, Tag: tagsforshare, Tag: artcafè, Tag: love, Tag: picofthenight, Tag: instalook, Tag: unavitasuitacchi, Tag: instasize, Tag: tagsforlikes, Tag: basic, Tag: roma, Tag: night, Tag: flowersart, Tag: friends, Tag: picoftheday]",https://scontent.cdninstagram.com/hphotos-xaf1/t51.2885-15/e15/11246742_1447285355571151_944414614_n.jpg
990945574138801520_214994730,2015-05-23 02:58:59,X-Pro II,18,"[Tag: jacopinob, Tag: gilda, Tag: kaos, Tag: friday, Tag: night]",https://scontent.cdninstagram.com/hphotos-xaf1/t51.2885-15/e15/11325813_459139804245907_970668052_n.jpg
990945150798959756_18644388,2015-05-23 02:58:09,Brannan,7,"[Tag: mvp, Tag: ecf, Tag: whereamazinghappens, Tag: cavshawks, Tag: allincle, Tag: nbaplayoffs, Tag: ipromise, Tag: striveforgreatness, Tag: theland, Tag: nba, Tag: theking, Tag: cavs, Tag: weareallwitnesses]",https://scontent.cdninstagram.com/hphotos-xaf1/t51.2885-15/e15/11327184_1644605739095995_1317051082_n.jpg
990944824544881025_214995153,2015-05-23 02:57:30,Reyes,11,"[Tag: instapic, Tag: art, Tag: drow, Tag: creation, Tag: instacolor, Tag: tagsforlike, Tag: instagood, Tag: instable, Tag: street, Tag: follow4follow, Tag: love, Tag: ultimated, Tag: like4like, Tag: picoftheday]",https://scontent.cdninstagram.com/hphotos-xaf1/t51.2885-15/e15/11373802_835902689796185_409971336_n.jpg
990944433236538011_232358515,2015-05-23 02:56:43,Lark,19,"[Tag: eurotrip, Tag: ultimodia, Tag: viagemperfeita]",https://scontent.cdninstagram.com/hphotos-xaf1/t51.2885-15/e15/11333608_100340493638809_35260738_n.jpg
990944426541762090_964567864,2015-05-23 02:56:42,Normal,70,"[Tag: funny, Tag: selfie, Tag: nikkireed, Tag: iansomerhalder, Tag: amazing, Tag: somerhalder, Tag: somereed, Tag: lovely, Tag: friend]",https://scontent.cdninstagram.com/hphotos-xfa1/t51.2885-15/e15/11376158_1449236155390222_1342618064_n.jpg
990943919724370736_2118860069,2015-05-23 02:55:42,Ludwig,11,"[Tag: tradizione, Tag: italianstyle, Tag: instacake, Tag: instagram, Tag: instalove, Tag: tortedifede, Tag: isognisondesideri, Tag: pannaefragole, Tag: instapicture, Tag: instamoment, Tag: mypassion, Tag: instaday, Tag: machebonta, Tag: myjob]",https://scontent.cdninstagram.com/hphotos-xfa1/t51.2885-15/e15/11330531_496070730542638_1186630881_n.jpg
990941627977185835_226683725,2015-05-23 02:51:09,X-Pro II,11,"[Tag: love, Tag: instagram, Tag: instalike, Tag: like, Tag: girl, Tag: instacrazy, Tag: cool, Tag: flower, Tag: followme, Tag: thebest, Tag: top, Tag: peace, Tag: tag4like, Tag: fiori, Tag: party, Tag: picoftheday]",https://scontent.cdninstagram.com/hphotos-xfa1/t51.2885-15/e15/11352929_782237068541504_401370066_n.jpg
990938999053743695_388037940,2015-05-23 02:45:55,Normal,9,"[Tag: basilicasanpietro, Tag: rome, Tag: basiliquesaintpierre, Tag: roma]",https://scontent.cdninstagram.com/hphotos-xaf1/t51.2885-15/e15/11325055_674193776017846_1396779434_n.jpg
990938830240495617_305057061,2015-05-23 02:45:35,Normal,89,"[Tag: eurotrip, Tag: museoleonardodavinci, Tag: europa, Tag: memories, Tag: roma, Tag: viajaresvivir, Tag: piazzadelpopolo, Tag: italia, Tag: recuerdos, Tag: viajarmipasión, Tag: lifestyle, Tag: lastyear, Tag: triplover]",https://scontent.cdninstagram.com/hphotos-xaf1/t51.2885-15/e15/11333608_1596202107329872_72311509_n.jpg
990937493071837692_13727669,2015-05-23 02:42:56,Normal,288,"[Tag: maje, Tag: rome, Tag: spanishsteps, Tag: valentino]",https://scontent.cdninstagram.com/hphotos-xaf1/t51.2885-15/e15/11356747_892417864154327_1154450110_n.jpg
990936119145571959_505219520,2015-05-23 02:40:12,Normal,94,"[Tag: art, Tag: rom, Tag: italien, Tag: contemporary, Tag: gallerianazionaledartemoderna, Tag: modernism, Tag: italy, Tag: paintings, Tag: lazio, Tag: sculpture, Tag: arthistory, Tag: rome, Tag: italia, Tag: architecture, Tag: roma, Tag: latium]",https://scontent.cdninstagram.com/hphotos-xaf1/t51.2885-15/e15/11267836_1660212957540692_1091564336_n.jpg
990932314626631163_505219520,2015-05-23 02:32:38,Normal,66,"[Tag: rom, Tag: italien, Tag: trajanssäule, Tag: trajansforum, Tag: corinthian, Tag: italy, Tag: colonnatraiana, Tag: lazio, Tag: foroditraiani, Tag: arthistory, Tag: archäologie, Tag: rome, Tag: music, Tag: architecture, Tag: trajanscolumn, Tag: roma, Tag: italia, Tag: order, Tag: latium, Tag: archaeology, Tag: columns]",https://scontent.cdninstagram.com/hphotos-xfa1/t51.2885-15/e15/11375900_1435107733475125_397611953_n.jpg
990931635684380728_1795832691,2015-05-23 02:31:18,Normal,18,"[Tag: beautiful, Tag: cute, Tag: bf, Tag: love, Tag: boy, Tag: kisses, Tag: couple, Tag: instalove, Tag: forever, Tag: gf, Tag: kiss, Tag: girlfriend, Tag: lovehim, Tag: girl, Tag: boyfriend, Tag: me, Tag: tagsforlikes, Tag: loveher, Tag: bff, Tag: xoxoxo, Tag: together, Tag: instagood, Tag: romance, Tag: pretty, Tag: hugs, Tag: fun, Tag: smile, Tag: photooftheday, Tag: adorable, Tag: happy]",https://scontent.cdninstagram.com/hphotos-xaf1/t51.2885-15/e15/11376135_836249303125215_304568022_n.jpg
990929518741792185_383410872,2015-05-23 02:27:05,Normal,4,[Tag: ho],https://scontent.cdninstagram.com/hphotos-xaf1/t51.2885-15/e15/11282097_1650630331823707_1445209810_n.jpg
990929396958143936_285992984,2015-05-23 02:26:51,Lark,68,"[Tag: frogskins, Tag: 토요일, Tag: shopping, Tag: 오클리, Tag: instalike, Tag: oakley, Tag: daily, Tag: 이탈리아, Tag: gucci, Tag: 선글라스, Tag: 데이트, Tag: 프로그스킨, Tag: 뒹굴뒹굴]",https://scontent.cdninstagram.com/hphotos-xaf1/t51.2885-15/e15/11245897_914997685209178_897344340_n.jpg
990928986512929658_1567063947,2015-05-23 02:26:02,Normal,4,"[Tag: dragonfly, Tag: libellula]",https://scontent.cdninstagram.com/hphotos-xaf1/t51.2885-15/e15/11375847_618162664987806_472411536_n.jpg
990928939520533943_505219520,2015-05-23 02:25:56,Normal,73,"[Tag: rom, Tag: italien, Tag: trajansforum, Tag: italy, Tag: colonnatraiana, Tag: lazio, Tag: foroditraiani, Tag: arthistory, Tag: archäologie, Tag: rome, Tag: italia, Tag: architecture, Tag: trajanscolumn, Tag: roma, Tag: trajanssäule, Tag: latium, Tag: archaeology]",https://scontent.cdninstagram.com/hphotos-xaf1/t51.2885-15/e15/11325198_458191857691718_1393927980_n.jpg
990928213342454240_273728103,2015-05-23 02:24:30,Normal,14,"[Tag: beautiful, Tag: fashion, Tag: love, Tag: beauty, Tag: circolodegliilluminati, Tag: roma, Tag: fiesta, Tag: presabene, Tag: boys, Tag: good, Tag: thisisagm, Tag: dj, Tag: friends, Tag: happiness, Tag: movida, Tag: smash, Tag: agm, Tag: serate, Tag: anygivenmonday, Tag: top, Tag: girls, Tag: colours, Tag: greatnight, Tag: goout, Tag: night, Tag: fun, Tag: closingnight, Tag: happy, Tag: mokai, Tag: goodcompany]",https://scontent.cdninstagram.com/hphotos-xfa1/t51.2885-15/e15/11282168_982602555097224_1001645604_n.jpg
990927687400390895_1534071631,2015-05-23 02:23:27,Normal,16,"[Tag: europe, Tag: ceiling, Tag: italy, Tag: interiors, Tag: vacation, Tag: details, Tag: firstpost, Tag: holiday, Tag: tb, Tag: architecture]",https://scontent.cdninstagram.com/hphotos-xaf1/t51.2885-15/e15/11246286_755252327926214_1965224280_n.jpg
990927445936943586_526944203,2015-05-23 02:22:58,Inkwell,31,"[Tag: smash, Tag: nightout, Tag: music, Tag: fiesta, Tag: alwaysthere, Tag: viaipensieri, Tag: расвлечение, Tag: rhome, Tag: circolodegliilluminati, Tag: amor, Tag: todoslosviernes, Tag: erasmuslife, Tag: friends, Tag: clubbingnights, Tag: любовь]",https://scontent.cdninstagram.com/hphotos-xaf1/t51.2885-15/e15/11330512_768979089886819_1059248839_n.jpg
990923683650516134_297450172,2015-05-23 02:15:30,Normal,9,[Tag: buonanotte],https://scontent.cdninstagram.com/hphotos-xfa1/t51.2885-15/e15/11251742_566519486821552_421674270_n.jpg
990923123367587531_34690746,2015-05-23 02:14:23,Normal,18,"[Tag: naturelover, Tag: nature, Tag: instalike, Tag: monkeydluffy, Tag: thailandinstagram, Tag: monkeyisland, Tag: insta, Tag: thailand, Tag: instagood, Tag: thailandsuperquality, Tag: thailandia, Tag: animales, Tag: monkey, Tag: khophiphi, Tag: thailandtrip, Tag: island, Tag: thailand_ig, Tag: monkeys, Tag: phiphiisland, Tag: animal, Tag: animallovers, Tag: phiphi, Tag: monkeyseemonkeydo]",https://scontent.cdninstagram.com/hphotos-xaf1/t51.2885-15/e15/11376403_809785995741689_84426698_n.jpg
990922578647141604_625092898,2015-05-23 02:13:18,Valencia,5,"[Tag: ローマ, Tag: コロッセオ, Tag: イタリア]",https://scontent.cdninstagram.com/hphotos-xaf1/t51.2885-15/e15/11327154_878292892209770_1621959705_n.jpg
990922032347808402_289618263,2015-05-23 02:12:13,Inkwell,12,"[Tag: night, Tag: random, Tag: vatican, Tag: selfie, Tag: friday, Tag: pictoftheday, Tag: rome]",https://scontent.cdninstagram.com/hphotos-xaf1/t51.2885-15/e15/11355726_1443454575969992_88833366_n.jpg
990921680528085643_417356795,2015-05-23 02:11:31,Amaro,8,"[Tag: gucci, Tag: trendalert]",https://scontent.cdninstagram.com/hphotos-xfa1/t51.2885-15/e15/11333417_458185084357695_956243793_n.jpg
990921654994421656_263753024,2015-05-23 02:11:28,Normal,16,"[Tag: amo, Tag: italia, Tag: discotecaroma, Tag: bailando, Tag: roma, Tag: lacrandoasferias, Tag: musicalatina, Tag: caruso]",https://scontent.cdninstagram.com/hphotos-xaf1/t51.2885-15/e15/11282710_984040384947927_1321790893_n.jpg
990921129615440367_180532573,2015-05-23 02:10:25,Perpetua,19,"[Tag: italyintwoweeks, Tag: rome, Tag: italy, Tag: colosseum, Tag: history]",https://scontent.cdninstagram.com/hphotos-xfa1/t51.2885-15/e15/11355002_692582717542054_536109434_n.jpg
990920974577322637_530802705,2015-05-23 02:10:07,Hefe,19,"[Tag: yerotv, Tag: warrior, Tag: italy, Tag: iphone6, Tag: photo, Tag: photography, Tag: rome, Tag: bloodwarrior, Tag: colosseum, Tag: gladiator]",https://scontent.cdninstagram.com/hphotos-xfa1/t51.2885-15/e15/11334584_1472368603054080_1640059635_n.jpg
990920784767877085_228262302,2015-05-23 02:09:44,Reyes,17,"[Tag: kiss, Tag: tagslike, Tag: photo, Tag: likealwayslike, Tag: moment, Tag: amazing, Tag: photooftheday, Tag: cafè, Tag: squaready, Tag: like4like, Tag: tweegram, Tag: instagramhub, Tag: friend, Tag: caruso]",https://scontent.cdninstagram.com/hphotos-xaf1/t51.2885-15/e15/11282176_1594911614128093_397492982_n.jpg
990920388063412177_1438158470,2015-05-23 02:08:57,Normal,21,"[Tag: beautiful, Tag: cute, Tag: likesforlikes, Tag: photo, Tag: selfie, Tag: likes, Tag: follow4follow, Tag: friends, Tag: like, Tag: swag, Tag: retrica, Tag: monopoly, Tag: followforfollow, Tag: likes4likes, Tag: like4likeforever, Tag: like4like, Tag: followme]",https://scontent.cdninstagram.com/hphotos-xaf1/l/t51.2885-15/e15/11248285_347169592144859_312435516_n.jpg
990919810760353567_943164392,2015-05-23 02:07:48,Normal,18,"[Tag: water, Tag: dropthemase, Tag: fire, Tag: earth, Tag: droptheproject, Tag: air]",https://scontent.cdninstagram.com/hphotos-xaf1/t51.2885-15/e15/11326452_104547803214764_594943619_n.jpg
990919013490402532_505219520,2015-05-23 02:06:13,Normal,63,"[Tag: trajansforum, Tag: italy, Tag: rom, Tag: lazio, Tag: italien, Tag: foroditraiani, Tag: arthistory, Tag: archäologie, Tag: rome, Tag: italia, Tag: architecture, Tag: roma, Tag: latium, Tag: archaeology]",https://scontent.cdninstagram.com/hphotos-xaf1/t51.2885-15/e15/11374614_378015939057991_754731556_n.jpg
990918789830677916_757261924,2015-05-23 02:05:46,Juno,3,"[Tag: fabriziomoro, Tag: ognunohaquelchesimerita, Tag: oggirespiro]",https://scontent.cdninstagram.com/hphotos-xfa1/t51.2885-15/e15/11335838_939778996089692_1148175997_n.jpg
990918160821994530_599959560,2015-05-23 02:04:31,Rise,13,"[Tag: tivogliobene, Tag: flowerpowerpacha, Tag: cuori, Tag: party, Tag: sambuca, Tag: sorella, Tag: molinari]",https://scontent.cdninstagram.com/hphotos-xaf1/t51.2885-15/e15/11272003_1611420412450126_1947377955_n.jpg
990917589497662244_969563185,2015-05-23 02:03:23,Normal,13,[Tag: mettiamoromako],https://scontent.cdninstagram.com/hphotos-xaf1/t51.2885-15/e15/11266036_977189728980896_1907864757_n.jpg
990917059921813866_42685231,2015-05-23 02:02:20,X-Pro II,97,"[Tag: topdj, Tag: djdamianito, Tag: damianito]",https://scontent.cdninstagram.com/hphotos-xfa1/t51.2885-15/e15/11312333_560378084101325_1989807983_n.jpg
990916709967485707_55581813,2015-05-23 02:01:38,Normal,8,"[Tag: magictrio, Tag: buonanotte, Tag: bellibelli, Tag: disagio, Tag: elprat, Tag: goodnight, Tag: anchemeno, Tag: buenasnoches, Tag: hola, Tag: buenasnoche, Tag: holabarcelona, Tag: barça, Tag: barcelona, Tag: delay, Tag: airport, Tag: spain, Tag: karma, Tag: triptobarcelona, Tag: ritardo, Tag: solocosebelle, Tag: ciaone]",https://scontent.cdninstagram.com/hphotos-xaf1/t51.2885-15/e15/11313280_1049338745094314_1720151607_n.jpg
990916703810789765_1513372343,2015-05-23 02:01:37,Amaro,11,"[Tag: talentoincompreso, Tag: ridichetipassa, Tag: bomberscar, Tag: giorgiatomtom, Tag: cantante, Tag: strettedimanodecise]",https://scontent.cdninstagram.com/hphotos-xfa1/t51.2885-15/e15/11363762_1672252736331334_1601101249_n.jpg
990916549912627118_227841600,2015-05-23 02:01:19,Willow,20,[Tag: domperignon],https://scontent.cdninstagram.com/hphotos-xaf1/t51.2885-15/e15/11325373_842311335861177_1424410609_n.jpg
