ID,Created At,Filter,Number of Likes,HashTags,url
992413329206952891_3523983,2015-05-25 03:35:09,Reyes,1,"[Tag: pontemilvio, Tag: rome, Tag: morning]",https://scontent.cdninstagram.com/hphotos-xaf1/t51.2885-15/e15/11326666_1430792963895748_809638147_n.jpg
992412976151627726_206175096,2015-05-25 03:34:27,Normal,1,"[Tag: testaccio, Tag: romaphotomarathon, Tag: photomarathon2015, Tag: romaphotomarathon2015, Tag: italiaphotomarathon, Tag: lungoteveretestaccio, Tag: roma, Tag: photomarathon]",https://scontent.cdninstagram.com/hphotos-xfa1/t51.2885-15/e15/11355257_1437542243230884_1202510235_n.jpg
992412060162223844_14209634,2015-05-25 03:32:38,Ludwig,2,"[Tag: love, Tag: money, Tag: mangiare, Tag: bianca, Tag: bene, Tag: jamon, Tag: pasta, Tag: pomodoro, Tag: voglie, Tag: eat, Tag: napoli, Tag: calzone, Tag: mozzarella, Tag: napoletano, Tag: sano, Tag: pizza]",https://scontent.cdninstagram.com/hphotos-xfa1/t51.2885-15/e15/11296889_496518707181509_1667727712_n.jpg
992410971194576738_1191324146,2015-05-25 03:30:28,Normal,7,[Tag: travel],https://scontent.cdninstagram.com/hphotos-xaf1/t51.2885-15/e15/11335777_460724510760481_1436100261_n.jpg
992410947366782887_206175096,2015-05-25 03:30:25,Normal,1,"[Tag: romaphotomarathon, Tag: photomarathon2015, Tag: romaphotomarathon2015, Tag: italiaphotomarathon, Tag: roma, Tag: lontanodacasa, Tag: stazionetermini, Tag: photomarathon]",https://scontent.cdninstagram.com/hphotos-xfa1/t51.2885-15/e15/11355782_421464581368358_57975864_n.jpg
992410906397348591_220630611,2015-05-25 03:30:20,Normal,0,[Tag: chrislyfe],https://scontent.cdninstagram.com/hphotos-xfa1/t51.2885-15/e15/11352158_1407216286270626_337008498_n.jpg
992408077959530335_206175096,2015-05-25 03:24:43,Normal,1,"[Tag: romaphotomarathon, Tag: photomarathon2015, Tag: romaphotomarathon2015, Tag: italiaphotomarathon, Tag: piramide, Tag: roma, Tag: stazionepiramide, Tag: photomarathon]",https://scontent.cdninstagram.com/hphotos-xaf1/t51.2885-15/e15/11356360_679032638891128_1257694318_n.jpg
992406699140810558_206175096,2015-05-25 03:21:59,Normal,1,"[Tag: villaborghese, Tag: romaphotomarathon, Tag: photomarathon2015, Tag: romaphotomarathon2015, Tag: italiaphotomarathon, Tag: roma, Tag: amore, Tag: photomarathon]",https://scontent.cdninstagram.com/hphotos-xfa1/t51.2885-15/e15/11379773_1587344611546097_428099104_n.jpg
992404501258405640_206175096,2015-05-25 03:17:37,Normal,1,"[Tag: italiaphotomarathon, Tag: stazionestiense, Tag: romaphotomarathon, Tag: roma, Tag: photomarathon]",https://scontent.cdninstagram.com/hphotos-xaf1/t51.2885-15/e15/11374440_1602743160011043_135913795_n.jpg
992403152512845555_206175096,2015-05-25 03:14:56,Normal,1,"[Tag: italiaphotomarathon, Tag: romaphotomarathon, Tag: photomarathon, Tag: piazzadellarepubblica, Tag: roma]",https://scontent.cdninstagram.com/hphotos-xaf1/t51.2885-15/e15/11374576_1581249678804476_767970421_n.jpg
992401518915323603_206175096,2015-05-25 03:11:41,Normal,1,"[Tag: acqua, Tag: roma, Tag: romaphotomarathon, Tag: photomarathon, Tag: piazzadellarepubblica, Tag: italiaphotomarathon]",https://scontent.cdninstagram.com/hphotos-xaf1/t51.2885-15/e15/11259366_1450589118586563_1721117403_n.jpg
992399431250839204_206175096,2015-05-25 03:07:32,Normal,1,"[Tag: italiaphotomarathon, Tag: romaphotomarathon, Tag: roma, Tag: stazionetermini, Tag: photomarathon]",https://scontent.cdninstagram.com/hphotos-xaf1/t51.2885-15/e15/11350930_1590119131242155_1611135832_n.jpg
992399380300465289_11742080,2015-05-25 03:07:26,Lo-fi,1,"[Tag: rome, Tag: frenchalps, Tag: nature, Tag: francois, Tag: notinla, Tag: snow, Tag: france]",https://scontent.cdninstagram.com/hphotos-xfa1/t51.2885-15/e15/11283323_706973572758853_515268415_n.jpg
992398575170100506_1519681926,2015-05-25 03:05:50,Normal,3,[Tag: конецгода],https://scontent.cdninstagram.com/hphotos-xaf1/t51.2885-15/e15/11242132_1608418466097071_1461027547_n.jpg
992398208230145858_236524782,2015-05-25 03:05:07,Normal,3,"[Tag: stpeters, Tag: rome, Tag: italy]",https://scontent.cdninstagram.com/hphotos-xaf1/t51.2885-15/e15/11258460_1595806817364672_194590413_n.jpg
992393707066013586_477645044,2015-05-25 02:56:10,Crema,17,"[Tag: viajar, Tag: trip]",https://scontent.cdninstagram.com/hphotos-xpf1/t51.2885-15/e15/11123951_1636614069890560_2116494598_n.jpg
992392420758836310_16266972,2015-05-25 02:53:37,Willow,2,"[Tag: rome, Tag: senzasosta, Tag: ciaomammaguardacomemidiverto, Tag: party, Tag: ciaomammaguardacomestudio, Tag: gildaclub]",https://scontent.cdninstagram.com/hphotos-xaf1/t51.2885-15/e15/11313333_415177682020394_1357583302_n.jpg
992392197613476582_41381973,2015-05-25 02:53:10,Normal,1,[Tag: squaready],https://scontent.cdninstagram.com/hphotos-xfa1/t51.2885-15/e15/11378243_1517511835138023_1046580588_n.jpg
992390727063420660_1505360110,2015-05-25 02:50:15,Normal,10,"[Tag: palmadoro, Tag: picoftheday, Tag: loveit, Tag: lovecinema, Tag: nokiaphoto, Tag: famous, Tag: vip, Tag: redcarpet, Tag: follow4follow, Tag: vsco, Tag: happiness, Tag: cinemapassion, Tag: festival, Tag: light, Tag: sophiemarceau, Tag: elegance, Tag: france, Tag: amazing, Tag: pictureoftheday, Tag: cannes, Tag: giuria, Tag: sophie, Tag: pass, Tag: followme]",https://scontent.cdninstagram.com/hphotos-xaf1/t51.2885-15/e15/11272996_408800812638712_644006915_n.jpg
992389389543868570_38267113,2015-05-25 02:47:35,Normal,12,"[Tag: europe, Tag: italy, Tag: igsg, Tag: zqfynhoneymoon, Tag: memories, Tag: happymoments, Tag: igrome, Tag: rome, Tag: zhiqiangyingxuanlovestory, Tag: sgig, Tag: colosseum, Tag: instadaily, Tag: addictedtosnapchat]",https://scontent.cdninstagram.com/hphotos-xaf1/t51.2885-15/e15/11375256_1111579788868719_1568751289_n.jpg
992388314197769925_1505360110,2015-05-25 02:45:27,Normal,10,"[Tag: sorrentinosfilm, Tag: cinema, Tag: janefonda, Tag: redcatpet, Tag: follow4follow, Tag: michealcaine, Tag: pass, Tag: vsco, Tag: film, Tag: festivaldecannes, Tag: nokia, Tag: italy, Tag: cinemapassion, Tag: festival, Tag: france, Tag: youth, Tag: cast, Tag: live, Tag: instagood, Tag: sorrentino, Tag: cannes, Tag: loveit, Tag: happiness, Tag: vscocam]",https://scontent.cdninstagram.com/hphotos-xaf1/t51.2885-15/e15/11372289_532362456902931_1270674249_n.jpg
992387407968929455_358555960,2015-05-25 02:43:39,Normal,8,[Tag: itscrazypnt],https://scontent.cdninstagram.com/hphotos-xaf1/t51.2885-15/e15/11371975_1591222764481679_1461069826_n.jpg
992379276390683570_221523699,2015-05-25 02:27:30,Slumber,67,"[Tag: beşiktaş, Tag: galatasaray]",https://scontent.cdninstagram.com/hphotos-xaf1/t51.2885-15/e15/11355820_1579057379022812_1752827514_n.jpg
992378796906238889_221523699,2015-05-25 02:26:32,Slumber,33,"[Tag: beşiktaş, Tag: galatasaray]",https://scontent.cdninstagram.com/hphotos-xfa1/t51.2885-15/e15/11375141_423716947802797_1389638371_n.jpg
992378317035918240_221523699,2015-05-25 02:25:35,Aden,48,"[Tag: beşiktaş, Tag: galatasaray]",https://scontent.cdninstagram.com/hphotos-xfa1/t51.2885-15/e15/11374478_1638818786339745_2107387938_n.jpg
992377656902800278_221523699,2015-05-25 02:24:17,Reyes,49,"[Tag: beşiktaş, Tag: galatasaray]",https://scontent.cdninstagram.com/hphotos-xaf1/t51.2885-15/e15/11378782_1418200138503217_19084417_n.jpg
992377458210722089_7684179,2015-05-25 02:23:53,Amaro,15,"[Tag: wanderlust, Tag: colosseum, Tag: striking, Tag: colosseumatnight, Tag: roma, Tag: nightviews]",https://scontent.cdninstagram.com/hphotos-xaf1/t51.2885-15/e15/11378091_1018967141447015_1270991560_n.jpg
992374259539125669_194621160,2015-05-25 02:17:32,Normal,63,"[Tag: europa2015, Tag: colisseo, Tag: feliz, Tag: roma]",https://scontent.cdninstagram.com/hphotos-xfa1/t51.2885-15/e15/11325446_406848352853062_642960303_n.jpg
992372593915805620_1743573022,2015-05-25 02:14:13,Lo-fi,8,"[Tag: play, Tag: ball, Tag: crowd, Tag: win, Tag: football, Tag: player, Tag: game, Tag: pass, Tag: active, Tag: winning, Tag: sport, Tag: throw, Tag: basketball, Tag: goal, Tag: fit, Tag: grass, Tag: sports, Tag: tagsforlikes, Tag: field, Tag: fans, Tag: score, Tag: games, Tag: futball, Tag: action, Tag: gametime, Tag: fun, Tag: green, Tag: soccer, Tag: playing, Tag: kick]",https://scontent.cdninstagram.com/hphotos-xfa1/l/t51.2885-15/e15/11330564_959609677402809_1176012252_n.jpg
992371874993415534_194621160,2015-05-25 02:12:47,Hudson,51,"[Tag: europa2015, Tag: roma]",https://scontent.cdninstagram.com/hphotos-xfa1/t51.2885-15/e15/11349182_869268733166170_763423636_n.jpg
992369226501898949_401627863,2015-05-25 02:07:32,Ludwig,29,[Tag: looslieuropeadventure],https://scontent.cdninstagram.com/hphotos-xfa1/t51.2885-15/e15/11372495_1440354612932949_45985184_n.jpg
992366703249408493_278826743,2015-05-25 02:02:31,Normal,24,"[Tag: passionfortravel, Tag: bellaitalia, Tag: tripaddicts, Tag: travelphotos, Tag: backpackers, Tag: roma, Tag: discover, Tag: travelpics, Tag: passionpassport, Tag: traveltips, Tag: instatravel, Tag: worldplaces, Tag: travelingram, Tag: travelmemories, Tag: wanderlust, Tag: italy, Tag: beautifuldestinations, Tag: travelandlife, Tag: travel, Tag: traveller, Tag: instatrip, Tag: postcard, Tag: rome, Tag: italia, Tag: travelgram, Tag: travelphotography, Tag: trippics, Tag: cntraveler, Tag: tlpicks, Tag: italylovers]",https://scontent.cdninstagram.com/hphotos-xaf1/t51.2885-15/e15/11274285_862926813778869_347201948_n.jpg
992365575420476349_267619317,2015-05-25 02:00:16,Willow,0,"[Tag: thinkingaboutus, Tag: grazie, Tag: larosapiùbella, Tag: goodnight]",https://scontent.cdninstagram.com/hphotos-xaf1/t51.2885-15/e15/11311179_1626979314184144_1908614103_n.jpg
992363882228864438_215567932,2015-05-25 01:56:55,Ludwig,61,"[Tag: ironman, Tag: vidal, Tag: theepioneer]",https://scontent.cdninstagram.com/hphotos-xfa1/t51.2885-15/e15/11313503_1436521029985187_1140604113_n.jpg
992363423096601469_267619317,2015-05-25 01:56:00,Reyes,2,[Tag: hola],https://scontent.cdninstagram.com/hphotos-xaf1/t51.2885-15/e15/11327175_1451104368536268_1610551481_n.jpg
992357668451769976_1127488318,2015-05-25 01:44:34,Normal,14,"[Tag: troppobuono, Tag: loveit, Tag: sushi]",https://scontent.cdninstagram.com/hphotos-xfa1/t51.2885-15/e15/11357669_517818655035558_1865047371_n.jpg
992355644399089497_43089284,2015-05-25 01:40:33,Ludwig,10,"[Tag: rome, Tag: honeymoonsf2]",https://scontent.cdninstagram.com/hphotos-xaf1/t51.2885-15/e15/11282767_853473188056244_297622436_n.jpg
992355310956889021_220980943,2015-05-25 01:39:53,Normal,18,[Tag: namethatmovie],https://scontent.cdninstagram.com/hphotos-xfa1/t51.2885-15/e15/11271041_1576628415932414_1759200709_n.jpg
992354483055032124_43089284,2015-05-25 01:38:14,Brannan,6,"[Tag: rome, Tag: honeymoonsf2]",https://scontent.cdninstagram.com/hphotos-xaf1/t51.2885-15/e15/11326527_1594690014139768_740300775_n.jpg
992350309846917625_500387855,2015-05-25 01:29:57,Normal,11,"[Tag: beautiful, Tag: cute, Tag: picstitch, Tag: fashion, Tag: love, Tag: summer, Tag: food, Tag: tbt, Tag: igers, Tag: jj, Tag: follow, Tag: girl, Tag: instamood, Tag: instagramhub, Tag: me, Tag: happy, Tag: webstagram, Tag: tflers, Tag: instadaily, Tag: sun, Tag: iphoneonly, Tag: sky, Tag: iphonesia, Tag: instagood, Tag: tagsforlikes, Tag: bestoftheday, Tag: nofilter, Tag: tweegram, Tag: picoftheday, Tag: photooftheday]",https://scontent.cdninstagram.com/hphotos-xfa1/t51.2885-15/e15/11296859_1639816109572923_2066267010_n.jpg
992349773738201588_1722651715,2015-05-25 01:28:53,Normal,17,"[Tag: beautiful, Tag: exploring, Tag: 10minutewalkfromlittleitaly, Tag: littleitalytours, Tag: city, Tag: pacific, Tag: coast, Tag: downtown, Tag: coronadobridge, Tag: california, Tag: traveling, Tag: bay, Tag: lovingsandiego, Tag: littleitaly, Tag: sandiego, Tag: visiting, Tag: west, Tag: ocean, Tag: cali, Tag: sunset, Tag: littleitalysd, Tag: seaportvillage, Tag: sandiegobay, Tag: socharacteristic, Tag: sd]",https://scontent.cdninstagram.com/hphotos-xfa1/t51.2885-15/e15/11243753_1576934122586276_370925924_n.jpg
992349238865357914_38258258,2015-05-25 01:27:49,Crema,1,"[Tag: flowboat, Tag: ladycoco, Tag: bds]",https://scontent.cdninstagram.com/hphotos-xaf1/t51.2885-15/e15/11350882_1653376678215093_2097205474_n.jpg
992348911131822876_29924225,2015-05-25 01:27:10,Normal,22,"[Tag: jornaloglobo, Tag: tourist, Tag: italytravel, Tag: instaitalia, Tag: italy, Tag: travel, Tag: iphoneonly, Tag: achadosdasemana, Tag: amazing, Tag: rome, Tag: italia, Tag: architecture, Tag: boaviagem, Tag: roma, Tag: bestoftheday, Tag: picoftheday, Tag: photooftheday]",https://scontent.cdninstagram.com/hphotos-xaf1/t51.2885-15/e15/11377578_1615553818662826_352191597_n.jpg
992348628165126859_295187105,2015-05-25 01:26:36,Mayfair,0,"[Tag: nottedincubiedarsura, Tag: lavendettadelprosciutto, Tag: dardabereagliassettati]",https://scontent.cdninstagram.com/hphotos-xaf1/t51.2885-15/e15/11375842_848528401894509_446310016_n.jpg
992345893242566894_207435669,2015-05-25 01:21:10,Rise,2,[Tag: interno7],https://scontent.cdninstagram.com/hphotos-xfa1/t51.2885-15/e15/11378798_718859801558725_1784088510_n.jpg
992344984673603822_2078516811,2015-05-25 01:19:22,Normal,1,"[Tag: viajaresvivir, Tag: around, Tag: places, Tag: lampedusa, Tag: goodlife, Tag: mundo, Tag: gaëlletrip, Tag: sitios, Tag: belleza, Tag: followme]",https://scontent.cdninstagram.com/hphotos-xfa1/t51.2885-15/e15/11356598_103385939998979_1424584140_n.jpg
992344897240403106_208428042,2015-05-25 01:19:11,Normal,0,"[Tag: menefrego, Tag: anoi, Tag: anchesetuttinoino]",https://scontent.cdninstagram.com/hphotos-xfa1/t51.2885-15/e15/11375285_1616265795297512_1125858682_n.jpg
992344538369046083_1598524684,2015-05-25 01:18:29,Normal,4,"[Tag: me, Tag: selfie, Tag: bingotime]",https://scontent.cdninstagram.com/hphotos-xfa1/t51.2885-15/e15/11264756_1610842592496808_672060738_n.jpg
992343134003576984_1184541327,2015-05-25 01:15:41,Normal,10,"[Tag: rome, Tag: italy, Tag: seetheworld, Tag: sevenwondersoftheworld, Tag: travel, Tag: colosseum]",https://scontent.cdninstagram.com/hphotos-xaf1/t51.2885-15/e15/11328342_786199921477303_268896243_n.jpg
992342989370810941_198964855,2015-05-25 01:15:24,Brannan,5,"[Tag: serateromane, Tag: nonescludoilritorno, Tag: beauty, Tag: summeriscoming, Tag: sweet, Tag: community, Tag: chicas, Tag: tagsgorlikes, Tag: dreams, Tag: bestfriends, Tag: bestmoments, Tag: girls, Tag: marmo, Tag: amazing, Tag: happiness, Tag: night, Tag: friendship]",https://scontent.cdninstagram.com/hphotos-xaf1/t51.2885-15/e15/11254698_1601809713431121_1295905815_n.jpg
992342813285138782_19939463,2015-05-25 01:15:03,Normal,335,"[Tag: europe, Tag: europa, Tag: fashion, Tag: igthai, Tag: asiangirl, Tag: streetfashion, Tag: streetstyle, Tag: lookbook, Tag: outfit, Tag: outfitpost, Tag: ootd, Tag: igfashion, Tag: girl, Tag: thaistyle, Tag: thai, Tag: kawaii, Tag: style, Tag: streetphotography, Tag: italy, Tag: look, Tag: thaigirl, Tag: travel, Tag: streetsnap, Tag: rome, Tag: italia, Tag: roma, Tag: snap, Tag: hat, Tag: asian, Tag: instafashion]",https://scontent.cdninstagram.com/hphotos-xaf1/t51.2885-15/e15/11253253_1437039556601822_726266737_n.jpg
992341330077799324_221523699,2015-05-25 01:12:06,Slumber,84,"[Tag: asroma, Tag: totti]",https://scontent.cdninstagram.com/hphotos-xfa1/t51.2885-15/e15/11244797_1416651801991596_1620859152_n.jpg
992341246886213400_8211980,2015-05-25 01:11:56,Normal,24,"[Tag: vscotravel, Tag: vscocam, Tag: vsco, Tag: vscogood, Tag: iceland, Tag: snow, Tag: alwayswandering, Tag: ice, Tag: lovemyjob, Tag: videomaker, Tag: vscogrid, Tag: landscape, Tag: traveling]",https://scontent.cdninstagram.com/hphotos-xfa1/t51.2885-15/e15/11311595_360003230865268_1664277509_n.jpg
992341009222218342_1108623979,2015-05-25 01:11:28,Normal,4,"[Tag: carrera, Tag: estate, Tag: haircut, Tag: sundaynight, Tag: fighetto, Tag: italy, Tag: parevero, Tag: rec23, Tag: prelerciù, Tag: ahno, Tag: roma, Tag: filter, Tag: sunday, Tag: rome, Tag: sorridosempreciao, Tag: night, Tag: new, Tag: timetogo, Tag: photooftheday, Tag: picoftheday, Tag: glasses]",https://scontent.cdninstagram.com/hphotos-xfa1/t51.2885-15/e15/11373728_481950918621358_368781560_n.jpg
992340593479499402_211280750,2015-05-25 01:10:38,Normal,48,[Tag: colosseum],https://scontent.cdninstagram.com/hphotos-xaf1/t51.2885-15/e15/11376469_822660374485784_89528814_n.jpg
991688892777546142_253073375,2015-05-24 03:35:50,Inkwell,14,"[Tag: lamore, Tag: festone, Tag: life, Tag: vipintrip]",https://scontent.cdninstagram.com/hphotos-xfa1/t51.2885-15/e15/11356025_920768821314736_309177311_n.jpg
991688010993288307_186804400,2015-05-24 03:34:04,Slumber,43,"[Tag: stadlin, Tag: camouflage]",https://scontent.cdninstagram.com/hphotos-xaf1/t51.2885-15/e15/11325886_1436957349941974_1106186000_n.jpg
991687825746041489_4952821,2015-05-24 03:33:42,Valencia,21,"[Tag: rome, Tag: italy, Tag: vacationover]",https://scontent.cdninstagram.com/hphotos-xaf1/l/t51.2885-15/e15/11373699_435025816658408_956916951_n.jpg
991687288582898280_1112869159,2015-05-24 03:32:38,Lark,8,"[Tag: topdigamma, Tag: classy, Tag: menstyle, Tag: madeinitaly, Tag: igers, Tag: dawn, Tag: quality, Tag: italy, Tag: 6am, Tag: igersitalia, Tag: sunday, Tag: clubbing, Tag: rome, Tag: nightlife, Tag: roma, Tag: piazzanavona]",https://scontent.cdninstagram.com/hphotos-xaf1/t51.2885-15/e15/11363787_894168997322318_1982185027_n.jpg
991686973481566966_710104111,2015-05-24 03:32:01,X-Pro II,8,"[Tag: myfriends, Tag: art, Tag: saturday]",https://scontent.cdninstagram.com/hphotos-xaf1/t51.2885-15/e15/11372479_1452155375078750_1404278813_n.jpg
991686754077641654_29924225,2015-05-24 03:31:35,Normal,19,"[Tag: jornaloglobo, Tag: tourist, Tag: italytravel, Tag: instaitalia, Tag: italy, Tag: travel, Tag: iphoneonly, Tag: achadosdasemana, Tag: amazing, Tag: rome, Tag: italia, Tag: boaviagem, Tag: roma, Tag: bestoftheday, Tag: picoftheday, Tag: photooftheday]",https://scontent.cdninstagram.com/hphotos-xfa1/t51.2885-15/e15/11326547_904213846292078_1969908954_n.jpg
991686674886875168_41381973,2015-05-24 03:31:25,Juno,8,"[Tag: saturday, Tag: night]",https://scontent.cdninstagram.com/hphotos-xfa1/t51.2885-15/e15/11376341_909720585767547_885563339_n.jpg
991686340074873416_315539423,2015-05-24 03:30:45,Rise,72,"[Tag: enjoy, Tag: saturdaynight]",https://scontent.cdninstagram.com/hphotos-xaf1/t51.2885-15/e15/11325411_1646536922226399_672031139_n.jpg
991686281044773752_1180174945,2015-05-24 03:30:38,Crema,7,[Tag: colosseo],https://scontent.cdninstagram.com/hphotos-xfa1/t51.2885-15/e15/11363786_844212602315485_358776936_n.jpg
991684621743490877_1437233904,2015-05-24 03:27:20,Normal,3,"[Tag: evaicondios, Tag: dritteavialibetta]",https://scontent.cdninstagram.com/hphotos-xaf1/t51.2885-15/e15/11380029_1445117525788762_1646597293_n.jpg
991684140780431986_324186737,2015-05-24 03:26:23,Normal,41,"[Tag: compagnadiavventure, Tag: chaletnelbosco, Tag: sfrantemabelle]",https://scontent.cdninstagram.com/hphotos-xaf1/t51.2885-15/e15/11335773_987417887956975_529838711_n.jpg
991683240492855709_1793779667,2015-05-24 03:24:36,Normal,12,"[Tag: 0inocente, Tag: italia, Tag: sancallisto, Tag: roma]",https://scontent.cdninstagram.com/hphotos-xaf1/t51.2885-15/e15/10860180_111911549142021_1793051341_n.jpg
991682657493088224_8694764,2015-05-24 03:23:26,Amaro,6,"[Tag: lettureserali, Tag: cultura]",https://scontent.cdninstagram.com/hphotos-xaf1/t51.2885-15/e15/11374684_673932342713014_277286969_n.jpg
991682498359786215_328389,2015-05-24 03:23:07,Aden,21,"[Tag: hotelhack, Tag: europe, Tag: rome, Tag: italy, Tag: roma, Tag: travel, Tag: breakfast]",https://scontent.cdninstagram.com/hphotos-xaf1/t51.2885-15/e15/11375886_929762777074726_1832054617_n.jpg
991682320682202671_27559876,2015-05-24 03:22:46,Amaro,18,"[Tag: swaag, Tag: love, Tag: instagram, Tag: dance, Tag: nevergiveup, Tag: instapic, Tag: neverstop, Tag: prettyinpink, Tag: rebel, Tag: instadaily, Tag: piccolecosecheamo, Tag: friends, Tag: saturday, Tag: osclub, Tag: labiondina, Tag: top, Tag: femminacomelavita, Tag: shootmeup, Tag: nessunomipuogiudicare, Tag: sabato, Tag: roma, Tag: igdaily, Tag: smile, Tag: wine, Tag: solocosebelle, Tag: stosenza, Tag: igers]",https://scontent.cdninstagram.com/hphotos-xfa1/t51.2885-15/e15/11335529_1841898206034717_1947094464_n.jpg
991680880261071976_203615128,2015-05-24 03:19:54,Valencia,59,"[Tag: bacini, Tag: vinile, Tag: 26, Tag: lifeinrome, Tag: frieds, Tag: kissme, Tag: brunette, Tag: italiangirls, Tag: happyness, Tag: kiss, Tag: whiteskin, Tag: party, Tag: blondie, Tag: tantiauguri, Tag: cool]",https://scontent.cdninstagram.com/hphotos-xaf1/t51.2885-15/e15/11352108_1850679768491368_723332251_n.jpg
991680314663051873_298508911,2015-05-24 03:18:47,Normal,30,"[Tag: beautiful, Tag: brunette, Tag: followback, Tag: family, Tag: food, Tag: girls, Tag: bestmoment, Tag: fashion, Tag: follow4follow, Tag: instadaily, Tag: friends, Tag: saturday, Tag: repost, Tag: vialeparioli, Tag: tflers, Tag: nightout, Tag: instamagic, Tag: igersroma, Tag: likeback, Tag: moltorestaurant, Tag: instagood, Tag: tagsforlikes, Tag: dinner, Tag: rome, Tag: night, Tag: fun, Tag: like4like, Tag: picoftheday, Tag: l4l]",https://scontent.cdninstagram.com/hphotos-xaf1/t51.2885-15/e15/11352235_473168776179237_1855292648_n.jpg
991679917940613715_298508911,2015-05-24 03:18:00,Normal,8,"[Tag: nicco, Tag: dinner, Tag: havefun, Tag: repost, Tag: friends, Tag: molto, Tag: fungostoriainfinita, Tag: storiedivitapassata]",https://scontent.cdninstagram.com/hphotos-xaf1/t51.2885-15/e15/11335161_1591168561138729_1942611272_n.jpg
991679547383223834_25459868,2015-05-24 03:17:16,Normal,17,"[Tag: throwback, Tag: 2015, Tag: italytrip]",https://scontent.cdninstagram.com/hphotos-xaf1/t51.2885-15/e15/11263186_1454112834882453_8547336_n.jpg
991679278372488247_203615128,2015-05-24 03:16:43,Normal,52,"[Tag: seidimattina, Tag: tagsforlike, Tag: vinile, Tag: dance, Tag: blondie, Tag: scattimprovvisi, Tag: instablondie, Tag: lion, Tag: redress, Tag: lifeinrome, Tag: whiteskin, Tag: me, Tag: rossodisera, Tag: followforfollow, Tag: redlips, Tag: caos, Tag: happyness, Tag: pizzo, Tag: roma, Tag: libetta, Tag: smile, Tag: gypsysoul, Tag: red]",https://scontent.cdninstagram.com/hphotos-xaf1/t51.2885-15/e15/11335833_835247163216678_372602741_n.jpg
991678295479876660_17775702,2015-05-24 03:14:46,X-Pro II,31,"[Tag: rome, Tag: colosseum, Tag: colosseo, Tag: roma]",https://scontent.cdninstagram.com/hphotos-xaf1/t51.2885-15/e15/11351809_1411324992524939_662045781_n.jpg
991678152406909534_213598759,2015-05-24 03:14:29,Normal,2,[Tag: eros],https://scontent.cdninstagram.com/hphotos-xaf1/t51.2885-15/e15/11282749_432842260230315_786418557_n.jpg
991677662248671002_43465356,2015-05-24 03:13:31,Rise,24,"[Tag: love, Tag: bff, Tag: spring, Tag: spreadyourlove, Tag: xs, Tag: rome, Tag: night, Tag: fun, Tag: party, Tag: closing, Tag: saturday, Tag: freakandc]",https://scontent.cdninstagram.com/hphotos-xfa1/t51.2885-15/e15/11312453_883382538400693_1237851542_n.jpg
991677393009447800_412191859,2015-05-24 03:12:59,Normal,8,"[Tag: doomwork, Tag: goanozoo, Tag: club, Tag: it, Tag: closingparty, Tag: goaclub, Tag: amazing, Tag: rome, Tag: night, Tag: onurözer]",https://scontent.cdninstagram.com/hphotos-xfa1/t51.2885-15/e15/11324363_389265457937463_2136812112_n.jpg
991677002275841791_1361526240,2015-05-24 03:12:12,Normal,5,"[Tag: altro, Tag: bonus, Tag: fanno, Tag: ballando, Tag: si, Tag: strani, Tag: avanti, Tag: incontri, Tag: un]",https://scontent.cdninstagram.com/hphotos-xaf1/t51.2885-15/e15/11375364_1454085284886129_507176209_n.jpg
991676953926153295_327448436,2015-05-24 03:12:06,Lark,29,"[Tag: beautiful, Tag: love, Tag: beauty, Tag: bellevere, Tag: instagood, Tag: moment, Tag: night, Tag: italy, Tag: blonde, Tag: friends, Tag: saturday, Tag: best]",https://scontent.cdninstagram.com/hphotos-xfa1/t51.2885-15/e15/11363900_373599619515668_610874261_n.jpg
991676582838522279_692675,2015-05-24 03:11:22,Normal,13,"[Tag: nurselife, Tag: europeadventures, Tag: latergram, Tag: roma, Tag: happygirlhappybag, Tag: 30newplacesbefore30]",https://scontent.cdninstagram.com/hphotos-xfa1/l/t51.2885-15/e15/11327015_1595587040688639_732951608_n.jpg
991676093640800823_328389,2015-05-24 03:10:24,Aden,30,"[Tag: europe, Tag: ancient, Tag: italy, Tag: forum, Tag: travel, Tag: rain, Tag: rome, Tag: camo, Tag: roma, Tag: umbrella, Tag: ruins]",https://scontent.cdninstagram.com/hphotos-xaf1/t51.2885-15/e15/11356665_922794771074006_223606996_n.jpg
991675721279971912_144964455,2015-05-24 03:09:39,Normal,15,"[Tag: beautiful, Tag: cute, Tag: eyes, Tag: fashion, Tag: love, Tag: picoftheday, Tag: beauty, Tag: sweet, Tag: style, Tag: hair, Tag: fun, Tag: igers, Tag: follow, Tag: girl, Tag: lady, Tag: cool, Tag: me, Tag: kik, Tag: swag, Tag: tflers, Tag: friends, Tag: girls, Tag: instagood, Tag: tagsforlikes, Tag: hot, Tag: pretty, Tag: instagramers, Tag: smile, Tag: followme, Tag: photooftheday]",https://scontent.cdninstagram.com/hphotos-xaf1/t51.2885-15/e15/11325058_919998891375542_257122816_n.jpg
991675025132911937_1347347846,2015-05-24 03:08:16,Inkwell,19,"[Tag: smilealways, Tag: friends]",https://scontent.cdninstagram.com/hphotos-xaf1/t51.2885-15/e15/11334550_1582877195294576_1883481293_n.jpg
991674906033103410_144964455,2015-05-24 03:08:02,Normal,82,"[Tag: beautiful, Tag: cute, Tag: eyes, Tag: fashion, Tag: love, Tag: picoftheday, Tag: beauty, Tag: sweet, Tag: style, Tag: hair, Tag: fun, Tag: igers, Tag: follow, Tag: girl, Tag: lady, Tag: cool, Tag: me, Tag: kik, Tag: swag, Tag: tflers, Tag: friends, Tag: girls, Tag: instagood, Tag: tagsforlikes, Tag: hot, Tag: pretty, Tag: instagramers, Tag: smile, Tag: followme, Tag: photooftheday]",https://scontent.cdninstagram.com/hphotos-xfa1/t51.2885-15/e15/11326679_372705766273227_908656128_n.jpg
991674700703391929_243252743,2015-05-24 03:07:38,Lark,43,"[Tag: throwback, Tag: rome, Tag: blessed]",https://scontent.cdninstagram.com/hphotos-xaf1/t51.2885-15/e15/11242018_928125257238713_223255424_n.jpg
