ID,Created At,Filter,Number of Likes,HashTags,url
990238110135255559_15022719,2015-05-22 03:33:23,Normal,30,"[Tag: dodgers, Tag: goblue, Tag: family, Tag: breadbowl, Tag: food, Tag: selfie, Tag: dodgerblue, Tag: photoaday, Tag: attpark, Tag: baseball, Tag: adventure, Tag: fmsphotoaday, Tag: mlb, Tag: sanfrancisco, Tag: inadrawer, Tag: cheesesteak, Tag: vacation, Tag: clamchowder, Tag: may]",https://scontent.cdninstagram.com/hphotos-xaf1/t51.2885-15/e15/11311644_1613614948921652_1182960961_n.jpg
990238049510704349_493237640,2015-05-22 03:33:16,Slumber,13,"[Tag: finalsarefinallyover, Tag: youthoughtiwaskiddingaboutthishuh, Tag: eatingin, Tag: rupaulsdragrace]",https://scontent.cdninstagram.com/hphotos-xaf1/t51.2885-15/e15/11335482_1611030412476352_297207560_n.jpg
990238048049530996_1491001121,2015-05-22 03:33:15,Mayfair,143,"[Tag: cityandcountybicycleco, Tag: baaw, Tag: deantitanium, Tag: woundupfork]",https://scontent.cdninstagram.com/hphotos-xfa1/t51.2885-15/e15/11280059_441008186078041_2107179243_n.jpg
990238042766105560_177022485,2015-05-22 03:33:15,Normal,122,"[Tag: katvondcosmetics, Tag: meltcosmetics, Tag: lipstick]",https://scontent.cdninstagram.com/hphotos-xaf1/t51.2885-15/e15/11363656_1488224864733363_71260429_n.jpg
990238031020808643_442811269,2015-05-22 03:33:13,Lark,28,"[Tag: alcatraz, Tag: iloveyou, Tag: favoritegirl, Tag: pier39, Tag: sealsandshit]",https://scontent.cdninstagram.com/hphotos-xaf1/t51.2885-15/e15/11280441_795476060565874_1633577185_n.jpg
990237932984162092_4467260,2015-05-22 03:33:02,Rise,37,[Tag: originaltart],https://scontent.cdninstagram.com/hphotos-xaf1/t51.2885-15/e15/11311876_615873031882306_529803537_n.jpg
990237921609268347_1441067318,2015-05-22 03:33:00,Normal,20,"[Tag: sfday2, Tag: lifeaftermaster, Tag: usgradtrip]",https://scontent.cdninstagram.com/hphotos-xaf1/t51.2885-15/e15/11324221_1156877037659531_1398529701_n.jpg
990237914019596960_15209289,2015-05-22 03:32:59,Charmes,16,"[Tag: irishcoffee, Tag: buenavista, Tag: sanfrancisco]",https://scontent.cdninstagram.com/hphotos-xfa1/t51.2885-15/e15/11350994_830928666981592_1047180849_n.jpg
990237853579275272_20153898,2015-05-22 03:32:52,Lark,3,[Tag: seabreeze],https://scontent.cdninstagram.com/hphotos-xaf1/t51.2885-15/e15/11326000_1437418386576351_1331476434_n.jpg
990237829593004608_223075733,2015-05-22 03:32:49,Normal,83,[Tag: atsicgiveaway],https://scontent.cdninstagram.com/hphotos-xaf1/t51.2885-15/e15/11311509_1057106337637658_1299717287_n.jpg
990237765898071756_1828650506,2015-05-22 03:32:42,Normal,9,"[Tag: hometome, Tag: atl, Tag: thesouth, Tag: southernboyatheart, Tag: lovethatcity]",https://scontent.cdninstagram.com/hphotos-xfa1/t51.2885-15/e15/11334530_434845256694030_306730949_n.jpg
990237760599530225_1185203493,2015-05-22 03:32:41,Amaro,19,"[Tag: sanfran, Tag: entrepreneurs, Tag: siliconvalleyresidency, Tag: perbacco]",https://scontent.cdninstagram.com/hphotos-xaf1/t51.2885-15/e15/11311650_443317365829382_457345632_n.jpg
990237743091930386_40367932,2015-05-22 03:32:39,Normal,11,[Tag: classof2015],https://scontent.cdninstagram.com/hphotos-xaf1/t51.2885-15/e15/11287473_393481060838053_280828006_n.jpg
990237682452370404_469579,2015-05-22 03:32:32,Normal,20,"[Tag: fatgold, Tag: prism, Tag: welost]",https://scontent.cdninstagram.com/hphotos-xfa1/t51.2885-15/e15/11282615_473264882822373_606237036_n.jpg
990237657024554644_416487680,2015-05-22 03:32:29,Normal,29,"[Tag: isthatanangel, Tag: unionsquare, Tag: squatandsnap, Tag: upupandaway]",https://scontent.cdninstagram.com/hphotos-xaf1/t51.2885-15/e15/11352316_1430669180586250_63384586_n.jpg
990237656874499923_185498598,2015-05-22 03:32:29,Hefe,65,"[Tag: selfie, Tag: 834selfie, Tag: savoryselfie]",https://scontent.cdninstagram.com/hphotos-xaf1/t51.2885-15/e15/11350887_1436899106612793_1389783506_n.jpg
990237635500830581_359934090,2015-05-22 03:32:26,Ludwig,44,"[Tag: stopanimalabuse, Tag: reportanimalabuse, Tag: saveanimals, Tag: repost]",https://scontent.cdninstagram.com/hphotos-xaf1/t51.2885-15/e15/11311353_839310226134969_935107856_n.jpg
990237522386519313_30916824,2015-05-22 03:32:13,Juno,80,"[Tag: awkwardteen, Tag: tbt]",https://scontent.cdninstagram.com/hphotos-xaf1/t51.2885-15/e15/11312280_820569701352306_923278511_n.jpg
990237490759808930_6445204,2015-05-22 03:32:09,Normal,11,"[Tag: nightlife, Tag: moonjellies, Tag: californiaacademyofsciences]",https://scontent.cdninstagram.com/hphotos-xfa1/t51.2885-15/e15/11349383_1429901660651824_1157754995_n.jpg
990237490401537652_500747586,2015-05-22 03:32:09,Lo-fi,22,"[Tag: mckswift, Tag: undertheinfluence, Tag: sanfrancisco, Tag: influence, Tag: northbeach, Tag: poetry, Tag: felakuti, Tag: emeraldtabletsf, Tag: emtabsf, Tag: music, Tag: performance, Tag: emeraldtablet]",https://scontent.cdninstagram.com/hphotos-xaf1/t51.2885-15/e15/11283330_1851870525038909_212950664_n.jpg
990237326346717106_20613744,2015-05-22 03:31:49,Normal,104,"[Tag: ampt_community, Tag: alwayssf, Tag: betterouthere, Tag: shoot2kill, Tag: vsco, Tag: vscogram, Tag: wearejuxt, Tag: allshots_, Tag: igerssf, Tag: evrgrn, Tag: killeverygram, Tag: rei, Tag: howsfseessf, Tag: justgoshoot, Tag: vscocam, Tag: sf]",https://scontent.cdninstagram.com/hphotos-xaf1/t51.2885-15/e15/11327115_1618360651765524_972278420_n.jpg
990237289125358370_236437665,2015-05-22 03:31:45,Normal,15,"[Tag: puck, Tag: dogsofinstagram, Tag: puckandjuliet, Tag: dogtricks, Tag: skateboard, Tag: instadog, Tag: rollingwithstyle, Tag: flipagram]",https://scontent.cdninstagram.com/hphotos-xfa1/t51.2885-15/e15/11348324_825481337536557_822753380_n.jpg
990237270978628492_1838405545,2015-05-22 03:31:43,Normal,81,"[Tag: mets, Tag: citifield, Tag: girlsthatlovebaseball, Tag: queens, Tag: letsgomets]",https://scontent.cdninstagram.com/hphotos-xfa1/t51.2885-15/e15/11355068_850671005025751_1038114227_n.jpg
990237247583525126_327351253,2015-05-22 03:31:40,Normal,7,"[Tag: instasf, Tag: sanfrancisco, Tag: dynamo, Tag: 24thstreet, Tag: 🍩, Tag: dynamodonuts, Tag: mission]",https://scontent.cdninstagram.com/hphotos-xfa1/t51.2885-15/e15/11349158_430043427165769_94953343_n.jpg
990237240523117946_1436253988,2015-05-22 03:31:39,Normal,5,"[Tag: servicedog, Tag: bone, Tag: bluestem]",https://scontent.cdninstagram.com/hphotos-xfa1/t51.2885-15/e15/11359010_1431495590503661_1024405225_n.jpg
990237207687099273_332471051,2015-05-22 03:31:35,Slumber,37,"[Tag: wearegapinc, Tag: bewhatspossible, Tag: bgcsfgala, Tag: letsdomore, Tag: gap]",https://scontent.cdninstagram.com/hphotos-xaf1/t51.2885-15/e15/11264256_406237916214127_598571461_n.jpg
990237168771404551_2585131,2015-05-22 03:31:31,Normal,212,"[Tag: gfk, Tag: instagram]",https://scontent.cdninstagram.com/hphotos-xaf1/t51.2885-15/e15/11254476_643227305813648_2067673201_n.jpg
990237153482590342_39153665,2015-05-22 03:31:29,Valencia,57,"[Tag: birthdaydinner, Tag: meat]",https://scontent.cdninstagram.com/hphotos-xaf1/t51.2885-15/e15/11326183_335712039971834_509206119_n.jpg
990237141745267492_40767043,2015-05-22 03:31:27,Juno,20,"[Tag: succulents, Tag: goldnengateparksf, Tag: sanfrancisco, Tag: garden, Tag: beauty, Tag: park, Tag: green, Tag: landscape]",https://scontent.cdninstagram.com/hphotos-xaf1/t51.2885-15/e15/11312239_465666700271726_1067307369_n.jpg
990237075367926189_1403518717,2015-05-22 03:31:19,Juno,9,"[Tag: themission, Tag: myfab5, Tag: eeeeeats, Tag: sanfrancisco, Tag: favabeans, Tag: sf, Tag: alsplace]",https://scontent.cdninstagram.com/hphotos-xfa1/t51.2885-15/e15/11325929_889534431085168_1524701197_n.jpg
990237022608991412_34470808,2015-05-22 03:31:13,Lark,14,"[Tag: sutrotower, Tag: truecar]",https://scontent.cdninstagram.com/hphotos-xaf1/t51.2885-15/e15/11280316_665618716901394_1282307005_n.jpg
990236986516409766_6339322,2015-05-22 03:31:09,Lo-fi,146,"[Tag: slobound, Tag: stilleatingfirst, Tag: tbt, Tag: ripsailors]",https://scontent.cdninstagram.com/hphotos-xaf1/t51.2885-15/e15/11287860_817680308316129_1048977374_n.jpg
990236940445932303_1957309085,2015-05-22 03:31:03,Normal,62,"[Tag: love, Tag: picoftheday, Tag: colorful, Tag: food, Tag: instalike, Tag: swag, Tag: instago, Tag: igers, Tag: follow4follow, Tag: follow, Tag: instadaily, Tag: girl, Tag: style, Tag: webstagram, Tag: tflers, Tag: look, Tag: instafollow, Tag: iphoneonly, Tag: 20likes, Tag: all_shots, Tag: instagood, Tag: amazing, Tag: instacool, Tag: bestoftheday, Tag: smile, Tag: like4like, Tag: tweegram, Tag: followme, Tag: photooftheday]",https://scontent.cdninstagram.com/hphotos-xaf1/t51.2885-15/e15/11275167_1597079457218395_1291115505_n.jpg
990236889231619763_22567268,2015-05-22 03:30:57,Reyes,9,[Tag: ozumo],https://scontent.cdninstagram.com/hphotos-xaf1/t51.2885-15/e15/11351803_391036137765227_1096089433_n.jpg
990236746095099880_1545275606,2015-05-22 03:30:40,Normal,5,"[Tag: sketch, Tag: collaboration, Tag: haiku, Tag: ios, Tag: internetart, Tag: uniform, Tag: internet, Tag: haikujam, Tag: android, Tag: experimental]",https://scontent.cdninstagram.com/hphotos-xaf1/t51.2885-15/e15/11243832_816860888408099_1029585670_n.jpg
990236690530978520_173547577,2015-05-22 03:30:34,Crema,45,"[Tag: gowarriors, Tag: southpark]",https://scontent.cdninstagram.com/hphotos-xfa1/t51.2885-15/e15/11275301_718307668280234_1529699930_n.jpg
990236663946638038_4261755,2015-05-22 03:30:30,Normal,20,"[Tag: designer, Tag: robot]",https://scontent.cdninstagram.com/hphotos-xaf1/t51.2885-15/e15/11330697_743433652445330_485867160_n.jpg
990236657638073169_245061431,2015-05-22 03:30:30,Normal,28,"[Tag: classof2015, Tag: sfstate]",https://scontent.cdninstagram.com/hphotos-xfa1/t51.2885-15/e15/11263607_829239117123488_1469466805_n.jpg
990236609572660111_4542711,2015-05-22 03:30:24,Normal,64,"[Tag: foodie, Tag: food, Tag: desserts, Tag: vscofood, Tag: getjag, Tag: vsco, Tag: foodofsf, Tag: sf]",https://scontent.cdninstagram.com/hphotos-xaf1/t51.2885-15/e15/11333674_825530800873556_1355712872_n.jpg
990236583332539010_295092169,2015-05-22 03:30:21,Reyes,41,[Tag: sanfran],https://scontent.cdninstagram.com/hphotos-xfa1/t51.2885-15/e15/11261705_366594690215370_1680330133_n.jpg
990236452109944927_31697561,2015-05-22 03:30:05,Normal,27,"[Tag: allwedoiswin, Tag: sweepla, Tag: beatla]",https://scontent.cdninstagram.com/hphotos-xaf1/t51.2885-15/e15/11356489_504756129678123_1282768055_n.jpg
990236427437266352_627100820,2015-05-22 03:30:02,Willow,12,[Tag: tbt],https://scontent.cdninstagram.com/hphotos-xaf1/t51.2885-15/e15/11263531_377174092488543_712428245_n.jpg
989514131902055687_350244112,2015-05-21 03:34:58,Normal,7,"[Tag: instafave, Tag: dungenesscrabmeat, Tag: wednyt, Tag: padthai, Tag: instagood]",https://scontent.cdninstagram.com/hphotos-xaf1/t51.2885-15/e15/11351937_291920480931773_1805346216_n.jpg
989514127027133896_229262998,2015-05-21 03:34:57,Normal,17,"[Tag: beatthegiants, Tag: dodgers, Tag: blueblood, Tag: swingingforthefences]",https://scontent.cdninstagram.com/hphotos-xaf1/t51.2885-15/e15/11327880_709205222540248_591350234_n.jpg
989514107134962577_1276745281,2015-05-21 03:34:55,Normal,2,"[Tag: attpark, Tag: sanfranciscogiants, Tag: nlwest]",https://scontent.cdninstagram.com/hphotos-xfa1/t51.2885-15/e15/11283323_1096968340317821_1362594305_n.jpg
989514107085291728_18925927,2015-05-21 03:34:55,Normal,87,"[Tag: attpark, Tag: shouldajustcroppedyouout, Tag: nopenever]",https://scontent.cdninstagram.com/hphotos-xaf1/t51.2885-15/e15/11269164_806807509397486_1572662810_n.jpg
989514064159891276_15810054,2015-05-21 03:34:50,Normal,13,[Tag: california],https://scontent.cdninstagram.com/hphotos-xfa1/t51.2885-15/e15/11296793_959736774067042_560089571_n.jpg
989514061572599513_51064730,2015-05-21 03:34:49,Lark,9,"[Tag: beautifulentrance, Tag: sanfrancisco, Tag: decoironwork]",https://scontent.cdninstagram.com/hphotos-xfa1/t51.2885-15/e15/11313233_1633705856872398_859521472_n.jpg
989514056788883521_14692573,2015-05-21 03:34:49,Normal,22,"[Tag: wearegiant, Tag: beatla]",https://scontent.cdninstagram.com/hphotos-xaf1/t51.2885-15/e15/11272461_1029273643756947_508912820_n.jpg
989514038801763018_4030673,2015-05-21 03:34:47,Normal,34,"[Tag: art, Tag: sfbay, Tag: concierge, Tag: entrepreneur, Tag: decoracao, Tag: design, Tag: staging, Tag: sanfrancisco, Tag: interiores, Tag: personalconcierge, Tag: interiordesign, Tag: custom, Tag: arte, Tag: architecture, Tag: arquitetura, Tag: nofilter, Tag: realestate]",https://scontent.cdninstagram.com/hphotos-xfa1/t51.2885-15/e15/11349374_444171369089543_1539555666_n.jpg
989514002776752693_53694639,2015-05-21 03:34:42,Juno,19,"[Tag: summerinsanfrancisco, Tag: gogiants]",https://scontent.cdninstagram.com/hphotos-xfa1/t51.2885-15/e15/11330702_1409497406041412_159371913_n.jpg
989513977701099738_1484137585,2015-05-21 03:34:39,Juno,19,"[Tag: sanfrancisco, Tag: gogiants, Tag: baseball]",https://scontent.cdninstagram.com/hphotos-xaf1/t51.2885-15/e15/11282710_702332759894974_745925473_n.jpg
989513972147284372_1065592041,2015-05-21 03:34:39,Lark,10,[Tag: alcatraz],https://scontent.cdninstagram.com/hphotos-xfa1/t51.2885-15/e15/11287778_718584361584927_1152595054_n.jpg
989513957838640920_206504308,2015-05-21 03:34:37,Normal,82,[Tag: giants],https://scontent.cdninstagram.com/hphotos-xaf1/t51.2885-15/e15/11326627_450662048432506_795852972_n.jpg
989513904721476477_207223821,2015-05-21 03:34:31,Normal,31,"[Tag: signal, Tag: twillio]",https://scontent.cdninstagram.com/hphotos-xaf1/t51.2885-15/e15/11263395_1600636453549444_1755748993_n.jpg
989513844122413961_18394057,2015-05-21 03:34:24,Lark,10,"[Tag: blt, Tag: trollz]",https://scontent.cdninstagram.com/hphotos-xfa1/t51.2885-15/e15/11282837_1410729829250698_87195071_n.jpg
989513836573432399_31169805,2015-05-21 03:34:23,Normal,81,"[Tag: attpark, Tag: gogiants, Tag: beatla]",https://scontent.cdninstagram.com/hphotos-xaf1/t51.2885-15/e15/11263660_1585649031688251_1042082437_n.jpg
989513705592417704_3858546,2015-05-21 03:34:07,Normal,27,"[Tag: gofamilydental, Tag: boododgers, Tag: funtimes, Tag: gogiants, Tag: humpday]",https://scontent.cdninstagram.com/hphotos-xaf1/t51.2885-15/e15/11311050_438543912970403_862626580_n.jpg
989513696625802566_14679334,2015-05-21 03:34:06,Normal,22,"[Tag: sfeatsathome, Tag: sanfranciscoeats, Tag: tartinebakery, Tag: sanfrancisco, Tag: eatinggood, Tag: bayarea, Tag: tartinebread, Tag: bayareaeats]",https://scontent.cdninstagram.com/hphotos-xaf1/t51.2885-15/e15/11296884_899009593508001_1650306867_n.jpg
989513629868528657_26333620,2015-05-21 03:33:58,Normal,77,[Tag: giants],https://scontent.cdninstagram.com/hphotos-xfa1/t51.2885-15/e15/11351030_1445497382417844_548795560_n.jpg
989513616191450881_205340058,2015-05-21 03:33:56,Normal,12,"[Tag: brendasfrenchsoulfood, Tag: sanfrancisco, Tag: usa, Tag: sanfran, Tag: creole, Tag: travel, Tag: fatboyfood, Tag: bayarea, Tag: california, Tag: sansouci2sanfrancisco, Tag: brunch, Tag: westcoast]",https://scontent.cdninstagram.com/hphotos-xaf1/t51.2885-15/e15/11352153_370319979824804_1738897900_n.jpg
989513600908483687_209141110,2015-05-21 03:33:55,Normal,16,"[Tag: fuckthegiants, Tag: beatsf, Tag: ladodgers]",https://scontent.cdninstagram.com/hphotos-xaf1/t51.2885-15/e15/11258814_788367621261302_1731191154_n.jpg
989513588854493518_13451539,2015-05-21 03:33:53,Normal,265,[Tag: twinning],https://scontent.cdninstagram.com/hphotos-xaf1/t51.2885-15/e15/11287923_1606825542894399_1619868962_n.jpg
989513524982754865_11205682,2015-05-21 03:33:45,Mayfair,25,"[Tag: giants, Tag: suitelife, Tag: beatla]",https://scontent.cdninstagram.com/hphotos-xfa1/t51.2885-15/e15/11324300_114101155587842_982515452_n.jpg
989513462387760897_55466462,2015-05-21 03:33:38,Normal,5,"[Tag: marina, Tag: tipsypig, Tag: ribs, Tag: sf]",https://scontent.cdninstagram.com/hphotos-xfa1/t51.2885-15/e15/11352857_1599202787028895_1234036063_n.jpg
989513368076609520_375978384,2015-05-21 03:33:27,Brooklyn,18,"[Tag: startuplife, Tag: networking, Tag: sf]",https://scontent.cdninstagram.com/hphotos-xfa1/t51.2885-15/e15/11312555_1576131409306630_899976968_n.jpg
989513244668640919_255970302,2015-05-21 03:33:12,X-Pro II,59,"[Tag: yoga, Tag: yogaeverydamday, Tag: yogi, Tag: shineyourlight, Tag: yogaeverywhere, Tag: goout, Tag: california, Tag: sanfrancisco, Tag: yogawithpradeepyoga, Tag: shareyourpassion]",https://scontent.cdninstagram.com/hphotos-xaf1/t51.2885-15/e15/11325364_1588793181406499_1123350377_n.jpg
989513105745333399_695855722,2015-05-21 03:32:56,Ginza,38,[Tag: baytobreakers],https://scontent.cdninstagram.com/hphotos-xfa1/t51.2885-15/e15/11333453_455160877980113_82845157_n.jpg
989513101579170848_8383628,2015-05-21 03:32:55,Normal,6,[Tag: introductiontobookbinding],https://scontent.cdninstagram.com/hphotos-xaf1/t51.2885-15/e15/11352087_467620476728623_658830698_n.jpg
989513062311340538_12422889,2015-05-21 03:32:50,Perpetua,89,"[Tag: patterns, Tag: 100daysofpatterns, Tag: 100daysofcreativeexperiments, Tag: the100dayproject]",https://scontent.cdninstagram.com/hphotos-xaf1/t51.2885-15/e15/11352415_103920726610921_445715497_n.jpg
989513051877745341_248379679,2015-05-21 03:32:49,Normal,28,"[Tag: mlb, Tag: bayarea, Tag: ilovebaseball, Tag: ladodgers, Tag: sports, Tag: losdodgers, Tag: attpark, Tag: baseball, Tag: love, Tag: sportsallweek, Tag: sfgiants]",https://scontent.cdninstagram.com/hphotos-xaf1/t51.2885-15/e15/11355775_102800210057094_583190552_n.jpg
989513033536130664_40365658,2015-05-21 03:32:47,Normal,23,"[Tag: art, Tag: palaceoffinearts, Tag: family, Tag: collage, Tag: landmark, Tag: sfo, Tag: trip, Tag: structure, Tag: nofilter, Tag: sanfrancisco, Tag: theatre, Tag: travel, Tag: tree, Tag: texture, Tag: mother, Tag: mum, Tag: holiday]",https://scontent.cdninstagram.com/hphotos-xaf1/t51.2885-15/e15/11313802_979633912046978_1230155696_n.jpg
989512976537133530_229677215,2015-05-21 03:32:40,Normal,64,"[Tag: girlythings, Tag: makeup, Tag: sephora]",https://scontent.cdninstagram.com/hphotos-xfa1/t51.2885-15/e15/11352101_1135693209790152_1873577136_n.jpg
989512964273531363_231562745,2015-05-21 03:32:39,Ludwig,19,"[Tag: giantsgame, Tag: wearingorange, Tag: giantsvsdodgers]",https://scontent.cdninstagram.com/hphotos-xfa1/t51.2885-15/e15/11356415_977657578920756_1596987449_n.jpg
989512953492791265_194781398,2015-05-21 03:32:37,Normal,96,"[Tag: goldengatebridge, Tag: sanfrancisco, Tag: sf]",https://scontent.cdninstagram.com/hphotos-xaf1/t51.2885-15/e15/11296849_1582418758695821_1515210903_n.jpg
989512895134419303_1402545,2015-05-21 03:32:30,Normal,28,"[Tag: houseofprimerib, Tag: primerib, Tag: steak, Tag: henryviii]",https://scontent.cdninstagram.com/hphotos-xfa1/t51.2885-15/e15/11325422_1586898198266083_1668498055_n.jpg
989512887619701097_1566213985,2015-05-21 03:32:30,Normal,40,"[Tag: giants, Tag: mlb, Tag: attpark, Tag: nlwest, Tag: giantsdodgersgame, Tag: sf, Tag: sfgiants]",https://scontent.cdninstagram.com/hphotos-xaf1/t51.2885-15/e15/11348173_792773307472714_203699992_n.jpg
989512833745735284_55936714,2015-05-21 03:32:23,Normal,28,"[Tag: sanfrancisco, Tag: foodporn, Tag: rainforestcafe, Tag: fisherwharf, Tag: pier39, Tag: citylife]",https://scontent.cdninstagram.com/hphotos-xaf1/t51.2885-15/e15/11244787_867805353291935_1266024852_n.jpg
989512792447491172_375614,2015-05-21 03:32:18,Hefe,86,"[Tag: beertography, Tag: craftbeer, Tag: beerporn]",https://scontent.cdninstagram.com/hphotos-xaf1/t51.2885-15/e15/11242738_392585957600746_2020294322_n.jpg
989512736474336571_2989546,2015-05-21 03:32:12,Normal,16,"[Tag: giants, Tag: realchampionshipring, Tag: snow, Tag: bayarea]",https://scontent.cdninstagram.com/hphotos-xfa1/t51.2885-15/e15/11262647_1003444799668479_1411102256_n.jpg
989512736160257389_503840932,2015-05-21 03:32:11,Lark,5,"[Tag: sanfrancisco, Tag: businesstrip]",https://scontent.cdninstagram.com/hphotos-xaf1/t51.2885-15/e15/11352348_481682125340678_927130577_n.jpg
989512717600040609_1313244616,2015-05-21 03:32:09,Normal,38,"[Tag: gordenbiersch, Tag: marzen, Tag: beerporn, Tag: instabeer, Tag: shakaking808whiskeybeers, Tag: bier, Tag: birra, Tag: beerme, Tag: ilovebeer, Tag: sfgiants]",https://scontent.cdninstagram.com/hphotos-xaf1/t51.2885-15/e15/11355757_1430975663877234_2007316668_n.jpg
989512667771868985_24814772,2015-05-21 03:32:03,Earlybird,26,"[Tag: plants, Tag: beautiful, Tag: flower, Tag: sanfrancisco, Tag: garden, Tag: nature, Tag: karshfish, Tag: eveningstroll, Tag: haight, Tag: sf]",https://scontent.cdninstagram.com/hphotos-xaf1/t51.2885-15/e15/11333622_1594501567458232_891347418_n.jpg
989512609349273908_206490545,2015-05-21 03:31:56,Aden,35,"[Tag: fashion, Tag: shoplocal, Tag: mgk, Tag: sunosurprise, Tag: suno, Tag: chic, Tag: designers, Tag: mgkstyle, Tag: style, Tag: stylegram, Tag: stylist, Tag: localgem, Tag: moda, Tag: boutique, Tag: sfstyle, Tag: bettylin, Tag: mode, Tag: potd, Tag: sf, Tag: fbloggers, Tag: lotd]",https://scontent.cdninstagram.com/hphotos-xaf1/t51.2885-15/e15/11350752_475675489254253_2036357293_n.jpg
989512434073697220_2294829,2015-05-21 03:31:35,Hefe,4,"[Tag: ban, Tag: chinatown, Tag: jestjammin]",https://scontent.cdninstagram.com/hphotos-xaf1/t51.2885-15/e15/11245836_992853454087569_2023413229_n.jpg
989512380528366348_1729419003,2015-05-21 03:31:29,Normal,3,"[Tag: wheel, Tag: bathtime, Tag: bigmoney, Tag: wheeloffortune, Tag: sanfrancisco, Tag: giants, Tag: idliketosolvethepuzzle, Tag: bathtimewheeloffortune, Tag: beatla]",https://scontent.cdninstagram.com/hphotos-xaf1/t51.2885-15/e15/11325255_954852794544955_1847112090_n.jpg
989512329440918385_792753197,2015-05-21 03:31:23,Normal,32,"[Tag: beautiful, Tag: mountains, Tag: 美景, Tag: lake, Tag: laketahoe, Tag: 太浩湖, Tag: sunset, Tag: view]",https://scontent.cdninstagram.com/hphotos-xaf1/t51.2885-15/e15/11350986_1674221849478976_327438703_n.jpg
989512272323590503_1359158885,2015-05-21 03:31:16,Ginza,36,"[Tag: 가족여행, Tag: 소통, Tag: virginamerica, Tag: 일상, Tag: lasvegas, Tag: 비행기, Tag: 여행]",https://scontent.cdninstagram.com/hphotos-xaf1/t51.2885-15/e15/11313685_384259455099216_1585797019_n.jpg
989512199896660950_803134189,2015-05-21 03:31:08,Normal,17,"[Tag: wedgewood, Tag: moniquelhuillier, Tag: bridesmaids, Tag: napa, Tag: wedding, Tag: destination, Tag: bridesmaiddress]",https://scontent.cdninstagram.com/hphotos-xfp1/t51.2885-15/e15/1597980_104256206577149_94359761_n.jpg
989512160592431785_4030673,2015-05-21 03:31:03,Normal,27,"[Tag: arquitetura, Tag: interiores, Tag: personalconcierge, Tag: interiordesign, Tag: concierge, Tag: entrepreneur, Tag: decoracao, Tag: design, Tag: boom, Tag: sanfrancisco, Tag: womeninbusiness, Tag: architecture]",https://scontent.cdninstagram.com/hphotos-xfa1/t51.2885-15/e15/11287991_1127636887252034_823938185_n.jpg
989512119609628698_11319517,2015-05-21 03:30:58,Aden,149,"[Tag: fitness, Tag: hiking, Tag: yosemite]",https://scontent.cdninstagram.com/hphotos-xaf1/t51.2885-15/e15/11356041_788027091295625_858650624_n.jpg
989512067523933526_280248708,2015-05-21 03:30:52,Ludwig,31,"[Tag: goenjoy, Tag: gogiants, Tag: thatsmyson, Tag: beatla]",https://scontent.cdninstagram.com/hphotos-xaf1/t51.2885-15/e15/11263168_389396277930715_1401189222_n.jpg
989512067294301572_1811550642,2015-05-21 03:30:52,Lo-fi,18,"[Tag: sanfrancisco, Tag: clarion, Tag: alley, Tag: clarionalley, Tag: graffiti, Tag: california, Tag: home, Tag: capitalismisover, Tag: housingisahumanright]",https://scontent.cdninstagram.com/hphotos-xaf1/t51.2885-15/e15/11247673_428500110655654_447256899_n.jpg
989512054084805584_176263143,2015-05-21 03:30:50,Normal,16,"[Tag: punkrockbowling2015, Tag: avenuepunx, Tag: punkrockbowling, Tag: avenuerockers]",https://scontent.cdninstagram.com/hphotos-xaf1/t51.2885-15/e15/11337144_786420694811058_711743143_n.jpg
989512047303838381_22110241,2015-05-21 03:30:49,Normal,670,"[Tag: mysanfrancisco, Tag: stravacycling, Tag: rapha100, Tag: girlgetoutside, Tag: inspiredyogis, Tag: yogaeverydamnday, Tag: cyclinglife, Tag: bikelove, Tag: badassisbeautiful, Tag: fitgirls, Tag: cyclingphotos, Tag: yogionabike, Tag: movenourishbelieve, Tag: igyogimovement, Tag: yogawithpb, Tag: rapha, Tag: cycling, Tag: healthyliving, Tag: aimtrue, Tag: outsideisfree, Tag: goanywhererideanything, Tag: rideyourbike, Tag: thisismyyoga, Tag: cyclingpics, Tag: raphacalling, Tag: alwayssf, Tag: womenscycling, Tag: igerscycling]",https://scontent.cdninstagram.com/hphotos-xaf1/t51.2885-15/e15/11330737_1457532094539950_668489045_n.jpg
989512024525247347_39834995,2015-05-21 03:30:47,Normal,328,"[Tag: feedfeed, Tag: f52grams, Tag: dscolor, Tag: thechalkboardeats, Tag: thatsdarling, Tag: foodwomenwine, Tag: eeeeeats]",https://scontent.cdninstagram.com/hphotos-xfa1/t51.2885-15/e15/11282606_822546884449587_1067862823_n.jpg
989511946012130532_1470580958,2015-05-21 03:30:37,Normal,11,"[Tag: nobhill, Tag: sanfrancisco, Tag: localsf, Tag: essentialoils, Tag: coldpressed, Tag: unionsquare, Tag: skinceresf, Tag: hydrate]",https://scontent.cdninstagram.com/hphotos-xfp1/t51.2885-15/e15/925027_1047986961897176_1532630951_n.jpg
989511942047548641_350244112,2015-05-21 03:30:37,Normal,9,"[Tag: fishsofttacos, Tag: instayum, Tag: latepost, Tag: mexfood, Tag: earlydinner, Tag: yesterday]",https://scontent.cdninstagram.com/hphotos-xaf1/t51.2885-15/e15/11273232_1602382810002924_1902172932_n.jpg
989511926525822044_353356376,2015-05-21 03:30:35,Amaro,12,"[Tag: baseball, Tag: sfgiants, Tag: babyitscoldoutside]",https://scontent.cdninstagram.com/hphotos-xaf1/t51.2885-15/e15/11250172_1727848860775817_642569377_n.jpg
989511904332966343_22884697,2015-05-21 03:30:32,Normal,21,"[Tag: feriasaem, Tag: saofranciscocalifornia]",https://scontent.cdninstagram.com/hphotos-xaf1/t51.2885-15/e15/11263414_727223590722359_1955056440_n.jpg
989511903392775478_974699046,2015-05-21 03:30:32,Normal,383,"[Tag: westie, Tag: lambiekins, Tag: westitude]",https://scontent.cdninstagram.com/hphotos-xfa1/t51.2885-15/e15/11263169_914194831957271_1915804885_n.jpg
