ID,Created At,Filter,Number of Likes,HashTags,url
992412990885921067_361688903,2015-05-25 03:34:29,Normal,0,"[Tag: onsale, Tag: instasale, Tag: madeintheusa, Tag: instajewelry, Tag: shophandmade, Tag: sale, Tag: glamour, Tag: handmadejewelry, Tag: memorialdaysale, Tag: bracelets, Tag: pinup, Tag: laplumenoir, Tag: girly, Tag: gypsy, Tag: shabbychic, Tag: vintage, Tag: necklaces, Tag: rings, Tag: sparkly, Tag: buyhandmade, Tag: boho, Tag: retro, Tag: shopsmall, Tag: earrings, Tag: jewelrydesigner, Tag: laplumenoirdotcom, Tag: gemstonering, Tag: sfetsy]",https://scontent.cdninstagram.com/hphotos-xtp1/t51.2885-15/e15/11111503_1828126480746465_1234034238_n.jpg
992412983762865516_15392802,2015-05-25 03:34:28,Normal,0,"[Tag: brother, Tag: family, Tag: roadtrip]",https://scontent.cdninstagram.com/hphotos-xaf1/t51.2885-15/e15/11375833_1452754491704322_402290893_n.jpg
992412960123754588_1100287789,2015-05-25 03:34:25,Ludwig,0,[Tag: darthvaderandfriends],https://scontent.cdninstagram.com/hphotos-xaf1/t51.2885-15/e15/11312031_1401618340165758_120783593_n.jpg
992412957038373592_422059377,2015-05-25 03:34:25,Lo-fi,0,"[Tag: culture, Tag: themission, Tag: carnaval, Tag: sendoff, Tag: thebaytho, Tag: sf, Tag: summernights]",https://scontent.cdninstagram.com/hphotos-xfa1/t51.2885-15/e15/11351042_957334720977733_1571785398_n.jpg
992412891815545823_13993009,2015-05-25 03:34:17,Normal,0,[Tag: damahike],https://scontent.cdninstagram.com/hphotos-xaf1/t51.2885-15/e15/11358040_809662232452096_1764452169_n.jpg
992412755313460981_361585416,2015-05-25 03:34:01,Normal,1,[Tag: saucha],https://scontent.cdninstagram.com/hphotos-xaf1/t51.2885-15/e15/11348152_1673862849501316_1184158993_n.jpg
992412708715873815_6406520,2015-05-25 03:33:55,Normal,1,"[Tag: socalbestcal, Tag: usf2015]",https://scontent.cdninstagram.com/hphotos-xaf1/t51.2885-15/e15/11357611_288452681278863_2131565583_n.jpg
992412682477490089_206357674,2015-05-25 03:33:52,Normal,0,[Tag: carnavalsf],https://scontent.cdninstagram.com/hphotos-xaf1/t51.2885-15/e15/11374063_840487049338813_111214239_n.jpg
992412657344047705_7351529,2015-05-25 03:33:49,Reyes,0,"[Tag: santacruz, Tag: mdw]",https://scontent.cdninstagram.com/hphotos-xaf1/t51.2885-15/e15/11372314_1128475200512012_724830322_n.jpg
992412645560594718_189004011,2015-05-25 03:33:48,Crema,0,"[Tag: tranceislife, Tag: tfsf5, Tag: trancefamilysf, Tag: tranceislove]",https://scontent.cdninstagram.com/hphotos-xaf1/t51.2885-15/e15/11325448_1493760017539344_751737258_n.jpg
992412568359510478_10823303,2015-05-25 03:33:38,Lark,1,"[Tag: alamosquare, Tag: sanfrancisco]",https://scontent.cdninstagram.com/hphotos-xaf1/t51.2885-15/e15/11358117_814452205306937_887043400_n.jpg
992412538789960578_233583589,2015-05-25 03:33:35,Normal,0,"[Tag: throwback, Tag: nofilter, Tag: palaceoffinearts, Tag: sunrise, Tag: tastetherainbow]",https://scontent.cdninstagram.com/hphotos-xaf1/t51.2885-15/e15/11352873_1453356388297134_1883394572_n.jpg
992412498247932472_51988701,2015-05-25 03:33:30,Earlybird,0,[Tag: converse],https://scontent.cdninstagram.com/hphotos-xfa1/t51.2885-15/e15/11371259_725275964250173_1185316071_n.jpg
992412492778471770_202243615,2015-05-25 03:33:29,Normal,0,"[Tag: damnadorable, Tag: bitchesloveme, Tag: girlsday, Tag: wearehot]",https://scontent.cdninstagram.com/hphotos-xaf1/t51.2885-15/e15/11265762_796236643805592_850510103_n.jpg
992412484449750476_299554754,2015-05-25 03:33:28,Willow,0,"[Tag: castro, Tag: shelovesme, Tag: goodtimes, Tag: sf]",https://scontent.cdninstagram.com/hphotos-xfa1/t51.2885-15/e15/11377949_943100789065217_1849454900_n.jpg
992412372566382880_35715357,2015-05-25 03:33:15,Normal,3,"[Tag: frisco, Tag: goldengatebridge, Tag: memorialweekend, Tag: sanfrancisco, Tag: byebye]",https://scontent.cdninstagram.com/hphotos-xfa1/t51.2885-15/e15/11272826_606271682847759_1246948880_n.jpg
992412340777293799_24089004,2015-05-25 03:33:11,Normal,1,[Tag: castro],https://scontent.cdninstagram.com/hphotos-xpa1/t51.2885-15/e15/10632512_400527293465865_808891304_n.jpg
992412304998675927_604872828,2015-05-25 03:33:07,Slumber,0,"[Tag: tmousatrip, Tag: museemechanique]",https://scontent.cdninstagram.com/hphotos-xaf1/t51.2885-15/e15/11325210_759503907504487_2131906333_n.jpg
992412289628925599_173716050,2015-05-25 03:33:05,Normal,3,"[Tag: cute, Tag: neff, Tag: columbia, Tag: iphone6, Tag: adventuretime, Tag: rain, Tag: roadtrip, Tag: goldengatebridge, Tag: california, Tag: northface]",https://scontent.cdninstagram.com/hphotos-xaf1/t51.2885-15/e15/11313202_852116404875780_684314563_n.jpg
992412256018993283_1820849195,2015-05-25 03:33:01,Normal,0,"[Tag: 2015, Tag: missiondistrict, Tag: carnavalsf]",https://scontent.cdninstagram.com/hphotos-xaf1/t51.2885-15/e15/11379333_1639388082940163_899796436_n.jpg
992412218670847902_362547180,2015-05-25 03:32:57,Lark,2,"[Tag: honeymooning, Tag: chocolate, Tag: thankyou, Tag: iloveyou, Tag: opsalfamily, Tag: sanfransisco, Tag: argonauthotel, Tag: champagne, Tag: jeffopsal]",https://scontent.cdninstagram.com/hphotos-xaf1/t51.2885-15/e15/11288209_556620444492742_907201044_n.jpg
992412154693653012_52724835,2015-05-25 03:32:49,Normal,0,"[Tag: macairbrush, Tag: macpropowell, Tag: macsanfrancisco, Tag: myartistcommunitynorthwest, Tag: macboy, Tag: macgirl, Tag: myartistcommunity, Tag: ineedatan, Tag: macpro]",https://scontent.cdninstagram.com/hphotos-xfa1/t51.2885-15/e15/11351666_672558996210740_113342232_n.jpg
992412122167716908_1511676610,2015-05-25 03:32:45,Juno,5,[Tag: diamondcelebration💎],https://scontent.cdninstagram.com/hphotos-xfa1/t51.2885-15/e15/11358200_838328959585061_1484108473_n.jpg
992412097145131084_517752227,2015-05-25 03:32:42,Normal,0,"[Tag: sanfrancisco, Tag: memorialday]",https://scontent.cdninstagram.com/hphotos-xaf1/t51.2885-15/e15/11352955_484205885079983_1769067036_n.jpg
992412064589578982_189992847,2015-05-25 03:32:38,Normal,0,"[Tag: boehmei, Tag: brachypelmaboehmei, Tag: brachypelma, Tag: critters, Tag: spider, Tag: fang_gang, Tag: arachnid, Tag: spiders, Tag: instaspider, Tag: spiderlove, Tag: tarantulas, Tag: ahilana, Tag: the_spider_room, Tag: terrarium, Tag: tarantula, Tag: tarantulasofinstagram]",https://scontent.cdninstagram.com/hphotos-xfa1/t51.2885-15/e15/11261630_974667585912040_519057977_n.jpg
992412060420859188_1978256,2015-05-25 03:32:38,Reyes,1,"[Tag: goofballs, Tag: friendsforever, Tag: sanfrancisco, Tag: latergram]",https://scontent.cdninstagram.com/hphotos-xaf1/t51.2885-15/e15/11325879_1639836392905813_295659889_n.jpg
992412017519919057_394166694,2015-05-25 03:32:33,Normal,2,"[Tag: forsale, Tag: sanfrancisco, Tag: photocollage, Tag: sanfranciscoartist, Tag: bearmask, Tag: bear, Tag: sanfranciscoart, Tag: localtake, Tag: animalmask, Tag: shawnrayharris, Tag: castro, Tag: print, Tag: woodframe, Tag: saw]",https://scontent.cdninstagram.com/hphotos-xaf1/t51.2885-15/e15/11385606_1591566377774523_686411051_n.jpg
992412010030862220_37543618,2015-05-25 03:32:32,Mayfair,1,"[Tag: greenapplebooks, Tag: cali, Tag: bookstore, Tag: sf, Tag: ilovethiscitysf]",https://scontent.cdninstagram.com/hphotos-xaf1/t51.2885-15/e15/11324947_383138721873449_1177469352_n.jpg
992412006630670186_1805878,2015-05-25 03:32:31,Normal,4,"[Tag: asundaykindoflove, Tag: dreamy, Tag: sf, Tag: blackandwhite, Tag: goldengatebridge]",https://scontent.cdninstagram.com/hphotos-xaf1/t51.2885-15/e15/11356410_466106640223335_1378775886_n.jpg
992412004811265025_350181780,2015-05-25 03:32:31,Reyes,0,"[Tag: sanfrancisco, Tag: art, Tag: deyoung]",https://scontent.cdninstagram.com/hphotos-xaf1/t51.2885-15/e15/11327103_454168608085651_1735824620_n.jpg
992412003343485622_4092001,2015-05-25 03:32:31,Lark,0,"[Tag: sloth, Tag: llama, Tag: terrapin]",https://scontent.cdninstagram.com/hphotos-xaf1/t51.2885-15/e15/11326689_1452233661740740_1955221439_n.jpg
992411987135406499_326150743,2015-05-25 03:32:29,Lark,2,"[Tag: besties, Tag: sanfrancisco, Tag: weekend, Tag: sundayfunday, Tag: castro, Tag: california, Tag: photobooth, Tag: love, Tag: californiagirl, Tag: friends]",https://scontent.cdninstagram.com/hphotos-xaf1/t51.2885-15/e15/11330757_984076061626274_828168319_n.jpg
992411972431886571_1697247413,2015-05-25 03:32:27,Juno,17,"[Tag: wiw, Tag: whatiwore, Tag: ootd, Tag: sfblogger, Tag: wsfashion, Tag: fashionista, Tag: fashionblogger]",https://scontent.cdninstagram.com/hphotos-xaf1/t51.2885-15/e15/11327364_658743660925118_1163788259_n.jpg
992411943602728343_1419924842,2015-05-25 03:32:24,Normal,0,"[Tag: 26andsouthvaness, Tag: mission, Tag: highspeeds, Tag: sfc, Tag: 415, Tag: frisco, Tag: citylife, Tag: sf, Tag: vgs]",https://scontent.cdninstagram.com/hphotos-xaf1/t51.2885-15/e15/11325720_990320797658254_56034678_n.jpg
992411890532463436_5926003,2015-05-25 03:32:18,Brannan,2,[Tag: mybitch],https://scontent.cdninstagram.com/hphotos-xaf1/t51.2885-15/e15/11352955_1630863270490411_1320028719_n.jpg
992411869420971790_1928576,2015-05-25 03:32:15,Normal,2,"[Tag: cocktails, Tag: tiki, Tag: sanfrancisco, Tag: cocktail, Tag: cocktailporn, Tag: tikisunday]",https://scontent.cdninstagram.com/hphotos-xaf1/t51.2885-15/e15/11348274_1423427834645670_268660966_n.jpg
992411809551604270_51988701,2015-05-25 03:32:08,Hudson,0,"[Tag: california, Tag: sanfrancisco, Tag: sf]",https://scontent.cdninstagram.com/hphotos-xfa1/t51.2885-15/e15/11274344_1595196747431348_282388845_n.jpg
992411807807189147_38259107,2015-05-25 03:32:08,Kelvin,0,"[Tag: ithappensalsoinsf, Tag: bike, Tag: findthewheels, Tag: cycle]",https://scontent.cdninstagram.com/hphotos-xaf1/t51.2885-15/e15/11374302_364279393776513_632365044_n.jpg
992411752247473460_214032188,2015-05-25 03:32:01,Amaro,10,"[Tag: funny, Tag: yummy, Tag: sanfrancisco, Tag: pier39, Tag: chocolate, Tag: ghirardelli, Tag: delicious, Tag: fun, Tag: aid, Tag: happy]",https://scontent.cdninstagram.com/hphotos-xpa1/t51.2885-15/e15/11191084_1572192063047577_497722435_n.jpg
992411738290836268_20979147,2015-05-25 03:31:59,Normal,1,"[Tag: scampiandpickle, Tag: weliketocablecar, Tag: thirdtime, Tag: cablecar, Tag: sanfransisco, Tag: oursfadventures, Tag: thanksgermanguy, Tag: likeatourist, Tag: weaddicted]",https://scontent.cdninstagram.com/hphotos-xaf1/t51.2885-15/e15/11335101_381952275342655_816617041_n.jpg
992411717286369116_1456129740,2015-05-25 03:31:57,Mayfair,0,[Tag: pier39],https://scontent.cdninstagram.com/hphotos-xaf1/t51.2885-15/e15/11312031_714415962014914_1420104693_n.jpg
992411712898904656_14574523,2015-05-25 03:31:56,Mayfair,2,"[Tag: doesnotsuck, Tag: happyrachel, Tag: iheartzuni]",https://scontent.cdninstagram.com/hphotos-xaf1/t51.2885-15/e15/11271159_1115190328508153_1307830731_n.jpg
992411698360020027_34933130,2015-05-25 03:31:55,Lark,1,"[Tag: fairmont, Tag: tiki, Tag: sanfrancisco, Tag: onaboat, Tag: tongaroom, Tag: prebirthday, Tag: ciglerfamilyfun]",https://scontent.cdninstagram.com/hphotos-xfa1/t51.2885-15/e15/11311586_475404272616318_1003250622_n.jpg
992411658096113339_51764508,2015-05-25 03:31:50,Normal,0,"[Tag: yee, Tag: djempire, Tag: famesundays]",https://scontent.cdninstagram.com/hphotos-xaf1/t51.2885-15/e15/11352870_1424063257915336_95878586_n.jpg
992411650978979173_230215998,2015-05-25 03:31:49,Normal,1,[Tag: followmeto],https://scontent.cdninstagram.com/hphotos-xfa1/t51.2885-15/e15/11287517_924509537619049_1564710369_n.jpg
992411636292400585_604872828,2015-05-25 03:31:47,Crema,0,[Tag: tmousatrip],https://scontent.cdninstagram.com/hphotos-xaf1/t51.2885-15/e15/11380044_1096829773665984_126851062_n.jpg
992411598180138040_10125078,2015-05-25 03:31:43,Valencia,0,"[Tag: cuestas, Tag: sanfrancisco, Tag: carcable, Tag: viajedenovios, Tag: ymascuestas, Tag: mayo2015, Tag: costaoeste, Tag: sf]",https://scontent.cdninstagram.com/hphotos-xaf1/t51.2885-15/e15/11370996_759689930816461_353659565_n.jpg
992411561666814853_317812311,2015-05-25 03:31:38,Normal,0,"[Tag: napavalley, Tag: dreamhome]",https://scontent.cdninstagram.com/hphotos-xaf1/t51.2885-15/e15/11378898_1660740740823131_476081060_n.jpg
992411558412749754_13993009,2015-05-25 03:31:38,Juno,1,[Tag: bac2015],https://scontent.cdninstagram.com/hphotos-xaf1/t51.2885-15/e15/11378133_691983324278374_1168655269_n.jpg
992411550964120172_11158453,2015-05-25 03:31:37,Mayfair,7,"[Tag: organic, Tag: plantbased, Tag: glutenfree, Tag: dairyfree, Tag: vegansofig, Tag: vegan, Tag: whatveganseat, Tag: thewholeingredient, Tag: veganfoodshare, Tag: realfood, Tag: meatfree, Tag: easyveganrecipe]",https://scontent.cdninstagram.com/hphotos-xaf1/t51.2885-15/e15/11271150_954554611232542_1790586891_n.jpg
992411502007149644_29337424,2015-05-25 03:31:31,Amaro,1,[Tag: 4505meats],https://scontent.cdninstagram.com/hphotos-xaf1/t51.2885-15/e15/11380981_1440316852952358_667638645_n.jpg
992411493644418213_185258118,2015-05-25 03:31:30,Normal,3,"[Tag: newbornnap, Tag: happybaby, Tag: sleepingbaby]",https://scontent.cdninstagram.com/hphotos-xfa1/t51.2885-15/e15/11379977_862522113821761_2116824762_n.jpg
992411492602878902_28531797,2015-05-25 03:31:30,Rise,0,"[Tag: tenderloinarea, Tag: sanfrancisco, Tag: memorialdayweekend, Tag: outwithfriends]",https://scontent.cdninstagram.com/hphotos-xaf1/t51.2885-15/e15/11313553_642049512597159_1971454640_n.jpg
992411409213785273_51323808,2015-05-25 03:31:20,Normal,2,[Tag: 🔥],https://scontent.cdninstagram.com/hphotos-xaf1/t51.2885-15/e15/11325963_1611144892464383_449398533_n.jpg
992411406772322044_18383438,2015-05-25 03:31:20,Normal,3,[Tag: wtf],https://scontent.cdninstagram.com/hphotos-xaf1/t51.2885-15/e15/11379322_699923503453206_1067708522_n.jpg
992411369733758633_20325646,2015-05-25 03:31:16,Normal,5,"[Tag: meow, Tag: catsofinstagram]",https://scontent.cdninstagram.com/hphotos-xaf1/t51.2885-15/e15/11355187_956796297704214_2010973637_n.jpg
992411230519266849_46388426,2015-05-25 03:30:59,Normal,2,"[Tag: lambbiryani, Tag: missiondistrict, Tag: sf, Tag: indianfood]",https://scontent.cdninstagram.com/hphotos-xfp1/t51.2885-15/e15/11176321_827593693989797_634592004_n.jpg
992411191024426945_42837182,2015-05-25 03:30:54,Normal,4,"[Tag: fullhouse, Tag: sanfrancisco, Tag: paintedladies, Tag: sanfran, Tag: victorian, Tag: architecture, Tag: postcardrow, Tag: photooftheday]",https://scontent.cdninstagram.com/hphotos-xfa1/t51.2885-15/e15/11374499_872551742816643_1399876066_n.jpg
992411166654796883_3731476,2015-05-25 03:30:51,Normal,15,[Tag: fhritp],https://scontent.cdninstagram.com/hphotos-xaf1/t51.2885-15/e15/11330581_1579778002296312_882440030_n.jpg
992411048949296515_1419924842,2015-05-25 03:30:37,Normal,0,"[Tag: carnival, Tag: dredog, Tag: 415, Tag: missiondistrict, Tag: buick, Tag: frisco, Tag: buickregal, Tag: oldschool, Tag: sesameastreet]",https://scontent.cdninstagram.com/hphotos-xfa1/t51.2885-15/e15/11282012_840450999325185_2106697321_n.jpg
992411028706640430_12053919,2015-05-25 03:30:35,Normal,1,"[Tag: scooter, Tag: goldengate, Tag: sf, Tag: selfiestick]",https://scontent.cdninstagram.com/hphotos-xfa1/t51.2885-15/e15/11283269_432950520217242_971550183_n.jpg
992411012591805201_246638607,2015-05-25 03:30:33,Normal,2,"[Tag: coffee, Tag: viewfromabove, Tag: ca, Tag: instacoffee, Tag: latte, Tag: california, Tag: sightglass, Tag: sanfrancisco, Tag: pistachio, Tag: croissant, Tag: mezzanine, Tag: wallpaperweekend, Tag: instafood, Tag: brekkiewithaview, Tag: artisan, Tag: vscocam, Tag: sf, Tag: blackberry]",https://scontent.cdninstagram.com/hphotos-xaf1/t51.2885-15/e15/11378529_447672705409946_2141183851_n.jpg
991688471920078694_2109607394,2015-05-24 03:34:59,Normal,14,"[Tag: namaste, Tag: sanfrancisco, Tag: burlingame, Tag: wellness, Tag: projectzen, Tag: massages, Tag: meow, Tag: health, Tag: massageme, Tag: fitness, Tag: sf, Tag: zen]",https://scontent.cdninstagram.com/hphotos-xfa1/t51.2885-15/e15/11371223_896565543734040_494920032_n.jpg
991688449572396326_303171974,2015-05-24 03:34:57,Mayfair,6,"[Tag: walkingalot, Tag: cornerbuilding, Tag: deco, Tag: sanfrancisco, Tag: california]",https://scontent.cdninstagram.com/hphotos-xaf1/t51.2885-15/e15/11352315_835065683214519_1842879767_n.jpg
991688433582817932_254771103,2015-05-24 03:34:55,Sierra,19,"[Tag: sanfran, Tag: favoritecityfavoritepeople, Tag: kinkhoa]",https://scontent.cdninstagram.com/hphotos-xaf1/t51.2885-15/e15/11325243_382895118578713_1552623888_n.jpg
991688366045521375_1263080504,2015-05-24 03:34:47,Normal,19,"[Tag: goldengatebridge, Tag: sanfrancisco]",https://scontent.cdninstagram.com/hphotos-xaf1/t51.2885-15/e15/11324941_1581971608720209_600224093_n.jpg
991688359351059074_1447900159,2015-05-24 03:34:46,Normal,11,[Tag: sweep],https://scontent.cdninstagram.com/hphotos-xaf1/t51.2885-15/e15/11351829_699168586878664_1072303319_n.jpg
991688284056638723_1003961844,2015-05-24 03:34:37,Normal,1,[Tag: soundtracking],https://scontent.cdninstagram.com/hphotos-xfa1/t51.2885-15/e15/11275313_834866079921441_187333305_n.jpg
991688239328971507_182252225,2015-05-24 03:34:32,Aden,8,"[Tag: san_francisco, Tag: street_jazz, Tag: homeless, Tag: 숲여행기]",https://scontent.cdninstagram.com/hphotos-xaf1/t51.2885-15/e15/11375131_825164600885480_1142291403_n.jpg
991688090682273081_542906674,2015-05-24 03:34:14,Normal,44,"[Tag: seasaltgrapefruitipa, Tag: seafarmer, Tag: ipa, Tag: craftbeer, Tag: specialtybeer, Tag: taproom, Tag: stephgonnasteph, Tag: liquidgoldsf, Tag: berkeley, Tag: gameover, Tag: seasalt, Tag: wearewarriors, Tag: sanfrancisco, Tag: onemoretogo, Tag: goldenstate, Tag: gswarriors, Tag: fieldworkbrewing, Tag: goldenstatewarriors, Tag: beer, Tag: stengthinnumbers, Tag: dubnation, Tag: justtapped, Tag: ilovecraftbeer, Tag: godubs, Tag: bottleshop]",https://scontent.cdninstagram.com/hphotos-xfa1/t51.2885-15/e15/11296814_828128360609978_1997210605_n.jpg
991688065946032655_184283397,2015-05-24 03:34:11,Aden,8,"[Tag: saturdaynight, Tag: inheaven, Tag: lounging, Tag: calmbeforethestorm, Tag: doireallyhavetogetup, Tag: sonerdingout, Tag: saturday, Tag: tryingtogetready]",https://scontent.cdninstagram.com/hphotos-xfa1/t51.2885-15/e15/11373716_439821672858273_1290125376_n.jpg
991688056908380761_214005349,2015-05-24 03:34:10,Hudson,31,"[Tag: sf, Tag: view]",https://scontent.cdninstagram.com/hphotos-xfa1/t51.2885-15/e15/11283164_390686761117939_940797289_n.jpg
991688050315093460_1263080504,2015-05-24 03:34:09,Reyes,15,"[Tag: lizisfreezing, Tag: goldengatebridge, Tag: windy, Tag: sanfrancisco]",https://scontent.cdninstagram.com/hphotos-xaf1/t51.2885-15/e15/11280220_919549624770461_1535342690_n.jpg
991687986740411675_301483022,2015-05-24 03:34:02,Inkwell,3,[Tag: staycationweekend],https://scontent.cdninstagram.com/hphotos-xaf1/t51.2885-15/e15/11378721_772373796203554_1187008445_n.jpg
991687910208706543_17615644,2015-05-24 03:33:52,Normal,39,"[Tag: getzugfanclub, Tag: groupiestakesf]",https://scontent.cdninstagram.com/hphotos-xaf1/t51.2885-15/e15/11379904_1594643344145911_1059107017_n.jpg
991687863234403225_3467501,2015-05-24 03:33:47,Normal,32,[Tag: california],https://scontent.cdninstagram.com/hphotos-xfa1/t51.2885-15/e15/11374481_1000606063283882_765631465_n.jpg
991687822144496090_2875055,2015-05-24 03:33:42,Amaro,2,"[Tag: pier, Tag: summer, Tag: sea, Tag: ferry, Tag: sunny, Tag: chilling]",https://scontent.cdninstagram.com/hphotos-xaf1/t51.2885-15/e15/11313316_527620204058844_98460641_n.jpg
991687818286387909_30345691,2015-05-24 03:33:41,Maven,14,"[Tag: sanfrancisco, Tag: timelapse, Tag: sunset]",https://scontent.cdninstagram.com/hphotos-xfa1/t51.2885-15/e15/11379794_415429265308793_2035698282_n.jpg
991687795428534611_196296769,2015-05-24 03:33:39,Normal,26,[Tag: sf❤️],https://scontent.cdninstagram.com/hphotos-xfa1/t51.2885-15/e15/11357459_1054767161218707_337614870_n.jpg
991687792987249442_12166573,2015-05-24 03:33:38,Normal,5,"[Tag: ipa, Tag: sanfrancisco, Tag: 415, Tag: saturday, Tag: bayarea, Tag: cali, Tag: california, Tag: sf]",https://scontent.cdninstagram.com/hphotos-xaf1/t51.2885-15/e15/11272962_453961544762200_308730146_n.jpg
991687788535483207_3244097,2015-05-24 03:33:38,Normal,23,[Tag: squirtlepond],https://scontent.cdninstagram.com/hphotos-xaf1/t51.2885-15/e15/11282194_1841390096085636_617961613_n.jpg
991687744689093472_5484941,2015-05-24 03:33:33,Crema,76,"[Tag: sanfrancisco, Tag: bakerbeach, Tag: sunset]",https://scontent.cdninstagram.com/hphotos-xaf1/t51.2885-15/e15/11282169_446465942191155_1809442042_n.jpg
991687694247807413_6214369,2015-05-24 03:33:27,Lo-fi,195,"[Tag: goals, Tag: prom2k15]",https://scontent.cdninstagram.com/hphotos-xaf1/t51.2885-15/e15/11263495_891494050908806_196233841_n.jpg
991687676839007383_16111988,2015-05-24 03:33:25,Normal,28,[Tag: selfystickoverload],https://scontent.cdninstagram.com/hphotos-xfa1/t51.2885-15/e15/11375402_1638034069764861_1254772608_n.jpg
991687614764141803_207952802,2015-05-24 03:33:17,Normal,7,[Tag: sanfrancisco],https://scontent.cdninstagram.com/hphotos-xaf1/t51.2885-15/e15/11311162_906025719464131_1907890501_n.jpg
991687573224525853_29418555,2015-05-24 03:33:12,Normal,127,"[Tag: vscocam, Tag: cityhall, Tag: sf, Tag: norcal]",https://scontent.cdninstagram.com/hphotos-xaf1/t51.2885-15/e15/11326368_1426280617692993_907161882_n.jpg
991687523688744553_13787528,2015-05-24 03:33:06,Rise,8,[Tag: cheatweekend],https://scontent.cdninstagram.com/hphotos-xaf1/t51.2885-15/e15/11337151_418145715030012_1558031576_n.jpg
991687480719707429_530475002,2015-05-24 03:33:01,Perpetua,15,"[Tag: goldengatebridge, Tag: sanfrancisco, Tag: roadtrip]",https://scontent.cdninstagram.com/hphotos-xfa1/t51.2885-15/e15/11378198_892786104093621_303869756_n.jpg
991687416421151983_31925124,2015-05-24 03:32:54,Normal,31,"[Tag: latepost, Tag: sushi, Tag: cucumberhandroll]",https://scontent.cdninstagram.com/hphotos-xfa1/t51.2885-15/e15/11312408_369917476549973_1361729071_n.jpg
991687337402262964_8301880,2015-05-24 03:32:44,Ludwig,4,"[Tag: halfamind, Tag: bff, Tag: snailmail]",https://scontent.cdninstagram.com/hphotos-xaf1/t51.2885-15/e15/11349450_932681650115792_1214489362_n.jpg
991687294326612260_20221735,2015-05-24 03:32:39,Normal,95,"[Tag: classof2015, Tag: shc, Tag: graduationday]",https://scontent.cdninstagram.com/hphotos-xfa1/t51.2885-15/e15/11265821_851128314924837_786101187_n.jpg
991687289789869885_211418194,2015-05-24 03:32:38,Normal,27,"[Tag: chickswhoride, Tag: bikes, Tag: ninja300, Tag: girlowned, Tag: kawasaki, Tag: kawigirl]",https://scontent.cdninstagram.com/hphotos-xfa1/t51.2885-15/e15/11351981_453164081513134_1148515517_n.jpg
991687242613898270_1416434718,2015-05-24 03:32:33,Clarendon,2,"[Tag: sanfransisco, Tag: saturday]",https://scontent.cdninstagram.com/hphotos-xaf1/t51.2885-15/e15/11327086_710041399106653_1512778260_n.jpg
991687239513831732_672500157,2015-05-24 03:32:32,Lo-fi,10,"[Tag: letsgodubs, Tag: basketball, Tag: sanfrancisco, Tag: warriors, Tag: insight, Tag: clutchcitywhat, Tag: ballislife, Tag: demandtobecompensated, Tag: dubnation, Tag: hometown, Tag: stephencurry, Tag: finals]",https://scontent.cdninstagram.com/hphotos-xaf1/t51.2885-15/e15/11325943_889951794395281_2144871573_n.jpg
991687237629550785_14473239,2015-05-24 03:32:32,Normal,77,"[Tag: nikon, Tag: teamnosleep, Tag: outinthemiddleofthenight, Tag: nocturnal, Tag: d5300]",https://scontent.cdninstagram.com/hphotos-xfa1/t51.2885-15/e15/11373596_1671642413071481_447535416_n.jpg
991687235858126061_1003961844,2015-05-24 03:32:32,Normal,0,[Tag: soundtracking],https://scontent.cdninstagram.com/hphotos-xaf1/l/t51.2885-15/e15/11230462_1584253998495338_1625162628_n.jpg
991687220870843031_9074929,2015-05-24 03:32:30,Normal,18,"[Tag: cute, Tag: alamosquare, Tag: tourist, Tag: happyanniversaryweekend, Tag: landmark, Tag: sf, Tag: instagood]",https://scontent.cdninstagram.com/hphotos-xfa1/t51.2885-15/e15/11257142_1450185698627632_1660619121_n.jpg
991687206289969427_194393491,2015-05-24 03:32:28,Earlybird,1,"[Tag: sanfrancisco, Tag: thecastro]",https://scontent.cdninstagram.com/hphotos-xaf1/t51.2885-15/e15/11375905_448188251973173_2141269389_n.jpg
991687162994244772_29761422,2015-05-24 03:32:23,Juno,84,[Tag: landsend],https://scontent.cdninstagram.com/hphotos-xaf1/t51.2885-15/e15/11326522_1624805427735586_494224690_n.jpg
991687161048110912_30056444,2015-05-24 03:32:23,Normal,47,"[Tag: stillburning, Tag: graffiti]",https://scontent.cdninstagram.com/hphotos-xfa1/t51.2885-15/e15/11324489_103047403366034_1498122037_n.jpg
991687032107918897_1709377520,2015-05-24 03:32:08,Ludwig,11,"[Tag: thuglife, Tag: 19hashtags, Tag: cocktail, Tag: selfie, Tag: drink, Tag: kimkardashian, Tag: jasperscornertapsf, Tag: selfiesaturday, Tag: eatsf, Tag: craftcocktails, Tag: socialsaturday, Tag: jasperfries, Tag: service, Tag: duckface, Tag: industry, Tag: hoh, Tag: gowarriors, Tag: jasperscornertap, Tag: foh]",https://scontent.cdninstagram.com/hphotos-xfa1/t51.2885-15/e15/11246309_837244849689428_97817154_n.jpg
991687031972866231_215686705,2015-05-24 03:32:08,Normal,16,"[Tag: foodporn, Tag: octopus, Tag: seafood, Tag: masonpacific, Tag: bacon, Tag: frenchfood]",https://scontent.cdninstagram.com/hphotos-xaf1/t51.2885-15/e15/11377635_1598398400438545_485884721_n.jpg
991686990434565576_182338742,2015-05-24 03:32:03,Juno,8,"[Tag: bridge, Tag: goldengate, Tag: sanfrancisco]",https://scontent.cdninstagram.com/hphotos-xaf1/t51.2885-15/e15/11357800_655905801221075_1816961381_n.jpg
991686972546344028_190420120,2015-05-24 03:32:01,Normal,7,[Tag: grandviewpark],https://scontent.cdninstagram.com/hphotos-xaf1/t51.2885-15/e15/11372181_1612748419011703_99140356_n.jpg
991686956576357032_1289296997,2015-05-24 03:31:59,Juno,17,[Tag: cocktails],https://scontent.cdninstagram.com/hphotos-xfa1/t51.2885-15/e15/11380139_891115460935135_2055681741_n.jpg
991686922997834262_473938047,2015-05-24 03:31:55,Normal,48,"[Tag: sanfransico, Tag: iamdiggingthisbeanie]",https://scontent.cdninstagram.com/hphotos-xaf1/t51.2885-15/e15/11328490_783682878412898_1766484995_n.jpg
