ID,Created At,Filter,Number of Likes,HashTags,url
992413414257897360_313782858,2015-05-25 03:35:19,Normal,0,[Tag: interiordesign],https://scontent.cdninstagram.com/hphotos-xfa1/t51.2885-15/e15/11333759_753726391406991_859084302_n.jpg
992413375242433532_19532811,2015-05-25 03:35:15,Lark,0,"[Tag: foodandmusic, Tag: foodie, Tag: glutenfree, Tag: vegan, Tag: raw, Tag: dinner, Tag: vancouver, Tag: acorn]",https://scontent.cdninstagram.com/hphotos-xaf1/t51.2885-15/e15/11272072_357798467762417_937816547_n.jpg
992413282354445479_247406902,2015-05-25 03:35:04,Normal,1,[Tag: explorebc],https://scontent.cdninstagram.com/hphotos-xaf1/t51.2885-15/e15/11358948_641543122657271_1808393791_n.jpg
992413279987175553_218915259,2015-05-25 03:35:03,Willow,0,"[Tag: vancity, Tag: vancouver, Tag: yvr]",https://scontent.cdninstagram.com/hphotos-xaf1/t51.2885-15/e15/11380780_825916390834881_1179017393_n.jpg
992413172547782680_2029717113,2015-05-25 03:34:50,Normal,0,"[Tag: aot, Tag: snk, Tag: attackontitan]",https://scontent.cdninstagram.com/hphotos-xaf1/t51.2885-15/e15/11355291_1578211439119640_252416197_n.jpg
992413115909817271_233798983,2015-05-25 03:34:44,Normal,0,"[Tag: futureislands, Tag: explorebc, Tag: yvr]",https://scontent.cdninstagram.com/hphotos-xfa1/t51.2885-15/e15/11267360_850441648326254_484341601_n.jpg
992413101674246804_210563883,2015-05-25 03:34:42,Normal,1,"[Tag: simplepleasures, Tag: wildones, Tag: details, Tag: sweettreat, Tag: spring, Tag: naturesbeauty]",https://scontent.cdninstagram.com/hphotos-xfa1/t51.2885-15/e15/11372402_1488419288049713_815862922_n.jpg
992413018508270310_31802597,2015-05-25 03:34:32,Normal,2,"[Tag: canada, Tag: vancouver, Tag: sunset]",https://scontent.cdninstagram.com/hphotos-xfa1/t51.2885-15/e15/11385635_696459953813657_1816922107_n.jpg
992412944891949149_14884651,2015-05-25 03:34:23,Lark,2,"[Tag: green, Tag: injurydiaries, Tag: friends, Tag: wallfie]",https://scontent.cdninstagram.com/hphotos-xaf1/t51.2885-15/e15/11357905_1586875411592932_1285161651_n.jpg
992412839828557916_189235291,2015-05-25 03:34:11,Normal,1,"[Tag: foodcoma, Tag: vancity, Tag: foodie, Tag: meat, Tag: celebrate, Tag: vanfoodie, Tag: japanese, Tag: beer, Tag: yakitori, Tag: foodpic, Tag: asian, Tag: bbq, Tag: drinks]",https://scontent.cdninstagram.com/hphotos-xaf1/t51.2885-15/e15/11244420_761795793919269_901283077_n.jpg
992412837281069664_33522877,2015-05-25 03:34:10,Normal,0,[Tag: pikeplace],https://scontent.cdninstagram.com/hphotos-xfa1/t51.2885-15/e15/11325770_1013275265349220_766663816_n.jpg
992412828227104723_18270282,2015-05-25 03:34:09,Reyes,2,"[Tag: me, Tag: art, Tag: artist, Tag: metal, Tag: tree, Tag: artsy, Tag: instagood, Tag: hipster, Tag: artistic, Tag: follow, Tag: fun, Tag: smile, Tag: sculpture, Tag: picoftheday]",https://scontent.cdninstagram.com/hphotos-xaf1/t51.2885-15/e15/11264523_1588884824721241_260357417_n.jpg
992412735687955653_20784164,2015-05-25 03:33:58,Normal,2,[Tag: mandiddle2014],https://scontent.cdninstagram.com/hphotos-xfa1/t51.2885-15/e15/11313668_883795505033287_176435207_n.jpg
992412731969679813_1099557091,2015-05-25 03:33:58,Hefe,1,"[Tag: foto, Tag: beautifulbc, Tag: cable, Tag: photo, Tag: signal, Tag: pic, Tag: señal, Tag: drums, Tag: torre, Tag: bowenisland, Tag: tower, Tag: thesummit]",https://scontent.cdninstagram.com/hphotos-xaf1/t51.2885-15/e15/11376526_1428465844129444_214553285_n.jpg
992412702566957597_1635851455,2015-05-25 03:33:54,Valencia,0,[Tag: coast],https://scontent.cdninstagram.com/hphotos-xfa1/t51.2885-15/e15/11372192_1657202871174939_510762286_n.jpg
992412656439528529_11387946,2015-05-25 03:33:49,Normal,0,[Tag: vintageneedlepointart],https://scontent.cdninstagram.com/hphotos-xaf1/t51.2885-15/e15/11349363_1012538475430628_807722505_n.jpg
992412648302146821_234762524,2015-05-25 03:33:48,Normal,0,"[Tag: lastmealinyvr, Tag: traditionaljapanese, Tag: awesome, Tag: yvrsbest, Tag: sogood, Tag: hiddengem, Tag: japanesefood, Tag: amazing, Tag: comfortfood, Tag: yum, Tag: latergram, Tag: yvrfood, Tag: yvreats, Tag: authentic, Tag: legit]",https://scontent.cdninstagram.com/hphotos-xaf1/t51.2885-15/e15/11374044_659528080849426_999261246_n.jpg
992412625650566609_35935240,2015-05-25 03:33:45,Juno,0,"[Tag: rainbow, Tag: salad, Tag: lunch, Tag: fresh, Tag: jerf, Tag: vegan]",https://scontent.cdninstagram.com/hphotos-xaf1/t51.2885-15/e15/11312055_1669116323317228_121301923_n.jpg
992412601107051054_271871755,2015-05-25 03:33:42,Normal,0,"[Tag: homecooking, Tag: tzatziki, Tag: greeknight]",https://scontent.cdninstagram.com/hphotos-xaf1/t51.2885-15/e15/11326435_1440195719631783_1950118985_n.jpg
992412542539964265_702343878,2015-05-25 03:33:35,Normal,11,"[Tag: life, Tag: picnic, Tag: englishbay, Tag: snacks, Tag: food, Tag: dessert, Tag: rawvegan, Tag: vegan, Tag: paleo, Tag: raw, Tag: delicious, Tag: fastfood, Tag: salad, Tag: wraps, Tag: organic, Tag: brownies, Tag: whatislife, Tag: healthy, Tag: plantbased, Tag: eats, Tag: greatsunset, Tag: vancouver, Tag: deliciousfood, Tag: beach, Tag: nongmo]",https://scontent.cdninstagram.com/hphotos-xfa1/t51.2885-15/e15/11325338_1470218139936464_886689388_n.jpg
992412487231056225_1811531129,2015-05-25 03:33:29,Normal,0,"[Tag: canada, Tag: vancouverlife, Tag: vancouver, Tag: englishbay, Tag: bc, Tag: guinness, Tag: stanleypark]",https://scontent.cdninstagram.com/hphotos-xaf1/t51.2885-15/e15/11282167_471991076288682_146297625_n.jpg
992412447721360204_1483761761,2015-05-25 03:33:24,Mayfair,0,"[Tag: downtown, Tag: northvancouver, Tag: sea]",https://scontent.cdninstagram.com/hphotos-xfa1/t51.2885-15/e15/11274344_1382596115372998_54674517_n.jpg
992412411700903006_144451982,2015-05-25 03:33:20,Normal,0,"[Tag: explorebc, Tag: squamish]",https://scontent.cdninstagram.com/hphotos-xfa1/t51.2885-15/e15/11380991_892024224187586_1283226309_n.jpg
992412358182368302_237957748,2015-05-25 03:33:13,X-Pro II,1,"[Tag: vancouver, Tag: meetingnewpeople, Tag: friends, Tag: sundaynights, Tag: alibi]",https://scontent.cdninstagram.com/hphotos-xaf1/t51.2885-15/e15/11385601_1397656937229316_1898080406_n.jpg
992412312162122774_1436497414,2015-05-25 03:33:08,Normal,4,"[Tag: thisiskitandace, Tag: meetkit]",https://scontent.cdninstagram.com/hphotos-xaf1/t51.2885-15/e15/11357325_802755129779660_184194661_n.jpg
992412222485670066_35835233,2015-05-25 03:32:57,Normal,4,"[Tag: beautiful, Tag: vivavancity, Tag: sunset_madness, Tag: westcoastbestcoast, Tag: veryvancouver, Tag: world_bestsky, Tag: explorecanada, Tag: vancity, Tag: sunsetlovers, Tag: yacht, Tag: pacificoceansunsets, Tag: vancitybuzz, Tag: explorebc, Tag: vancouver, Tag: falsecreek, Tag: vancouverisawesome, Tag: britishcolumbia, Tag: sunset_perfection, Tag: thisviewtho, Tag: pacificoceanview, Tag: view]",https://scontent.cdninstagram.com/hphotos-xaf1/t51.2885-15/e15/11352955_817159435046328_1843998296_n.jpg
992412182584913792_947623994,2015-05-25 03:32:52,Normal,1,"[Tag: cactusclubcafe, Tag: proposal, Tag: love, Tag: englishbay]",https://scontent.cdninstagram.com/hphotos-xfa1/t51.2885-15/e15/11327045_643665442435157_1834775738_n.jpg
992412152972959943_214488831,2015-05-25 03:32:49,Lark,1,"[Tag: goodlife, Tag: keepthevacationgoing, Tag: thewarondrugs, Tag: happy]",https://scontent.cdninstagram.com/hphotos-xaf1/t51.2885-15/e15/11356659_1589939351284382_14361939_n.jpg
992412115774793658_1708785824,2015-05-25 03:32:44,Normal,0,[Tag: megdiy],https://scontent.cdninstagram.com/hphotos-xfa1/t51.2885-15/e15/11264291_973035229387860_1682311692_n.jpg
992412047441192887_1708785824,2015-05-25 03:32:36,Normal,0,[Tag: megdiy],https://scontent.cdninstagram.com/hphotos-xaf1/t51.2885-15/e15/11378281_1634380406798279_1837778050_n.jpg
992411995020202085_218915259,2015-05-25 03:32:30,Normal,3,"[Tag: vancouverfood, Tag: vancity, Tag: vancouver, Tag: yvr]",https://scontent.cdninstagram.com/hphotos-xaf1/t51.2885-15/e15/11287594_386257601566244_1222389693_n.jpg
992411973742302383_20784164,2015-05-25 03:32:27,Normal,2,[Tag: mandiddle2014],https://scontent.cdninstagram.com/hphotos-xfa1/t51.2885-15/e15/11330636_1640615506150111_1015832194_n.jpg
992411945757174485_36398449,2015-05-25 03:32:24,Reyes,2,"[Tag: art, Tag: perspectives, Tag: yvr, Tag: vancouver, Tag: publicart, Tag: sky]",https://scontent.cdninstagram.com/hphotos-xaf1/t51.2885-15/e15/11373517_1441263469502726_513461343_n.jpg
992411914533373713_322102080,2015-05-25 03:32:20,Lark,11,"[Tag: northernlightsbcplace, Tag: northernlights, Tag: purple, Tag: roof, Tag: bcss, Tag: vancouver, Tag: igers, Tag: stadium, Tag: bcplace]",https://scontent.cdninstagram.com/hphotos-xaf1/t51.2885-15/e15/11325963_1436432109995831_377283714_n.jpg
992411849369380788_1708785824,2015-05-25 03:32:13,Normal,0,[Tag: megdiy],https://scontent.cdninstagram.com/hphotos-xaf1/t51.2885-15/e15/11271054_995129837164150_790326318_n.jpg
992411814181970891_34738559,2015-05-25 03:32:09,Valencia,0,"[Tag: deadeyes, Tag: expressionlessselfie, Tag: shameless]",https://scontent.cdninstagram.com/hphotos-xaf1/t51.2885-15/e15/11385606_854618414629663_1842756381_n.jpg
992411778177529117_311888036,2015-05-25 03:32:04,Normal,9,"[Tag: happyhannah, Tag: boogaloosam, Tag: bigleaf, Tag: live, Tag: culturallydefinedworkshop, Tag: hiphop, Tag: diamonds, Tag: popping]",https://scontent.cdninstagram.com/hphotos-xaf1/t51.2885-15/e15/11374012_810959398990734_195969352_n.jpg
992411762899609520_1708785824,2015-05-25 03:32:02,Normal,0,[Tag: megdiy],https://scontent.cdninstagram.com/hphotos-xfa1/t51.2885-15/e15/11372069_1634049443475349_256696242_n.jpg
992411706435388952_839395336,2015-05-25 03:31:56,Normal,9,"[Tag: landscape, Tag: vancouver, Tag: 얼스타그램, Tag: 셀스타그램, Tag: selfie, Tag: travel, Tag: daily]",https://scontent.cdninstagram.com/hphotos-xfa1/t51.2885-15/e15/11357504_647079762060786_1994960329_n.jpg
992411681537796954_18620137,2015-05-25 03:31:53,Rise,4,"[Tag: losgatos, Tag: champions, Tag: keepersquad]",https://scontent.cdninstagram.com/hphotos-xaf1/t51.2885-15/e15/11325720_823806324339419_939427300_n.jpg
992411679785281454_1708785824,2015-05-25 03:31:52,Normal,0,[Tag: megdiy],https://scontent.cdninstagram.com/hphotos-xaf1/t51.2885-15/e15/11326422_1680935252126313_1699381525_n.jpg
992411665493062689_237957748,2015-05-25 03:31:51,X-Pro II,0,"[Tag: friends, Tag: birthdaybliss, Tag: alibi, Tag: sundaynights]",https://scontent.cdninstagram.com/hphotos-xaf1/t51.2885-15/e15/11326413_1622942071252386_1170546818_n.jpg
992411612158577130_1387098025,2015-05-25 03:31:44,Normal,2,"[Tag: foodstagram, Tag: foodie, Tag: foodporn, Tag: food, Tag: japanese, Tag: hungry, Tag: yum, Tag: yummy]",https://scontent.cdninstagram.com/hphotos-xaf1/t51.2885-15/e15/11355163_826685844092081_964176317_n.jpg
992411560997148607_13663700,2015-05-25 03:31:38,Normal,25,"[Tag: flex, Tag: bathroomselfie, Tag: fitness, Tag: girlsthatlift, Tag: muscular, Tag: selfies, Tag: muscleissexy, Tag: bikinicompetitior, Tag: fitgirls, Tag: bodybuilding, Tag: girlswithmuscle, Tag: beastmode, Tag: biceps, Tag: lifestyle, Tag: fit, Tag: healthy, Tag: bikini, Tag: flexing, Tag: vascular, Tag: veins, Tag: vanfitfam, Tag: muscle, Tag: vancityfitchicks, Tag: happy]",https://scontent.cdninstagram.com/hphotos-xaf1/t51.2885-15/e15/11378107_1475267446098413_266254048_n.jpg
992411532978554030_21173072,2015-05-25 03:31:35,Valencia,0,[Tag: happybirthday],https://scontent.cdninstagram.com/hphotos-xaf1/t51.2885-15/e15/11333442_406762489508086_1649392258_n.jpg
992411515116906409_1708785824,2015-05-25 03:31:33,Normal,0,[Tag: megdiy],https://scontent.cdninstagram.com/hphotos-xfa1/t51.2885-15/e15/11326613_950678491650119_1763771898_n.jpg
992411466113934449_42279024,2015-05-25 03:31:27,Amaro,3,"[Tag: vancity, Tag: getoffthebikepath, Tag: apresbeerisland, Tag: followtheleader, Tag: ryangoslings, Tag: sundayfunday]",https://scontent.cdninstagram.com/hphotos-xaf1/t51.2885-15/e15/11373867_512478015568986_849884955_n.jpg
992411397183514799_276672825,2015-05-25 03:31:19,Normal,0,"[Tag: britishcolumbia, Tag: getoutstayout, Tag: exploremore, Tag: letsgosomewhere, Tag: goalzero, Tag: neverstopexploring, Tag: mecnation, Tag: vancouverite, Tag: patagonia, Tag: ilovebc, Tag: explorecanada, Tag: canada, Tag: northwestisbest, Tag: vsco, Tag: humanpoweredadventures, Tag: livesimplelivebold, Tag: canadian, Tag: 31nightsout, Tag: momentsmakethejourney, Tag: wildsights, Tag: meetthemoment, Tag: funhogging, Tag: outdoors, Tag: justpassingthrough, Tag: hellobc, Tag: explorebc, Tag: livebetterstories]",https://scontent.cdninstagram.com/hphotos-xaf1/t51.2885-15/e15/11355780_651586658307117_1628834045_n.jpg
992411308563371674_41380004,2015-05-25 03:31:08,Normal,4,"[Tag: canada, Tag: noordamerika, Tag: travel, Tag: bestofcanada, Tag: travelmars, Tag: britishcolombia, Tag: vancouver, Tag: jenmtravel, Tag: travelgram, Tag: reisblogger, Tag: reizen, Tag: explorecanada]",https://scontent.cdninstagram.com/hphotos-xaf1/t51.2885-15/e15/11378326_1585809441693419_1830388753_n.jpg
992411289086968316_5866903,2015-05-25 03:31:06,Inkwell,3,[Tag: awildplease],https://scontent.cdninstagram.com/hphotos-xfa1/t51.2885-15/e15/11358098_953978311321300_1046338167_n.jpg
992411269979220879_187553369,2015-05-25 03:31:04,Normal,2,[Tag: nofilter],https://scontent.cdninstagram.com/hphotos-xfa1/t51.2885-15/e15/11330648_565603736915945_447470361_n.jpg
992411185387861011_237957748,2015-05-25 03:30:54,Normal,1,"[Tag: bachelorette, Tag: patio]",https://scontent.cdninstagram.com/hphotos-xfa1/t51.2885-15/e15/11357903_392620290944851_1809419435_n.jpg
992411176688874514_237957748,2015-05-25 03:30:53,Normal,2,"[Tag: nofilter, Tag: vancouver]",https://scontent.cdninstagram.com/hphotos-xaf1/t51.2885-15/e15/11356494_1164601973566580_1128134826_n.jpg
992411174559416959_309733967,2015-05-25 03:30:52,Normal,1,"[Tag: hooray, Tag: joestrummer, Tag: gabysalter]",https://scontent.cdninstagram.com/hphotos-xaf1/t51.2885-15/e15/10891080_899928490067834_796374271_n.jpg
992411069818230751_234787964,2015-05-25 03:30:40,Normal,3,"[Tag: goodfinds, Tag: westend, Tag: daviest, Tag: kurtoskalacs, Tag: dessert, Tag: chimneycake, Tag: hiddengem, Tag: vancouver, Tag: treat, Tag: yum, Tag: hungariantreat, Tag: theundomesticatedkitchen]",https://scontent.cdninstagram.com/hphotos-xfa1/t51.2885-15/e15/11313305_587124301390379_1681563347_n.jpg
992411005551036811_1355575945,2015-05-25 03:30:32,Juno,2,"[Tag: downtown, Tag: lunchdate, Tag: milestones, Tag: treat, Tag: strawberry, Tag: sundayfunday, Tag: margarita]",https://scontent.cdninstagram.com/hphotos-xaf1/t51.2885-15/e15/11380147_1571016576482396_1029830774_n.jpg
992410969118582567_7090232,2015-05-25 03:30:28,Normal,4,"[Tag: canada, Tag: richardvegatattoos, Tag: eagletattoo, Tag: blackandgrey, Tag: mapleleaf, Tag: inprocess, Tag: vancouvertattoo]",https://scontent.cdninstagram.com/hphotos-xaf1/t51.2885-15/e15/11271049_983109568379462_1323711502_n.jpg
992410965226197464_586810163,2015-05-25 03:30:27,Normal,0,"[Tag: lolitascantina, Tag: cheapeatsvancity, Tag: vanfood, Tag: delicious, Tag: dinnerspecial, Tag: vancouverrestaurants]",https://scontent.cdninstagram.com/hphotos-xaf1/t51.2885-15/e15/11326494_440804666080751_1247360369_n.jpg
992410902028636235_874567323,2015-05-25 03:30:20,Valencia,1,"[Tag: imakereservationsfordinner, Tag: workhardplayhard, Tag: vancouverbc]",https://scontent.cdninstagram.com/hphotos-xaf1/t51.2885-15/e15/11335044_398023637047932_1335508068_n.jpg
992410738315220503_261656012,2015-05-25 03:30:00,Normal,1,[Tag: lumberjackstatus],https://scontent.cdninstagram.com/hphotos-xaf1/t51.2885-15/e15/11373951_496824140467755_1078673062_n.jpg
992410577424039629_1067733278,2015-05-25 03:29:41,Normal,0,"[Tag: silverface, Tag: 33acres, Tag: marshall, Tag: bassman, Tag: fender, Tag: tubes, Tag: beer]",https://scontent.cdninstagram.com/hphotos-xaf1/t51.2885-15/e15/11351658_635839386551403_167865763_n.jpg
992410559242877997_53175302,2015-05-25 03:29:39,Normal,8,"[Tag: birthdayboy, Tag: 1, Tag: timeflies, Tag: somuchlove]",https://scontent.cdninstagram.com/hphotos-xaf1/t51.2885-15/e15/11282586_1587232201531453_1292912554_n.jpg
992410507845832780_218915259,2015-05-25 03:29:33,Normal,3,"[Tag: vancity, Tag: yvr, Tag: stanleypark, Tag: water, Tag: skyline, Tag: vancouver, Tag: boats, Tag: pacificnorthwest, Tag: seawall]",https://scontent.cdninstagram.com/hphotos-xaf1/t51.2885-15/e15/11376060_972281922790910_189548987_n.jpg
992410475943838682_1725505143,2015-05-25 03:29:29,Normal,5,"[Tag: canon😎📷📷📷, Tag: большехештегов, Tag: love, Tag: goodfriend, Tag: beauty, Tag: picture, Tag: photo, Tag: фотограф, Tag: photographer, Tag: селфи, Tag: давайдавай, Tag: zaraearrings, Tag: instadaily, Tag: vsco, Tag: girl, Tag: best, Tag: canada, Tag: vancity, Tag: bestofvsco, Tag: ура, Tag: instafollow, Tag: верныйдруг, Tag: instagood, Tag: фотографич, Tag: instalike, Tag: zara, Tag: vscocam, Tag: instamood, Tag: friend]",https://scontent.cdninstagram.com/hphotos-xaf1/t51.2885-15/e15/11356773_767983953321103_1994812227_n.jpg
992410423251284526_1203059715,2015-05-25 03:29:23,Normal,30,"[Tag: nutrition, Tag: salad, Tag: fitfam, Tag: holisticnutrition, Tag: carrots, Tag: vegan, Tag: holistichealth, Tag: raw, Tag: beets, Tag: herbivore, Tag: naturalnutrition, Tag: holistic, Tag: organic, Tag: plantstrong, Tag: plantbased, Tag: vegansofig, Tag: vegetarian, Tag: whatveganseat, Tag: health, Tag: eatclean, Tag: veganfoodshare, Tag: fitness, Tag: fresh]",https://scontent.cdninstagram.com/hphotos-xfa1/t51.2885-15/e15/11378654_483515581802969_1897109519_n.jpg
992410376492830150_1701474370,2015-05-25 03:29:17,Normal,3,"[Tag: picoftheday, Tag: justdance, Tag: greatness, Tag: bfwmagazine, Tag: warriorfitgirl, Tag: bfwinspire, Tag: blackballerina]",https://scontent.cdninstagram.com/hphotos-xaf1/t51.2885-15/e15/11330565_1647466242153815_697158894_n.jpg
991688869421987706_26846740,2015-05-24 03:35:47,Normal,8,"[Tag: catstagram, Tag: tuxedocats, Tag: ilovemycat, Tag: tuxedocatsofinstagram, Tag: bcspca, Tag: catsofinstagram, Tag: caturday, Tag: cats_of_instagram, Tag: silly, Tag: sally, Tag: igcats]",https://scontent.cdninstagram.com/hphotos-xaf1/t51.2885-15/e15/11327835_1581456815438649_2006209991_n.jpg
991688837259645294_289616331,2015-05-24 03:35:43,Normal,13,"[Tag: gastown, Tag: bloodalley, Tag: vsco, Tag: vancouver, Tag: vscocam]",https://scontent.cdninstagram.com/hphotos-xaf1/t51.2885-15/e15/11379121_448734711974360_164480248_n.jpg
991688816815814309_321410556,2015-05-24 03:35:41,Normal,74,"[Tag: pink, Tag: peony, Tag: travel, Tag: rings, Tag: gypsy, Tag: boho, Tag: moonstone, Tag: vancouver, Tag: chevron, Tag: gypsett, Tag: kits]",https://scontent.cdninstagram.com/hphotos-xaf1/t51.2885-15/e15/11240310_1565341970385725_2118202647_n.jpg
991688802785035969_260273840,2015-05-24 03:35:39,Amaro,8,[Tag: cristyandjames],https://scontent.cdninstagram.com/hphotos-xaf1/t51.2885-15/e15/11313640_857744837626620_1819664894_n.jpg
991688682279219727_1368955459,2015-05-24 03:35:24,Normal,32,"[Tag: finderskeepers, Tag: instancefinderskeepers, Tag: uncommonthread, Tag: socks, Tag: free]",https://scontent.cdninstagram.com/hphotos-xaf1/t51.2885-15/e15/11357800_1826281890930828_2056077688_n.jpg
991688558036289662_1470376185,2015-05-24 03:35:10,Valencia,19,"[Tag: vancouver, Tag: bostonterrierpuppy, Tag: cutenessoverload, Tag: iwantadog, Tag: kisses, Tag: bostonterrier]",https://scontent.cdninstagram.com/hphotos-xfa1/t51.2885-15/e15/11334410_1020644084637170_3312230_n.jpg
991688514014873681_513137,2015-05-24 03:35:04,Aden,215,[Tag: laughcoma],https://scontent.cdninstagram.com/hphotos-xfa1/t51.2885-15/e15/11265968_469959089835381_883823801_n.jpg
991688341016812143_177333333,2015-05-24 03:34:44,Hudson,5,[Tag: vancouver],https://scontent.cdninstagram.com/hphotos-xaf1/t51.2885-15/e15/11377546_630812077049843_1334051713_n.jpg
991688268850778788_1525674467,2015-05-24 03:34:35,Normal,39,"[Tag: 458, Tag: aventador, Tag: lamborghini, Tag: ferrari, Tag: spider]",https://scontent.cdninstagram.com/hphotos-xaf1/t51.2885-15/e15/11372310_713446015432065_361484652_n.jpg
991688174336695661_176569822,2015-05-24 03:34:24,Normal,32,"[Tag: canada, Tag: typicaltourists, Tag: vancouver, Tag: stanleypark, Tag: maplesyrup]",https://scontent.cdninstagram.com/hphotos-xaf1/t51.2885-15/e15/11324890_841357829251909_385330041_n.jpg
991687915630634827_24953464,2015-05-24 03:33:53,Normal,81,"[Tag: childhoodunplugged, Tag: vsco, Tag: vscokids, Tag: vscogood, Tag: vscocam, Tag: kidsforreal]",https://scontent.cdninstagram.com/hphotos-xaf1/t51.2885-15/e15/11381467_1591143197826718_2023877604_n.jpg
991687758166960778_174032377,2015-05-24 03:33:34,Normal,46,"[Tag: vancouver, Tag: englishbay]",https://scontent.cdninstagram.com/hphotos-xaf1/t51.2885-15/e15/11280582_500151483473998_492144623_n.jpg
991687730985513531_233375075,2015-05-24 03:33:31,Normal,13,[Tag: vancouver],https://scontent.cdninstagram.com/hphotos-xaf1/t51.2885-15/e15/11357952_109232239411115_579278102_n.jpg
991687611650881374_26846740,2015-05-24 03:33:17,Normal,8,"[Tag: catstagram, Tag: tuxedocats, Tag: ilovemycat, Tag: tuxedocatsofinstagram, Tag: catsofinstagram, Tag: caturday, Tag: cats_of_instagram, Tag: igcats, Tag: silly, Tag: sally, Tag: catslife]",https://scontent.cdninstagram.com/hphotos-xfa1/t51.2885-15/e15/11325218_1429908177317884_1123049632_n.jpg
991687581803340706_420090887,2015-05-24 03:33:13,Normal,36,"[Tag: vscopicture, Tag: goexplore, Tag: beautifulbc, Tag: nature, Tag: vancouverisawesome, Tag: letsgosomewhere, Tag: vscocool, Tag: instaphoto, Tag: britishcolumbia, Tag: instadaily, Tag: vscogrid, Tag: justgoshoot, Tag: landscape, Tag: inspiration, Tag: 2instagood, Tag: thatsdarling, Tag: vscogood, Tag: photographyislifee, Tag: livefolk, Tag: liveauthentic, Tag: instagood, Tag: byewinter, Tag: goodvibes, Tag: vancouver, Tag: wonderful_places, Tag: vscogram, Tag: vscocam, Tag: amazing, Tag: picoftheday, Tag: photooftheday]",https://scontent.cdninstagram.com/hphotos-xfa1/t51.2885-15/e15/11374694_829021077172821_663784588_n.jpg
991687568290498449_506082064,2015-05-24 03:33:12,Willow,14,"[Tag: endoftheworld, Tag: safetyfirst, Tag: ready, Tag: selfie, Tag: partytime, Tag: boom]",https://scontent.cdninstagram.com/hphotos-xaf1/t51.2885-15/e15/11351862_1444405915874516_98631461_n.jpg
991687541168775428_1371935743,2015-05-24 03:33:08,Normal,200,[Tag: outandabout💓],https://scontent.cdninstagram.com/hphotos-xaf1/t51.2885-15/e15/11351026_608380962630533_1841708251_n.jpg
991687484746381250_8245140,2015-05-24 03:33:02,Normal,138,[Tag: granvilleislanding],https://scontent.cdninstagram.com/hphotos-xaf1/t51.2885-15/e15/11371144_677460199027018_2112112429_n.jpg
991687426982779999_618265486,2015-05-24 03:32:55,Vesper,34,"[Tag: lliv, Tag: luckyladyiv]",https://scontent.cdninstagram.com/hphotos-xaf1/t51.2885-15/e15/11377911_358989614303482_1626777467_n.jpg
991687390181696943_204685232,2015-05-24 03:32:50,Normal,14,"[Tag: toolbox, Tag: lady, Tag: makersgonnamake]",https://scontent.cdninstagram.com/hphotos-xfa1/t51.2885-15/e15/11269184_779141978869980_670979739_n.jpg
991687280207890998_1419381057,2015-05-24 03:32:37,Normal,11,"[Tag: foodstagram, Tag: 맛집, Tag: 디저트다그램, Tag: bc, Tag: food, Tag: dessert, Tag: thierry, Tag: 먹어본것중제일맛남, Tag: 디저트, Tag: downtown, Tag: 띠어리, Tag: 입에서살살녹음, Tag: delicious, Tag: cafe, Tag: alberni, Tag: canada, Tag: 추천, Tag: 벤쿠버맛집, Tag: 저기서일할까말까, Tag: 고민중, Tag: patisserie, Tag: bakery, Tag: st, Tag: tiramisu, Tag: 대애애애애애박, Tag: vancouver, Tag: dessertgram, Tag: 베이커리, Tag: foodoftheday]",https://scontent.cdninstagram.com/hphotos-xfa1/t51.2885-15/e15/11351564_360500800809188_843848019_n.jpg
991687262676754735_1779817087,2015-05-24 03:32:35,Normal,14,"[Tag: wellahair, Tag: ombre, Tag: freelights, Tag: hair, Tag: vancouver, Tag: vancouverhairstylist, Tag: blonde, Tag: wella]",https://scontent.cdninstagram.com/hphotos-xfa1/t51.2885-15/e15/11356493_1572893579644619_571054840_n.jpg
991686883404397404_727923821,2015-05-24 03:31:50,Lo-fi,19,"[Tag: familybusiness, Tag: irishpub, Tag: mussels, Tag: whatwesee, Tag: ambassadorlife, Tag: downtownvancouver, Tag: downtownambassadors, Tag: nachos, Tag: oceanview, Tag: patio, Tag: drinks]",https://scontent.cdninstagram.com/hphotos-xaf1/t51.2885-15/e15/11281989_1471081096517297_1952837438_n.jpg
991686699086710407_144355704,2015-05-24 03:31:28,Ludwig,11,[Tag: patintero],https://scontent.cdninstagram.com/hphotos-xaf1/t51.2885-15/e15/11313502_1842933195932448_1215700384_n.jpg
991686675297234335_353626306,2015-05-24 03:31:25,Normal,27,"[Tag: vancouver, Tag: 밴쿠버, Tag: pho]",https://scontent.cdninstagram.com/hphotos-xfa1/t51.2885-15/e15/11349356_1598862723723937_1252027112_n.jpg
991686656567073992_230812870,2015-05-24 03:31:23,Lark,33,"[Tag: coffeetoffee, Tag: dessert, Tag: honeylavender, Tag: handmade, Tag: waffle, Tag: icecream, Tag: cone, Tag: delicious, Tag: blueberrybalsamic]",https://scontent.cdninstagram.com/hphotos-xaf1/t51.2885-15/e15/11379175_824152414333361_195148123_n.jpg
991686528874526536_26846740,2015-05-24 03:31:08,Normal,8,"[Tag: catstagram, Tag: tuxedocats, Tag: tuxedocatsofinstagram, Tag: bcspca, Tag: caturday, Tag: igcats, Tag: igcatvideos, Tag: silly, Tag: sally, Tag: catslife]",https://scontent.cdninstagram.com/hphotos-xaf1/t51.2885-15/e15/11282625_818801944867650_1312461749_n.jpg
991686514063551934_226594970,2015-05-24 03:31:06,X-Pro II,15,"[Tag: vancity, Tag: videographer, Tag: videography, Tag: vancouver, Tag: blackmagic, Tag: kotd, Tag: blackmagicdesign]",https://scontent.cdninstagram.com/hphotos-xaf1/t51.2885-15/e15/11355094_779222978865257_1078067166_n.jpg
