ID,Created At,Filter,Number of Likes,HashTags,url
989512147792055723_4636298,2015-05-21 03:31:01,Skyline,26,[Tag: lyndsaylearnstolikevegetables],https://scontent.cdninstagram.com/hphotos-xaf1/t51.2885-15/e15/11272128_1471422029816532_1209241289_n.jpg
989512106679700782_325931506,2015-05-21 03:30:56,Ludwig,44,"[Tag: withmybabe, Tag: qualitytime, Tag: sunset, Tag: englishbay, Tag: earlymonthsary]",https://scontent.cdninstagram.com/hphotos-xaf1/t51.2885-15/e15/11326846_768616819903839_1922442461_n.jpg
989512063188090166_1710154750,2015-05-21 03:30:51,Normal,4,"[Tag: spring, Tag: slopitch, Tag: vancity, Tag: ballfield, Tag: deck]",https://scontent.cdninstagram.com/hphotos-xaf1/t51.2885-15/e15/11324979_836321499751143_412825931_n.jpg
989512048834368515_4083956,2015-05-21 03:30:50,Valencia,48,"[Tag: dunk, Tag: backtothefuture, Tag: nike, Tag: nikesb, Tag: sorrytotheladythatwantedthem, Tag: blackhistorymonth]",https://scontent.cdninstagram.com/hphotos-xaf1/t51.2885-15/e15/11334423_1441637052819689_1577616529_n.jpg
989512042597953265_197410362,2015-05-21 03:30:49,Normal,2,[Tag: vivino],https://scontent.cdninstagram.com/hphotos-xaf1/t51.2885-15/e15/11324949_385130655004089_1870885589_n.jpg
989511926234788712_210563883,2015-05-21 03:30:35,Normal,37,"[Tag: spring, Tag: goldenhour, Tag: vancouver, Tag: falsecreek, Tag: homesweethome, Tag: sunset, Tag: east, Tag: reflections, Tag: view]",https://scontent.cdninstagram.com/hphotos-xfa1/t51.2885-15/e15/11262722_1611858345755882_708726382_n.jpg
989511654611739337_18563959,2015-05-21 03:30:03,Normal,7,"[Tag: fabpro, Tag: fabuloso, Tag: westandunder]",https://scontent.cdninstagram.com/hphotos-xaf1/t51.2885-15/e15/11261688_806032002844030_740484548_n.jpg
989511584710278440_1710154750,2015-05-21 03:29:54,Normal,6,"[Tag: vancity, Tag: slopitch, Tag: running, Tag: vancouver, Tag: homebase, Tag: fun, Tag: southvan, Tag: runningbases]",https://scontent.cdninstagram.com/hphotos-xaf1/t51.2885-15/e15/11348125_747935228638279_1994977930_n.jpg
989511563637397668_8339069,2015-05-21 03:29:52,Normal,34,"[Tag: bridge, Tag: life, Tag: nature, Tag: socality, Tag: pnw, Tag: photosafari, Tag: neverstopexploring, Tag: explore, Tag: getoutside, Tag: adventure, Tag: instadaily, Tag: northwestisbest, Tag: getlost, Tag: roadtrip, Tag: liveauthentic, Tag: explorebc]",https://scontent.cdninstagram.com/hphotos-xaf1/t51.2885-15/e15/11355843_1635136816698547_1688168598_n.jpg
989511417084996681_536635730,2015-05-21 03:29:34,Normal,29,"[Tag: vancouverlife, Tag: blackandblue, Tag: theroof, Tag: glowbalgroup, Tag: afterwork, Tag: patioseason]",https://scontent.cdninstagram.com/hphotos-xfa1/t51.2885-15/e15/11270828_810268132391689_2145653572_n.jpg
989511410953648354_1578831437,2015-05-21 03:29:34,Willow,7,"[Tag: 잉베, Tag: 벤쿠버, Tag: 캐나다, Tag: 잉글리시베이, Tag: english]",https://scontent.cdninstagram.com/hphotos-xaf1/t51.2885-15/e15/11280181_896937967011331_849530918_n.jpg
989511381720710482_284772766,2015-05-21 03:29:30,Inkwell,96,"[Tag: life, Tag: blackandwhite, Tag: bc, Tag: beauty, Tag: instalike, Tag: photography, Tag: follow, Tag: canada, Tag: vancity, Tag: like, Tag: vancitybuzz, Tag: explorebc, Tag: vancouver, Tag: architecture, Tag: picoftheday, Tag: photooftheday]",https://scontent.cdninstagram.com/hphotos-xfa1/t51.2885-15/e15/11356439_1512921318984081_1647905513_n.jpg
989511372163609481_226190347,2015-05-21 03:29:29,Lark,17,[Tag: likefatherlikeson],https://scontent.cdninstagram.com/hphotos-xfa1/t51.2885-15/e15/11326121_1668369540066737_1649912553_n.jpg
989511130616322643_193177965,2015-05-21 03:29:00,Hefe,14,"[Tag: vancouver, Tag: seawall, Tag: englishbay, Tag: summerishere]",https://scontent.cdninstagram.com/hphotos-xfa1/t51.2885-15/e15/11328266_1859236584301588_1138553695_n.jpg
989511127780506124_228147509,2015-05-21 03:29:00,Juno,41,"[Tag: fashion, Tag: menwithstyle, Tag: trenchcoat, Tag: bright, Tag: zaraman, Tag: sharp, Tag: dapper, Tag: guccieyewear, Tag: style, Tag: workaholic, Tag: stylist, Tag: orange, Tag: menswearstyle, Tag: trench, Tag: gucci, Tag: zara, Tag: stylish]",https://scontent.cdninstagram.com/hphotos-xaf1/t51.2885-15/e15/11333668_1560369324227299_1654553246_n.jpg
989511096443013702_227779801,2015-05-21 03:28:56,Normal,44,"[Tag: sunset, Tag: vancouver]",https://scontent.cdninstagram.com/hphotos-xfa1/t51.2885-15/e15/11324240_390639894465691_2020048403_n.jpg
989511071428055030_269734674,2015-05-21 03:28:53,Normal,68,"[Tag: runningroom, Tag: run, Tag: kitsilano, Tag: vanierpark, Tag: runvan, Tag: running, Tag: vancouver, Tag: summertime]",https://scontent.cdninstagram.com/hphotos-xfa1/t51.2885-15/e15/11330516_1637701969794261_1961713064_n.jpg
989511061638466127_23234593,2015-05-21 03:28:52,Lark,124,[Tag: muminvancity],https://scontent.cdninstagram.com/hphotos-xfa1/t51.2885-15/e15/11262896_651763171621344_598397267_n.jpg
989511031800347931_1710154750,2015-05-21 03:28:48,Normal,2,"[Tag: vancity, Tag: slopitch, Tag: vancouver, Tag: baseball, Tag: southvancouver, Tag: batter, Tag: southvan, Tag: swingbattabatta, Tag: rosspark]",https://scontent.cdninstagram.com/hphotos-xaf1/t51.2885-15/e15/11335524_1607536392837920_450753506_n.jpg
989510879048597583_16081247,2015-05-21 03:28:30,Normal,29,"[Tag: спаситеребенка, Tag: помогите, Tag: благотворительность, Tag: спасиребенка, Tag: помощьдетям, Tag: помоги, Tag: помогитеребенку]",https://scontent.cdninstagram.com/hphotos-xaf1/t51.2885-15/e15/11267493_834012046691342_418485951_n.jpg
989510647195985048_322291368,2015-05-21 03:28:02,Normal,7,"[Tag: vancouverbootcamp, Tag: hiit, Tag: fitness, Tag: urbanfitnessclub, Tag: workout, Tag: bodyweight, Tag: bootcamp]",https://scontent.cdninstagram.com/hphotos-xaf1/t51.2885-15/e15/11249865_830193827072587_1935945709_n.jpg
989510629673177147_450167339,2015-05-21 03:28:00,Normal,29,"[Tag: morelike525, Tag: 520]",https://scontent.cdninstagram.com/hphotos-xfa1/t51.2885-15/e15/11356625_692419600886892_1705489655_n.jpg
989510500364987643_205349490,2015-05-21 03:27:45,Valencia,85,"[Tag: vegetablebouquet, Tag: kale, Tag: handmade, Tag: vegan, Tag: birthday, Tag: artichoke, Tag: healthylifestyle, Tag: friends, Tag: present, Tag: asparagus, Tag: plum, Tag: creativity, Tag: lychee, Tag: yogagirl, Tag: rawfoodlife, Tag: bunny]",https://scontent.cdninstagram.com/hphotos-xaf1/t51.2885-15/e15/11328525_473016136189795_1109798472_n.jpg
989510468845755699_224546334,2015-05-21 03:27:41,Normal,16,"[Tag: nofilter, Tag: vancouver, Tag: stanleypark, Tag: seawall, Tag: mybackyard]",https://scontent.cdninstagram.com/hphotos-xaf1/t51.2885-15/e15/11348185_1649316361965464_1526110761_n.jpg
989510335260351105_16559437,2015-05-21 03:27:25,Valencia,22,[Tag: virusintl],https://scontent.cdninstagram.com/hphotos-xat1/t51.2885-15/e15/11193114_1437069086595300_457182819_n.jpg
989510264583307233_1343306486,2015-05-21 03:27:17,Aden,47,"[Tag: greatnorthcollective, Tag: huffpostcanada, Tag: vansun360, Tag: photography, Tag: huffpostgram, Tag: outdoorvancouver, Tag: pacificnorthwest, Tag: westcoast, Tag: vancity, Tag: streetphotography, Tag: imagesofcanada, Tag: travel, Tag: vancitybuzz, Tag: exklusive_shot, Tag: window, Tag: vancouver, Tag: travelphotography, Tag: vancouverisawesome, Tag: explorecanada, Tag: westend, Tag: explorebc, Tag: architecture]",https://scontent.cdninstagram.com/hphotos-xfa1/t51.2885-15/e15/11312471_920783014638566_1760369507_n.jpg
989510247789230194_226301405,2015-05-21 03:27:15,Crema,7,"[Tag: vancity, Tag: kits, Tag: sunglasses, Tag: kitsbeach]",https://scontent.cdninstagram.com/hphotos-xaf1/t51.2885-15/e15/11282653_1834934940065481_899231301_n.jpg
989510077098732335_53192281,2015-05-21 03:26:55,Lark,5,"[Tag: science, Tag: fartmakingfoods, Tag: toottoot, Tag: scienceworld, Tag: themusicalfruit]",https://scontent.cdninstagram.com/hphotos-xfa1/t51.2885-15/e15/11326568_351806721610420_1215533363_n.jpg
989510026582260300_6912013,2015-05-21 03:26:48,Lo-fi,73,"[Tag: japan, Tag: vancouver, Tag: beauty]",https://scontent.cdninstagram.com/hphotos-xaf1/t51.2885-15/e15/11311243_968338866544066_1868018082_n.jpg
989509990513972285_416514676,2015-05-21 03:26:44,Normal,50,"[Tag: summervibes, Tag: adventuretime, Tag: earnest]",https://scontent.cdninstagram.com/hphotos-xaf1/t51.2885-15/e15/11327227_984487058257619_964614196_n.jpg
989509984926586772_31069116,2015-05-21 03:26:43,Normal,57,"[Tag: gastown, Tag: vanarch]",https://scontent.cdninstagram.com/hphotos-xaf1/t51.2885-15/e15/11282781_870651816326238_87677292_n.jpg
989509910637672108_609344700,2015-05-21 03:26:35,Normal,82,"[Tag: beautiful, Tag: bridge, Tag: hsdailyfeature, Tag: createexploretakeover, Tag: explorecanada, Tag: thecreatorclass, Tag: vscophile, Tag: cityscape, Tag: mobilemag, Tag: momentstop, Tag: createyourhype, Tag: topmasters, Tag: instafocus, Tag: thefeaturepage, Tag: sunset_madness, Tag: exploreeverything, Tag: igmasters, Tag: visualsoflife, Tag: livefolk, Tag: streetdreamsmag, Tag: instagood, Tag: seaside, Tag: vancouver, Tag: igdaily, Tag: sunset, Tag: justgoshoot, Tag: vscocam, Tag: chasinglight]",https://scontent.cdninstagram.com/hphotos-xfa1/t51.2885-15/e15/11248841_499568773533909_519146744_n.jpg
