ID,Created At,Filter,Number of Likes,HashTags,url
991686474523862351_470440888,2015-05-24 03:31:01,Normal,81,"[Tag: urban, Tag: fashion, Tag: love, Tag: gq, Tag: dope, Tag: streetstyle, Tag: loyalteam, Tag: vancouverfashion, Tag: ootd, Tag: onlineshopping, Tag: streetwear, Tag: loyalcoalition, Tag: vancity, Tag: style, Tag: mensfashion, Tag: loyal, Tag: summertime, Tag: fresh, Tag: showroom, Tag: instafashion, Tag: picoftheday, Tag: mensstyle]",https://scontent.cdninstagram.com/hphotos-xfa1/t51.2885-15/e15/11351963_452819561550014_869327544_n.jpg
991686374560145057_408529134,2015-05-24 03:30:49,Ginza,13,"[Tag: slacking, Tag: littlemountain, Tag: slackline]",https://scontent.cdninstagram.com/hphotos-xaf1/t51.2885-15/e15/11327385_1452612158371044_1666792369_n.jpg
991686271218719635_2023687021,2015-05-24 03:30:37,Willow,53,"[Tag: crazy, Tag: black, Tag: nyc, Tag: white, Tag: model, Tag: jordanbarrett]",https://scontent.cdninstagram.com/hphotos-xaf1/t51.2885-15/e15/11372454_1655084498045850_71386657_n.jpg
991686201642317275_605585764,2015-05-24 03:30:29,Ludwig,12,"[Tag: flat, Tag: onlycuzthelugnutsdidntfit, Tag: icandoit, Tag: tire, Tag: diditmyself, Tag: killingit, Tag: calleddad, Tag: justkidding]",https://scontent.cdninstagram.com/hphotos-xaf1/t51.2885-15/e15/11380854_408107146044652_1341935558_n.jpg
991686158517180516_5111445,2015-05-24 03:30:24,Mayfair,9,[Tag: vancaf],https://scontent.cdninstagram.com/hphotos-xaf1/t51.2885-15/e15/11327839_1404410869885034_1513722806_n.jpg
991685933316712177_193496544,2015-05-24 03:29:57,Normal,82,[Tag: foodporn],https://scontent.cdninstagram.com/hphotos-xfa1/t51.2885-15/e15/11240726_565087263594243_613933937_n.jpg
991685920197417866_2023687021,2015-05-24 03:29:55,Inkwell,110,"[Tag: nyc, Tag: crazy, Tag: model, Tag: jordanbarrett]",https://scontent.cdninstagram.com/hphotos-xaf1/t51.2885-15/e15/11375332_687702038002748_1482815930_n.jpg
991685912104605612_1154004164,2015-05-24 03:29:54,Normal,34,"[Tag: vibes, Tag: celebsxo, Tag: tonight🔻🔸🔺, Tag: temporaryview]",https://scontent.cdninstagram.com/hphotos-xaf1/t51.2885-15/e15/11326398_1592691431002972_811326992_n.jpg
991685893245234127_335782425,2015-05-24 03:29:52,Normal,25,"[Tag: gastronomnom, Tag: foodiegram, Tag: bcveggieday, Tag: foodie, Tag: foodporn, Tag: nomnom]",https://scontent.cdninstagram.com/hphotos-xfa1/t51.2885-15/e15/11379125_477821902381009_267812479_n.jpg
991685789521314244_3783615,2015-05-24 03:29:40,Nashville,9,"[Tag: purple, Tag: rebel, Tag: newhair]",https://scontent.cdninstagram.com/hphotos-xfa1/t51.2885-15/e15/11330519_109699979363832_527786968_n.jpg
991685780988543454_7277095,2015-05-24 03:29:39,Normal,545,"[Tag: canada, Tag: family]",https://scontent.cdninstagram.com/hphotos-xaf1/t51.2885-15/e15/11379751_488053218026230_883798043_n.jpg
991685709327385838_236389752,2015-05-24 03:29:30,Normal,21,"[Tag: hazardsofthethrone, Tag: vtsl, Tag: throneandgames, Tag: thoughtsoftherulerofwesteros]",https://scontent.cdninstagram.com/hphotos-xaf1/t51.2885-15/e15/11376670_858122657571033_678542362_n.jpg
991685695248166912_1051691,2015-05-24 03:29:28,Normal,35,"[Tag: art, Tag: yvr, Tag: weekend, Tag: pnw, Tag: vanierpark, Tag: explore, Tag: vancouverisawesome, Tag: vancouver, Tag: vsco, Tag: westcoast, Tag: explorebc]",https://scontent.cdninstagram.com/hphotos-xfa1/t51.2885-15/e15/11265770_1589759064609359_482376787_n.jpg
991685632730091340_230683858,2015-05-24 03:29:21,Valencia,31,"[Tag: wus, Tag: paneristi, Tag: inhouse, Tag: foodie, Tag: luminor, Tag: instawatch, Tag: firenze, Tag: fusion, Tag: wis, Tag: asian, Tag: datlifestyle, Tag: instadaily, Tag: pam510, Tag: watchfam, Tag: panerai, Tag: womw, Tag: whiskey, Tag: sour, Tag: watchville, Tag: swiss, Tag: watchnerd, Tag: jahbru, Tag: watchmania]",https://scontent.cdninstagram.com/hphotos-xaf1/t51.2885-15/e15/11357481_911197332259480_1454500685_n.jpg
991685395170372621_175451194,2015-05-24 03:28:53,Normal,83,[Tag: suncouver],https://scontent.cdninstagram.com/hphotos-xaf1/t51.2885-15/e15/11282292_1420843384904812_735259001_n.jpg
991685311091538708_405981373,2015-05-24 03:28:43,Juno,11,"[Tag: dinner, Tag: homecooking, Tag: yvr, Tag: salad, Tag: vancouver, Tag: vegetarian]",https://scontent.cdninstagram.com/hphotos-xaf1/t51.2885-15/e15/10860180_1603524706585201_1166111265_n.jpg
991685058368329048_1811748,2015-05-24 03:28:12,Normal,11,"[Tag: foodcoma, Tag: weekend]",https://scontent.cdninstagram.com/hphotos-xaf1/t51.2885-15/e15/11312199_441390232698775_1161323337_n.jpg
991685031133189845_1579356,2015-05-24 03:28:09,Normal,42,"[Tag: hair, Tag: model, Tag: makeup, Tag: vancouver, Tag: vsco]",https://scontent.cdninstagram.com/hphotos-xaf1/t51.2885-15/e15/11348412_1072241669471542_1404523666_n.jpg
991685022675119256_6587058,2015-05-24 03:28:08,Normal,58,"[Tag: makeupartist, Tag: makeup, Tag: mua, Tag: makeupbykmkutsuma, Tag: fotd]",https://scontent.cdninstagram.com/hphotos-xfa1/t51.2885-15/e15/11355068_802201606542022_401406365_n.jpg
991684671401182400_674081104,2015-05-24 03:27:26,Normal,3,"[Tag: vancouver_signs, Tag: yvr, Tag: decals, Tag: vancouver_printing, Tag: graphicsolutionscanada, Tag: printing, Tag: graphics, Tag: gastown, Tag: stickers]",https://scontent.cdninstagram.com/hphotos-xaf1/t51.2885-15/e15/11358234_698173170304499_178994812_n.jpg
991684649544402351_202209944,2015-05-24 03:27:24,Lo-fi,8,"[Tag: canada, Tag: vancouver, Tag: wine]",https://scontent.cdninstagram.com/hphotos-xaf1/t51.2885-15/e15/11357862_654015931368910_1317416590_n.jpg
991684464112427241_1085993191,2015-05-24 03:27:02,Normal,89,"[Tag: capital, Tag: pregame, Tag: thecatalyst]",https://scontent.cdninstagram.com/hphotos-xfa1/t51.2885-15/e15/11377817_1593321974271285_1521757334_n.jpg
991684433914611564_284714336,2015-05-24 03:26:58,Normal,23,"[Tag: vancouverhairdresser, Tag: dirtyblonde, Tag: ombrevancouver, Tag: vancouverblonde, Tag: beforeandafter, Tag: iloveblondes, Tag: vancouverblondespecialist, Tag: olaplex, Tag: vancouverhairstylist, Tag: vancouverhairsalon, Tag: blondespecialist, Tag: vancity, Tag: balayagespecialist, Tag: olaplexvancouver, Tag: balayagevancouver, Tag: balayage, Tag: colormelt, Tag: ilovehair, Tag: ilovemyjob, Tag: healthyhair, Tag: vancouverhair, Tag: vancouverolaplex, Tag: hairpainting, Tag: hairtransformation, Tag: vancouver, Tag: blondehair, Tag: ombre, Tag: vancouversalon, Tag: behindthechair, Tag: modernsalon]",https://scontent.cdninstagram.com/hphotos-xaf1/t51.2885-15/e15/11378632_1599154200325740_1678153477_n.jpg
991684337412291317_1603109557,2015-05-24 03:26:47,Normal,3,"[Tag: operaopulenza, Tag: opera, Tag: classicalsinging]",https://scontent.cdninstagram.com/hphotos-xaf1/t51.2885-15/e15/11378179_1389691511361742_905510882_n.jpg
991684275947618250_30713246,2015-05-24 03:26:39,Lark,20,"[Tag: yummy, Tag: yvr, Tag: foodporn, Tag: softboiledegg, Tag: top3, Tag: chasu, Tag: vancouver, Tag: delicious, Tag: quickeats, Tag: dinewithdoug, Tag: aldente, Tag: ramen, Tag: saturday]",https://scontent.cdninstagram.com/hphotos-xfa1/t51.2885-15/e15/11264252_856809027717703_1578705073_n.jpg
991684152104472073_279631170,2015-05-24 03:26:24,Normal,71,[Tag: seacanor2015],https://scontent.cdninstagram.com/hphotos-xaf1/t51.2885-15/e15/11380243_958719850826161_985427284_n.jpg
991684119777481412_628811,2015-05-24 03:26:21,Normal,23,[Tag: minions],https://scontent.cdninstagram.com/hphotos-xfa1/t51.2885-15/e15/11242853_1631952933707294_1757524551_n.jpg
991684072673412399_530371824,2015-05-24 03:26:15,Valencia,22,"[Tag: vancity, Tag: jackdaniels, Tag: laughter, Tag: goodtimes, Tag: bestfriends, Tag: mydawg, Tag: reunited, Tag: weekend, Tag: happy]",https://scontent.cdninstagram.com/hphotos-xaf1/t51.2885-15/e15/11355963_771075349679971_2118992204_n.jpg
991684025135947935_285452583,2015-05-24 03:26:09,Normal,23,"[Tag: 홈스타그램, Tag: 맛스타그램, Tag: 얌스타그램, Tag: simply7, Tag: 집스타그램, Tag: selfie, Tag: 더먹지, Tag: 먹스타그램, Tag: quinoa, Tag: seaslat, Tag: 셀스타그램, Tag: chips, Tag: 쉬는날엔, Tag: 과자, Tag: 몸땡이size, Tag: hugesizedbag, Tag: 데일리그램, Tag: daily, Tag: instasize, Tag: vancouver, Tag: 일상]",https://scontent.cdninstagram.com/hphotos-xaf1/t51.2885-15/e15/11313691_1733294590230891_550500348_n.jpg
991683986202862125_206886063,2015-05-24 03:26:05,Normal,36,"[Tag: chenna, Tag: unicorndreams, Tag: eastsideflea]",https://scontent.cdninstagram.com/hphotos-xaf1/t51.2885-15/e15/11282755_1622492264663792_1908065326_n.jpg
991683985685828364_2209051,2015-05-24 03:26:05,X-Pro II,15,"[Tag: littledragon, Tag: malkinbowl]",https://scontent.cdninstagram.com/hphotos-xfa1/t51.2885-15/e15/11374811_839541559416941_1612370828_n.jpg
991683962052413988_145186409,2015-05-24 03:26:02,Normal,15,"[Tag: decor, Tag: art, Tag: homedecor, Tag: gold, Tag: justuntilwegettherealthing, Tag: matisse, Tag: diy]",https://scontent.cdninstagram.com/hphotos-xaf1/t51.2885-15/e15/11356723_829861453764209_849787202_n.jpg
991683920873098730_1364691762,2015-05-24 03:25:57,Normal,6,"[Tag: ☕️, Tag: livealittle, Tag: icecreamontop, Tag: sweetending, Tag: dessert, Tag: waffles]",https://scontent.cdninstagram.com/hphotos-xaf1/t51.2885-15/e15/11313798_1603680746540544_80440885_n.jpg
991683889171613867_8345849,2015-05-24 03:25:53,Normal,12,[Tag: andrejuelie],https://scontent.cdninstagram.com/hphotos-xaf1/t51.2885-15/e15/11334394_1602664716641743_1471301836_n.jpg
991683867378175788_35706010,2015-05-24 03:25:51,Aden,58,"[Tag: minimansions, Tag: music, Tag: voguetheatre]",https://scontent.cdninstagram.com/hphotos-xfa1/t51.2885-15/e15/11282732_1398138433847746_1111392873_n.jpg
991683789635331182_26008720,2015-05-24 03:25:41,Valencia,21,"[Tag: yumsinmytums, Tag: vaneats, Tag: foodie, Tag: yvr, Tag: dessert, Tag: cracklecreme]",https://scontent.cdninstagram.com/hphotos-xaf1/t51.2885-15/e15/11358975_1449759278657716_1480919843_n.jpg
991683785899676740_284091060,2015-05-24 03:25:41,Lark,35,"[Tag: jethrosfinegrub, Tag: vancouver, Tag: pancake]",https://scontent.cdninstagram.com/hphotos-xaf1/t51.2885-15/e15/11312149_1068119323202245_346133629_n.jpg
991683770760543363_5533310,2015-05-24 03:25:39,Mayfair,10,"[Tag: bikerides, Tag: vancity, Tag: dosflowers, Tag: craftbeer, Tag: df, Tag: weekends, Tag: onedrink, Tag: olympicvillage, Tag: summernights, Tag: patioseason, Tag: seawall, Tag: vancouver, Tag: splitfood, Tag: bikedhere, Tag: onlyone, Tag: patiobeers, Tag: drinks, Tag: justonedrink, Tag: summerishere, Tag: redumbrella, Tag: lovethiscity]",https://scontent.cdninstagram.com/hphotos-xfa1/t51.2885-15/e15/11374811_1599145023699501_1441272155_n.jpg
991683663058494654_220622616,2015-05-24 03:25:26,Normal,12,"[Tag: beach, Tag: vancouver, Tag: sunset]",https://scontent.cdninstagram.com/hphotos-xfa1/t51.2885-15/e15/11357897_685846398226763_2068977437_n.jpg
991683639931333020_7007841,2015-05-24 03:25:23,Lark,27,[Tag: evsd],https://scontent.cdninstagram.com/hphotos-xfa1/t51.2885-15/e15/11372522_1441881602795359_1688075026_n.jpg
991683614127575750_2036027451,2015-05-24 03:25:20,Ludwig,7,"[Tag: love, Tag: vancouver]",https://scontent.cdninstagram.com/hphotos-xaf1/t51.2885-15/e15/11325673_371136333093429_344101303_n.jpg
991683511409301991_1483557677,2015-05-24 03:25:08,Ludwig,24,"[Tag: spinach, Tag: cooking, Tag: outinvancouver, Tag: chef, Tag: dinner, Tag: vancouver, Tag: homemade, Tag: ricotta, Tag: tart]",https://scontent.cdninstagram.com/hphotos-xaf1/t51.2885-15/e15/11364012_1453431984967974_1645718385_n.jpg
991683301256318969_44946138,2015-05-24 03:24:43,Normal,3,"[Tag: beautiful, Tag: stanleypark, Tag: vancouverbc]",https://scontent.cdninstagram.com/hphotos-xaf1/t51.2885-15/e15/11328292_1621427241462933_1763405342_n.jpg
991683275967110620_209588526,2015-05-24 03:24:40,Amaro,36,"[Tag: throwback, Tag: purpleladies, Tag: everythingispurple, Tag: purpleforlife, Tag: purple, Tag: taboorevue, Tag: bestwife]",https://scontent.cdninstagram.com/hphotos-xaf1/t51.2885-15/e15/11334517_1460709990887987_1600408730_n.jpg
991683214049381653_644912146,2015-05-24 03:24:33,Normal,12058,"[Tag: meowbox, Tag: adorablebehbeh, Tag: yes, Tag: everyday]",https://scontent.cdninstagram.com/hphotos-xaf1/t51.2885-15/e15/11280384_1581685582094033_280024035_n.jpg
991683126372144061_235202627,2015-05-24 03:24:22,Juno,12,"[Tag: friendforever, Tag: rodneysoysters, Tag: birthdaycelebration, Tag: 30, Tag: wishsusanwashere, Tag: reunited]",https://scontent.cdninstagram.com/hphotos-xaf1/t51.2885-15/e15/11313327_1619088221703239_637102346_n.jpg
991683045691201888_316343301,2015-05-24 03:24:13,Ludwig,20,"[Tag: bcstrawberries, Tag: organic, Tag: supportlocalfarmers]",https://scontent.cdninstagram.com/hphotos-xaf1/t51.2885-15/e15/11326996_1632201560328726_567051065_n.jpg
991683028024333487_220372852,2015-05-24 03:24:10,Lark,31,[Tag: latergram],https://scontent.cdninstagram.com/hphotos-xaf1/t51.2885-15/e15/11351529_439636536197748_84867383_n.jpg
991682961015432819_29562168,2015-05-24 03:24:02,Ludwig,9,"[Tag: flowers, Tag: sunflower]",https://scontent.cdninstagram.com/hphotos-xaf1/t51.2885-15/e15/11312065_374025439462115_340399963_n.jpg
990964051933174488_31802597,2015-05-23 03:35:42,Normal,21,"[Tag: canada, Tag: vancouver]",https://scontent.cdninstagram.com/hphotos-xaf1/t51.2885-15/e15/11313742_848574071899792_1845398109_n.jpg
990963997648301906_199525458,2015-05-23 03:35:35,Normal,50,"[Tag: jimmypage, Tag: ledzeppelin]",https://scontent.cdninstagram.com/hphotos-xaf1/t51.2885-15/e15/11373879_359310944280210_1232778366_n.jpg
990963973432565825_44452583,2015-05-23 03:35:32,Rise,0,"[Tag: vfs, Tag: vfskaraoke, Tag: karaoke, Tag: vfscafe]",https://scontent.cdninstagram.com/hphotos-xfa1/t51.2885-15/e15/11372453_885731581486672_1872344444_n.jpg
990963931045930860_19453560,2015-05-23 03:35:27,Normal,15,"[Tag: gilmoregirls, Tag: fortyninthparallel, Tag: coffee, Tag: addict, Tag: pepup]",https://scontent.cdninstagram.com/hphotos-xaf1/t51.2885-15/e15/11372223_414243892109717_82036686_n.jpg
990963903597429920_22332608,2015-05-23 03:35:24,Normal,31,"[Tag: beautifulbc, Tag: vancouverisawesome, Tag: vscocam, Tag: vscolove, Tag: explorebc, Tag: vsco]",https://scontent.cdninstagram.com/hphotos-xfa1/t51.2885-15/e15/11377823_546279128843191_701230350_n.jpg
990963789259047307_2020510991,2015-05-23 03:35:11,Lo-fi,6,"[Tag: bennithestaffy, Tag: staffy, Tag: puppy, Tag: dogsofinstagram]",https://scontent.cdninstagram.com/hphotos-xfa1/t51.2885-15/e15/11372378_829867780422512_17427401_n.jpg
990963750061137005_307417998,2015-05-23 03:35:06,Juno,18,"[Tag: fendi, Tag: sunglasses, Tag: 👓, Tag: want]",https://scontent.cdninstagram.com/hphotos-xaf1/t51.2885-15/e15/11358942_1399027267091819_839626338_n.jpg
990963710200253626_363599738,2015-05-23 03:35:01,Normal,10,"[Tag: gastown, Tag: seagull, Tag: vancouver]",https://scontent.cdninstagram.com/hphotos-xfa1/t51.2885-15/e15/11335478_655579131242016_821096994_n.jpg
990963703981773748_222432275,2015-05-23 03:35:00,Normal,60,"[Tag: vancity, Tag: nofilter, Tag: fridaynightfitness, Tag: beautifulthings]",https://scontent.cdninstagram.com/hphotos-xaf1/t51.2885-15/e15/11376339_379865332218583_871201894_n.jpg
990963657199257966_1783873009,2015-05-23 03:34:55,Normal,22,"[Tag: yoga, Tag: allages, Tag: dance, Tag: hoop, Tag: slackline, Tag: free, Tag: hiphop, Tag: elfest, Tag: shipyards, Tag: tango, Tag: flowfest, Tag: poi, Tag: acro]",https://scontent.cdninstagram.com/hphotos-xaf1/t51.2885-15/e15/11334390_1572004099731833_442418400_n.jpg
990963529506105565_211971289,2015-05-23 03:34:40,Mayfair,18,"[Tag: summer, Tag: art, Tag: skull, Tag: af, Tag: shadefackedmyshot, Tag: hard, Tag: downtown, Tag: tag, Tag: graffiti, Tag: ish, Tag: vancouver, Tag: killyourself]",https://scontent.cdninstagram.com/hphotos-xfa1/t51.2885-15/e15/11352431_719681074807778_439862740_n.jpg
990963510010774485_1482676087,2015-05-23 03:34:37,Normal,15,[Tag: summer],https://scontent.cdninstagram.com/hphotos-xaf1/t51.2885-15/e15/11353144_359290124267412_421759312_n.jpg
990963478864686722_530776882,2015-05-23 03:34:33,Amaro,4,"[Tag: ntevancouver, Tag: memesrents]",https://scontent.cdninstagram.com/hphotos-xfa1/t51.2885-15/e15/11333579_1103417353008531_2093160431_n.jpg
990963476657872160_3081286,2015-05-23 03:34:33,Aden,23,[Tag: smallssaves],https://scontent.cdninstagram.com/hphotos-xaf1/t51.2885-15/e15/11378587_419234944868436_429333767_n.jpg
990963446211011333_258009983,2015-05-23 03:34:30,Normal,9,"[Tag: crows, Tag: iamscared, Tag: scarycrows, Tag: why, Tag: evilcrows]",https://scontent.cdninstagram.com/hphotos-xaf1/l/t51.2885-15/e15/11377647_1096527463696748_569813751_n.jpg
990963348145799227_22692655,2015-05-23 03:34:18,Lark,35,"[Tag: party, Tag: drinking, Tag: whiskeywiseman, Tag: charity]",https://scontent.cdninstagram.com/hphotos-xaf1/t51.2885-15/e15/11377951_376729442530157_905900802_n.jpg
990963155964456103_1326579282,2015-05-23 03:33:55,Normal,4,"[Tag: northshore, Tag: vancouver]",https://scontent.cdninstagram.com/hphotos-xfa1/t51.2885-15/e15/11326463_982942585073436_1025648854_n.jpg
990963037406925020_334972979,2015-05-23 03:33:41,Crema,6,"[Tag: luna, Tag: lunatic]",https://scontent.cdninstagram.com/hphotos-xfa1/t51.2885-15/e15/11356604_423311124508958_857838531_n.jpg
990962910669663371_182190858,2015-05-23 03:33:26,Normal,9,"[Tag: vancity, Tag: friday, Tag: vancouver, Tag: granvillestreet]",https://scontent.cdninstagram.com/hphotos-xaf1/t51.2885-15/e15/11334394_102285753442854_528332706_n.jpg
990962837598185993_217472505,2015-05-23 03:33:17,Perpetua,18,[Tag: fashiondesign],https://scontent.cdninstagram.com/hphotos-xfa1/t51.2885-15/e15/11372312_634467853320598_216499043_n.jpg
990962724730978412_569863983,2015-05-23 03:33:04,Amaro,5,"[Tag: vancity, Tag: rosewine, Tag: biggulp, Tag: englishbay]",https://scontent.cdninstagram.com/hphotos-xaf1/t51.2885-15/e15/11376477_621851644618289_1023972162_n.jpg
990962634417791003_44452583,2015-05-23 03:32:53,X-Pro II,2,"[Tag: heather, Tag: p49, Tag: vfscafe, Tag: vfs, Tag: vfskaraoke, Tag: karaoke]",https://scontent.cdninstagram.com/hphotos-xfa1/t51.2885-15/e15/11363924_738017339658090_438206949_n.jpg
990962632595855549_297291013,2015-05-23 03:32:53,Normal,7,"[Tag: fridaymandatory, Tag: funcommittee, Tag: funfriday, Tag: trophies, Tag: patioseason]",https://scontent.cdninstagram.com/hphotos-xaf1/t51.2885-15/e15/11372508_1008651929173258_2107790075_n.jpg
990962624745293615_1423802160,2015-05-23 03:32:52,Slumber,30,"[Tag: mountpleasant, Tag: fashion, Tag: ootd, Tag: friyay, Tag: style, Tag: volleykimono, Tag: summervibes, Tag: lululemonlab, Tag: summertime, Tag: inmynewhood]",https://scontent.cdninstagram.com/hphotos-xaf1/t51.2885-15/e15/11375151_1577773622491732_450928382_n.jpg
990962594202566993_14827351,2015-05-23 03:32:48,X-Pro II,67,"[Tag: freakfam, Tag: stagetimeyet, Tag: bcabba, Tag: beautynbronze, Tag: bikini, Tag: abs, Tag: readytobepretty, Tag: bcs2015, Tag: muscle, Tag: nuggets, Tag: freakfitness]",https://scontent.cdninstagram.com/hphotos-xaf1/t51.2885-15/e15/11327101_833732966703474_1799426226_n.jpg
990962589612464637_6285853,2015-05-23 03:32:47,Normal,10,"[Tag: vancity, Tag: vancouver, Tag: yvr, Tag: vancouverart, Tag: battleofthebrush, Tag: herritagehall, Tag: artevent]",https://scontent.cdninstagram.com/hphotos-xfa1/t51.2885-15/e15/11330519_1601466173464606_308039688_n.jpg
990962543594490590_559017737,2015-05-23 03:32:42,Mayfair,25,[Tag: أمي],https://scontent.cdninstagram.com/hphotos-xat1/t51.2885-15/e15/11176560_1435911030046345_1627142963_n.jpg
990962506619108090_1344119301,2015-05-23 03:32:38,X-Pro II,11,"[Tag: walking, Tag: laughoften, Tag: lovedeeply, Tag: livesimply, Tag: dtes, Tag: graffiti, Tag: vancouver, Tag: wisewords, Tag: cityart, Tag: neighbourhood]",https://scontent.cdninstagram.com/hphotos-xaf1/t51.2885-15/e15/11282262_804820056281221_637261622_n.jpg
990962359851964730_22744245,2015-05-23 03:32:20,Normal,16,"[Tag: dlux, Tag: granvillestreet]",https://scontent.cdninstagram.com/hphotos-xaf1/t51.2885-15/e15/11352147_841394432602133_494060291_n.jpg
990962356094413789_484864777,2015-05-23 03:32:20,Normal,26,"[Tag: beautiful, Tag: vancity, Tag: igersvancouver, Tag: yvr, Tag: ig_great_shots_canada, Tag: park, Tag: yaletown, Tag: vanlove, Tag: vancouverisawesome, Tag: igers, Tag: outdoorvancouver, Tag: vancouver, Tag: explorebc]",https://scontent.cdninstagram.com/hphotos-xaf1/t51.2885-15/e15/11328297_1621467741402550_1477036510_n.jpg
990962306555151629_247620352,2015-05-23 03:32:14,Aden,13,"[Tag: howtosurvivewhensheleaves, Tag: takingadvantage]",https://scontent.cdninstagram.com/hphotos-xaf1/t51.2885-15/e15/11372107_1432809727038171_2106003419_n.jpg
990962194432999389_229490334,2015-05-23 03:32:00,Normal,10,"[Tag: greypants, Tag: johnfluevogshoes, Tag: shoes, Tag: menswear, Tag: grey, Tag: menlook, Tag: mensfashion, Tag: vancouver, Tag: menfashion, Tag: menstyle, Tag: johnfluevog, Tag: legs]",https://scontent.cdninstagram.com/hphotos-xaf1/t51.2885-15/e15/11271031_1438512399800528_1190887991_n.jpg
990962190650271798_46410857,2015-05-23 03:32:00,Normal,70,"[Tag: igersvancouver, Tag: vancouver, Tag: cloudporn, Tag: vancouverisawesome, Tag: awesome, Tag: yaletown, Tag: view]",https://scontent.cdninstagram.com/hphotos-xaf1/t51.2885-15/e15/11376232_810172475714876_2092057823_n.jpg
990962180642943566_566366131,2015-05-23 03:31:59,Normal,15,"[Tag: westcoastisbestcoast, Tag: vancouver, Tag: fridayproblems, Tag: stanleyparkamber]",https://scontent.cdninstagram.com/hphotos-xaf1/t51.2885-15/e15/11324992_1588314498116324_2051198491_n.jpg
990962172798930624_44390482,2015-05-23 03:31:58,Normal,3,"[Tag: foodie, Tag: fatty, Tag: grub, Tag: club, Tag: rings, Tag: pub]",https://scontent.cdninstagram.com/hphotos-xaf1/t51.2885-15/e15/11271043_952968988077250_1455587706_n.jpg
990962039378056009_1826080419,2015-05-23 03:31:42,Normal,7,"[Tag: d2k2015, Tag: nofilter, Tag: bcliving]",https://scontent.cdninstagram.com/hphotos-xaf1/t51.2885-15/e15/11287842_1675676862655137_1447206619_n.jpg
990961869352380872_300888369,2015-05-23 03:31:22,Normal,14,[Tag: puglife],https://scontent.cdninstagram.com/hphotos-xaf1/t51.2885-15/e15/11376168_1394865377509148_1260352238_n.jpg
990961736444404720_6449471,2015-05-23 03:31:06,Normal,48,"[Tag: thehawkslastflight, Tag: hannahbetty, Tag: bridesmaids, Tag: watchout, Tag: bachelorette, Tag: vancouverbc]",https://scontent.cdninstagram.com/hphotos-xaf1/t51.2885-15/e15/11356684_1441829002784797_1302097716_n.jpg
990961695521265935_1448536045,2015-05-23 03:31:01,Rise,7,[Tag: withmylove],https://scontent.cdninstagram.com/hphotos-xaf1/t51.2885-15/e15/11373672_679723258823968_92807823_n.jpg
990961677002930124_636964668,2015-05-23 03:30:59,Amaro,24,"[Tag: bubbly, Tag: vancity, Tag: love, Tag: fuckya, Tag: westcoast, Tag: westcoastlife, Tag: birthday, Tag: vancouver, Tag: shots, Tag: likeforlike, Tag: pictureoftheday, Tag: birthweek, Tag: friends, Tag: happy]",https://scontent.cdninstagram.com/hphotos-xaf1/t51.2885-15/e15/11335494_1589663294656458_2082956959_n.jpg
990961635141828452_2182766,2015-05-23 03:30:54,Normal,7,"[Tag: tonight, Tag: yvr, Tag: onenightonly, Tag: livemusicvancouver, Tag: ifyouareviewingthisyoualreadymissedit, Tag: garyneverfeltsogood, Tag: thewindinthehorses]",https://scontent.cdninstagram.com/hphotos-xaf1/t51.2885-15/e15/11350830_885334938172551_1631475090_n.jpg
990961622280063177_448460785,2015-05-23 03:30:52,Normal,33,"[Tag: clarissa, Tag: drmartens]",https://scontent.cdninstagram.com/hphotos-xfa1/t51.2885-15/e15/11326412_447580705401550_1460598008_n.jpg
990961577453809597_978993194,2015-05-23 03:30:47,Normal,6,"[Tag: house, Tag: vancouver, Tag: concert, Tag: vancitybuzz]",https://scontent.cdninstagram.com/hphotos-xfa1/t51.2885-15/e15/11333438_875508679195055_138816546_n.jpg
990961412339151624_312486547,2015-05-23 03:30:27,Lark,18,"[Tag: foodstagram, Tag: starving, Tag: vancouver, Tag: canape, Tag: shocktopbeer, Tag: tgif]",https://scontent.cdninstagram.com/hphotos-xaf1/t51.2885-15/e15/11377609_854973114576704_76887441_n.jpg
990961322028569404_176227691,2015-05-23 03:30:16,Normal,9,"[Tag: love, Tag: bff, Tag: lovemyfriends, Tag: gettingold, Tag: may22, Tag: birthday, Tag: birth, Tag: happybirthdaytome, Tag: weekend]",https://scontent.cdninstagram.com/hphotos-xaf1/t51.2885-15/e15/11350701_901185196612981_424611577_n.jpg
990961271377988576_21377529,2015-05-23 03:30:10,Normal,8,[Tag: gyoza],https://scontent.cdninstagram.com/hphotos-xfa1/t51.2885-15/e15/11376359_906272822765720_1481278216_n.jpg
990961097330314160_20606713,2015-05-23 03:29:50,Normal,11,"[Tag: houseconcert, Tag: nofilter, Tag: beachave, Tag: epic]",https://scontent.cdninstagram.com/hphotos-xfa1/t51.2885-15/e15/11333378_1577121469204192_1870116545_n.jpg
990961081318349782_292408557,2015-05-23 03:29:48,Normal,28,[Tag: amordesextafeira],https://scontent.cdninstagram.com/hphotos-xfa1/t51.2885-15/e15/11328485_370957743112654_1905119527_n.jpg
990960934146704994_1561016696,2015-05-23 03:29:30,Normal,3,"[Tag: summer, Tag: vancouver, Tag: tokyopoliceclub]",https://scontent.cdninstagram.com/hphotos-xaf1/t51.2885-15/e15/11375293_1617078451869203_1798432298_n.jpg
990960682516221623_305189226,2015-05-23 03:29:00,Normal,15,[Tag: davidlampark],https://scontent.cdninstagram.com/hphotos-xaf1/t51.2885-15/e15/11355154_1615047558711500_1837305959_n.jpg
990960583392800760_188090682,2015-05-23 03:28:48,Juno,9,"[Tag: gastropostvan, Tag: parentsnightout, Tag: nomnomnom, Tag: vancouver, Tag: yvrfoodie]",https://scontent.cdninstagram.com/hphotos-xaf1/t51.2885-15/e15/11327059_1432309353754439_406946234_n.jpg
990960511677961536_191595068,2015-05-23 03:28:40,Normal,27,[Tag: nomnomnom],https://scontent.cdninstagram.com/hphotos-xfa1/t51.2885-15/e15/11375858_1430835327236960_1198160626_n.jpg
