ID,Created At,Filter,Number of Likes,HashTags,url
1002627763334822114_1746655269,2015-06-08 05:49:25,Normal,12,"[Tag: benq, Tag: gamerguy, Tag: gfx, Tag: callofdutychamps, Tag: greenwall, Tag: optic, Tag: scufgaming, Tag: triggersquad, Tag: xgames, Tag: astro, Tag: controller, Tag: ranked, Tag: livestream, Tag: xboxone, Tag: logo, Tag: nadeshot, Tag: astrogaming, Tag: mlg, Tag: setup, Tag: youtube, Tag: callofduty, Tag: xbox, Tag: umg, Tag: scuf, Tag: cod, Tag: elgato, Tag: egl, Tag: twitch, Tag: followme]",https://scontent.cdninstagram.com/hphotos-xfa1/t51.2885-15/e15/11357729_684404165025255_1455347289_n.jpg
1002622247837746480_31804464,2015-06-08 05:38:27,Crema,5,"[Tag: granbyst, Tag: takemebacktothosenights, Tag: granbytheater, Tag: littlebody, Tag: dancer, Tag: downtownnorfolk, Tag: whatsupwithmyhairtho, Tag: bighead]",https://scontent.cdninstagram.com/hphotos-xaf1/t51.2885-15/e15/11350912_808001572653485_630344899_n.jpg
1002619804418692379_193172420,2015-06-08 05:33:36,Normal,9,[Tag: virginiabeach],https://scontent.cdninstagram.com/hphotos-xaf1/t51.2885-15/e15/11326725_387470691461907_66433217_n.jpg
1002616944811902845_1367229928,2015-06-08 05:27:55,Sierra,5,"[Tag: crystalqueen, Tag: spiritual, Tag: quartz, Tag: witch, Tag: crystals, Tag: chakras]",https://scontent.cdninstagram.com/hphotos-xfa1/t51.2885-15/e15/11374019_810815129025366_298378289_n.jpg
1002615432769968997_512351285,2015-06-08 05:24:55,Normal,5,"[Tag: echoingwaters, Tag: textileart, Tag: sarong, Tag: textiledesign, Tag: auroraborealissarong, Tag: festivalstyle, Tag: laurenmchaleart, Tag: beachwear, Tag: alwaysseektobehappy, Tag: moretocome, Tag: dowhatyoulove, Tag: handdyed, Tag: echoingwatersonetsy, Tag: beach, Tag: dreambigworkhardbekind]",https://scontent.cdninstagram.com/hphotos-xaf1/t51.2885-15/e15/11334403_1457009811275811_1090365763_n.jpg
1002605203747047074_1367229928,2015-06-08 05:04:35,Normal,0,[Tag: thetonyawards],https://scontent.cdninstagram.com/hphotos-xaf1/t51.2885-15/e15/11355946_487332584749096_1872974490_n.jpg
1002601315077640391_1398045691,2015-06-08 04:56:52,Normal,3,[Tag: satellites],https://scontent.cdninstagram.com/hphotos-xaf1/t51.2885-15/e15/11330631_1493362877552882_229792440_n.jpg
1002599683662132696_8376644,2015-06-08 04:53:37,Vesper,2,"[Tag: senormeow, Tag: raycharles]",https://scontent.cdninstagram.com/hphotos-xaf1/t51.2885-15/e15/11378341_1652676244963078_2064505295_n.jpg
1002582720061153446_1733748111,2015-06-08 04:19:55,Normal,13,"[Tag: catfa, Tag: sebastianstan, Tag: captainamerica, Tag: steverogers, Tag: buckybarnes]",https://scontent.cdninstagram.com/hphotos-xfa1/t51.2885-15/e15/11357330_1516388881933922_1362815002_n.jpg
1002578393082994194_262823174,2015-06-08 04:11:19,Normal,54,"[Tag: 458, Tag: lamborghini, Tag: love, Tag: springfest2015, Tag: virginia, Tag: luxurious, Tag: hero4, Tag: gopro, Tag: springfest, Tag: ferrari, Tag: aventadorroadster, Tag: blackonblack, Tag: carporn, Tag: italian]",https://scontent.cdninstagram.com/hphotos-xaf1/t51.2885-15/e15/11376357_109513912717194_1413064430_n.jpg
1002578229833493841_25669346,2015-06-08 04:11:00,Normal,6,[Tag: mcm],https://scontent.cdninstagram.com/hphotos-xaf1/t51.2885-15/e15/11375893_483452728496474_679688981_n.jpg
1002576397332864309_219978542,2015-06-08 04:07:21,Normal,5,[Tag: vscocam],https://scontent.cdninstagram.com/hphotos-xfa1/t51.2885-15/e15/11287865_490381784452570_504096158_n.jpg
1002570430748180406_647385910,2015-06-08 03:55:30,Aden,47,[Tag: va],https://scontent.cdninstagram.com/hphotos-xfa1/t51.2885-15/e15/11381477_384825918389542_215339804_n.jpg
1002566344197790218_1306287805,2015-06-08 03:47:23,X-Pro II,2,"[Tag: вечерняя, Tag: прогулочка]",https://scontent.cdninstagram.com/hphotos-xaf1/t51.2885-15/e15/11352009_387139261473521_587047408_n.jpg
1002565060035642000_337087335,2015-06-08 03:44:50,Normal,0,"[Tag: nofilterneeded, Tag: elizabethriver, Tag: norfolkva, Tag: harborfest]",https://scontent.cdninstagram.com/hphotos-xfa1/t51.2885-15/e15/11385626_736457956463278_1328831266_n.jpg
1002557364235853322_917228766,2015-06-08 03:29:32,Normal,4,[Tag: ysbh],https://scontent.cdninstagram.com/hphotos-xaf1/t51.2885-15/e15/11356725_1443737202595589_240153500_n.jpg
1002557316342291426_1808635837,2015-06-08 03:29:27,Normal,17,"[Tag: virginiacities, Tag: 757, Tag: virginiabeach, Tag: travel, Tag: hamptonroads, Tag: virginia, Tag: 757collective, Tag: architecture, Tag: minimalism, Tag: picoftheday, Tag: minimal, Tag: furniture]",https://scontent.cdninstagram.com/hphotos-xaf1/t51.2885-15/e15/11333382_830373513722834_1269058468_n.jpg
1002555445884033963_1808635837,2015-06-08 03:25:44,Juno,20,"[Tag: virginiacities, Tag: 757, Tag: virginiabeach, Tag: travel, Tag: virginia, Tag: hamptonroads, Tag: minimal_lookup, Tag: 757collective, Tag: architecture, Tag: minimalism, Tag: oceanfront, Tag: picoftheday, Tag: minimal]",https://scontent.cdninstagram.com/hphotos-xfa1/t51.2885-15/e15/11355011_841572949262696_2138259393_n.jpg
1002550821018666779_1783596536,2015-06-08 03:16:32,Normal,2,[Tag: clearviewlyfe],https://scontent.cdninstagram.com/hphotos-xaf1/t51.2885-15/e15/11374714_104238719915743_1943616655_n.jpg
1002548902148378918_13665195,2015-06-08 03:12:44,Normal,15,"[Tag: revolutionary, Tag: joinme, Tag: virginiabeach, Tag: helpingpeople, Tag: results, Tag: workfromhome, Tag: leadership, Tag: askme, Tag: moreinfo, Tag: opportunity, Tag: jointheteam, Tag: homebiz, Tag: info, Tag: hamptonroads, Tag: homebusiness, Tag: profit, Tag: worthit, Tag: income, Tag: tto, Tag: itworks]",https://scontent.cdninstagram.com/hphotos-xfa1/t51.2885-15/e15/11380895_404810676380354_1827989267_n.jpg
1002547553856152974_266840536,2015-06-08 03:10:03,Normal,4,[Tag: genius],https://scontent.cdninstagram.com/hphotos-xfa1/t51.2885-15/e15/11417486_1444958135822365_656005227_n.jpg
1002547117179154048_286535906,2015-06-08 03:09:11,Mayfair,59,"[Tag: morty, Tag: tuxedocat, Tag: catsofinstagram, Tag: ansel, Tag: gingercat, Tag: anselpants, Tag: mortimerbartholomew, Tag: brothercats, Tag: kittentown, Tag: brothercat, Tag: gingertabby, Tag: catboys, Tag: brocats]",https://scontent.cdninstagram.com/hphotos-xaf1/t51.2885-15/e15/11380173_381563945384969_941259351_n.jpg
1002546062701011626_40019263,2015-06-08 03:07:05,Willow,14,[Tag: chichosvb],https://scontent.cdninstagram.com/hphotos-xaf1/t51.2885-15/e15/11313415_401146456739386_1747714663_n.jpg
1002544491941248216_251962990,2015-06-08 03:03:58,X-Pro II,0,"[Tag: andyouregone, Tag: thebeatles, Tag: lucyintheskywithdiamonds, Tag: adventures, Tag: aquarium]",https://scontent.cdninstagram.com/hphotos-xaf1/t51.2885-15/e15/11283256_959650504065548_2029204891_n.jpg
1002542537410803349_6091468,2015-06-08 03:00:05,Inkwell,70,[Tag: liftedresearch],https://scontent.cdninstagram.com/hphotos-xaf1/t51.2885-15/e15/11311399_472226226268729_1410662058_n.jpg
1002542485116605172_2011741843,2015-06-08 02:59:59,Normal,4,"[Tag: ilovetheocean, Tag: dolphins]",https://scontent.cdninstagram.com/hphotos-xaf1/t51.2885-15/e15/11376711_941159462601216_1180085459_n.jpg
1002541910759566791_203089346,2015-06-08 02:58:50,Lark,11,[Tag: summer],https://scontent.cdninstagram.com/hphotos-xaf1/t51.2885-15/e15/11375986_100645630278122_1325426914_n.jpg
1002539520070774142_41036786,2015-06-08 02:54:05,Normal,6,"[Tag: spammed, Tag: loveyou, Tag: boyfriend]",https://scontent.cdninstagram.com/hphotos-xaf1/t51.2885-15/e15/11327443_1657482804474352_542076257_n.jpg
1002539017091071074_251962990,2015-06-08 02:53:05,Juno,0,"[Tag: pufferfish, Tag: fisharefriends, Tag: dontgettooclose, Tag: favorite, Tag: adventures, Tag: notfood, Tag: poof, Tag: aquarium, Tag: thesetwoweremyhomiesforeal]",https://scontent.cdninstagram.com/hphotos-xaf1/t51.2885-15/e15/11379867_737830526340490_302745195_n.jpg
1002537759908217327_430509015,2015-06-08 02:50:35,Sierra,40,[Tag: gn💋],https://scontent.cdninstagram.com/hphotos-xaf1/t51.2885-15/e15/11374731_569500743187960_1083316107_n.jpg
1002537504491908057_183449041,2015-06-08 02:50:05,Normal,16,"[Tag: chevy, Tag: s10, Tag: notlowenough]",https://scontent.cdninstagram.com/hphotos-xaf1/t51.2885-15/e15/11379106_775582195872726_919630556_n.jpg
1002535349430795745_1263866550,2015-06-08 02:45:48,Normal,1,"[Tag: californialove, Tag: passreb, Tag: passionaterebellions]",https://scontent.cdninstagram.com/hphotos-xaf1/t51.2885-15/e15/11324248_1639689049596596_1560672179_n.jpg
1002534488810881484_24437463,2015-06-08 02:44:05,Normal,19,"[Tag: hamptonroadsweddingphotographer, Tag: debbielaughlinphotography, Tag: realcouples, Tag: ringshot, Tag: debbielaughlinbrides, Tag: dlpcouples, Tag: engagementsession]",https://scontent.cdninstagram.com/hphotos-xaf1/t51.2885-15/e15/11330517_1457006234597811_1514992108_n.jpg
1002534254249550609_182568367,2015-06-08 02:43:37,Normal,15,[Tag: goals],https://scontent.cdninstagram.com/hphotos-xfa1/t51.2885-15/e15/11313281_1460275644269915_1777204848_n.jpg
1002533420171496321_1977749577,2015-06-08 02:41:58,Normal,13,"[Tag: summer, Tag: tanning, Tag: family, Tag: fun, Tag: friends, Tag: months, Tag: beach]",https://scontent.cdninstagram.com/hphotos-xfa1/t51.2885-15/e15/11358164_861652710555482_906212602_n.jpg
1001919348856731116_1652003212,2015-06-07 06:21:55,Sierra,9,"[Tag: bighats, Tag: wedontfwu, Tag: dontcare, Tag: vabeach, Tag: luhdisgurl, Tag: goodtimes]",https://scontent.cdninstagram.com/hphotos-xfa1/t51.2885-15/e15/11123956_1456460847986293_1344770176_n.jpg
1001914701871404713_184994692,2015-06-07 06:12:41,Ludwig,12,"[Tag: virginiabeach, Tag: vabeach, Tag: friends, Tag: virginia, Tag: pizza]",https://scontent.cdninstagram.com/hphotos-xaf1/l/t51.2885-15/e15/11311630_968619246503219_1301078880_n.jpg
1001910101554510350_184640525,2015-06-07 06:03:33,Inkwell,13,"[Tag: hrvaweddings, Tag: sparklerexit, Tag: monteroscatering, Tag: virginiabeachwedding]",https://scontent.cdninstagram.com/hphotos-xaf1/t51.2885-15/e15/11377630_1137358276289581_1386812594_n.jpg
1001909379013027323_3563336,2015-06-07 06:02:06,Normal,32,[Tag: family],https://scontent.cdninstagram.com/hphotos-xfa1/t51.2885-15/e15/11417483_855445171216153_1487158437_n.jpg
1001906953606989607_994288904,2015-06-07 05:57:17,Normal,16,"[Tag: toonami, Tag: inyuyasha]",https://scontent.cdninstagram.com/hphotos-xaf1/t51.2885-15/e15/11373622_479839548849214_1312588_n.jpg
1001899863966457142_361953814,2015-06-07 05:43:12,Normal,118,"[Tag: roadtousa, Tag: usa, Tag: wt]",https://scontent.cdninstagram.com/hphotos-xfa1/t51.2885-15/e15/11256974_1584762945121404_614123324_n.jpg
1001899029541418201_16117044,2015-06-07 05:41:33,Earlybird,16,"[Tag: lucyis25, Tag: birthdaydinner, Tag: virginiabeach]",https://scontent.cdninstagram.com/hphotos-xaf1/t51.2885-15/e15/11378154_1101888173160869_39221591_n.jpg
1001898950033380454_337431252,2015-06-07 05:41:23,Lo-fi,16,"[Tag: orangecrush, Tag: valove, Tag: watermans]",https://scontent.cdninstagram.com/hphotos-xaf1/t51.2885-15/e15/11426436_834803213277807_483855807_n.jpg
1001898693788128468_247882772,2015-06-07 05:40:53,Ludwig,29,"[Tag: calypso, Tag: malibu, Tag: summernights, Tag: barnight, Tag: drinkdrankdrunk, Tag: sisters, Tag: oceanfront, Tag: rumbucket]",https://scontent.cdninstagram.com/hphotos-xaf1/t51.2885-15/e15/11374720_1438585893115795_136422286_n.jpg
1001897834357716160_16117044,2015-06-07 05:39:10,Valencia,15,"[Tag: lucyis25, Tag: virginiabeachorbust, Tag: birthdaydinner, Tag: virginiabeach]",https://scontent.cdninstagram.com/hphotos-xpf1/l/t51.2885-15/e15/10009838_464210267077152_1789721112_n.jpg
1001896984978797635_1652003212,2015-06-07 05:37:29,Inkwell,6,"[Tag: loveher, Tag: vabeach, Tag: wearedorks, Tag: marijuanamerchandiseinthebackground, Tag: hilarious, Tag: bestiefoeva]",https://scontent.cdninstagram.com/hphotos-xfa1/t51.2885-15/e15/11373698_990855050927438_929220862_n.jpg
1001892694081427700_17174629,2015-06-07 05:28:57,Aden,77,"[Tag: love, Tag: blackpeoplebelike, Tag: awake, Tag: panafrican, Tag: nochill, Tag: buildblack, Tag: blackwomanisgod, Tag: blackyouth, Tag: noreligion, Tag: takeebonyback, Tag: blacklivesmatter, Tag: buyblack, Tag: blackpantherparty, Tag: melanin, Tag: consciouscomminty, Tag: blackconsciousness, Tag: ebony, Tag: newslaves, Tag: blackpower, Tag: freedom, Tag: instasize, Tag: unity, Tag: wakeup, Tag: blackunity, Tag: enlightenment]",https://scontent.cdninstagram.com/hphotos-xaf1/t51.2885-15/e15/11419221_1596365777308417_1984256163_n.jpg
1001891471299490902_17484908,2015-06-07 05:26:32,Normal,43,"[Tag: perfectnighttonight, Tag: besttime, Tag: loveit]",https://scontent.cdninstagram.com/hphotos-xfa1/t51.2885-15/e15/11325896_910196502355522_1940861144_n.jpg
1001882416439853282_852841759,2015-06-07 05:08:32,Normal,15,"[Tag: goodboyfriend, Tag: iloveyou, Tag: iworry]",https://scontent.cdninstagram.com/hphotos-xaf1/t51.2885-15/e15/11377996_1618522068416019_1153986370_n.jpg
1001881740723955509_403609936,2015-06-07 05:07:12,Normal,37,"[Tag: nocomments, Tag: vb, Tag: vabeach, Tag: love, Tag: virginiabeach, Tag: life, Tag: beinlove, Tag: upsidedown, Tag: summer, Tag: myworld, Tag: mounttrashmore, Tag: happy]",https://scontent.cdninstagram.com/hphotos-xfa1/t51.2885-15/e15/11283302_1456919401287478_1143209038_n.jpg
1001880918476585535_191080637,2015-06-07 05:05:34,Normal,189,"[Tag: prom, Tag: salem, Tag: twinning, Tag: bestnightever, Tag: prom2015]",https://scontent.cdninstagram.com/hphotos-xaf1/t51.2885-15/e15/11355997_831238873632510_1059920108_n.jpg
1001879356503705206_397668280,2015-06-07 05:02:27,Willow,8,"[Tag: goodbyessuck, Tag: onelasthug]",https://scontent.cdninstagram.com/hphotos-xfa1/l/t51.2885-15/e15/11379284_1619696851581048_565611994_n.jpg
1001876085179908189_852841759,2015-06-07 04:55:58,Slumber,21,[Tag: 757],https://scontent.cdninstagram.com/hphotos-xfa1/t51.2885-15/e15/11287460_953347008019938_688684132_n.jpg
1001875565253297658_257756088,2015-06-07 04:54:56,Normal,61,"[Tag: opp, Tag: sgr, Tag: greeklove, Tag: zc, Tag: kas, Tag: greekunity, Tag: zoeticcouture, Tag: superchill, Tag: divinienine, Tag: ipt, Tag: d9, Tag: apa, Tag: stroll, Tag: partystroll, Tag: greekpicnic, Tag: pbs, Tag: greekapparel, Tag: greeks, Tag: dst, Tag: greekdom, Tag: noshade, Tag: greekpicnicseason, Tag: nphc, Tag: hbcu, Tag: agp2015, Tag: aka, Tag: zpb, Tag: atl, Tag: agp]",https://scontent.cdninstagram.com/hphotos-xaf1/t51.2885-15/e15/11419003_1442668269384482_1948351818_n.jpg
1001872907191543379_192738928,2015-06-07 04:49:39,Normal,15,[Tag: envb],https://scontent.cdninstagram.com/hphotos-xaf1/t51.2885-15/e15/11420841_860280110686404_1044144302_n.jpg
1001872818631584257_13582537,2015-06-07 04:49:28,Normal,7220,"[Tag: springfest2015, Tag: sumospeed, Tag: springfest, Tag: slammedenuff]",https://scontent.cdninstagram.com/hphotos-xpa1/t51.2885-15/e15/1515854_1121570231191552_1495480179_n.jpg
1001871685412843878_528945891,2015-06-07 04:47:13,Juno,8,"[Tag: goodtasteinmusic, Tag: billyjoel, Tag: shesanoldsoul]",https://scontent.cdninstagram.com/hphotos-xaf1/t51.2885-15/e15/11282859_908414185885875_1705427806_n.jpg
1001871127648286281_1652003212,2015-06-07 04:46:07,X-Pro II,10,"[Tag: vabeach, Tag: noididntbuythat, Tag: turndownforwhat, Tag: lmao, Tag: shenanigans, Tag: turntup]",https://scontent.cdninstagram.com/hphotos-xfa1/t51.2885-15/e15/11336165_599557690184243_181289122_n.jpg
1001868974352290040_39439147,2015-06-07 04:41:50,Normal,12,"[Tag: sisterlylove, Tag: vabeach, Tag: loveva]",https://scontent.cdninstagram.com/hphotos-xaf1/t51.2885-15/e15/11260939_1504592953099005_2015659101_n.jpg
1001868401358993391_27678132,2015-06-07 04:40:42,Juno,2,"[Tag: blue, Tag: mazda, Tag: springfest, Tag: gold, Tag: carshow]",https://scontent.cdninstagram.com/hphotos-xfa1/t51.2885-15/e15/11330660_384284241777173_257922578_n.jpg
1001864448317452469_528945891,2015-06-07 04:32:50,Normal,4,"[Tag: billyjoel, Tag: pianoman]",https://scontent.cdninstagram.com/hphotos-xaf1/t51.2885-15/e15/11325939_817251171716268_1732084630_n.jpg
1001862476155075399_1746655269,2015-06-07 04:28:55,Normal,25,"[Tag: benq, Tag: gamerguy, Tag: callofdutychamps, Tag: greenwall, Tag: optic, Tag: scufgaming, Tag: triggersquad, Tag: astro, Tag: controller, Tag: ranked, Tag: livestream, Tag: xboxone, Tag: nadeshot, Tag: astrogaming, Tag: mlg, Tag: setup, Tag: youtube, Tag: callofduty, Tag: xbox, Tag: umg, Tag: scuf, Tag: cod, Tag: elgato, Tag: egl, Tag: twitch, Tag: followme]",https://scontent.cdninstagram.com/hphotos-xfa1/t51.2885-15/e15/11376161_1623643571206803_1874257299_n.jpg
1001861662354153817_25228303,2015-06-07 04:27:18,Normal,22,"[Tag: goingawayparty, Tag: cantreplacethem]",https://scontent.cdninstagram.com/hphotos-xpt1/t51.2885-15/e15/11116787_1458372354457203_1488559447_n.jpg
1001856520103563451_26912979,2015-06-07 04:17:05,Normal,40,[Tag: springfest2015],https://scontent.cdninstagram.com/hphotos-xaf1/t51.2885-15/e15/11311981_495237027306573_989147035_n.jpg
1001856445694473210_528945891,2015-06-07 04:16:56,Normal,7,"[Tag: billyjoel, Tag: onlythegooddieyoung]",https://scontent.cdninstagram.com/hphotos-xaf1/l/t51.2885-15/e15/11377558_985383421512076_759577175_n.jpg
1001854467318158661_37477244,2015-06-07 04:13:01,Normal,549,[Tag: springfest6],https://scontent.cdninstagram.com/hphotos-xaf1/t51.2885-15/e15/11335089_1663387490551487_929309822_n.jpg
1001194276755655996_206387866,2015-06-06 06:21:20,Clarendon,20,"[Tag: sportscar, Tag: snombile, Tag: funtimes, Tag: problems, Tag: snow]",https://scontent.cdninstagram.com/hphotos-xaf1/t51.2885-15/e15/11358126_400327770159490_1736127207_n.jpg
1001189141234577967_366809347,2015-06-06 06:11:07,Lark,25,"[Tag: bestview, Tag: suchbeauty]",https://scontent.cdninstagram.com/hphotos-xaf1/t51.2885-15/e15/11428791_972402879471382_1316078547_n.jpg
1001179816740124802_208281405,2015-06-06 05:52:36,Lark,9,"[Tag: vbfd, Tag: engine14, Tag: ladder11]",https://scontent.cdninstagram.com/hphotos-xaf1/t51.2885-15/e15/11325936_573482342793408_1720474525_n.jpg
1001176726333954716_1451690389,2015-06-06 05:46:27,Normal,30,[Tag: candid],https://scontent.cdninstagram.com/hphotos-xfa1/t51.2885-15/e15/11378822_411618475709979_78374877_n.jpg
1001175566668658749_208281405,2015-06-06 05:44:09,Lo-fi,7,"[Tag: vbfd, Tag: tiller, Tag: laddertruck, Tag: ladder11]",https://scontent.cdninstagram.com/hphotos-xaf1/t51.2885-15/e15/11325391_1683299451899088_173909150_n.jpg
1001175316386131838_1927716386,2015-06-06 05:43:39,Normal,8,[Tag: truth],https://scontent.cdninstagram.com/hphotos-xfp1/t51.2885-15/e15/10268864_947518828604626_85831492_n.jpg
1001172002868593290_44990799,2015-06-06 05:37:04,X-Pro II,3,"[Tag: vonzipper, Tag: axisglobal, Tag: sharingiscaring]",https://scontent.cdninstagram.com/hphotos-xfa1/t51.2885-15/e15/11380142_1643383872546551_1809887153_n.jpg
1001171339396307720_239515309,2015-06-06 05:35:45,Normal,90,"[Tag: springfest, Tag: bazreia, Tag: springfest6, Tag: vipmodulars, Tag: ep3, Tag: baggedaccords, Tag: trendsetterzcrew, Tag: honda, Tag: vabeach, Tag: m8g, Tag: weready, Tag: kranze]",https://scontent.cdninstagram.com/hphotos-xaf1/t51.2885-15/e15/11327337_912233242151623_1549023402_n.jpg
1001170291709530001_1968445338,2015-06-06 05:33:40,Juno,21,"[Tag: play, Tag: golf, Tag: beauty, Tag: nature, Tag: travel, Tag: ocean, Tag: gooutside, Tag: adventure]",https://scontent.cdninstagram.com/hphotos-xfa1/t51.2885-15/e15/11363633_1446842288967107_1446494915_n.jpg
1001169785272226798_179500083,2015-06-06 05:32:40,Normal,11,"[Tag: va, Tag: portsmouth, Tag: stressthebest, Tag: gospelrecordingartist, Tag: itsmytime, Tag: jesusiscomingagain, Tag: illdoit, Tag: naomikthomas, Tag: toknowyoulord, Tag: iamhealed, Tag: heswatchingoverme, Tag: thepearl, Tag: spiritandlife, Tag: breatkthrough, Tag: bestoffering, Tag: prayandseekgod]",https://scontent.cdninstagram.com/hphotos-xaf1/t51.2885-15/e15/11287995_846605322075763_1730823587_n.jpg
1001166231382471823_26342764,2015-06-06 05:25:36,Normal,26,"[Tag: is300, Tag: sw20, Tag: springfest2015, Tag: toyota, Tag: trd, Tag: mr2, Tag: lexus, Tag: sxe10]",https://scontent.cdninstagram.com/hphotos-xaf1/t51.2885-15/e15/11333688_1449505558699039_153085500_n.jpg
1001155805649509595_49045966,2015-06-06 05:04:54,Normal,3,[Tag: studyhour],https://scontent.cdninstagram.com/hphotos-xaf1/t51.2885-15/e15/11430196_1596288457310320_1150160901_n.jpg
1001153359500762051_176788797,2015-06-06 05:00:02,Normal,33,[Tag: bbw],https://scontent.cdninstagram.com/hphotos-xaf1/t51.2885-15/e15/11283304_1000803376599619_54042860_n.jpg
1001152953283175457_7574536,2015-06-06 04:59:14,Normal,136,[Tag: sandsoccernight1],https://scontent.cdninstagram.com/hphotos-xaf1/t51.2885-15/e15/11334555_1580388792227415_326001749_n.jpg
1001152939263054444_268876843,2015-06-06 04:59:12,Normal,211,"[Tag: modeling, Tag: springfest, Tag: projectdsg]",https://scontent.cdninstagram.com/hphotos-xaf1/t51.2885-15/e15/11333356_1003904482955498_1122914255_n.jpg
1001147150325263895_1143025522,2015-06-06 04:47:42,Normal,46,"[Tag: volunteersrock, Tag: virginiabeach, Tag: nassc, Tag: usopen, Tag: beachsoccer, Tag: sandsoccer]",https://scontent.cdninstagram.com/hphotos-xfa1/t51.2885-15/e15/11326973_829606417135471_771039527_n.jpg
1001146852840636285_19996086,2015-06-06 04:47:06,Normal,64,[Tag: nationaldonutday],https://scontent.cdninstagram.com/hphotos-xaf1/t51.2885-15/e15/11283165_1581295705456858_1245256984_n.jpg
1001145664530528646_10569333,2015-06-06 04:44:45,Amaro,8,[Tag: neptune],https://scontent.cdninstagram.com/hphotos-xfa1/t51.2885-15/e15/11356829_858879137521719_668114240_n.jpg
1001144640412790141_220051482,2015-06-06 04:42:43,Lark,6,"[Tag: gettinthatbodytight, Tag: datfitness, Tag: allaboutourfitness, Tag: sweatinnydivas, Tag: wediddat]",https://scontent.cdninstagram.com/hphotos-xaf1/t51.2885-15/e15/11378883_906217612758148_355860726_n.jpg
1001144108804454770_10569333,2015-06-06 04:41:39,Normal,9,[Tag: sisters],https://scontent.cdninstagram.com/hphotos-xaf1/t51.2885-15/e15/11357992_393765867482919_845336496_n.jpg
1001142767572694361_1490046996,2015-06-06 04:38:59,Nashville,11,"[Tag: lhvb, Tag: vabeach]",https://scontent.cdninstagram.com/hphotos-xfa1/t51.2885-15/e15/11376629_1598448963738548_1368766106_n.jpg
1001142168213031754_9445033,2015-06-06 04:37:48,Normal,12,[Tag: alvinandthoya2015],https://scontent.cdninstagram.com/hphotos-xaf1/t51.2885-15/e15/11378443_1611735199082993_907545483_n.jpg
1001141246112074551_9445033,2015-06-06 04:35:58,Sierra,16,[Tag: alvinandthoya2015],https://scontent.cdninstagram.com/hphotos-xaf1/t51.2885-15/e15/11267361_679593875518581_1400334614_n.jpg
1001141173710520626_236105543,2015-06-06 04:35:49,Normal,38,"[Tag: enjoy, Tag: life, Tag: virginiabeach, Tag: americanlife, Tag: weekends, Tag: ladies, Tag: night, Tag: party]",https://scontent.cdninstagram.com/hphotos-xfp1/t51.2885-15/e15/10808757_1004250376259980_229986116_n.jpg
1001141034335238449_1830701949,2015-06-06 04:35:33,Normal,1,[Tag: nothingtosay],https://scontent.cdninstagram.com/hphotos-xaf1/t51.2885-15/e15/11375979_1593721450898978_1538767622_n.jpg
1001140441053378864_10569333,2015-06-06 04:34:22,Mayfair,12,[Tag: squinty],https://scontent.cdninstagram.com/hphotos-xaf1/t51.2885-15/e15/11327863_1460947007530957_468472474_n.jpg
1001139050001591872_49121914,2015-06-06 04:31:36,Normal,26,"[Tag: badbitcheslinkup, Tag: hersexyass]",https://scontent.cdninstagram.com/hphotos-xaf1/t51.2885-15/e15/11355048_483321471818854_1097555801_n.jpg
1001138220838112456_469062002,2015-06-06 04:29:57,Normal,66,"[Tag: 18thstreetvaos, Tag: blackasfuck]",https://scontent.cdninstagram.com/hphotos-xaf1/t51.2885-15/e15/11324212_1605182309740316_841178780_n.jpg
1001136428527922834_319636802,2015-06-06 04:26:24,Normal,60,"[Tag: focaljet, Tag: nwstassociation, Tag: focusfamily, Tag: 808steeze, Tag: hoonigan, Tag: mk3sedanmafia, Tag: focus, Tag: ford, Tag: fordsofinstagram, Tag: whoreyourford, Tag: 503designs, Tag: focusfanatics, Tag: acarsworld, Tag: focus_united, Tag: fastfords, Tag: rebeldevilcustoms, Tag: mk3, Tag: 757fastfords, Tag: modifiedfamilia, Tag: justafocus, Tag: fords_mondaytosunday, Tag: bcracing]",https://scontent.cdninstagram.com/hphotos-xfa1/t51.2885-15/e15/11356670_278583442312259_1187298608_n.jpg
1001135691983798647_1561527607,2015-06-06 04:24:56,Normal,5,[Tag: operationshakedownshakas],https://scontent.cdninstagram.com/hphotos-xaf1/t51.2885-15/e15/11380869_706422269503767_2111787251_n.jpg
1001134158202859797_3403131,2015-06-06 04:21:53,Juno,40,"[Tag: inspiredhairstyles, Tag: btc_pics, Tag: virginiabeach, Tag: btconeshot_rainbow, Tag: costalvirginia, Tag: embeemeche, Tag: hairstylist, Tag: hairofinstagram, Tag: joicointensity, Tag: hair, Tag: hrvahairartistry, Tag: hothair757, Tag: kenracolorcreative, Tag: hamptonroads, Tag: beautylaunchpad, Tag: highvoltagehairbycrystalcasey, Tag: mermaidians, Tag: paulmitchell, Tag: americansalon, Tag: joico, Tag: pravanavivids, Tag: btconeshot_hairpaint, Tag: btconeshot_color, Tag: hotonbeauty, Tag: haircolor, Tag: highvoltagehair, Tag: blondehair, Tag: nofilter, Tag: stylistshopconnect, Tag: modernsalon]",https://scontent.cdninstagram.com/hphotos-xfa1/t51.2885-15/e15/11424602_1458434514454377_1884246062_n.jpg
1001130692743065811_3403131,2015-06-06 04:15:00,Juno,47,"[Tag: inspiredhairstyles, Tag: btc_pics, Tag: virginiabeach, Tag: btconeshot_rainbow, Tag: costalvirginia, Tag: embeemeche, Tag: hairstylist, Tag: hairofinstagram, Tag: joicointensity, Tag: hair, Tag: hrvahairartistry, Tag: hothair757, Tag: kenracolorcreative, Tag: hamptonroads, Tag: beautylaunchpad, Tag: highvoltagehairbycrystalcasey, Tag: mermaidians, Tag: paulmitchell, Tag: americansalon, Tag: joico, Tag: pravanavivids, Tag: btconeshot_hairpaint, Tag: btconeshot_color, Tag: hotonbeauty, Tag: haircolor, Tag: highvoltagehair, Tag: blondehair, Tag: nofilter, Tag: stylistshopconnect, Tag: modernsalon]",https://scontent.cdninstagram.com/hphotos-xaf1/t51.2885-15/e15/11313447_1594825214139708_2050845658_n.jpg
